{
  "data_type": "threads",
  "processed_at": "2026-01-06T09:04:26.044851",
  "source_file": "data/raw/threads/threads_20260106_085721.json",
  "statistics": {
    "total": 50,
    "success": 50,
    "failed": 0,
    "errors": []
  },
  "records": [
    {
      "url": "https://www.threads.net/@honphuc2000/post/DRnBwGZgSkA",
      "source_type": "api",
      "source": "https://www.threads.net/@honphuc2000/post/DRnBwGZgSkA",
      "domain": "threads.net",
      "social_platform": "threads",
      "title": "Kiếm người đi chơi Noel với mình",
      "content": "Kiếm người đi chơi Noel với mình",
      "word_count": 7,
      "published_date": 1764353645.0,
      "published_datetime": "2025-11-28 18:14:05+00:00",
      "likes_count": 0,
      "shares_count": 0,
      "comments_count": 0,
      "views_count": 0,
      "reactions": null,
      "account_id": "honphuc2000",
      "account_name": "honphuc2000",
      "account_url": "https://www.threads.net/@honphuc2000",
      "post_id": "8162",
      "post_type": "thread",
      "raw_metadata": {
        "username": "honphuc2000",
        "likes": 0,
        "replies": 0,
        "reposts": 0,
        "shares": 0,
        "time": "11/28/25",
        "datetime": "2025-11-28T18:14:05.000Z"
      },
      "is_cleaned": true,
      "data_type": "threads",
      "reposts_count": 0
    },
    {
      "url": "https://www.threads.net/@tung846/post/DSl7o_5DXwp",
      "source_type": "api",
      "source": "https://www.threads.net/@tung846/post/DSl7o_5DXwp",
      "domain": "threads.net",
      "social_platform": "threads",
      "title": "Chúc Đảng bộ, chính quyền và Nhân dân Hưng Yên ngày càng phát triển, tiến bộ và đạt được nhiều thành...",
      "content": "Chúc Đảng bộ, chính quyền và Nhân dân Hưng Yên ngày càng phát triển, tiến bộ và đạt được nhiều thành công mới to lớn hơn nữa; quê hương ta ngày càng Hưng và ngày càng Yên hơn nữa!.Chúc Hưng Yên tiến thật xa.Hưng Yên như thế mới là Hưng Yên rồi cùng Hà Tĩnh- Hậu Giang cũ",
      "word_count": 58,
      "published_date": 1766464370.0,
      "published_datetime": "2025-12-23 04:32:50+00:00",
      "likes_count": 0,
      "shares_count": 0,
      "comments_count": 0,
      "views_count": 0,
      "reactions": null,
      "account_id": "tung846",
      "account_name": "tung846",
      "account_url": "https://www.threads.net/@tung846",
      "post_id": "8161",
      "post_type": "thread",
      "raw_metadata": {
        "username": "tung846",
        "likes": 0,
        "replies": 0,
        "reposts": 0,
        "shares": 0,
        "time": "12/22/25",
        "datetime": "2025-12-23T04:32:50.000Z"
      },
      "is_cleaned": true,
      "data_type": "threads",
      "reposts_count": 0
    },
    {
      "url": "https://www.threads.net/@tradaolasomottt/post/DSR3BwFEzz6",
      "source_type": "api",
      "source": "https://www.threads.net/@tradaolasomottt/post/DSR3BwFEzz6",
      "domain": "threads.net",
      "social_platform": "threads",
      "title": "Tìm bạn nhận make up tại fansign Quang Hùng MasterD chặng Hưng Yên ngày mai huhu",
      "content": "Tìm bạn nhận make up tại fansign Quang Hùng MasterD chặng Hưng Yên ngày mai huhu",
      "word_count": 16,
      "published_date": 1765790863.0,
      "published_datetime": "2025-12-15 09:27:43+00:00",
      "likes_count": 0,
      "shares_count": 0,
      "comments_count": 0,
      "views_count": 0,
      "reactions": null,
      "account_id": "tradaolasomottt",
      "account_name": "tradaolasomottt",
      "account_url": "https://www.threads.net/@tradaolasomottt",
      "post_id": "8160",
      "post_type": "thread",
      "raw_metadata": {
        "username": "tradaolasomottt",
        "likes": 0,
        "replies": 0,
        "reposts": 0,
        "shares": 0,
        "time": "12/15/25",
        "datetime": "2025-12-15T09:27:43.000Z"
      },
      "is_cleaned": true,
      "data_type": "threads",
      "reposts_count": 0
    },
    {
      "url": "https://www.threads.net/@thi.mit/post/DS0MU4Nko3G",
      "source_type": "api",
      "source": "https://www.threads.net/@thi.mit/post/DS0MU4Nko3G",
      "domain": "threads.net",
      "social_platform": "threads",
      "title": "Đêm nay có chuyện khiến mình không ngủ được, ngồi xem lại album ảnh, cũng muốn làm recap đồ này nọ n...",
      "content": "Đêm nay có chuyện khiến mình không ngủ được, ngồi xem lại album ảnh, cũng muốn làm recap đồ này nọ nhưng lười quá :( Mình chỉ nhớ mình đã gặp DKzz rất nhiều, và hiện tại mình thực sự nhớ em ấy rất nhiềuuuuu Từ fmt 412025 ở HN cho đến 13122025 là ngày cuối cùng mình gặp Khánh, mình đã gặp em ấy ở những đâu nhỉ? Fmt QH ở Đà Nẵng, concert ở HCM và Hưng Yên, fmt anh Rhym và fancon Nhà Trẻ, từ Hạ Long đến Hàn Quốc, từ Nhật Bản về Bản Liền.... Translate 12",
      "word_count": 101,
      "published_date": 1766942880.0,
      "published_datetime": "2025-12-28 17:28:00+00:00",
      "likes_count": 0,
      "shares_count": 0,
      "comments_count": 0,
      "views_count": 0,
      "reactions": null,
      "account_id": "thi.mit",
      "account_name": "thi.mit",
      "account_url": "https://www.threads.net/@thi.mit",
      "post_id": "8159",
      "post_type": "thread",
      "raw_metadata": {
        "username": "thi.mit",
        "likes": 0,
        "replies": 0,
        "reposts": 0,
        "shares": 0,
        "time": "6d",
        "datetime": "2025-12-28T17:28:00.000Z"
      },
      "is_cleaned": true,
      "data_type": "threads",
      "reposts_count": 0
    },
    {
      "url": "https://www.threads.net/@vieclamtiengnhat_hr/post/DQItSq9j1PO",
      "source_type": "api",
      "source": "https://www.threads.net/@vieclamtiengnhat_hr/post/DQItSq9j1PO",
      "domain": "threads.net",
      "social_platform": "threads",
      "title": "Bác nào ở Hưng Yên tiếng Nhật tốt, muốn làm hành chính nhân sự ib em nhé TelZalo: 0978 589 845 Tra...",
      "content": "Bác nào ở Hưng Yên tiếng Nhật tốt, muốn làm hành chính nhân sự ib em nhé TelZalo: 0978 589 845 Translate 12",
      "word_count": 23,
      "published_date": 1761188801.0,
      "published_datetime": "2025-10-23 03:06:41+00:00",
      "likes_count": 0,
      "shares_count": 0,
      "comments_count": 0,
      "views_count": 0,
      "reactions": null,
      "account_id": "vieclamtiengnhat_hr",
      "account_name": "vieclamtiengnhat_hr",
      "account_url": "https://www.threads.net/@vieclamtiengnhat_hr",
      "post_id": "8158",
      "post_type": "thread",
      "raw_metadata": {
        "username": "vieclamtiengnhat_hr",
        "likes": 0,
        "replies": 0,
        "reposts": 0,
        "shares": 0,
        "time": "10/22/25",
        "datetime": "2025-10-23T03:06:41.000Z"
      },
      "is_cleaned": true,
      "data_type": "threads",
      "reposts_count": 0
    },
    {
      "url": "https://www.threads.net/@choi.zuizui/post/DP0VvrfE4WQ",
      "source_type": "api",
      "source": "https://www.threads.net/@choi.zuizui/post/DP0VvrfE4WQ",
      "domain": "threads.net",
      "social_platform": "threads",
      "title": "Em làm việc chỉ vào ban ngày, có công vuệc nào làm đêm mà nhận hàng về nhà được không ạ! Mn giới thi...",
      "content": "Em làm việc chỉ vào ban ngày, có công vuệc nào làm đêm mà nhận hàng về nhà được không ạ! Mn giới thiệu chỗ uy tín cho em với, làm thủ công, làm máy tính đều được ạ! Em ở Hưng Yên",
      "word_count": 43,
      "published_date": 1760505367.0,
      "published_datetime": "2025-10-15 05:16:07+00:00",
      "likes_count": 0,
      "shares_count": 0,
      "comments_count": 0,
      "views_count": 0,
      "reactions": null,
      "account_id": "choi.zuizui",
      "account_name": "choi.zuizui",
      "account_url": "https://www.threads.net/@choi.zuizui",
      "post_id": "8157",
      "post_type": "thread",
      "raw_metadata": {
        "username": "choi.zuizui",
        "likes": 0,
        "replies": 0,
        "reposts": 0,
        "shares": 0,
        "time": "10/15/25",
        "datetime": "2025-10-15T05:16:07.000Z"
      },
      "is_cleaned": true,
      "data_type": "threads",
      "reposts_count": 0
    },
    {
      "url": "https://www.threads.net/@trghduc/post/DS16RbnCb16",
      "source_type": "api",
      "source": "https://www.threads.net/@trghduc/post/DS16RbnCb16",
      "domain": "threads.net",
      "social_platform": "threads",
      "title": "Chả là t ở viện từ sáng trông ng thân. T gặp ông cò xe tỉnh, sáng ông bảo ổng quê Nghệ An. Chiều ổng...",
      "content": "Chả là t ở viện từ sáng trông ng thân. T gặp ông cò xe tỉnh, sáng ông bảo ổng quê Nghệ An. Chiều ổng bảo ơ em ở Ninh Bình , vừa rồi ông ơ tiếp với 1 chị em ở Hưng Yên . Thế là quê ông ở đâu dị :)))",
      "word_count": 53,
      "published_date": 1767000524.0,
      "published_datetime": "2025-12-29 09:28:44+00:00",
      "likes_count": 0,
      "shares_count": 0,
      "comments_count": 0,
      "views_count": 0,
      "reactions": null,
      "account_id": "trghduc",
      "account_name": "trghduc",
      "account_url": "https://www.threads.net/@trghduc",
      "post_id": "8156",
      "post_type": "thread",
      "raw_metadata": {
        "username": "trghduc",
        "likes": 0,
        "replies": 0,
        "reposts": 0,
        "shares": 0,
        "time": "6d",
        "datetime": "2025-12-29T09:28:44.000Z"
      },
      "is_cleaned": true,
      "data_type": "threads",
      "reposts_count": 0
    },
    {
      "url": "https://www.threads.net/@buivinh618/post/DHEDY6kNTQ1",
      "source_type": "api",
      "source": "https://www.threads.net/@buivinh618/post/DHEDY6kNTQ1",
      "domain": "threads.net",
      "social_platform": "threads",
      "title": "Mình ở bang hàng tiên lữ Hưng yên muốn công việc làm ai có việc gì Cho mình đi làm với",
      "content": "Mình ở bang hàng tiên lữ Hưng yên muốn công việc làm ai có việc gì Cho mình đi làm với",
      "word_count": 21,
      "published_date": 1741705262.0,
      "published_datetime": "2025-03-11 15:01:02+00:00",
      "likes_count": 0,
      "shares_count": 0,
      "comments_count": 0,
      "views_count": 0,
      "reactions": null,
      "account_id": "buivinh618",
      "account_name": "buivinh618",
      "account_url": "https://www.threads.net/@buivinh618",
      "post_id": "8155",
      "post_type": "thread",
      "raw_metadata": {
        "username": "buivinh618",
        "likes": 0,
        "replies": 0,
        "reposts": 0,
        "shares": 0,
        "time": "03/11/25",
        "datetime": "2025-03-11T15:01:02.000Z"
      },
      "is_cleaned": true,
      "data_type": "threads",
      "reposts_count": 0
    },
    {
      "url": "https://www.threads.net/@tng_lqh/post/DSSdRjiE5Nn",
      "source_type": "api",
      "source": "https://www.threads.net/@tng_lqh/post/DSSdRjiE5Nn",
      "domain": "threads.net",
      "social_platform": "threads",
      "title": "Huhuuuu ai pass fansign của Hùng ở Hưng Yên không Mom nào ở HCM trúng khum đi đc pass khumm,toai ...",
      "content": "Huhuuuu ai pass fansign của Hùng ở Hưng Yên không Mom nào ở HCM trúng khum đi đc pass khumm,toai mún gặp ảnh 1 lầnnnn",
      "word_count": 25,
      "published_date": 1765810915.0,
      "published_datetime": "2025-12-15 15:01:55+00:00",
      "likes_count": 0,
      "shares_count": 0,
      "comments_count": 0,
      "views_count": 0,
      "reactions": null,
      "account_id": "tng_lqh",
      "account_name": "tng_lqh",
      "account_url": "https://www.threads.net/@tng_lqh",
      "post_id": "8154",
      "post_type": "thread",
      "raw_metadata": {
        "username": "tng_lqh",
        "likes": 0,
        "replies": 0,
        "reposts": 0,
        "shares": 0,
        "time": "12/15/25",
        "datetime": "2025-12-15T15:01:55.000Z"
      },
      "is_cleaned": true,
      "data_type": "threads",
      "reposts_count": 0
    },
    {
      "url": "https://www.threads.net/@nancy.nguyen03/post/DRoWto_Ea7d",
      "source_type": "api",
      "source": "https://www.threads.net/@nancy.nguyen03/post/DRoWto_Ea7d",
      "domain": "threads.net",
      "social_platform": "threads",
      "title": "Em cần tìm phòng quanh khu vực Trung Kính, Yên Hoà, Trần Duy Hưng Yêu cầu: không chung chủ, vskk, đ...",
      "content": "Em cần tìm phòng quanh khu vực Trung Kính, Yên Hoà, Trần Duy Hưng Yêu cầu: không chung chủ, vskk, đh, nóng lạnh, máy giặt,. TC khoảng 3tr Mọi người có tt phòng trọ cho em xin với ạ Translate 12",
      "word_count": 41,
      "published_date": 1764398189.0,
      "published_datetime": "2025-11-29 06:36:29+00:00",
      "likes_count": 0,
      "shares_count": 0,
      "comments_count": 0,
      "views_count": 0,
      "reactions": null,
      "account_id": "nancy.nguyen03",
      "account_name": "nancy.nguyen03",
      "account_url": "https://www.threads.net/@nancy.nguyen03",
      "post_id": "8153",
      "post_type": "thread",
      "raw_metadata": {
        "username": "nancy.nguyen03",
        "likes": 0,
        "replies": 0,
        "reposts": 0,
        "shares": 0,
        "time": "11/29/25",
        "datetime": "2025-11-29T06:36:29.000Z"
      },
      "is_cleaned": true,
      "data_type": "threads",
      "reposts_count": 0
    },
    {
      "url": "https://www.threads.net/@khchou__101/post/DG93i75xAfD",
      "source_type": "api",
      "source": "https://www.threads.net/@khchou__101/post/DG93i75xAfD",
      "domain": "threads.net",
      "social_platform": "threads",
      "title": "Top nào hnoi,hưng yên mê skinship hay cuddle kh nhỉ kkk Translate 12",
      "content": "Top nào hnoi,hưng yên mê skinship hay cuddle kh nhỉ kkk Translate 12",
      "word_count": 13,
      "published_date": 1741497726.0,
      "published_datetime": "2025-03-09 05:22:06+00:00",
      "likes_count": 0,
      "shares_count": 0,
      "comments_count": 0,
      "views_count": 0,
      "reactions": null,
      "account_id": "khchou__101",
      "account_name": "khchou__101",
      "account_url": "https://www.threads.net/@khchou__101",
      "post_id": "8152",
      "post_type": "thread",
      "raw_metadata": {
        "username": "khchou__101",
        "likes": 0,
        "replies": 0,
        "reposts": 0,
        "shares": 0,
        "time": "03/09/25",
        "datetime": "2025-03-09T05:22:06.000Z"
      },
      "is_cleaned": true,
      "data_type": "threads",
      "reposts_count": 0
    },
    {
      "url": "https://www.threads.net/@limerenara/post/DSi_fQhAaQ5",
      "source_type": "api",
      "source": "https://www.threads.net/@limerenara/post/DSi_fQhAaQ5",
      "domain": "threads.net",
      "social_platform": "threads",
      "title": "2 ngày theo chân Phúc từ Hưng Yên đến Hạ Long thì cái tôi mệt là còn có quá nhiều suộc và không biết...",
      "content": "2 ngày theo chân Phúc từ Hưng Yên đến Hạ Long thì cái tôi mệt là còn có quá nhiều suộc và không biết đăng ntn",
      "word_count": 26,
      "published_date": 1766365724.0,
      "published_datetime": "2025-12-22 01:08:44+00:00",
      "likes_count": 0,
      "shares_count": 0,
      "comments_count": 0,
      "views_count": 0,
      "reactions": null,
      "account_id": "limerenara",
      "account_name": "limerenara",
      "account_url": "https://www.threads.net/@limerenara",
      "post_id": "8151",
      "post_type": "thread",
      "raw_metadata": {
        "username": "limerenara",
        "likes": 0,
        "replies": 0,
        "reposts": 0,
        "shares": 0,
        "time": "12/21/25",
        "datetime": "2025-12-22T01:08:44.000Z"
      },
      "is_cleaned": true,
      "data_type": "threads",
      "reposts_count": 0
    },
    {
      "url": "https://www.threads.net/@khanhtrang0408/post/DO3hyXsEuxt",
      "source_type": "api",
      "source": "https://www.threads.net/@khanhtrang0408/post/DO3hyXsEuxt",
      "domain": "threads.net",
      "social_platform": "threads",
      "title": "Có ai nhận make kỷ yếu ở mỹ hào , hưng yên giá 300k",
      "content": "Có ai nhận make kỷ yếu ở mỹ hào , hưng yên giá 300k",
      "word_count": 14,
      "published_date": 1758464861.0,
      "published_datetime": "2025-09-21 14:27:41+00:00",
      "likes_count": 0,
      "shares_count": 0,
      "comments_count": 0,
      "views_count": 0,
      "reactions": null,
      "account_id": "khanhtrang0408",
      "account_name": "khanhtrang0408",
      "account_url": "https://www.threads.net/@khanhtrang0408",
      "post_id": "8150",
      "post_type": "thread",
      "raw_metadata": {
        "username": "khanhtrang0408",
        "likes": 0,
        "replies": 0,
        "reposts": 0,
        "shares": 0,
        "time": "09/21/25",
        "datetime": "2025-09-21T14:27:41.000Z"
      },
      "is_cleaned": true,
      "data_type": "threads",
      "reposts_count": 0
    },
    {
      "url": "https://www.threads.net/@phan_ha_uyen98/post/DS7H-WrEg3r",
      "source_type": "api",
      "source": "https://www.threads.net/@phan_ha_uyen98/post/DS7H-WrEg3r",
      "domain": "threads.net",
      "social_platform": "threads",
      "title": "Gò vấp tối đi nhậu hong mng , xong đi coi pháo hoaaaa ak, tìm ng chở tui huhu",
      "content": "Gò vấp tối đi nhậu hong mng , xong đi coi pháo hoaaaa ak, tìm ng chở tui huhu",
      "word_count": 19,
      "published_date": 1767175480.0,
      "published_datetime": "2025-12-31 10:04:40+00:00",
      "likes_count": 0,
      "shares_count": 0,
      "comments_count": 0,
      "views_count": 0,
      "reactions": null,
      "account_id": "phan_ha_uyen98",
      "account_name": "phan_ha_uyen98",
      "account_url": "https://www.threads.net/@phan_ha_uyen98",
      "post_id": "8149",
      "post_type": "thread",
      "raw_metadata": {
        "username": "phan_ha_uyen98",
        "likes": 0,
        "replies": 0,
        "reposts": 0,
        "shares": 0,
        "time": "4d",
        "datetime": "2025-12-31T10:04:40.000Z"
      },
      "is_cleaned": true,
      "data_type": "threads",
      "reposts_count": 0
    },
    {
      "url": "https://www.threads.net/@_hrzkkk.k_/post/DIHgBZqzqBI",
      "source_type": "api",
      "source": "https://www.threads.net/@_hrzkkk.k_/post/DIHgBZqzqBI",
      "domain": "threads.net",
      "social_platform": "threads",
      "title": "th đc r t 6 tính nửa đêm lướt đc post  bảo nhà mình đ có tiền thuê Mỹ Đình nên phải lủi về Hưng Yên...",
      "content": "th đc r t 6 tính nửa đêm lướt đc post  bảo nhà mình đ có tiền thuê Mỹ Đình nên phải lủi về Hưng Yên ))))))))))))))))))))",
      "word_count": 27,
      "published_date": 1743968421.0,
      "published_datetime": "2025-04-06 19:40:21+00:00",
      "likes_count": 0,
      "shares_count": 0,
      "comments_count": 0,
      "views_count": 0,
      "reactions": null,
      "account_id": "_hrzkkk.k_",
      "account_name": "_hrzkkk.k_",
      "account_url": "https://www.threads.net/@_hrzkkk.k_",
      "post_id": "8148",
      "post_type": "thread",
      "raw_metadata": {
        "username": "_hrzkkk.k_",
        "likes": 0,
        "replies": 0,
        "reposts": 0,
        "shares": 0,
        "time": "04/06/25",
        "datetime": "2025-04-06T19:40:21.000Z"
      },
      "is_cleaned": true,
      "data_type": "threads",
      "reposts_count": 0
    },
    {
      "url": "https://www.threads.net/@harie_byeol/post/DSu8SLxkw6M",
      "source_type": "api",
      "source": "https://www.threads.net/@harie_byeol/post/DSu8SLxkw6M",
      "domain": "threads.net",
      "social_platform": "threads",
      "title": "HELP ME Có ai pass lại slot thi SAT tháng 3 tại Hải Phòng, Hà Nội hoặc Hưng Yên giúp mình với ạ. ...",
      "content": "HELP ME Có ai pass lại slot thi SAT tháng 3 tại Hải Phòng, Hà Nội hoặc Hưng Yên giúp mình với ạ. Mình lớp 12 đã thi tháng 12 nhưng điểm chưa đạt mong muốn, tha thiết mong mọi người giúp đỡ vì tháng 3 là lần cuối mình thi rùi",
      "word_count": 52,
      "published_date": 1766766697.0,
      "published_datetime": "2025-12-26 16:31:37+00:00",
      "likes_count": 0,
      "shares_count": 0,
      "comments_count": 0,
      "views_count": 0,
      "reactions": null,
      "account_id": "harie_byeol",
      "account_name": "harie_byeol",
      "account_url": "https://www.threads.net/@harie_byeol",
      "post_id": "8147",
      "post_type": "thread",
      "raw_metadata": {
        "username": "harie_byeol",
        "likes": 0,
        "replies": 0,
        "reposts": 0,
        "shares": 0,
        "time": "12/26/25",
        "datetime": "2025-12-26T16:31:37.000Z"
      },
      "is_cleaned": true,
      "data_type": "threads",
      "reposts_count": 0
    },
    {
      "url": "https://www.threads.net/@huonggg.hr/post/DPyuFVFAZae",
      "source_type": "api",
      "source": "https://www.threads.net/@huonggg.hr/post/DPyuFVFAZae",
      "domain": "threads.net",
      "social_platform": "threads",
      "title": "Hưng Yên  Công ty mới thành lập  Tuyển Giám đốc nhà máy  Lương: 4060 triệu  Yêu cầu: Có kinh ...",
      "content": "Hưng Yên  Công ty mới thành lập  Tuyển Giám đốc nhà máy  Lương: 4060 triệu  Yêu cầu: Có kinh nghiệm quản lý sản xuất thực phẩm, biết tiếng Nhật hoặc tiếng Anh  Quan tâm inbox em nhé!",
      "word_count": 37,
      "published_date": 1760451019.0,
      "published_datetime": "2025-10-14 14:10:19+00:00",
      "likes_count": 0,
      "shares_count": 0,
      "comments_count": 0,
      "views_count": 0,
      "reactions": null,
      "account_id": "huonggg.hr",
      "account_name": "huonggg.hr",
      "account_url": "https://www.threads.net/@huonggg.hr",
      "post_id": "8146",
      "post_type": "thread",
      "raw_metadata": {
        "username": "huonggg.hr",
        "likes": 0,
        "replies": 0,
        "reposts": 0,
        "shares": 0,
        "time": "10/14/25",
        "datetime": "2025-10-14T14:10:19.000Z"
      },
      "is_cleaned": true,
      "data_type": "threads",
      "reposts_count": 0
    },
    {
      "url": "https://www.threads.net/@__callmehanie__/post/DO0qVODD2_h",
      "source_type": "api",
      "source": "https://www.threads.net/@__callmehanie__/post/DO0qVODD2_h",
      "domain": "threads.net",
      "social_platform": "threads",
      "title": "SƠN TÙNG M-TP Tìm thợ chụp kỉ yếu cá nhân (nhóm 2 người) nhận chụp khu vực thành phố Hưng Yên ạaaaa...",
      "content": "SƠN TÙNG M-TP Tìm thợ chụp kỉ yếu cá nhân (nhóm 2 người) nhận chụp khu vực thành phố Hưng Yên ạaaaa Tiện thể tìm thợ make luôn ạ",
      "word_count": 29,
      "published_date": 1758368677.0,
      "published_datetime": "2025-09-20 11:44:37+00:00",
      "likes_count": 0,
      "shares_count": 0,
      "comments_count": 0,
      "views_count": 0,
      "reactions": null,
      "account_id": "__callmehanie__",
      "account_name": "__callmehanie__",
      "account_url": "https://www.threads.net/@__callmehanie__",
      "post_id": "8145",
      "post_type": "thread",
      "raw_metadata": {
        "username": "__callmehanie__",
        "likes": 0,
        "replies": 0,
        "reposts": 0,
        "shares": 0,
        "time": "09/20/25",
        "datetime": "2025-09-20T11:44:37.000Z"
      },
      "is_cleaned": true,
      "data_type": "threads",
      "reposts_count": 0
    },
    {
      "url": "https://www.threads.net/@tungtunv/post/DJT2C9Fvf1f",
      "source_type": "api",
      "source": "https://www.threads.net/@tungtunv/post/DJT2C9Fvf1f",
      "domain": "threads.net",
      "social_platform": "threads",
      "title": "Mọi người cho mình hỏi với : Mình với ny mình cuối tuần này muốn đi lên Hạ Long chơi nhưng đang phâ...",
      "content": "Mọi người cho mình hỏi với : Mình với ny mình cuối tuần này muốn đi lên Hạ Long chơi nhưng đang phân vân không biết nên đi xe máy hay đi xe khách ? Bọn mình đi từ phố nối B Hưng yên lên đấy tầm 130 km thì nếu mình đi xe máy thì có cần lưu ý gì không như về đường đi , cảnh sát giao thông . Hay mình nên đi bằng xe khách ạ? Tại mình muốn thoải mái giờ giấc với vừa đi vừa ngắm cảnh và 1 phần cũng vì ny mình rất say xe ý ạ . Ai đi rồi hay có kinh nghiệm thì chia sẻ cho mình với ạ mình c ơn-3",
      "word_count": 123,
      "published_date": 1746530104.0,
      "published_datetime": "2025-05-06 11:15:04+00:00",
      "likes_count": 0,
      "shares_count": 0,
      "comments_count": 0,
      "views_count": 0,
      "reactions": null,
      "account_id": "tungtunv",
      "account_name": "tungtunv",
      "account_url": "https://www.threads.net/@tungtunv",
      "post_id": "8144",
      "post_type": "thread",
      "raw_metadata": {
        "username": "tungtunv",
        "likes": 0,
        "replies": 0,
        "reposts": 0,
        "shares": 0,
        "time": "05/06/25",
        "datetime": "2025-05-06T11:15:04.000Z"
      },
      "is_cleaned": true,
      "data_type": "threads",
      "reposts_count": 0
    },
    {
      "url": "https://www.threads.net/@huonggg.hr/post/DLuyXxiheDW",
      "source_type": "api",
      "source": "https://www.threads.net/@huonggg.hr/post/DLuyXxiheDW",
      "domain": "threads.net",
      "social_platform": "threads",
      "title": "GẤP  TUYỂN DỤNG TẠI HƯNG YÊN Cánh tay các bạn ở Hưng Yên đâu rồi ạ??? Cơ hội làm việc tại công...",
      "content": "GẤP  TUYỂN DỤNG TẠI HƯNG YÊN Cánh tay các bạn ở Hưng Yên đâu rồi ạ??? Cơ hội làm việc tại công ty Nhật Bản ổn định  chuyên nghiệp  nhiều đãi ngộ tốt ngay tại KCN Thăng Long II, Hưng Yên",
      "word_count": 41,
      "published_date": 1751729115.0,
      "published_datetime": "2025-07-05 15:25:15+00:00",
      "likes_count": 0,
      "shares_count": 0,
      "comments_count": 0,
      "views_count": 0,
      "reactions": null,
      "account_id": "huonggg.hr",
      "account_name": "huonggg.hr",
      "account_url": "https://www.threads.net/@huonggg.hr",
      "post_id": "8143",
      "post_type": "thread",
      "raw_metadata": {
        "username": "huonggg.hr",
        "likes": 0,
        "replies": 0,
        "reposts": 0,
        "shares": 0,
        "time": "07/05/25",
        "datetime": "2025-07-05T15:25:15.000Z"
      },
      "is_cleaned": true,
      "data_type": "threads",
      "reposts_count": 0
    },
    {
      "url": "https://www.threads.net/@zbbyist/post/DSL95r9j3x3",
      "source_type": "api",
      "source": "https://www.threads.net/@zbbyist/post/DSL95r9j3x3",
      "domain": "threads.net",
      "social_platform": "threads",
      "title": "Tìm người ghép xe đi từ TP Nam định đến Hưng Yên cùng  Translate 12",
      "content": "Tìm người ghép xe đi từ TP Nam định đến Hưng Yên cùng  Translate 12",
      "word_count": 15,
      "published_date": 1765593140.0,
      "published_datetime": "2025-12-13 02:32:20+00:00",
      "likes_count": 0,
      "shares_count": 0,
      "comments_count": 0,
      "views_count": 0,
      "reactions": null,
      "account_id": "zbbyist",
      "account_name": "zbbyist",
      "account_url": "https://www.threads.net/@zbbyist",
      "post_id": "8142",
      "post_type": "thread",
      "raw_metadata": {
        "username": "zbbyist",
        "likes": 0,
        "replies": 0,
        "reposts": 0,
        "shares": 0,
        "time": "12/12/25",
        "datetime": "2025-12-13T02:32:20.000Z"
      },
      "is_cleaned": true,
      "data_type": "threads",
      "reposts_count": 0
    },
    {
      "url": "https://www.threads.net/@tivihomnaycogi/post/DTA8vXXE-u5",
      "source_type": "api",
      "source": "https://www.threads.net/@tivihomnaycogi/post/DTA8vXXE-u5",
      "domain": "threads.net",
      "social_platform": "threads",
      "title": "- \"Ai là triệu phú?\" Nhật Bản trở lại đúng dịp năm mới với tập đặc biệt dài 4 tiếng, Hashimoto Kanna...",
      "content": "- \"Ai là triệu phú?\" Nhật Bản trở lại đúng dịp năm mới với tập đặc biệt dài 4 tiếng, Hashimoto Kanna vượt qua hết 12 câu để thắng 10 triệu Yên (ảnh). Translate 12",
      "word_count": 35,
      "published_date": 1767370916.0,
      "published_datetime": "2026-01-02 16:21:56+00:00",
      "likes_count": 0,
      "shares_count": 0,
      "comments_count": 0,
      "views_count": 0,
      "reactions": null,
      "account_id": "tivihomnaycogi",
      "account_name": "tivihomnaycogi",
      "account_url": "https://www.threads.net/@tivihomnaycogi",
      "post_id": "8141",
      "post_type": "thread",
      "raw_metadata": {
        "username": "tivihomnaycogi",
        "likes": 0,
        "replies": 0,
        "reposts": 0,
        "shares": 0,
        "time": "1d",
        "datetime": "2026-01-02T16:21:56.000Z"
      },
      "is_cleaned": true,
      "data_type": "threads",
      "reposts_count": 0
    },
    {
      "url": "https://www.threads.net/@myslifewith2cats/post/DR1XL08kxsY",
      "source_type": "api",
      "source": "https://www.threads.net/@myslifewith2cats/post/DR1XL08kxsY",
      "domain": "threads.net",
      "social_platform": "threads",
      "title": "Mình có máy digital LUMIX DMC FX01 màu bạc cần pass ạ. Ưu tiên các bạn có thể gdtt ạ (Hưng Yên cũCh...",
      "content": "Mình có máy digital LUMIX DMC FX01 màu bạc cần pass ạ. Ưu tiên các bạn có thể gdtt ạ (Hưng Yên cũChùa Làng gần ĐH Ngoại Thương).",
      "word_count": 28,
      "published_date": 1764834644.0,
      "published_datetime": "2025-12-04 07:50:44+00:00",
      "likes_count": 0,
      "shares_count": 0,
      "comments_count": 0,
      "views_count": 0,
      "reactions": null,
      "account_id": "myslifewith2cats",
      "account_name": "myslifewith2cats",
      "account_url": "https://www.threads.net/@myslifewith2cats",
      "post_id": "8140",
      "post_type": "thread",
      "raw_metadata": {
        "username": "myslifewith2cats",
        "likes": 0,
        "replies": 0,
        "reposts": 0,
        "shares": 0,
        "time": "12/04/25",
        "datetime": "2025-12-04T07:50:44.000Z"
      },
      "is_cleaned": true,
      "data_type": "threads",
      "reposts_count": 0
    },
    {
      "url": "https://www.threads.net/@_27atherrr.0/post/DS7BLXJE8OQ",
      "source_type": "api",
      "source": "https://www.threads.net/@_27atherrr.0/post/DS7BLXJE8OQ",
      "domain": "threads.net",
      "social_platform": "threads",
      "title": "Pháp luật nào cấm tôi yêu Bùi Lan Hương",
      "content": "Pháp luật nào cấm tôi yêu Bùi Lan Hương",
      "word_count": 9,
      "published_date": 1767171916.0,
      "published_datetime": "2025-12-31 09:05:16+00:00",
      "likes_count": 0,
      "shares_count": 0,
      "comments_count": 0,
      "views_count": 0,
      "reactions": null,
      "account_id": "_27atherrr.0",
      "account_name": "_27atherrr.0",
      "account_url": "https://www.threads.net/@_27atherrr.0",
      "post_id": "8139",
      "post_type": "thread",
      "raw_metadata": {
        "username": "_27atherrr.0",
        "likes": 0,
        "replies": 0,
        "reposts": 0,
        "shares": 0,
        "time": "4d",
        "datetime": "2025-12-31T09:05:16.000Z"
      },
      "is_cleaned": true,
      "data_type": "threads",
      "reposts_count": 0
    },
    {
      "url": "https://www.threads.net/@ngolinh17.1/post/DTC3D4AEh2V",
      "source_type": "api",
      "source": "https://www.threads.net/@ngolinh17.1/post/DTC3D4AEh2V",
      "domain": "threads.net",
      "social_platform": "threads",
      "title": "Lý do gì khiến một số bạn chọn nghie giệc vào cuối năm vậy ạ? Bên mình vẫn còn job tiéng trung, tiến...",
      "content": "Lý do gì khiến một số bạn chọn nghie giệc vào cuối năm vậy ạ? Bên mình vẫn còn job tiéng trung, tiếng Anh, tiếng nhật khu vực BG, BN, HN, Hưng Yên, Bạn nào qtam gửi Cv mình hỗ trợ nhé Mail: ngolinh17.hr@gmail.com",
      "word_count": 44,
      "published_date": 1767435047.0,
      "published_datetime": "2026-01-03 10:10:47+00:00",
      "likes_count": 0,
      "shares_count": 0,
      "comments_count": 0,
      "views_count": 0,
      "reactions": null,
      "account_id": "ngolinh17.1",
      "account_name": "ngolinh17.1",
      "account_url": "https://www.threads.net/@ngolinh17.1",
      "post_id": "8138",
      "post_type": "thread",
      "raw_metadata": {
        "username": "ngolinh17.1",
        "likes": 0,
        "replies": 0,
        "reposts": 0,
        "shares": 0,
        "time": "1d",
        "datetime": "2026-01-03T10:10:47.000Z"
      },
      "is_cleaned": true,
      "data_type": "threads",
      "reposts_count": 0
    },
    {
      "url": "https://www.threads.net/@kim_thuy_shophoahungyen/post/DKeO6fsz_ah",
      "source_type": "api",
      "source": "https://www.threads.net/@kim_thuy_shophoahungyen/post/DKeO6fsz_ah",
      "domain": "threads.net",
      "social_platform": "threads",
      "title": "Shop hoa mình ở Hưng Yên anh chị em ai cần ib mình nhé Hưng Yên",
      "content": "Shop hoa mình ở Hưng Yên anh chị em ai cần ib mình nhé Hưng Yên",
      "word_count": 16,
      "published_date": 1749026170.0,
      "published_datetime": "2025-06-04 08:36:10+00:00",
      "likes_count": 0,
      "shares_count": 0,
      "comments_count": 0,
      "views_count": 0,
      "reactions": null,
      "account_id": "kim_thuy_shophoahungyen",
      "account_name": "kim_thuy_shophoahungyen",
      "account_url": "https://www.threads.net/@kim_thuy_shophoahungyen",
      "post_id": "8137",
      "post_type": "thread",
      "raw_metadata": {
        "username": "kim_thuy_shophoahungyen",
        "likes": 0,
        "replies": 0,
        "reposts": 0,
        "shares": 0,
        "time": "06/04/25",
        "datetime": "2025-06-04T08:36:10.000Z"
      },
      "is_cleaned": true,
      "data_type": "threads",
      "reposts_count": 0
    },
    {
      "url": "https://www.threads.net/@namtienvu/post/DTFGVyYDrGD",
      "source_type": "api",
      "source": "https://www.threads.net/@namtienvu/post/DTFGVyYDrGD",
      "domain": "threads.net",
      "social_platform": "threads",
      "title": "Tôi không tin vào Toà án tỉnh Hưng Yên nữa, nên không kính gửi đơn thư nào đến cơ quan này liên quan...",
      "content": "Tôi không tin vào Toà án tỉnh Hưng Yên nữa, nên không kính gửi đơn thư nào đến cơ quan này liên quan tới việc giải quyết mà UBND tỉnh Hưng Yên cần trả lại quyền và lợi ích của gia đình và công ty tôi.",
      "word_count": 46,
      "published_date": 1767510167.0,
      "published_datetime": "2026-01-04 07:02:47+00:00",
      "likes_count": 0,
      "shares_count": 0,
      "comments_count": 0,
      "views_count": 0,
      "reactions": null,
      "account_id": "namtienvu",
      "account_name": "namtienvu",
      "account_url": "https://www.threads.net/@namtienvu",
      "post_id": "8136",
      "post_type": "thread",
      "raw_metadata": {
        "username": "namtienvu",
        "likes": 0,
        "replies": 0,
        "reposts": 0,
        "shares": 0,
        "time": "3h",
        "datetime": "2026-01-04T07:02:47.000Z"
      },
      "is_cleaned": true,
      "data_type": "threads",
      "reposts_count": 0
    },
    {
      "url": "https://www.threads.net/@nha680413/post/DS9r79uk2mA",
      "source_type": "api",
      "source": "https://www.threads.net/@nha680413/post/DS9r79uk2mA",
      "domain": "threads.net",
      "social_platform": "threads",
      "title": "Vừa về tuyên quang đã bị hỏi có ny ch 22 tuổi rồi đó",
      "content": "Vừa về tuyên quang đã bị hỏi có ny ch 22 tuổi rồi đó",
      "word_count": 14,
      "published_date": 1767261443.0,
      "published_datetime": "2026-01-01 09:57:23+00:00",
      "likes_count": 0,
      "shares_count": 0,
      "comments_count": 0,
      "views_count": 0,
      "reactions": null,
      "account_id": "nha680413",
      "account_name": "nha680413",
      "account_url": "https://www.threads.net/@nha680413",
      "post_id": "8135",
      "post_type": "thread",
      "raw_metadata": {
        "username": "nha680413",
        "likes": 0,
        "replies": 0,
        "reposts": 0,
        "shares": 0,
        "time": "3d",
        "datetime": "2026-01-01T09:57:23.000Z"
      },
      "is_cleaned": true,
      "data_type": "threads",
      "reposts_count": 0
    },
    {
      "url": "https://www.threads.net/@lyly_han25/post/DSUaVM-EYnM",
      "source_type": "api",
      "source": "https://www.threads.net/@lyly_han25/post/DSUaVM-EYnM",
      "domain": "threads.net",
      "social_platform": "threads",
      "title": "Ai passs fansign chặng Hưng Yên cho em với ạ",
      "content": "Ai passs fansign chặng Hưng Yên cho em với ạ",
      "word_count": 10,
      "published_date": 1765876481.0,
      "published_datetime": "2025-12-16 09:14:41+00:00",
      "likes_count": 0,
      "shares_count": 0,
      "comments_count": 0,
      "views_count": 0,
      "reactions": null,
      "account_id": "lyly_han25",
      "account_name": "lyly_han25",
      "account_url": "https://www.threads.net/@lyly_han25",
      "post_id": "8134",
      "post_type": "thread",
      "raw_metadata": {
        "username": "lyly_han25",
        "likes": 0,
        "replies": 0,
        "reposts": 0,
        "shares": 0,
        "time": "12/16/25",
        "datetime": "2025-12-16T09:14:41.000Z"
      },
      "is_cleaned": true,
      "data_type": "threads",
      "reposts_count": 0
    },
    {
      "url": "https://www.threads.net/@vanbui.hr/post/DKY2RfwzRRk",
      "source_type": "api",
      "source": "https://www.threads.net/@vanbui.hr/post/DKY2RfwzRRk",
      "domain": "threads.net",
      "social_platform": "threads",
      "title": "Văn Lâm, Hưng Yên Mình đang cần 2 bạn HR Lead làm việc thứ 2 đến thứ 7, lương up to 16tr , có 3 nă...",
      "content": "Văn Lâm, Hưng Yên Mình đang cần 2 bạn HR Lead làm việc thứ 2 đến thứ 7, lương up to 16tr , có 3 năm kn nhan sự trở lên. Inbox zalo 0343213082, mình gửi jd nha",
      "word_count": 38,
      "published_date": 1748845479.0,
      "published_datetime": "2025-06-02 06:24:39+00:00",
      "likes_count": 0,
      "shares_count": 0,
      "comments_count": 0,
      "views_count": 0,
      "reactions": null,
      "account_id": "vanbui.hr",
      "account_name": "vanbui.hr",
      "account_url": "https://www.threads.net/@vanbui.hr",
      "post_id": "8133",
      "post_type": "thread",
      "raw_metadata": {
        "username": "vanbui.hr",
        "likes": 0,
        "replies": 0,
        "reposts": 0,
        "shares": 0,
        "time": "06/02/25",
        "datetime": "2025-06-02T06:24:39.000Z"
      },
      "is_cleaned": true,
      "data_type": "threads",
      "reposts_count": 0
    },
    {
      "url": "https://www.threads.net/@htoh1503/post/DMzGmzhvnkG",
      "source_type": "api",
      "source": "https://www.threads.net/@htoh1503/post/DMzGmzhvnkG",
      "domain": "threads.net",
      "social_platform": "threads",
      "title": "HƯNG YÊN  Cần tuyển Nhân viên kho Lương 11M Ib ngay 0375155581 nhé",
      "content": "HƯNG YÊN  Cần tuyển Nhân viên kho Lương 11M Ib ngay 0375155581 nhé",
      "word_count": 13,
      "published_date": 1754021425.0,
      "published_datetime": "2025-08-01 04:10:25+00:00",
      "likes_count": 0,
      "shares_count": 0,
      "comments_count": 0,
      "views_count": 0,
      "reactions": null,
      "account_id": "htoh1503",
      "account_name": "htoh1503",
      "account_url": "https://www.threads.net/@htoh1503",
      "post_id": "8132",
      "post_type": "thread",
      "raw_metadata": {
        "username": "htoh1503",
        "likes": 0,
        "replies": 0,
        "reposts": 0,
        "shares": 0,
        "time": "08/01/25",
        "datetime": "2025-08-01T04:10:25.000Z"
      },
      "is_cleaned": true,
      "data_type": "threads",
      "reposts_count": 0
    },
    {
      "url": "https://www.threads.net/@trachanhdayy/post/DSPIQZsicHQ",
      "source_type": "api",
      "source": "https://www.threads.net/@trachanhdayy/post/DSPIQZsicHQ",
      "domain": "threads.net",
      "social_platform": "threads",
      "title": "hẹn hưng yên 1 tuần nữa  Translate 12",
      "content": "hẹn hưng yên 1 tuần nữa  Translate 12",
      "word_count": 8,
      "published_date": 1765699232.0,
      "published_datetime": "2025-12-14 08:00:32+00:00",
      "likes_count": 0,
      "shares_count": 0,
      "comments_count": 0,
      "views_count": 0,
      "reactions": null,
      "account_id": "trachanhdayy",
      "account_name": "trachanhdayy",
      "account_url": "https://www.threads.net/@trachanhdayy",
      "post_id": "8131",
      "post_type": "thread",
      "raw_metadata": {
        "username": "trachanhdayy",
        "likes": 0,
        "replies": 0,
        "reposts": 0,
        "shares": 0,
        "time": "12/14/25",
        "datetime": "2025-12-14T08:00:32.000Z"
      },
      "is_cleaned": true,
      "data_type": "threads",
      "reposts_count": 0
    },
    {
      "url": "https://www.threads.net/@purple_photosg/post/DS-FauDFIaE",
      "source_type": "api",
      "source": "https://www.threads.net/@purple_photosg/post/DS-FauDFIaE",
      "domain": "threads.net",
      "social_platform": "threads",
      "title": "Mình ở SG muốn tết này ra Hưng Yên ăn tết có nhận chụp hình Tết 200k bằng photophone iphone 17. Hy v...",
      "content": "Mình ở SG muốn tết này ra Hưng Yên ăn tết có nhận chụp hình Tết 200k bằng photophone iphone 17. Hy vọng có nhiều bạn cần đặt lịch ạ  Mình còn có make-up nữa nhennnn",
      "word_count": 36,
      "published_date": 1767274802.0,
      "published_datetime": "2026-01-01 13:40:02+00:00",
      "likes_count": 0,
      "shares_count": 0,
      "comments_count": 0,
      "views_count": 0,
      "reactions": null,
      "account_id": "purple_photosg",
      "account_name": "purple_photosg",
      "account_url": "https://www.threads.net/@purple_photosg",
      "post_id": "8130",
      "post_type": "thread",
      "raw_metadata": {
        "username": "purple_photosg",
        "likes": 0,
        "replies": 0,
        "reposts": 0,
        "shares": 0,
        "time": "2d",
        "datetime": "2026-01-01T13:40:02.000Z"
      },
      "is_cleaned": true,
      "data_type": "threads",
      "reposts_count": 0
    },
    {
      "url": "https://www.threads.net/@hng.neey/post/DS9zK4QgU2a",
      "source_type": "api",
      "source": "https://www.threads.net/@hng.neey/post/DS9zK4QgU2a",
      "domain": "threads.net",
      "social_platform": "threads",
      "title": "Đầu năm 2026, first trip với ảnh hi vọng cả năm nhiều tiền và nhiều trip y vậy nữa nha.",
      "content": "Đầu năm 2026, first trip với ảnh hi vọng cả năm nhiều tiền và nhiều trip y vậy nữa nha.",
      "word_count": 20,
      "published_date": 1767265235.0,
      "published_datetime": "2026-01-01 11:00:35+00:00",
      "likes_count": 0,
      "shares_count": 0,
      "comments_count": 0,
      "views_count": 0,
      "reactions": null,
      "account_id": "hng.neey",
      "account_name": "hng.neey",
      "account_url": "https://www.threads.net/@hng.neey",
      "post_id": "8129",
      "post_type": "thread",
      "raw_metadata": {
        "username": "hng.neey",
        "likes": 0,
        "replies": 0,
        "reposts": 0,
        "shares": 0,
        "time": "2d",
        "datetime": "2026-01-01T11:00:35.000Z"
      },
      "is_cleaned": true,
      "data_type": "threads",
      "reposts_count": 0
    },
    {
      "url": "https://www.threads.net/@hoang17tm/post/DTErSpEiMNt",
      "source_type": "api",
      "source": "https://www.threads.net/@hoang17tm/post/DTErSpEiMNt",
      "domain": "threads.net",
      "social_platform": "threads",
      "title": "Rồi lại suốt ngày full bàn như HT Club hưng yên",
      "content": "Rồi lại suốt ngày full bàn như HT Club hưng yên",
      "word_count": 11,
      "published_date": 1767495992.0,
      "published_datetime": "2026-01-04 03:06:32+00:00",
      "likes_count": 0,
      "shares_count": 0,
      "comments_count": 0,
      "views_count": 0,
      "reactions": null,
      "account_id": "hoang17tm",
      "account_name": "hoang17tm",
      "account_url": "https://www.threads.net/@hoang17tm",
      "post_id": "8128",
      "post_type": "thread",
      "raw_metadata": {
        "username": "hoang17tm",
        "likes": 0,
        "replies": 0,
        "reposts": 0,
        "shares": 0,
        "time": "7h",
        "datetime": "2026-01-04T03:06:32.000Z"
      },
      "is_cleaned": true,
      "data_type": "threads",
      "reposts_count": 0
    },
    {
      "url": "https://www.threads.net/@raeju_02/post/DSckoQxEmQ8",
      "source_type": "api",
      "source": "https://www.threads.net/@raeju_02/post/DSckoQxEmQ8",
      "domain": "threads.net",
      "social_platform": "threads",
      "title": "rốt cuộc là đất Hưng Yên có gì vậy ạ",
      "content": "rốt cuộc là đất Hưng Yên có gì vậy ạ",
      "word_count": 10,
      "published_date": 1766150336.0,
      "published_datetime": "2025-12-19 13:18:56+00:00",
      "likes_count": 0,
      "shares_count": 0,
      "comments_count": 0,
      "views_count": 0,
      "reactions": null,
      "account_id": "raeju_02",
      "account_name": "raeju_02",
      "account_url": "https://www.threads.net/@raeju_02",
      "post_id": "8127",
      "post_type": "thread",
      "raw_metadata": {
        "username": "raeju_02",
        "likes": 0,
        "replies": 0,
        "reposts": 0,
        "shares": 0,
        "time": "12/19/25",
        "datetime": "2025-12-19T13:18:56.000Z"
      },
      "is_cleaned": true,
      "data_type": "threads",
      "reposts_count": 0
    },
    {
      "url": "https://www.threads.net/@mygg_1001/post/DRTr0lXk6R2",
      "source_type": "api",
      "source": "https://www.threads.net/@mygg_1001/post/DRTr0lXk6R2",
      "domain": "threads.net",
      "social_platform": "threads",
      "title": "Gái bản về xuôi aa",
      "content": "Gái bản về xuôi aa",
      "word_count": 5,
      "published_date": 1763704613.0,
      "published_datetime": "2025-11-21 05:56:53+00:00",
      "likes_count": 0,
      "shares_count": 0,
      "comments_count": 0,
      "views_count": 0,
      "reactions": null,
      "account_id": "mygg_1001",
      "account_name": "mygg_1001",
      "account_url": "https://www.threads.net/@mygg_1001",
      "post_id": "8126",
      "post_type": "thread",
      "raw_metadata": {
        "username": "mygg_1001",
        "likes": 0,
        "replies": 0,
        "reposts": 0,
        "shares": 0,
        "time": "11/21/25",
        "datetime": "2025-11-21T05:56:53.000Z"
      },
      "is_cleaned": true,
      "data_type": "threads",
      "reposts_count": 0
    },
    {
      "url": "https://www.threads.net/@diemmy2412_/post/DP6J71rkkK4",
      "source_type": "api",
      "source": "https://www.threads.net/@diemmy2412_/post/DP6J71rkkK4",
      "domain": "threads.net",
      "social_platform": "threads",
      "title": "Em tìm thợ chụp kỉ yếu cá nhân cả ngày. EM ở Hưng Yên, em mong tìm được thợ chụp được màu mang hướng...",
      "content": "Em tìm thợ chụp kỉ yếu cá nhân cả ngày. EM ở Hưng Yên, em mong tìm được thợ chụp được màu mang hướng vibes nắng thơ hoặc màu hồng lạnh như ảnh đầu luôn ạ. Translate 12",
      "word_count": 38,
      "published_date": 1760700502.0,
      "published_datetime": "2025-10-17 11:28:22+00:00",
      "likes_count": 0,
      "shares_count": 0,
      "comments_count": 0,
      "views_count": 0,
      "reactions": null,
      "account_id": "diemmy2412_",
      "account_name": "diemmy2412_",
      "account_url": "https://www.threads.net/@diemmy2412_",
      "post_id": "8125",
      "post_type": "thread",
      "raw_metadata": {
        "username": "diemmy2412_",
        "likes": 0,
        "replies": 0,
        "reposts": 0,
        "shares": 0,
        "time": "10/17/25",
        "datetime": "2025-10-17T11:28:22.000Z"
      },
      "is_cleaned": true,
      "data_type": "threads",
      "reposts_count": 0
    },
    {
      "url": "https://www.threads.net/@_.iammai7128._/post/DQePHB2E0yf",
      "source_type": "api",
      "source": "https://www.threads.net/@_.iammai7128._/post/DQePHB2E0yf",
      "domain": "threads.net",
      "social_platform": "threads",
      "title": "Cần tìm make kỉ yếu khu vực TP Hưng Yên 41. Giá cả 300_450k ặ",
      "content": "Cần tìm make kỉ yếu khu vực TP Hưng Yên 41. Giá cả 300_450k ặ",
      "word_count": 15,
      "published_date": 1761911175.0,
      "published_datetime": "2025-10-31 11:46:15+00:00",
      "likes_count": 0,
      "shares_count": 0,
      "comments_count": 0,
      "views_count": 0,
      "reactions": null,
      "account_id": "_.iammai7128._",
      "account_name": "_.iammai7128._",
      "account_url": "https://www.threads.net/@_.iammai7128._",
      "post_id": "8124",
      "post_type": "thread",
      "raw_metadata": {
        "username": "_.iammai7128._",
        "likes": 0,
        "replies": 0,
        "reposts": 0,
        "shares": 0,
        "time": "10/31/25",
        "datetime": "2025-10-31T11:46:15.000Z"
      },
      "is_cleaned": true,
      "data_type": "threads",
      "reposts_count": 0
    },
    {
      "url": "https://www.threads.net/@thodaodanghong03/post/DS49i4oEevV",
      "source_type": "api",
      "source": "https://www.threads.net/@thodaodanghong03/post/DS49i4oEevV",
      "domain": "threads.net",
      "social_platform": "threads",
      "title": "Thật sự là nguyên ngày hôm nay em cháy máy với TRỐNG CƠM các bác ạ :))",
      "content": "Thật sự là nguyên ngày hôm nay em cháy máy với TRỐNG CƠM các bác ạ :))",
      "word_count": 17,
      "published_date": 1767102903.0,
      "published_datetime": "2025-12-30 13:55:03+00:00",
      "likes_count": 0,
      "shares_count": 0,
      "comments_count": 0,
      "views_count": 0,
      "reactions": null,
      "account_id": "thodaodanghong03",
      "account_name": "thodaodanghong03",
      "account_url": "https://www.threads.net/@thodaodanghong03",
      "post_id": "8123",
      "post_type": "thread",
      "raw_metadata": {
        "username": "thodaodanghong03",
        "likes": 0,
        "replies": 0,
        "reposts": 0,
        "shares": 0,
        "time": "4d",
        "datetime": "2025-12-30T13:55:03.000Z"
      },
      "is_cleaned": true,
      "data_type": "threads",
      "reposts_count": 0
    },
    {
      "url": "https://www.threads.net/@cloud.ngocthom/post/DAi1iGDT0IG",
      "source_type": "api",
      "source": "https://www.threads.net/@cloud.ngocthom/post/DAi1iGDT0IG",
      "domain": "threads.net",
      "social_platform": "threads",
      "title": "Ai đi Vinhomes Ocean Park3 Hưng yên chưa ạ  @threads",
      "content": "Ai đi Vinhomes Ocean Park3 Hưng yên chưa ạ  @threads",
      "word_count": 10,
      "published_date": 1727705799.0,
      "published_datetime": "2024-09-30 14:16:39+00:00",
      "likes_count": 0,
      "shares_count": 0,
      "comments_count": 0,
      "views_count": 0,
      "reactions": null,
      "account_id": "cloud.ngocthom",
      "account_name": "cloud.ngocthom",
      "account_url": "https://www.threads.net/@cloud.ngocthom",
      "post_id": "8122",
      "post_type": "thread",
      "raw_metadata": {
        "username": "cloud.ngocthom",
        "likes": 0,
        "replies": 0,
        "reposts": 0,
        "shares": 0,
        "time": "09/30/24",
        "datetime": "2024-09-30T14:16:39.000Z"
      },
      "is_cleaned": true,
      "data_type": "threads",
      "reposts_count": 0
    },
    {
      "url": "https://www.threads.net/@vohieuphuc/post/DDfGAnsTmzN",
      "source_type": "api",
      "source": "https://www.threads.net/@vohieuphuc/post/DDfGAnsTmzN",
      "domain": "threads.net",
      "social_platform": "threads",
      "title": "Đố các bạn, trên thế gian này khoảng cách nào là xa nhất ? Nó không phải là khoảng cách từ ngọn núi ...",
      "content": "Đố các bạn, trên thế gian này khoảng cách nào là xa nhất ? Nó không phải là khoảng cách từ ngọn núi này đến ngọn núi kia Không phải là khoảng cách từ đại dương này đến đại dương kia Cũng không phải là khoảng cách từ châu lục này đến châu lục kia Mà nó chính là khỏang cách từ Hà Nội đến Hưng Yên dài 59.6km",
      "word_count": 69,
      "published_date": 1734022671.0,
      "published_datetime": "2024-12-12 16:57:51+00:00",
      "likes_count": 0,
      "shares_count": 0,
      "comments_count": 0,
      "views_count": 0,
      "reactions": null,
      "account_id": "vohieuphuc",
      "account_name": "vohieuphuc",
      "account_url": "https://www.threads.net/@vohieuphuc",
      "post_id": "8121",
      "post_type": "thread",
      "raw_metadata": {
        "username": "vohieuphuc",
        "likes": 0,
        "replies": 0,
        "reposts": 0,
        "shares": 0,
        "time": "12/12/24",
        "datetime": "2024-12-12T16:57:51.000Z"
      },
      "is_cleaned": true,
      "data_type": "threads",
      "reposts_count": 0
    },
    {
      "url": "https://www.threads.net/@k.huyeen/post/DS8KcRTknaX",
      "source_type": "api",
      "source": "https://www.threads.net/@k.huyeen/post/DS8KcRTknaX",
      "domain": "threads.net",
      "social_platform": "threads",
      "title": "Pháo hoa HG xịn đétttt HPNY 2026",
      "content": "Pháo hoa HG xịn đétttt HPNY 2026",
      "word_count": 7,
      "published_date": 1767210363.0,
      "published_datetime": "2025-12-31 19:46:03+00:00",
      "likes_count": 0,
      "shares_count": 0,
      "comments_count": 0,
      "views_count": 0,
      "reactions": null,
      "account_id": "k.huyeen",
      "account_name": "k.huyeen",
      "account_url": "https://www.threads.net/@k.huyeen",
      "post_id": "8120",
      "post_type": "thread",
      "raw_metadata": {
        "username": "k.huyeen",
        "likes": 0,
        "replies": 0,
        "reposts": 0,
        "shares": 0,
        "time": "3d",
        "datetime": "2025-12-31T19:46:03.000Z"
      },
      "is_cleaned": true,
      "data_type": "threads",
      "reposts_count": 0
    },
    {
      "url": "https://www.threads.net/@lynhan_w/post/DSPuFfyj19y",
      "source_type": "api",
      "source": "https://www.threads.net/@lynhan_w/post/DSPuFfyj19y",
      "domain": "threads.net",
      "social_platform": "threads",
      "title": "mng ơi, rcm e thợ ảnh Tết ở Hưng Yên giá khoảng 1tr với ạ, e muốn chụp ảnh Tết với gia đình ấy ạ ...",
      "content": "mng ơi, rcm e thợ ảnh Tết ở Hưng Yên giá khoảng 1tr với ạ, e muốn chụp ảnh Tết với gia đình ấy ạ  e cảm ơn ạ Translate 12",
      "word_count": 31,
      "published_date": 1765719066.0,
      "published_datetime": "2025-12-14 13:31:06+00:00",
      "likes_count": 0,
      "shares_count": 0,
      "comments_count": 0,
      "views_count": 0,
      "reactions": null,
      "account_id": "lynhan_w",
      "account_name": "lynhan_w",
      "account_url": "https://www.threads.net/@lynhan_w",
      "post_id": "8119",
      "post_type": "thread",
      "raw_metadata": {
        "username": "lynhan_w",
        "likes": 0,
        "replies": 0,
        "reposts": 0,
        "shares": 0,
        "time": "12/14/25",
        "datetime": "2025-12-14T13:31:06.000Z"
      },
      "is_cleaned": true,
      "data_type": "threads",
      "reposts_count": 0
    },
    {
      "url": "https://www.threads.net/@idc.bxtch_/post/DIjXLPkPX-D",
      "source_type": "api",
      "source": "https://www.threads.net/@idc.bxtch_/post/DIjXLPkPX-D",
      "domain": "threads.net",
      "social_platform": "threads",
      "title": "ê bực mình vl, dẹp ngay cái vụ toxic Hưng Yên với Thái Bình dùm t cái???",
      "content": "ê bực mình vl, dẹp ngay cái vụ toxic Hưng Yên với Thái Bình dùm t cái???",
      "word_count": 17,
      "published_date": 1744903307.0,
      "published_datetime": "2025-04-17 15:21:47+00:00",
      "likes_count": 0,
      "shares_count": 0,
      "comments_count": 0,
      "views_count": 0,
      "reactions": null,
      "account_id": "idc.bxtch_",
      "account_name": "idc.bxtch_",
      "account_url": "https://www.threads.net/@idc.bxtch_",
      "post_id": "8118",
      "post_type": "thread",
      "raw_metadata": {
        "username": "idc.bxtch_",
        "likes": 0,
        "replies": 0,
        "reposts": 0,
        "shares": 0,
        "time": "04/17/25",
        "datetime": "2025-04-17T15:21:47.000Z"
      },
      "is_cleaned": true,
      "data_type": "threads",
      "reposts_count": 0
    },
    {
      "url": "https://www.threads.net/@kmerveiller/post/DK0lx4Dzd3y",
      "source_type": "api",
      "source": "https://www.threads.net/@kmerveiller/post/DK0lx4Dzd3y",
      "domain": "threads.net",
      "social_platform": "threads",
      "title": "30 tô bánh canh tại các tụ điểm: - hà nộihưng yên (concert atvncg): châu, chung, tâm, quân, đạt, na...",
      "content": "30 tô bánh canh tại các tụ điểm: - hà nộihưng yên (concert atvncg): châu, chung, tâm, quân, đạt, nam minh, phong - hà nội (về thăm nhà không biết có đi concert hay không): sơn, bông, khang, đức duy lân - sài gòn: cường, vĩ, tin - đà lạt: phúc nguyên (về thăm nhà), lâm anh, phát, kim bảo, liêm, long hoàng (đi homestay của chị tóc tiên chơi với bố tony và chị hủ)",
      "word_count": 76,
      "published_date": 1749776356.0,
      "published_datetime": "2025-06-13 00:59:16+00:00",
      "likes_count": 0,
      "shares_count": 0,
      "comments_count": 0,
      "views_count": 0,
      "reactions": null,
      "account_id": "kmerveiller",
      "account_name": "kmerveiller",
      "account_url": "https://www.threads.net/@kmerveiller",
      "post_id": "8117",
      "post_type": "thread",
      "raw_metadata": {
        "username": "kmerveiller",
        "likes": 0,
        "replies": 0,
        "reposts": 0,
        "shares": 0,
        "time": "06/12/25",
        "datetime": "2025-06-13T00:59:16.000Z"
      },
      "is_cleaned": true,
      "data_type": "threads",
      "reposts_count": 0
    },
    {
      "url": "https://www.threads.net/@_phantom_2910/post/DSsIE9UE2h3",
      "source_type": "api",
      "source": "https://www.threads.net/@_phantom_2910/post/DSsIE9UE2h3",
      "domain": "threads.net",
      "social_platform": "threads",
      "title": "sắp hết ngày rồi nhma e xin phép Dear Satan CHỊ ĐẸP CONCERT DAY 2 OCEAN PARK 3 XÃ NGHĨA TRỤ TỈNH HƯN...",
      "content": "sắp hết ngày rồi nhma e xin phép Dear Satan CHỊ ĐẸP CONCERT DAY 2 OCEAN PARK 3 XÃ NGHĨA TRỤ TỈNH HƯNG YÊN CONCERT ANH TRAI VƯỢT NGÀN CHÔNG GAI DAY 9-10 XÃ NGHĨA TRỤ TỈNH HƯNG YÊN Thank Santa",
      "word_count": 41,
      "published_date": 1766672217.0,
      "published_datetime": "2025-12-25 14:16:57+00:00",
      "likes_count": 0,
      "shares_count": 0,
      "comments_count": 0,
      "views_count": 0,
      "reactions": null,
      "account_id": "_phantom_2910",
      "account_name": "_phantom_2910",
      "account_url": "https://www.threads.net/@_phantom_2910",
      "post_id": "8116",
      "post_type": "thread",
      "raw_metadata": {
        "username": "_phantom_2910",
        "likes": 0,
        "replies": 0,
        "reposts": 0,
        "shares": 0,
        "time": "12/25/25",
        "datetime": "2025-12-25T14:16:57.000Z"
      },
      "is_cleaned": true,
      "data_type": "threads",
      "reposts_count": 0
    },
    {
      "url": "https://www.threads.net/@__holyrosie/post/DS7rHpzgczY",
      "source_type": "api",
      "source": "https://www.threads.net/@__holyrosie/post/DS7rHpzgczY",
      "domain": "threads.net",
      "social_platform": "threads",
      "title": "Lân bỏ cả ngủ trưa để chọn quà giáng sinh - xe ô tô đồ chơi có phun sương nhưng lại nhận được quà củ...",
      "content": "Lân bỏ cả ngủ trưa để chọn quà giáng sinh - xe ô tô đồ chơi có phun sương nhưng lại nhận được quà của Phúc Nguyên - báo hoa học trò  áo TBTN chôm của ekip ))) Còn Long Hoàng đi thu gom dầu gội mặt nạ cao dán thừa ở KTX thì lại bốc được trúng quà của Wonbi cũng là xe ô tô đồ chơi ))) Đúng là không phải ở hiền sẽ gặp được lành , poor Lân  Translate 12",
      "word_count": 84,
      "published_date": 1767193906.0,
      "published_datetime": "2025-12-31 15:11:46+00:00",
      "likes_count": 0,
      "shares_count": 0,
      "comments_count": 0,
      "views_count": 0,
      "reactions": null,
      "account_id": "__holyrosie",
      "account_name": "__holyrosie",
      "account_url": "https://www.threads.net/@__holyrosie",
      "post_id": "8115",
      "post_type": "thread",
      "raw_metadata": {
        "username": "__holyrosie",
        "likes": 0,
        "replies": 0,
        "reposts": 0,
        "shares": 0,
        "time": "3d",
        "datetime": "2025-12-31T15:11:46.000Z"
      },
      "is_cleaned": true,
      "data_type": "threads",
      "reposts_count": 0
    },
    {
      "url": "https://www.threads.net/@phonephonnnniu/post/DSNwUzME6Us",
      "source_type": "api",
      "source": "https://www.threads.net/@phonephonnnniu/post/DSNwUzME6Us",
      "domain": "threads.net",
      "social_platform": "threads",
      "title": "TÌM NGƯỜI ĐI CHUNG FANSIGN HYEN  Có ai nhà ở huỳnh thúc kháng đống đa hoặc gần đó honggg đi chung ...",
      "content": "TÌM NGƯỜI ĐI CHUNG FANSIGN HYEN  Có ai nhà ở huỳnh thúc kháng đống đa hoặc gần đó honggg đi chung ô tô vs em share tiền ạ  tối đa 3 ng 1 xe  87k để sag Hưng Yên  mấy Muzik nào đi với tui đi huhuhuhu",
      "word_count": 47,
      "published_date": 1765653131.0,
      "published_datetime": "2025-12-13 19:12:11+00:00",
      "likes_count": 0,
      "shares_count": 0,
      "comments_count": 0,
      "views_count": 0,
      "reactions": null,
      "account_id": "phonephonnnniu",
      "account_name": "phonephonnnniu",
      "account_url": "https://www.threads.net/@phonephonnnniu",
      "post_id": "8114",
      "post_type": "thread",
      "raw_metadata": {
        "username": "phonephonnnniu",
        "likes": 0,
        "replies": 0,
        "reposts": 0,
        "shares": 0,
        "time": "12/13/25",
        "datetime": "2025-12-13T19:12:11.000Z"
      },
      "is_cleaned": true,
      "data_type": "threads",
      "reposts_count": 0
    },
    {
      "url": "https://www.threads.net/@n.mih04_/post/DRZc12FEuCD",
      "source_type": "api",
      "source": "https://www.threads.net/@n.mih04_/post/DRZc12FEuCD",
      "domain": "threads.net",
      "social_platform": "threads",
      "title": "ở văn giang hưng yên add locket đi, ăn dookki t giữ chỗ cho",
      "content": "ở văn giang hưng yên add locket đi, ăn dookki t giữ chỗ cho",
      "word_count": 14,
      "published_date": 1763898086.0,
      "published_datetime": "2025-11-23 11:41:26+00:00",
      "likes_count": 0,
      "shares_count": 0,
      "comments_count": 0,
      "views_count": 0,
      "reactions": null,
      "account_id": "n.mih04_",
      "account_name": "n.mih04_",
      "account_url": "https://www.threads.net/@n.mih04_",
      "post_id": "8113",
      "post_type": "thread",
      "raw_metadata": {
        "username": "n.mih04_",
        "likes": 0,
        "replies": 0,
        "reposts": 0,
        "shares": 0,
        "time": "11/23/25",
        "datetime": "2025-11-23T11:41:26.000Z"
      },
      "is_cleaned": true,
      "data_type": "threads",
      "reposts_count": 0
    }
  ]
}