{
  "data_type": "threads",
  "processed_at": "2026-01-16T11:01:17.292637",
  "source_file": "data/raw/threads/threads_20260116_095852.json",
  "statistics": {
    "total": 478,
    "success": 478,
    "failed": 0,
    "errors": []
  },
  "records": [
    {
      "url": "https://www.threads.net/@honphuc2000/post/DRnBwGZgSkA",
      "source_type": "threads",
      "source": "https://www.threads.net/@honphuc2000/post/DRnBwGZgSkA",
      "domain": "threads.net",
      "social_platform": "threads",
      "title": "Kiếm người đi chơi Noel với mình",
      "content": "Kiếm người đi chơi Noel với mình",
      "word_count": 7,
      "published_date": 1764353645.0,
      "published_datetime": "2025-11-28 18:14:05+00:00",
      "likes_count": 0,
      "shares_count": 0,
      "comments_count": 0,
      "views_count": 0,
      "reactions": null,
      "account_id": "honphuc2000",
      "account_name": "honphuc2000",
      "account_url": "https://www.threads.net/@honphuc2000",
      "post_id": "8162",
      "post_type": "thread",
      "raw_metadata": {
        "username": "honphuc2000",
        "likes": 0,
        "replies": 0,
        "reposts": 0,
        "shares": 0,
        "time": "11/28/25",
        "datetime": "2025-11-28T18:14:05.000Z"
      },
      "is_cleaned": true,
      "data_type": "threads",
      "reposts_count": 0
    },
    {
      "url": "https://www.threads.net/@tung846/post/DSl7o_5DXwp",
      "source_type": "threads",
      "source": "https://www.threads.net/@tung846/post/DSl7o_5DXwp",
      "domain": "threads.net",
      "social_platform": "threads",
      "title": "Chúc Đảng bộ, chính quyền và Nhân dân Hưng Yên ngày càng phát triển, tiến bộ và đạt được nhiều thành...",
      "content": "Chúc Đảng bộ, chính quyền và Nhân dân Hưng Yên ngày càng phát triển, tiến bộ và đạt được nhiều thành công mới to lớn hơn nữa; quê hương ta ngày càng Hưng và ngày càng Yên hơn nữa!.Chúc Hưng Yên tiến thật xa.Hưng Yên như thế mới là Hưng Yên rồi cùng Hà Tĩnh- Hậu Giang cũ",
      "word_count": 58,
      "published_date": 1766464370.0,
      "published_datetime": "2025-12-23 04:32:50+00:00",
      "likes_count": 0,
      "shares_count": 0,
      "comments_count": 0,
      "views_count": 0,
      "reactions": null,
      "account_id": "tung846",
      "account_name": "tung846",
      "account_url": "https://www.threads.net/@tung846",
      "post_id": "8161",
      "post_type": "thread",
      "raw_metadata": {
        "username": "tung846",
        "likes": 0,
        "replies": 0,
        "reposts": 0,
        "shares": 0,
        "time": "12/22/25",
        "datetime": "2025-12-23T04:32:50.000Z"
      },
      "is_cleaned": true,
      "data_type": "threads",
      "reposts_count": 0
    },
    {
      "url": "https://www.threads.net/@tradaolasomottt/post/DSR3BwFEzz6",
      "source_type": "threads",
      "source": "https://www.threads.net/@tradaolasomottt/post/DSR3BwFEzz6",
      "domain": "threads.net",
      "social_platform": "threads",
      "title": "Tìm bạn nhận make up tại fansign Quang Hùng MasterD chặng Hưng Yên ngày mai huhu",
      "content": "Tìm bạn nhận make up tại fansign Quang Hùng MasterD chặng Hưng Yên ngày mai huhu",
      "word_count": 16,
      "published_date": 1765790863.0,
      "published_datetime": "2025-12-15 09:27:43+00:00",
      "likes_count": 0,
      "shares_count": 0,
      "comments_count": 0,
      "views_count": 0,
      "reactions": null,
      "account_id": "tradaolasomottt",
      "account_name": "tradaolasomottt",
      "account_url": "https://www.threads.net/@tradaolasomottt",
      "post_id": "8160",
      "post_type": "thread",
      "raw_metadata": {
        "username": "tradaolasomottt",
        "likes": 0,
        "replies": 0,
        "reposts": 0,
        "shares": 0,
        "time": "12/15/25",
        "datetime": "2025-12-15T09:27:43.000Z"
      },
      "is_cleaned": true,
      "data_type": "threads",
      "reposts_count": 0
    },
    {
      "url": "https://www.threads.net/@thi.mit/post/DS0MU4Nko3G",
      "source_type": "threads",
      "source": "https://www.threads.net/@thi.mit/post/DS0MU4Nko3G",
      "domain": "threads.net",
      "social_platform": "threads",
      "title": "Đêm nay có chuyện khiến mình không ngủ được, ngồi xem lại album ảnh, cũng muốn làm recap đồ này nọ n...",
      "content": "Đêm nay có chuyện khiến mình không ngủ được, ngồi xem lại album ảnh, cũng muốn làm recap đồ này nọ nhưng lười quá :( Mình chỉ nhớ mình đã gặp DKzz rất nhiều, và hiện tại mình thực sự nhớ em ấy rất nhiềuuuuu Từ fmt 412025 ở HN cho đến 13122025 là ngày cuối cùng mình gặp Khánh, mình đã gặp em ấy ở những đâu nhỉ? Fmt QH ở Đà Nẵng, concert ở HCM và Hưng Yên, fmt anh Rhym và fancon Nhà Trẻ, từ Hạ Long đến Hàn Quốc, từ Nhật Bản về Bản Liền.... Translate 12",
      "word_count": 101,
      "published_date": 1766942880.0,
      "published_datetime": "2025-12-28 17:28:00+00:00",
      "likes_count": 0,
      "shares_count": 0,
      "comments_count": 0,
      "views_count": 0,
      "reactions": null,
      "account_id": "thi.mit",
      "account_name": "thi.mit",
      "account_url": "https://www.threads.net/@thi.mit",
      "post_id": "8159",
      "post_type": "thread",
      "raw_metadata": {
        "username": "thi.mit",
        "likes": 0,
        "replies": 0,
        "reposts": 0,
        "shares": 0,
        "time": "6d",
        "datetime": "2025-12-28T17:28:00.000Z"
      },
      "is_cleaned": true,
      "data_type": "threads",
      "reposts_count": 0
    },
    {
      "url": "https://www.threads.net/@vieclamtiengnhat_hr/post/DQItSq9j1PO",
      "source_type": "threads",
      "source": "https://www.threads.net/@vieclamtiengnhat_hr/post/DQItSq9j1PO",
      "domain": "threads.net",
      "social_platform": "threads",
      "title": "Bác nào ở Hưng Yên tiếng Nhật tốt, muốn làm hành chính nhân sự ib em nhé TelZalo: 0978 589 845 Tra...",
      "content": "Bác nào ở Hưng Yên tiếng Nhật tốt, muốn làm hành chính nhân sự ib em nhé TelZalo: 0978 589 845 Translate 12",
      "word_count": 23,
      "published_date": 1761188801.0,
      "published_datetime": "2025-10-23 03:06:41+00:00",
      "likes_count": 0,
      "shares_count": 0,
      "comments_count": 0,
      "views_count": 0,
      "reactions": null,
      "account_id": "vieclamtiengnhat_hr",
      "account_name": "vieclamtiengnhat_hr",
      "account_url": "https://www.threads.net/@vieclamtiengnhat_hr",
      "post_id": "8158",
      "post_type": "thread",
      "raw_metadata": {
        "username": "vieclamtiengnhat_hr",
        "likes": 0,
        "replies": 0,
        "reposts": 0,
        "shares": 0,
        "time": "10/22/25",
        "datetime": "2025-10-23T03:06:41.000Z"
      },
      "is_cleaned": true,
      "data_type": "threads",
      "reposts_count": 0
    },
    {
      "url": "https://www.threads.net/@choi.zuizui/post/DP0VvrfE4WQ",
      "source_type": "threads",
      "source": "https://www.threads.net/@choi.zuizui/post/DP0VvrfE4WQ",
      "domain": "threads.net",
      "social_platform": "threads",
      "title": "Em làm việc chỉ vào ban ngày, có công vuệc nào làm đêm mà nhận hàng về nhà được không ạ! Mn giới thi...",
      "content": "Em làm việc chỉ vào ban ngày, có công vuệc nào làm đêm mà nhận hàng về nhà được không ạ! Mn giới thiệu chỗ uy tín cho em với, làm thủ công, làm máy tính đều được ạ! Em ở Hưng Yên",
      "word_count": 43,
      "published_date": 1760505367.0,
      "published_datetime": "2025-10-15 05:16:07+00:00",
      "likes_count": 0,
      "shares_count": 0,
      "comments_count": 0,
      "views_count": 0,
      "reactions": null,
      "account_id": "choi.zuizui",
      "account_name": "choi.zuizui",
      "account_url": "https://www.threads.net/@choi.zuizui",
      "post_id": "8157",
      "post_type": "thread",
      "raw_metadata": {
        "username": "choi.zuizui",
        "likes": 0,
        "replies": 0,
        "reposts": 0,
        "shares": 0,
        "time": "10/15/25",
        "datetime": "2025-10-15T05:16:07.000Z"
      },
      "is_cleaned": true,
      "data_type": "threads",
      "reposts_count": 0
    },
    {
      "url": "https://www.threads.net/@trghduc/post/DS16RbnCb16",
      "source_type": "threads",
      "source": "https://www.threads.net/@trghduc/post/DS16RbnCb16",
      "domain": "threads.net",
      "social_platform": "threads",
      "title": "Chả là t ở viện từ sáng trông ng thân. T gặp ông cò xe tỉnh, sáng ông bảo ổng quê Nghệ An. Chiều ổng...",
      "content": "Chả là t ở viện từ sáng trông ng thân. T gặp ông cò xe tỉnh, sáng ông bảo ổng quê Nghệ An. Chiều ổng bảo ơ em ở Ninh Bình , vừa rồi ông ơ tiếp với 1 chị em ở Hưng Yên . Thế là quê ông ở đâu dị :)))",
      "word_count": 53,
      "published_date": 1767000524.0,
      "published_datetime": "2025-12-29 09:28:44+00:00",
      "likes_count": 0,
      "shares_count": 0,
      "comments_count": 0,
      "views_count": 0,
      "reactions": null,
      "account_id": "trghduc",
      "account_name": "trghduc",
      "account_url": "https://www.threads.net/@trghduc",
      "post_id": "8156",
      "post_type": "thread",
      "raw_metadata": {
        "username": "trghduc",
        "likes": 0,
        "replies": 0,
        "reposts": 0,
        "shares": 0,
        "time": "6d",
        "datetime": "2025-12-29T09:28:44.000Z"
      },
      "is_cleaned": true,
      "data_type": "threads",
      "reposts_count": 0
    },
    {
      "url": "https://www.threads.net/@buivinh618/post/DHEDY6kNTQ1",
      "source_type": "threads",
      "source": "https://www.threads.net/@buivinh618/post/DHEDY6kNTQ1",
      "domain": "threads.net",
      "social_platform": "threads",
      "title": "Mình ở bang hàng tiên lữ Hưng yên muốn công việc làm ai có việc gì Cho mình đi làm với",
      "content": "Mình ở bang hàng tiên lữ Hưng yên muốn công việc làm ai có việc gì Cho mình đi làm với",
      "word_count": 21,
      "published_date": 1741705262.0,
      "published_datetime": "2025-03-11 15:01:02+00:00",
      "likes_count": 0,
      "shares_count": 0,
      "comments_count": 0,
      "views_count": 0,
      "reactions": null,
      "account_id": "buivinh618",
      "account_name": "buivinh618",
      "account_url": "https://www.threads.net/@buivinh618",
      "post_id": "8155",
      "post_type": "thread",
      "raw_metadata": {
        "username": "buivinh618",
        "likes": 0,
        "replies": 0,
        "reposts": 0,
        "shares": 0,
        "time": "03/11/25",
        "datetime": "2025-03-11T15:01:02.000Z"
      },
      "is_cleaned": true,
      "data_type": "threads",
      "reposts_count": 0
    },
    {
      "url": "https://www.threads.net/@tng_lqh/post/DSSdRjiE5Nn",
      "source_type": "threads",
      "source": "https://www.threads.net/@tng_lqh/post/DSSdRjiE5Nn",
      "domain": "threads.net",
      "social_platform": "threads",
      "title": "Huhuuuu ai pass fansign của Hùng ở Hưng Yên không Mom nào ở HCM trúng khum đi đc pass khumm,toai ...",
      "content": "Huhuuuu ai pass fansign của Hùng ở Hưng Yên không Mom nào ở HCM trúng khum đi đc pass khumm,toai mún gặp ảnh 1 lầnnnn",
      "word_count": 25,
      "published_date": 1765810915.0,
      "published_datetime": "2025-12-15 15:01:55+00:00",
      "likes_count": 0,
      "shares_count": 0,
      "comments_count": 0,
      "views_count": 0,
      "reactions": null,
      "account_id": "tng_lqh",
      "account_name": "tng_lqh",
      "account_url": "https://www.threads.net/@tng_lqh",
      "post_id": "8154",
      "post_type": "thread",
      "raw_metadata": {
        "username": "tng_lqh",
        "likes": 0,
        "replies": 0,
        "reposts": 0,
        "shares": 0,
        "time": "12/15/25",
        "datetime": "2025-12-15T15:01:55.000Z"
      },
      "is_cleaned": true,
      "data_type": "threads",
      "reposts_count": 0
    },
    {
      "url": "https://www.threads.net/@nancy.nguyen03/post/DRoWto_Ea7d",
      "source_type": "threads",
      "source": "https://www.threads.net/@nancy.nguyen03/post/DRoWto_Ea7d",
      "domain": "threads.net",
      "social_platform": "threads",
      "title": "Em cần tìm phòng quanh khu vực Trung Kính, Yên Hoà, Trần Duy Hưng Yêu cầu: không chung chủ, vskk, đ...",
      "content": "Em cần tìm phòng quanh khu vực Trung Kính, Yên Hoà, Trần Duy Hưng Yêu cầu: không chung chủ, vskk, đh, nóng lạnh, máy giặt,. TC khoảng 3tr Mọi người có tt phòng trọ cho em xin với ạ Translate 12",
      "word_count": 41,
      "published_date": 1764398189.0,
      "published_datetime": "2025-11-29 06:36:29+00:00",
      "likes_count": 0,
      "shares_count": 0,
      "comments_count": 0,
      "views_count": 0,
      "reactions": null,
      "account_id": "nancy.nguyen03",
      "account_name": "nancy.nguyen03",
      "account_url": "https://www.threads.net/@nancy.nguyen03",
      "post_id": "8153",
      "post_type": "thread",
      "raw_metadata": {
        "username": "nancy.nguyen03",
        "likes": 0,
        "replies": 0,
        "reposts": 0,
        "shares": 0,
        "time": "11/29/25",
        "datetime": "2025-11-29T06:36:29.000Z"
      },
      "is_cleaned": true,
      "data_type": "threads",
      "reposts_count": 0
    },
    {
      "url": "https://www.threads.net/@khchou__101/post/DG93i75xAfD",
      "source_type": "threads",
      "source": "https://www.threads.net/@khchou__101/post/DG93i75xAfD",
      "domain": "threads.net",
      "social_platform": "threads",
      "title": "Top nào hnoi,hưng yên mê skinship hay cuddle kh nhỉ kkk Translate 12",
      "content": "Top nào hnoi,hưng yên mê skinship hay cuddle kh nhỉ kkk Translate 12",
      "word_count": 13,
      "published_date": 1741497726.0,
      "published_datetime": "2025-03-09 05:22:06+00:00",
      "likes_count": 0,
      "shares_count": 0,
      "comments_count": 0,
      "views_count": 0,
      "reactions": null,
      "account_id": "khchou__101",
      "account_name": "khchou__101",
      "account_url": "https://www.threads.net/@khchou__101",
      "post_id": "8152",
      "post_type": "thread",
      "raw_metadata": {
        "username": "khchou__101",
        "likes": 0,
        "replies": 0,
        "reposts": 0,
        "shares": 0,
        "time": "03/09/25",
        "datetime": "2025-03-09T05:22:06.000Z"
      },
      "is_cleaned": true,
      "data_type": "threads",
      "reposts_count": 0
    },
    {
      "url": "https://www.threads.net/@limerenara/post/DSi_fQhAaQ5",
      "source_type": "threads",
      "source": "https://www.threads.net/@limerenara/post/DSi_fQhAaQ5",
      "domain": "threads.net",
      "social_platform": "threads",
      "title": "2 ngày theo chân Phúc từ Hưng Yên đến Hạ Long thì cái tôi mệt là còn có quá nhiều suộc và không biết...",
      "content": "2 ngày theo chân Phúc từ Hưng Yên đến Hạ Long thì cái tôi mệt là còn có quá nhiều suộc và không biết đăng ntn",
      "word_count": 26,
      "published_date": 1766365724.0,
      "published_datetime": "2025-12-22 01:08:44+00:00",
      "likes_count": 0,
      "shares_count": 0,
      "comments_count": 0,
      "views_count": 0,
      "reactions": null,
      "account_id": "limerenara",
      "account_name": "limerenara",
      "account_url": "https://www.threads.net/@limerenara",
      "post_id": "8151",
      "post_type": "thread",
      "raw_metadata": {
        "username": "limerenara",
        "likes": 0,
        "replies": 0,
        "reposts": 0,
        "shares": 0,
        "time": "12/21/25",
        "datetime": "2025-12-22T01:08:44.000Z"
      },
      "is_cleaned": true,
      "data_type": "threads",
      "reposts_count": 0
    },
    {
      "url": "https://www.threads.net/@khanhtrang0408/post/DO3hyXsEuxt",
      "source_type": "threads",
      "source": "https://www.threads.net/@khanhtrang0408/post/DO3hyXsEuxt",
      "domain": "threads.net",
      "social_platform": "threads",
      "title": "Có ai nhận make kỷ yếu ở mỹ hào , hưng yên giá 300k",
      "content": "Có ai nhận make kỷ yếu ở mỹ hào , hưng yên giá 300k",
      "word_count": 14,
      "published_date": 1758464861.0,
      "published_datetime": "2025-09-21 14:27:41+00:00",
      "likes_count": 0,
      "shares_count": 0,
      "comments_count": 0,
      "views_count": 0,
      "reactions": null,
      "account_id": "khanhtrang0408",
      "account_name": "khanhtrang0408",
      "account_url": "https://www.threads.net/@khanhtrang0408",
      "post_id": "8150",
      "post_type": "thread",
      "raw_metadata": {
        "username": "khanhtrang0408",
        "likes": 0,
        "replies": 0,
        "reposts": 0,
        "shares": 0,
        "time": "09/21/25",
        "datetime": "2025-09-21T14:27:41.000Z"
      },
      "is_cleaned": true,
      "data_type": "threads",
      "reposts_count": 0
    },
    {
      "url": "https://www.threads.net/@phan_ha_uyen98/post/DS7H-WrEg3r",
      "source_type": "threads",
      "source": "https://www.threads.net/@phan_ha_uyen98/post/DS7H-WrEg3r",
      "domain": "threads.net",
      "social_platform": "threads",
      "title": "Gò vấp tối đi nhậu hong mng , xong đi coi pháo hoaaaa ak, tìm ng chở tui huhu",
      "content": "Gò vấp tối đi nhậu hong mng , xong đi coi pháo hoaaaa ak, tìm ng chở tui huhu",
      "word_count": 19,
      "published_date": 1767175480.0,
      "published_datetime": "2025-12-31 10:04:40+00:00",
      "likes_count": 0,
      "shares_count": 0,
      "comments_count": 0,
      "views_count": 0,
      "reactions": null,
      "account_id": "phan_ha_uyen98",
      "account_name": "phan_ha_uyen98",
      "account_url": "https://www.threads.net/@phan_ha_uyen98",
      "post_id": "8149",
      "post_type": "thread",
      "raw_metadata": {
        "username": "phan_ha_uyen98",
        "likes": 0,
        "replies": 0,
        "reposts": 0,
        "shares": 0,
        "time": "4d",
        "datetime": "2025-12-31T10:04:40.000Z"
      },
      "is_cleaned": true,
      "data_type": "threads",
      "reposts_count": 0
    },
    {
      "url": "https://www.threads.net/@_hrzkkk.k_/post/DIHgBZqzqBI",
      "source_type": "threads",
      "source": "https://www.threads.net/@_hrzkkk.k_/post/DIHgBZqzqBI",
      "domain": "threads.net",
      "social_platform": "threads",
      "title": "th đc r t 6 tính nửa đêm lướt đc post  bảo nhà mình đ có tiền thuê Mỹ Đình nên phải lủi về Hưng Yên...",
      "content": "th đc r t 6 tính nửa đêm lướt đc post  bảo nhà mình đ có tiền thuê Mỹ Đình nên phải lủi về Hưng Yên ))))))))))))))))))))",
      "word_count": 27,
      "published_date": 1743968421.0,
      "published_datetime": "2025-04-06 19:40:21+00:00",
      "likes_count": 0,
      "shares_count": 0,
      "comments_count": 0,
      "views_count": 0,
      "reactions": null,
      "account_id": "_hrzkkk.k_",
      "account_name": "_hrzkkk.k_",
      "account_url": "https://www.threads.net/@_hrzkkk.k_",
      "post_id": "8148",
      "post_type": "thread",
      "raw_metadata": {
        "username": "_hrzkkk.k_",
        "likes": 0,
        "replies": 0,
        "reposts": 0,
        "shares": 0,
        "time": "04/06/25",
        "datetime": "2025-04-06T19:40:21.000Z"
      },
      "is_cleaned": true,
      "data_type": "threads",
      "reposts_count": 0
    },
    {
      "url": "https://www.threads.net/@harie_byeol/post/DSu8SLxkw6M",
      "source_type": "threads",
      "source": "https://www.threads.net/@harie_byeol/post/DSu8SLxkw6M",
      "domain": "threads.net",
      "social_platform": "threads",
      "title": "HELP ME Có ai pass lại slot thi SAT tháng 3 tại Hải Phòng, Hà Nội hoặc Hưng Yên giúp mình với ạ. ...",
      "content": "HELP ME Có ai pass lại slot thi SAT tháng 3 tại Hải Phòng, Hà Nội hoặc Hưng Yên giúp mình với ạ. Mình lớp 12 đã thi tháng 12 nhưng điểm chưa đạt mong muốn, tha thiết mong mọi người giúp đỡ vì tháng 3 là lần cuối mình thi rùi",
      "word_count": 52,
      "published_date": 1766766697.0,
      "published_datetime": "2025-12-26 16:31:37+00:00",
      "likes_count": 0,
      "shares_count": 0,
      "comments_count": 0,
      "views_count": 0,
      "reactions": null,
      "account_id": "harie_byeol",
      "account_name": "harie_byeol",
      "account_url": "https://www.threads.net/@harie_byeol",
      "post_id": "8147",
      "post_type": "thread",
      "raw_metadata": {
        "username": "harie_byeol",
        "likes": 0,
        "replies": 0,
        "reposts": 0,
        "shares": 0,
        "time": "12/26/25",
        "datetime": "2025-12-26T16:31:37.000Z"
      },
      "is_cleaned": true,
      "data_type": "threads",
      "reposts_count": 0
    },
    {
      "url": "https://www.threads.net/@huonggg.hr/post/DPyuFVFAZae",
      "source_type": "threads",
      "source": "https://www.threads.net/@huonggg.hr/post/DPyuFVFAZae",
      "domain": "threads.net",
      "social_platform": "threads",
      "title": "Hưng Yên  Công ty mới thành lập  Tuyển Giám đốc nhà máy  Lương: 4060 triệu  Yêu cầu: Có kinh ...",
      "content": "Hưng Yên  Công ty mới thành lập  Tuyển Giám đốc nhà máy  Lương: 4060 triệu  Yêu cầu: Có kinh nghiệm quản lý sản xuất thực phẩm, biết tiếng Nhật hoặc tiếng Anh  Quan tâm inbox em nhé!",
      "word_count": 37,
      "published_date": 1760451019.0,
      "published_datetime": "2025-10-14 14:10:19+00:00",
      "likes_count": 0,
      "shares_count": 0,
      "comments_count": 0,
      "views_count": 0,
      "reactions": null,
      "account_id": "huonggg.hr",
      "account_name": "huonggg.hr",
      "account_url": "https://www.threads.net/@huonggg.hr",
      "post_id": "8146",
      "post_type": "thread",
      "raw_metadata": {
        "username": "huonggg.hr",
        "likes": 0,
        "replies": 0,
        "reposts": 0,
        "shares": 0,
        "time": "10/14/25",
        "datetime": "2025-10-14T14:10:19.000Z"
      },
      "is_cleaned": true,
      "data_type": "threads",
      "reposts_count": 0
    },
    {
      "url": "https://www.threads.net/@__callmehanie__/post/DO0qVODD2_h",
      "source_type": "threads",
      "source": "https://www.threads.net/@__callmehanie__/post/DO0qVODD2_h",
      "domain": "threads.net",
      "social_platform": "threads",
      "title": "SƠN TÙNG M-TP Tìm thợ chụp kỉ yếu cá nhân (nhóm 2 người) nhận chụp khu vực thành phố Hưng Yên ạaaaa...",
      "content": "SƠN TÙNG M-TP Tìm thợ chụp kỉ yếu cá nhân (nhóm 2 người) nhận chụp khu vực thành phố Hưng Yên ạaaaa Tiện thể tìm thợ make luôn ạ",
      "word_count": 29,
      "published_date": 1758368677.0,
      "published_datetime": "2025-09-20 11:44:37+00:00",
      "likes_count": 0,
      "shares_count": 0,
      "comments_count": 0,
      "views_count": 0,
      "reactions": null,
      "account_id": "__callmehanie__",
      "account_name": "__callmehanie__",
      "account_url": "https://www.threads.net/@__callmehanie__",
      "post_id": "8145",
      "post_type": "thread",
      "raw_metadata": {
        "username": "__callmehanie__",
        "likes": 0,
        "replies": 0,
        "reposts": 0,
        "shares": 0,
        "time": "09/20/25",
        "datetime": "2025-09-20T11:44:37.000Z"
      },
      "is_cleaned": true,
      "data_type": "threads",
      "reposts_count": 0
    },
    {
      "url": "https://www.threads.net/@tungtunv/post/DJT2C9Fvf1f",
      "source_type": "threads",
      "source": "https://www.threads.net/@tungtunv/post/DJT2C9Fvf1f",
      "domain": "threads.net",
      "social_platform": "threads",
      "title": "Mọi người cho mình hỏi với : Mình với ny mình cuối tuần này muốn đi lên Hạ Long chơi nhưng đang phâ...",
      "content": "Mọi người cho mình hỏi với : Mình với ny mình cuối tuần này muốn đi lên Hạ Long chơi nhưng đang phân vân không biết nên đi xe máy hay đi xe khách ? Bọn mình đi từ phố nối B Hưng yên lên đấy tầm 130 km thì nếu mình đi xe máy thì có cần lưu ý gì không như về đường đi , cảnh sát giao thông . Hay mình nên đi bằng xe khách ạ? Tại mình muốn thoải mái giờ giấc với vừa đi vừa ngắm cảnh và 1 phần cũng vì ny mình rất say xe ý ạ . Ai đi rồi hay có kinh nghiệm thì chia sẻ cho mình với ạ mình c ơn-3",
      "word_count": 123,
      "published_date": 1746530104.0,
      "published_datetime": "2025-05-06 11:15:04+00:00",
      "likes_count": 0,
      "shares_count": 0,
      "comments_count": 0,
      "views_count": 0,
      "reactions": null,
      "account_id": "tungtunv",
      "account_name": "tungtunv",
      "account_url": "https://www.threads.net/@tungtunv",
      "post_id": "8144",
      "post_type": "thread",
      "raw_metadata": {
        "username": "tungtunv",
        "likes": 0,
        "replies": 0,
        "reposts": 0,
        "shares": 0,
        "time": "05/06/25",
        "datetime": "2025-05-06T11:15:04.000Z"
      },
      "is_cleaned": true,
      "data_type": "threads",
      "reposts_count": 0
    },
    {
      "url": "https://www.threads.net/@huonggg.hr/post/DLuyXxiheDW",
      "source_type": "threads",
      "source": "https://www.threads.net/@huonggg.hr/post/DLuyXxiheDW",
      "domain": "threads.net",
      "social_platform": "threads",
      "title": "GẤP  TUYỂN DỤNG TẠI HƯNG YÊN Cánh tay các bạn ở Hưng Yên đâu rồi ạ??? Cơ hội làm việc tại công...",
      "content": "GẤP  TUYỂN DỤNG TẠI HƯNG YÊN Cánh tay các bạn ở Hưng Yên đâu rồi ạ??? Cơ hội làm việc tại công ty Nhật Bản ổn định  chuyên nghiệp  nhiều đãi ngộ tốt ngay tại KCN Thăng Long II, Hưng Yên",
      "word_count": 41,
      "published_date": 1751729115.0,
      "published_datetime": "2025-07-05 15:25:15+00:00",
      "likes_count": 0,
      "shares_count": 0,
      "comments_count": 0,
      "views_count": 0,
      "reactions": null,
      "account_id": "huonggg.hr",
      "account_name": "huonggg.hr",
      "account_url": "https://www.threads.net/@huonggg.hr",
      "post_id": "8143",
      "post_type": "thread",
      "raw_metadata": {
        "username": "huonggg.hr",
        "likes": 0,
        "replies": 0,
        "reposts": 0,
        "shares": 0,
        "time": "07/05/25",
        "datetime": "2025-07-05T15:25:15.000Z"
      },
      "is_cleaned": true,
      "data_type": "threads",
      "reposts_count": 0
    },
    {
      "url": "https://www.threads.net/@zbbyist/post/DSL95r9j3x3",
      "source_type": "threads",
      "source": "https://www.threads.net/@zbbyist/post/DSL95r9j3x3",
      "domain": "threads.net",
      "social_platform": "threads",
      "title": "Tìm người ghép xe đi từ TP Nam định đến Hưng Yên cùng  Translate 12",
      "content": "Tìm người ghép xe đi từ TP Nam định đến Hưng Yên cùng  Translate 12",
      "word_count": 15,
      "published_date": 1765593140.0,
      "published_datetime": "2025-12-13 02:32:20+00:00",
      "likes_count": 0,
      "shares_count": 0,
      "comments_count": 0,
      "views_count": 0,
      "reactions": null,
      "account_id": "zbbyist",
      "account_name": "zbbyist",
      "account_url": "https://www.threads.net/@zbbyist",
      "post_id": "8142",
      "post_type": "thread",
      "raw_metadata": {
        "username": "zbbyist",
        "likes": 0,
        "replies": 0,
        "reposts": 0,
        "shares": 0,
        "time": "12/12/25",
        "datetime": "2025-12-13T02:32:20.000Z"
      },
      "is_cleaned": true,
      "data_type": "threads",
      "reposts_count": 0
    },
    {
      "url": "https://www.threads.net/@tivihomnaycogi/post/DTA8vXXE-u5",
      "source_type": "threads",
      "source": "https://www.threads.net/@tivihomnaycogi/post/DTA8vXXE-u5",
      "domain": "threads.net",
      "social_platform": "threads",
      "title": "- \"Ai là triệu phú?\" Nhật Bản trở lại đúng dịp năm mới với tập đặc biệt dài 4 tiếng, Hashimoto Kanna...",
      "content": "- \"Ai là triệu phú?\" Nhật Bản trở lại đúng dịp năm mới với tập đặc biệt dài 4 tiếng, Hashimoto Kanna vượt qua hết 12 câu để thắng 10 triệu Yên (ảnh). Translate 12",
      "word_count": 35,
      "published_date": 1767370916.0,
      "published_datetime": "2026-01-02 16:21:56+00:00",
      "likes_count": 0,
      "shares_count": 0,
      "comments_count": 0,
      "views_count": 0,
      "reactions": null,
      "account_id": "tivihomnaycogi",
      "account_name": "tivihomnaycogi",
      "account_url": "https://www.threads.net/@tivihomnaycogi",
      "post_id": "8141",
      "post_type": "thread",
      "raw_metadata": {
        "username": "tivihomnaycogi",
        "likes": 0,
        "replies": 0,
        "reposts": 0,
        "shares": 0,
        "time": "1d",
        "datetime": "2026-01-02T16:21:56.000Z"
      },
      "is_cleaned": true,
      "data_type": "threads",
      "reposts_count": 0
    },
    {
      "url": "https://www.threads.net/@myslifewith2cats/post/DR1XL08kxsY",
      "source_type": "threads",
      "source": "https://www.threads.net/@myslifewith2cats/post/DR1XL08kxsY",
      "domain": "threads.net",
      "social_platform": "threads",
      "title": "Mình có máy digital LUMIX DMC FX01 màu bạc cần pass ạ. Ưu tiên các bạn có thể gdtt ạ (Hưng Yên cũCh...",
      "content": "Mình có máy digital LUMIX DMC FX01 màu bạc cần pass ạ. Ưu tiên các bạn có thể gdtt ạ (Hưng Yên cũChùa Làng gần ĐH Ngoại Thương).",
      "word_count": 28,
      "published_date": 1764834644.0,
      "published_datetime": "2025-12-04 07:50:44+00:00",
      "likes_count": 0,
      "shares_count": 0,
      "comments_count": 0,
      "views_count": 0,
      "reactions": null,
      "account_id": "myslifewith2cats",
      "account_name": "myslifewith2cats",
      "account_url": "https://www.threads.net/@myslifewith2cats",
      "post_id": "8140",
      "post_type": "thread",
      "raw_metadata": {
        "username": "myslifewith2cats",
        "likes": 0,
        "replies": 0,
        "reposts": 0,
        "shares": 0,
        "time": "12/04/25",
        "datetime": "2025-12-04T07:50:44.000Z"
      },
      "is_cleaned": true,
      "data_type": "threads",
      "reposts_count": 0
    },
    {
      "url": "https://www.threads.net/@_27atherrr.0/post/DS7BLXJE8OQ",
      "source_type": "threads",
      "source": "https://www.threads.net/@_27atherrr.0/post/DS7BLXJE8OQ",
      "domain": "threads.net",
      "social_platform": "threads",
      "title": "Pháp luật nào cấm tôi yêu Bùi Lan Hương",
      "content": "Pháp luật nào cấm tôi yêu Bùi Lan Hương",
      "word_count": 9,
      "published_date": 1767171916.0,
      "published_datetime": "2025-12-31 09:05:16+00:00",
      "likes_count": 0,
      "shares_count": 0,
      "comments_count": 0,
      "views_count": 0,
      "reactions": null,
      "account_id": "_27atherrr.0",
      "account_name": "_27atherrr.0",
      "account_url": "https://www.threads.net/@_27atherrr.0",
      "post_id": "8139",
      "post_type": "thread",
      "raw_metadata": {
        "username": "_27atherrr.0",
        "likes": 0,
        "replies": 0,
        "reposts": 0,
        "shares": 0,
        "time": "4d",
        "datetime": "2025-12-31T09:05:16.000Z"
      },
      "is_cleaned": true,
      "data_type": "threads",
      "reposts_count": 0
    },
    {
      "url": "https://www.threads.net/@ngolinh17.1/post/DTC3D4AEh2V",
      "source_type": "threads",
      "source": "https://www.threads.net/@ngolinh17.1/post/DTC3D4AEh2V",
      "domain": "threads.net",
      "social_platform": "threads",
      "title": "Lý do gì khiến một số bạn chọn nghie giệc vào cuối năm vậy ạ? Bên mình vẫn còn job tiéng trung, tiến...",
      "content": "Lý do gì khiến một số bạn chọn nghie giệc vào cuối năm vậy ạ? Bên mình vẫn còn job tiéng trung, tiếng Anh, tiếng nhật khu vực BG, BN, HN, Hưng Yên, Bạn nào qtam gửi Cv mình hỗ trợ nhé Mail: ngolinh17.hr@gmail.com",
      "word_count": 44,
      "published_date": 1767435047.0,
      "published_datetime": "2026-01-03 10:10:47+00:00",
      "likes_count": 0,
      "shares_count": 0,
      "comments_count": 0,
      "views_count": 0,
      "reactions": null,
      "account_id": "ngolinh17.1",
      "account_name": "ngolinh17.1",
      "account_url": "https://www.threads.net/@ngolinh17.1",
      "post_id": "8138",
      "post_type": "thread",
      "raw_metadata": {
        "username": "ngolinh17.1",
        "likes": 0,
        "replies": 0,
        "reposts": 0,
        "shares": 0,
        "time": "1d",
        "datetime": "2026-01-03T10:10:47.000Z"
      },
      "is_cleaned": true,
      "data_type": "threads",
      "reposts_count": 0
    },
    {
      "url": "https://www.threads.net/@kim_thuy_shophoahungyen/post/DKeO6fsz_ah",
      "source_type": "threads",
      "source": "https://www.threads.net/@kim_thuy_shophoahungyen/post/DKeO6fsz_ah",
      "domain": "threads.net",
      "social_platform": "threads",
      "title": "Shop hoa mình ở Hưng Yên anh chị em ai cần ib mình nhé Hưng Yên",
      "content": "Shop hoa mình ở Hưng Yên anh chị em ai cần ib mình nhé Hưng Yên",
      "word_count": 16,
      "published_date": 1749026170.0,
      "published_datetime": "2025-06-04 08:36:10+00:00",
      "likes_count": 0,
      "shares_count": 0,
      "comments_count": 0,
      "views_count": 0,
      "reactions": null,
      "account_id": "kim_thuy_shophoahungyen",
      "account_name": "kim_thuy_shophoahungyen",
      "account_url": "https://www.threads.net/@kim_thuy_shophoahungyen",
      "post_id": "8137",
      "post_type": "thread",
      "raw_metadata": {
        "username": "kim_thuy_shophoahungyen",
        "likes": 0,
        "replies": 0,
        "reposts": 0,
        "shares": 0,
        "time": "06/04/25",
        "datetime": "2025-06-04T08:36:10.000Z"
      },
      "is_cleaned": true,
      "data_type": "threads",
      "reposts_count": 0
    },
    {
      "url": "https://www.threads.net/@namtienvu/post/DTFGVyYDrGD",
      "source_type": "threads",
      "source": "https://www.threads.net/@namtienvu/post/DTFGVyYDrGD",
      "domain": "threads.net",
      "social_platform": "threads",
      "title": "Tôi không tin vào Toà án tỉnh Hưng Yên nữa, nên không kính gửi đơn thư nào đến cơ quan này liên quan...",
      "content": "Tôi không tin vào Toà án tỉnh Hưng Yên nữa, nên không kính gửi đơn thư nào đến cơ quan này liên quan tới việc giải quyết mà UBND tỉnh Hưng Yên cần trả lại quyền và lợi ích của gia đình và công ty tôi.",
      "word_count": 46,
      "published_date": 1767510167.0,
      "published_datetime": "2026-01-04 07:02:47+00:00",
      "likes_count": 0,
      "shares_count": 0,
      "comments_count": 0,
      "views_count": 0,
      "reactions": null,
      "account_id": "namtienvu",
      "account_name": "namtienvu",
      "account_url": "https://www.threads.net/@namtienvu",
      "post_id": "8136",
      "post_type": "thread",
      "raw_metadata": {
        "username": "namtienvu",
        "likes": 0,
        "replies": 0,
        "reposts": 0,
        "shares": 0,
        "time": "3h",
        "datetime": "2026-01-04T07:02:47.000Z"
      },
      "is_cleaned": true,
      "data_type": "threads",
      "reposts_count": 0
    },
    {
      "url": "https://www.threads.net/@nha680413/post/DS9r79uk2mA",
      "source_type": "threads",
      "source": "https://www.threads.net/@nha680413/post/DS9r79uk2mA",
      "domain": "threads.net",
      "social_platform": "threads",
      "title": "Vừa về tuyên quang đã bị hỏi có ny ch 22 tuổi rồi đó",
      "content": "Vừa về tuyên quang đã bị hỏi có ny ch 22 tuổi rồi đó",
      "word_count": 14,
      "published_date": 1767261443.0,
      "published_datetime": "2026-01-01 09:57:23+00:00",
      "likes_count": 0,
      "shares_count": 0,
      "comments_count": 0,
      "views_count": 0,
      "reactions": null,
      "account_id": "nha680413",
      "account_name": "nha680413",
      "account_url": "https://www.threads.net/@nha680413",
      "post_id": "8135",
      "post_type": "thread",
      "raw_metadata": {
        "username": "nha680413",
        "likes": 0,
        "replies": 0,
        "reposts": 0,
        "shares": 0,
        "time": "3d",
        "datetime": "2026-01-01T09:57:23.000Z"
      },
      "is_cleaned": true,
      "data_type": "threads",
      "reposts_count": 0
    },
    {
      "url": "https://www.threads.net/@lyly_han25/post/DSUaVM-EYnM",
      "source_type": "threads",
      "source": "https://www.threads.net/@lyly_han25/post/DSUaVM-EYnM",
      "domain": "threads.net",
      "social_platform": "threads",
      "title": "Ai passs fansign chặng Hưng Yên cho em với ạ",
      "content": "Ai passs fansign chặng Hưng Yên cho em với ạ",
      "word_count": 10,
      "published_date": 1765876481.0,
      "published_datetime": "2025-12-16 09:14:41+00:00",
      "likes_count": 0,
      "shares_count": 0,
      "comments_count": 0,
      "views_count": 0,
      "reactions": null,
      "account_id": "lyly_han25",
      "account_name": "lyly_han25",
      "account_url": "https://www.threads.net/@lyly_han25",
      "post_id": "8134",
      "post_type": "thread",
      "raw_metadata": {
        "username": "lyly_han25",
        "likes": 0,
        "replies": 0,
        "reposts": 0,
        "shares": 0,
        "time": "12/16/25",
        "datetime": "2025-12-16T09:14:41.000Z"
      },
      "is_cleaned": true,
      "data_type": "threads",
      "reposts_count": 0
    },
    {
      "url": "https://www.threads.net/@vanbui.hr/post/DKY2RfwzRRk",
      "source_type": "threads",
      "source": "https://www.threads.net/@vanbui.hr/post/DKY2RfwzRRk",
      "domain": "threads.net",
      "social_platform": "threads",
      "title": "Văn Lâm, Hưng Yên Mình đang cần 2 bạn HR Lead làm việc thứ 2 đến thứ 7, lương up to 16tr , có 3 nă...",
      "content": "Văn Lâm, Hưng Yên Mình đang cần 2 bạn HR Lead làm việc thứ 2 đến thứ 7, lương up to 16tr , có 3 năm kn nhan sự trở lên. Inbox zalo 0343213082, mình gửi jd nha",
      "word_count": 38,
      "published_date": 1748845479.0,
      "published_datetime": "2025-06-02 06:24:39+00:00",
      "likes_count": 0,
      "shares_count": 0,
      "comments_count": 0,
      "views_count": 0,
      "reactions": null,
      "account_id": "vanbui.hr",
      "account_name": "vanbui.hr",
      "account_url": "https://www.threads.net/@vanbui.hr",
      "post_id": "8133",
      "post_type": "thread",
      "raw_metadata": {
        "username": "vanbui.hr",
        "likes": 0,
        "replies": 0,
        "reposts": 0,
        "shares": 0,
        "time": "06/02/25",
        "datetime": "2025-06-02T06:24:39.000Z"
      },
      "is_cleaned": true,
      "data_type": "threads",
      "reposts_count": 0
    },
    {
      "url": "https://www.threads.net/@htoh1503/post/DMzGmzhvnkG",
      "source_type": "threads",
      "source": "https://www.threads.net/@htoh1503/post/DMzGmzhvnkG",
      "domain": "threads.net",
      "social_platform": "threads",
      "title": "HƯNG YÊN  Cần tuyển Nhân viên kho Lương 11M Ib ngay 0375155581 nhé",
      "content": "HƯNG YÊN  Cần tuyển Nhân viên kho Lương 11M Ib ngay 0375155581 nhé",
      "word_count": 13,
      "published_date": 1754021425.0,
      "published_datetime": "2025-08-01 04:10:25+00:00",
      "likes_count": 0,
      "shares_count": 0,
      "comments_count": 0,
      "views_count": 0,
      "reactions": null,
      "account_id": "htoh1503",
      "account_name": "htoh1503",
      "account_url": "https://www.threads.net/@htoh1503",
      "post_id": "8132",
      "post_type": "thread",
      "raw_metadata": {
        "username": "htoh1503",
        "likes": 0,
        "replies": 0,
        "reposts": 0,
        "shares": 0,
        "time": "08/01/25",
        "datetime": "2025-08-01T04:10:25.000Z"
      },
      "is_cleaned": true,
      "data_type": "threads",
      "reposts_count": 0
    },
    {
      "url": "https://www.threads.net/@trachanhdayy/post/DSPIQZsicHQ",
      "source_type": "threads",
      "source": "https://www.threads.net/@trachanhdayy/post/DSPIQZsicHQ",
      "domain": "threads.net",
      "social_platform": "threads",
      "title": "hẹn hưng yên 1 tuần nữa  Translate 12",
      "content": "hẹn hưng yên 1 tuần nữa  Translate 12",
      "word_count": 8,
      "published_date": 1765699232.0,
      "published_datetime": "2025-12-14 08:00:32+00:00",
      "likes_count": 0,
      "shares_count": 0,
      "comments_count": 0,
      "views_count": 0,
      "reactions": null,
      "account_id": "trachanhdayy",
      "account_name": "trachanhdayy",
      "account_url": "https://www.threads.net/@trachanhdayy",
      "post_id": "8131",
      "post_type": "thread",
      "raw_metadata": {
        "username": "trachanhdayy",
        "likes": 0,
        "replies": 0,
        "reposts": 0,
        "shares": 0,
        "time": "12/14/25",
        "datetime": "2025-12-14T08:00:32.000Z"
      },
      "is_cleaned": true,
      "data_type": "threads",
      "reposts_count": 0
    },
    {
      "url": "https://www.threads.net/@purple_photosg/post/DS-FauDFIaE",
      "source_type": "threads",
      "source": "https://www.threads.net/@purple_photosg/post/DS-FauDFIaE",
      "domain": "threads.net",
      "social_platform": "threads",
      "title": "Mình ở SG muốn tết này ra Hưng Yên ăn tết có nhận chụp hình Tết 200k bằng photophone iphone 17. Hy v...",
      "content": "Mình ở SG muốn tết này ra Hưng Yên ăn tết có nhận chụp hình Tết 200k bằng photophone iphone 17. Hy vọng có nhiều bạn cần đặt lịch ạ  Mình còn có make-up nữa nhennnn",
      "word_count": 36,
      "published_date": 1767274802.0,
      "published_datetime": "2026-01-01 13:40:02+00:00",
      "likes_count": 0,
      "shares_count": 0,
      "comments_count": 0,
      "views_count": 0,
      "reactions": null,
      "account_id": "purple_photosg",
      "account_name": "purple_photosg",
      "account_url": "https://www.threads.net/@purple_photosg",
      "post_id": "8130",
      "post_type": "thread",
      "raw_metadata": {
        "username": "purple_photosg",
        "likes": 0,
        "replies": 0,
        "reposts": 0,
        "shares": 0,
        "time": "2d",
        "datetime": "2026-01-01T13:40:02.000Z"
      },
      "is_cleaned": true,
      "data_type": "threads",
      "reposts_count": 0
    },
    {
      "url": "https://www.threads.net/@hng.neey/post/DS9zK4QgU2a",
      "source_type": "threads",
      "source": "https://www.threads.net/@hng.neey/post/DS9zK4QgU2a",
      "domain": "threads.net",
      "social_platform": "threads",
      "title": "Đầu năm 2026, first trip với ảnh hi vọng cả năm nhiều tiền và nhiều trip y vậy nữa nha.",
      "content": "Đầu năm 2026, first trip với ảnh hi vọng cả năm nhiều tiền và nhiều trip y vậy nữa nha.",
      "word_count": 20,
      "published_date": 1767265235.0,
      "published_datetime": "2026-01-01 11:00:35+00:00",
      "likes_count": 0,
      "shares_count": 0,
      "comments_count": 0,
      "views_count": 0,
      "reactions": null,
      "account_id": "hng.neey",
      "account_name": "hng.neey",
      "account_url": "https://www.threads.net/@hng.neey",
      "post_id": "8129",
      "post_type": "thread",
      "raw_metadata": {
        "username": "hng.neey",
        "likes": 0,
        "replies": 0,
        "reposts": 0,
        "shares": 0,
        "time": "2d",
        "datetime": "2026-01-01T11:00:35.000Z"
      },
      "is_cleaned": true,
      "data_type": "threads",
      "reposts_count": 0
    },
    {
      "url": "https://www.threads.net/@hoang17tm/post/DTErSpEiMNt",
      "source_type": "threads",
      "source": "https://www.threads.net/@hoang17tm/post/DTErSpEiMNt",
      "domain": "threads.net",
      "social_platform": "threads",
      "title": "Rồi lại suốt ngày full bàn như HT Club hưng yên",
      "content": "Rồi lại suốt ngày full bàn như HT Club hưng yên",
      "word_count": 11,
      "published_date": 1767495992.0,
      "published_datetime": "2026-01-04 03:06:32+00:00",
      "likes_count": 0,
      "shares_count": 0,
      "comments_count": 0,
      "views_count": 0,
      "reactions": null,
      "account_id": "hoang17tm",
      "account_name": "hoang17tm",
      "account_url": "https://www.threads.net/@hoang17tm",
      "post_id": "8128",
      "post_type": "thread",
      "raw_metadata": {
        "username": "hoang17tm",
        "likes": 0,
        "replies": 0,
        "reposts": 0,
        "shares": 0,
        "time": "7h",
        "datetime": "2026-01-04T03:06:32.000Z"
      },
      "is_cleaned": true,
      "data_type": "threads",
      "reposts_count": 0
    },
    {
      "url": "https://www.threads.net/@raeju_02/post/DSckoQxEmQ8",
      "source_type": "threads",
      "source": "https://www.threads.net/@raeju_02/post/DSckoQxEmQ8",
      "domain": "threads.net",
      "social_platform": "threads",
      "title": "rốt cuộc là đất Hưng Yên có gì vậy ạ",
      "content": "rốt cuộc là đất Hưng Yên có gì vậy ạ",
      "word_count": 10,
      "published_date": 1766150336.0,
      "published_datetime": "2025-12-19 13:18:56+00:00",
      "likes_count": 0,
      "shares_count": 0,
      "comments_count": 0,
      "views_count": 0,
      "reactions": null,
      "account_id": "raeju_02",
      "account_name": "raeju_02",
      "account_url": "https://www.threads.net/@raeju_02",
      "post_id": "8127",
      "post_type": "thread",
      "raw_metadata": {
        "username": "raeju_02",
        "likes": 0,
        "replies": 0,
        "reposts": 0,
        "shares": 0,
        "time": "12/19/25",
        "datetime": "2025-12-19T13:18:56.000Z"
      },
      "is_cleaned": true,
      "data_type": "threads",
      "reposts_count": 0
    },
    {
      "url": "https://www.threads.net/@mygg_1001/post/DRTr0lXk6R2",
      "source_type": "threads",
      "source": "https://www.threads.net/@mygg_1001/post/DRTr0lXk6R2",
      "domain": "threads.net",
      "social_platform": "threads",
      "title": "Gái bản về xuôi aa",
      "content": "Gái bản về xuôi aa",
      "word_count": 5,
      "published_date": 1763704613.0,
      "published_datetime": "2025-11-21 05:56:53+00:00",
      "likes_count": 0,
      "shares_count": 0,
      "comments_count": 0,
      "views_count": 0,
      "reactions": null,
      "account_id": "mygg_1001",
      "account_name": "mygg_1001",
      "account_url": "https://www.threads.net/@mygg_1001",
      "post_id": "8126",
      "post_type": "thread",
      "raw_metadata": {
        "username": "mygg_1001",
        "likes": 0,
        "replies": 0,
        "reposts": 0,
        "shares": 0,
        "time": "11/21/25",
        "datetime": "2025-11-21T05:56:53.000Z"
      },
      "is_cleaned": true,
      "data_type": "threads",
      "reposts_count": 0
    },
    {
      "url": "https://www.threads.net/@diemmy2412_/post/DP6J71rkkK4",
      "source_type": "threads",
      "source": "https://www.threads.net/@diemmy2412_/post/DP6J71rkkK4",
      "domain": "threads.net",
      "social_platform": "threads",
      "title": "Em tìm thợ chụp kỉ yếu cá nhân cả ngày. EM ở Hưng Yên, em mong tìm được thợ chụp được màu mang hướng...",
      "content": "Em tìm thợ chụp kỉ yếu cá nhân cả ngày. EM ở Hưng Yên, em mong tìm được thợ chụp được màu mang hướng vibes nắng thơ hoặc màu hồng lạnh như ảnh đầu luôn ạ. Translate 12",
      "word_count": 38,
      "published_date": 1760700502.0,
      "published_datetime": "2025-10-17 11:28:22+00:00",
      "likes_count": 0,
      "shares_count": 0,
      "comments_count": 0,
      "views_count": 0,
      "reactions": null,
      "account_id": "diemmy2412_",
      "account_name": "diemmy2412_",
      "account_url": "https://www.threads.net/@diemmy2412_",
      "post_id": "8125",
      "post_type": "thread",
      "raw_metadata": {
        "username": "diemmy2412_",
        "likes": 0,
        "replies": 0,
        "reposts": 0,
        "shares": 0,
        "time": "10/17/25",
        "datetime": "2025-10-17T11:28:22.000Z"
      },
      "is_cleaned": true,
      "data_type": "threads",
      "reposts_count": 0
    },
    {
      "url": "https://www.threads.net/@_.iammai7128._/post/DQePHB2E0yf",
      "source_type": "threads",
      "source": "https://www.threads.net/@_.iammai7128._/post/DQePHB2E0yf",
      "domain": "threads.net",
      "social_platform": "threads",
      "title": "Cần tìm make kỉ yếu khu vực TP Hưng Yên 41. Giá cả 300_450k ặ",
      "content": "Cần tìm make kỉ yếu khu vực TP Hưng Yên 41. Giá cả 300_450k ặ",
      "word_count": 15,
      "published_date": 1761911175.0,
      "published_datetime": "2025-10-31 11:46:15+00:00",
      "likes_count": 0,
      "shares_count": 0,
      "comments_count": 0,
      "views_count": 0,
      "reactions": null,
      "account_id": "_.iammai7128._",
      "account_name": "_.iammai7128._",
      "account_url": "https://www.threads.net/@_.iammai7128._",
      "post_id": "8124",
      "post_type": "thread",
      "raw_metadata": {
        "username": "_.iammai7128._",
        "likes": 0,
        "replies": 0,
        "reposts": 0,
        "shares": 0,
        "time": "10/31/25",
        "datetime": "2025-10-31T11:46:15.000Z"
      },
      "is_cleaned": true,
      "data_type": "threads",
      "reposts_count": 0
    },
    {
      "url": "https://www.threads.net/@thodaodanghong03/post/DS49i4oEevV",
      "source_type": "threads",
      "source": "https://www.threads.net/@thodaodanghong03/post/DS49i4oEevV",
      "domain": "threads.net",
      "social_platform": "threads",
      "title": "Thật sự là nguyên ngày hôm nay em cháy máy với TRỐNG CƠM các bác ạ :))",
      "content": "Thật sự là nguyên ngày hôm nay em cháy máy với TRỐNG CƠM các bác ạ :))",
      "word_count": 17,
      "published_date": 1767102903.0,
      "published_datetime": "2025-12-30 13:55:03+00:00",
      "likes_count": 0,
      "shares_count": 0,
      "comments_count": 0,
      "views_count": 0,
      "reactions": null,
      "account_id": "thodaodanghong03",
      "account_name": "thodaodanghong03",
      "account_url": "https://www.threads.net/@thodaodanghong03",
      "post_id": "8123",
      "post_type": "thread",
      "raw_metadata": {
        "username": "thodaodanghong03",
        "likes": 0,
        "replies": 0,
        "reposts": 0,
        "shares": 0,
        "time": "4d",
        "datetime": "2025-12-30T13:55:03.000Z"
      },
      "is_cleaned": true,
      "data_type": "threads",
      "reposts_count": 0
    },
    {
      "url": "https://www.threads.net/@cloud.ngocthom/post/DAi1iGDT0IG",
      "source_type": "threads",
      "source": "https://www.threads.net/@cloud.ngocthom/post/DAi1iGDT0IG",
      "domain": "threads.net",
      "social_platform": "threads",
      "title": "Ai đi Vinhomes Ocean Park3 Hưng yên chưa ạ  @threads",
      "content": "Ai đi Vinhomes Ocean Park3 Hưng yên chưa ạ  @threads",
      "word_count": 10,
      "published_date": 1727705799.0,
      "published_datetime": "2024-09-30 14:16:39+00:00",
      "likes_count": 0,
      "shares_count": 0,
      "comments_count": 0,
      "views_count": 0,
      "reactions": null,
      "account_id": "cloud.ngocthom",
      "account_name": "cloud.ngocthom",
      "account_url": "https://www.threads.net/@cloud.ngocthom",
      "post_id": "8122",
      "post_type": "thread",
      "raw_metadata": {
        "username": "cloud.ngocthom",
        "likes": 0,
        "replies": 0,
        "reposts": 0,
        "shares": 0,
        "time": "09/30/24",
        "datetime": "2024-09-30T14:16:39.000Z"
      },
      "is_cleaned": true,
      "data_type": "threads",
      "reposts_count": 0
    },
    {
      "url": "https://www.threads.net/@vohieuphuc/post/DDfGAnsTmzN",
      "source_type": "threads",
      "source": "https://www.threads.net/@vohieuphuc/post/DDfGAnsTmzN",
      "domain": "threads.net",
      "social_platform": "threads",
      "title": "Đố các bạn, trên thế gian này khoảng cách nào là xa nhất ? Nó không phải là khoảng cách từ ngọn núi ...",
      "content": "Đố các bạn, trên thế gian này khoảng cách nào là xa nhất ? Nó không phải là khoảng cách từ ngọn núi này đến ngọn núi kia Không phải là khoảng cách từ đại dương này đến đại dương kia Cũng không phải là khoảng cách từ châu lục này đến châu lục kia Mà nó chính là khỏang cách từ Hà Nội đến Hưng Yên dài 59.6km",
      "word_count": 69,
      "published_date": 1734022671.0,
      "published_datetime": "2024-12-12 16:57:51+00:00",
      "likes_count": 0,
      "shares_count": 0,
      "comments_count": 0,
      "views_count": 0,
      "reactions": null,
      "account_id": "vohieuphuc",
      "account_name": "vohieuphuc",
      "account_url": "https://www.threads.net/@vohieuphuc",
      "post_id": "8121",
      "post_type": "thread",
      "raw_metadata": {
        "username": "vohieuphuc",
        "likes": 0,
        "replies": 0,
        "reposts": 0,
        "shares": 0,
        "time": "12/12/24",
        "datetime": "2024-12-12T16:57:51.000Z"
      },
      "is_cleaned": true,
      "data_type": "threads",
      "reposts_count": 0
    },
    {
      "url": "https://www.threads.net/@k.huyeen/post/DS8KcRTknaX",
      "source_type": "threads",
      "source": "https://www.threads.net/@k.huyeen/post/DS8KcRTknaX",
      "domain": "threads.net",
      "social_platform": "threads",
      "title": "Pháo hoa HG xịn đétttt HPNY 2026",
      "content": "Pháo hoa HG xịn đétttt HPNY 2026",
      "word_count": 7,
      "published_date": 1767210363.0,
      "published_datetime": "2025-12-31 19:46:03+00:00",
      "likes_count": 0,
      "shares_count": 0,
      "comments_count": 0,
      "views_count": 0,
      "reactions": null,
      "account_id": "k.huyeen",
      "account_name": "k.huyeen",
      "account_url": "https://www.threads.net/@k.huyeen",
      "post_id": "8120",
      "post_type": "thread",
      "raw_metadata": {
        "username": "k.huyeen",
        "likes": 0,
        "replies": 0,
        "reposts": 0,
        "shares": 0,
        "time": "3d",
        "datetime": "2025-12-31T19:46:03.000Z"
      },
      "is_cleaned": true,
      "data_type": "threads",
      "reposts_count": 0
    },
    {
      "url": "https://www.threads.net/@lynhan_w/post/DSPuFfyj19y",
      "source_type": "threads",
      "source": "https://www.threads.net/@lynhan_w/post/DSPuFfyj19y",
      "domain": "threads.net",
      "social_platform": "threads",
      "title": "mng ơi, rcm e thợ ảnh Tết ở Hưng Yên giá khoảng 1tr với ạ, e muốn chụp ảnh Tết với gia đình ấy ạ ...",
      "content": "mng ơi, rcm e thợ ảnh Tết ở Hưng Yên giá khoảng 1tr với ạ, e muốn chụp ảnh Tết với gia đình ấy ạ  e cảm ơn ạ Translate 12",
      "word_count": 31,
      "published_date": 1765719066.0,
      "published_datetime": "2025-12-14 13:31:06+00:00",
      "likes_count": 0,
      "shares_count": 0,
      "comments_count": 0,
      "views_count": 0,
      "reactions": null,
      "account_id": "lynhan_w",
      "account_name": "lynhan_w",
      "account_url": "https://www.threads.net/@lynhan_w",
      "post_id": "8119",
      "post_type": "thread",
      "raw_metadata": {
        "username": "lynhan_w",
        "likes": 0,
        "replies": 0,
        "reposts": 0,
        "shares": 0,
        "time": "12/14/25",
        "datetime": "2025-12-14T13:31:06.000Z"
      },
      "is_cleaned": true,
      "data_type": "threads",
      "reposts_count": 0
    },
    {
      "url": "https://www.threads.net/@idc.bxtch_/post/DIjXLPkPX-D",
      "source_type": "threads",
      "source": "https://www.threads.net/@idc.bxtch_/post/DIjXLPkPX-D",
      "domain": "threads.net",
      "social_platform": "threads",
      "title": "ê bực mình vl, dẹp ngay cái vụ toxic Hưng Yên với Thái Bình dùm t cái???",
      "content": "ê bực mình vl, dẹp ngay cái vụ toxic Hưng Yên với Thái Bình dùm t cái???",
      "word_count": 17,
      "published_date": 1744903307.0,
      "published_datetime": "2025-04-17 15:21:47+00:00",
      "likes_count": 0,
      "shares_count": 0,
      "comments_count": 0,
      "views_count": 0,
      "reactions": null,
      "account_id": "idc.bxtch_",
      "account_name": "idc.bxtch_",
      "account_url": "https://www.threads.net/@idc.bxtch_",
      "post_id": "8118",
      "post_type": "thread",
      "raw_metadata": {
        "username": "idc.bxtch_",
        "likes": 0,
        "replies": 0,
        "reposts": 0,
        "shares": 0,
        "time": "04/17/25",
        "datetime": "2025-04-17T15:21:47.000Z"
      },
      "is_cleaned": true,
      "data_type": "threads",
      "reposts_count": 0
    },
    {
      "url": "https://www.threads.net/@kmerveiller/post/DK0lx4Dzd3y",
      "source_type": "threads",
      "source": "https://www.threads.net/@kmerveiller/post/DK0lx4Dzd3y",
      "domain": "threads.net",
      "social_platform": "threads",
      "title": "30 tô bánh canh tại các tụ điểm: - hà nộihưng yên (concert atvncg): châu, chung, tâm, quân, đạt, na...",
      "content": "30 tô bánh canh tại các tụ điểm: - hà nộihưng yên (concert atvncg): châu, chung, tâm, quân, đạt, nam minh, phong - hà nội (về thăm nhà không biết có đi concert hay không): sơn, bông, khang, đức duy lân - sài gòn: cường, vĩ, tin - đà lạt: phúc nguyên (về thăm nhà), lâm anh, phát, kim bảo, liêm, long hoàng (đi homestay của chị tóc tiên chơi với bố tony và chị hủ)",
      "word_count": 76,
      "published_date": 1749776356.0,
      "published_datetime": "2025-06-13 00:59:16+00:00",
      "likes_count": 0,
      "shares_count": 0,
      "comments_count": 0,
      "views_count": 0,
      "reactions": null,
      "account_id": "kmerveiller",
      "account_name": "kmerveiller",
      "account_url": "https://www.threads.net/@kmerveiller",
      "post_id": "8117",
      "post_type": "thread",
      "raw_metadata": {
        "username": "kmerveiller",
        "likes": 0,
        "replies": 0,
        "reposts": 0,
        "shares": 0,
        "time": "06/12/25",
        "datetime": "2025-06-13T00:59:16.000Z"
      },
      "is_cleaned": true,
      "data_type": "threads",
      "reposts_count": 0
    },
    {
      "url": "https://www.threads.net/@_phantom_2910/post/DSsIE9UE2h3",
      "source_type": "threads",
      "source": "https://www.threads.net/@_phantom_2910/post/DSsIE9UE2h3",
      "domain": "threads.net",
      "social_platform": "threads",
      "title": "sắp hết ngày rồi nhma e xin phép Dear Satan CHỊ ĐẸP CONCERT DAY 2 OCEAN PARK 3 XÃ NGHĨA TRỤ TỈNH HƯN...",
      "content": "sắp hết ngày rồi nhma e xin phép Dear Satan CHỊ ĐẸP CONCERT DAY 2 OCEAN PARK 3 XÃ NGHĨA TRỤ TỈNH HƯNG YÊN CONCERT ANH TRAI VƯỢT NGÀN CHÔNG GAI DAY 9-10 XÃ NGHĨA TRỤ TỈNH HƯNG YÊN Thank Santa",
      "word_count": 41,
      "published_date": 1766672217.0,
      "published_datetime": "2025-12-25 14:16:57+00:00",
      "likes_count": 0,
      "shares_count": 0,
      "comments_count": 0,
      "views_count": 0,
      "reactions": null,
      "account_id": "_phantom_2910",
      "account_name": "_phantom_2910",
      "account_url": "https://www.threads.net/@_phantom_2910",
      "post_id": "8116",
      "post_type": "thread",
      "raw_metadata": {
        "username": "_phantom_2910",
        "likes": 0,
        "replies": 0,
        "reposts": 0,
        "shares": 0,
        "time": "12/25/25",
        "datetime": "2025-12-25T14:16:57.000Z"
      },
      "is_cleaned": true,
      "data_type": "threads",
      "reposts_count": 0
    },
    {
      "url": "https://www.threads.net/@__holyrosie/post/DS7rHpzgczY",
      "source_type": "threads",
      "source": "https://www.threads.net/@__holyrosie/post/DS7rHpzgczY",
      "domain": "threads.net",
      "social_platform": "threads",
      "title": "Lân bỏ cả ngủ trưa để chọn quà giáng sinh - xe ô tô đồ chơi có phun sương nhưng lại nhận được quà củ...",
      "content": "Lân bỏ cả ngủ trưa để chọn quà giáng sinh - xe ô tô đồ chơi có phun sương nhưng lại nhận được quà của Phúc Nguyên - báo hoa học trò  áo TBTN chôm của ekip ))) Còn Long Hoàng đi thu gom dầu gội mặt nạ cao dán thừa ở KTX thì lại bốc được trúng quà của Wonbi cũng là xe ô tô đồ chơi ))) Đúng là không phải ở hiền sẽ gặp được lành , poor Lân  Translate 12",
      "word_count": 84,
      "published_date": 1767193906.0,
      "published_datetime": "2025-12-31 15:11:46+00:00",
      "likes_count": 0,
      "shares_count": 0,
      "comments_count": 0,
      "views_count": 0,
      "reactions": null,
      "account_id": "__holyrosie",
      "account_name": "__holyrosie",
      "account_url": "https://www.threads.net/@__holyrosie",
      "post_id": "8115",
      "post_type": "thread",
      "raw_metadata": {
        "username": "__holyrosie",
        "likes": 0,
        "replies": 0,
        "reposts": 0,
        "shares": 0,
        "time": "3d",
        "datetime": "2025-12-31T15:11:46.000Z"
      },
      "is_cleaned": true,
      "data_type": "threads",
      "reposts_count": 0
    },
    {
      "url": "https://www.threads.net/@phonephonnnniu/post/DSNwUzME6Us",
      "source_type": "threads",
      "source": "https://www.threads.net/@phonephonnnniu/post/DSNwUzME6Us",
      "domain": "threads.net",
      "social_platform": "threads",
      "title": "TÌM NGƯỜI ĐI CHUNG FANSIGN HYEN  Có ai nhà ở huỳnh thúc kháng đống đa hoặc gần đó honggg đi chung ...",
      "content": "TÌM NGƯỜI ĐI CHUNG FANSIGN HYEN  Có ai nhà ở huỳnh thúc kháng đống đa hoặc gần đó honggg đi chung ô tô vs em share tiền ạ  tối đa 3 ng 1 xe  87k để sag Hưng Yên  mấy Muzik nào đi với tui đi huhuhuhu",
      "word_count": 47,
      "published_date": 1765653131.0,
      "published_datetime": "2025-12-13 19:12:11+00:00",
      "likes_count": 0,
      "shares_count": 0,
      "comments_count": 0,
      "views_count": 0,
      "reactions": null,
      "account_id": "phonephonnnniu",
      "account_name": "phonephonnnniu",
      "account_url": "https://www.threads.net/@phonephonnnniu",
      "post_id": "8114",
      "post_type": "thread",
      "raw_metadata": {
        "username": "phonephonnnniu",
        "likes": 0,
        "replies": 0,
        "reposts": 0,
        "shares": 0,
        "time": "12/13/25",
        "datetime": "2025-12-13T19:12:11.000Z"
      },
      "is_cleaned": true,
      "data_type": "threads",
      "reposts_count": 0
    },
    {
      "url": "https://www.threads.net/@n.mih04_/post/DRZc12FEuCD",
      "source_type": "threads",
      "source": "https://www.threads.net/@n.mih04_/post/DRZc12FEuCD",
      "domain": "threads.net",
      "social_platform": "threads",
      "title": "ở văn giang hưng yên add locket đi, ăn dookki t giữ chỗ cho",
      "content": "ở văn giang hưng yên add locket đi, ăn dookki t giữ chỗ cho",
      "word_count": 14,
      "published_date": 1763898086.0,
      "published_datetime": "2025-11-23 11:41:26+00:00",
      "likes_count": 0,
      "shares_count": 0,
      "comments_count": 0,
      "views_count": 0,
      "reactions": null,
      "account_id": "n.mih04_",
      "account_name": "n.mih04_",
      "account_url": "https://www.threads.net/@n.mih04_",
      "post_id": "8113",
      "post_type": "thread",
      "raw_metadata": {
        "username": "n.mih04_",
        "likes": 0,
        "replies": 0,
        "reposts": 0,
        "shares": 0,
        "time": "11/23/25",
        "datetime": "2025-11-23T11:41:26.000Z"
      },
      "is_cleaned": true,
      "data_type": "threads",
      "reposts_count": 0
    },
    {
      "url": "https://www.threads.net/@dtqb1412/post/DOfn_m3kaB5",
      "source_type": "threads",
      "source": "https://www.threads.net/@dtqb1412/post/DOfn_m3kaB5",
      "domain": "threads.net",
      "social_platform": "threads",
      "title": "Biết làm sao bây giờ, đoàn nhà mình có định xếp hàng xuống Hưng Yên k.... Translate 12",
      "content": "Biết làm sao bây giờ, đoàn nhà mình có định xếp hàng xuống Hưng Yên k.... Translate 12",
      "word_count": 18,
      "published_date": 1757662808.0,
      "published_datetime": "2025-09-12 07:40:08+00:00",
      "likes_count": 0,
      "shares_count": 0,
      "comments_count": 0,
      "views_count": 0,
      "reactions": null,
      "account_id": "dtqb1412",
      "account_name": "dtqb1412",
      "account_url": "https://www.threads.net/@dtqb1412",
      "post_id": "8112",
      "post_type": "thread",
      "raw_metadata": {
        "username": "dtqb1412",
        "likes": 0,
        "replies": 0,
        "reposts": 0,
        "shares": 0,
        "time": "09/12/25",
        "datetime": "2025-09-12T07:40:08.000Z"
      },
      "is_cleaned": true,
      "data_type": "threads",
      "reposts_count": 0
    },
    {
      "url": "https://www.threads.net/@gdm7_2420/post/DS8zmKPExlq",
      "source_type": "threads",
      "source": "https://www.threads.net/@gdm7_2420/post/DS8zmKPExlq",
      "domain": "threads.net",
      "social_platform": "threads",
      "title": "năm mới rồi k chị nào ib luôn ha",
      "content": "năm mới rồi k chị nào ib luôn ha",
      "word_count": 9,
      "published_date": 1767231905.0,
      "published_datetime": "2026-01-01 01:45:05+00:00",
      "likes_count": 0,
      "shares_count": 0,
      "comments_count": 0,
      "views_count": 0,
      "reactions": null,
      "account_id": "gdm7_2420",
      "account_name": "gdm7_2420",
      "account_url": "https://www.threads.net/@gdm7_2420",
      "post_id": "8111",
      "post_type": "thread",
      "raw_metadata": {
        "username": "gdm7_2420",
        "likes": 0,
        "replies": 0,
        "reposts": 0,
        "shares": 0,
        "time": "3d",
        "datetime": "2026-01-01T01:45:05.000Z"
      },
      "is_cleaned": true,
      "data_type": "threads",
      "reposts_count": 0
    },
    {
      "url": "https://www.threads.net/@hiimbaoo_/post/DS9idwuEsm8",
      "source_type": "threads",
      "source": "https://www.threads.net/@hiimbaoo_/post/DS9idwuEsm8",
      "domain": "threads.net",
      "social_platform": "threads",
      "title": "Chỗ cũ của tụi em bị dành mất nên tụi em dời lên chỗ khác hát ạ  Vẫn sẽ chiều t5,cn nma từ 16-18h ...",
      "content": "Chỗ cũ của tụi em bị dành mất nên tụi em dời lên chỗ khác hát ạ  Vẫn sẽ chiều t5,cn nma từ 16-18h để mng ngắm hoàng hôn nhá",
      "word_count": 30,
      "published_date": 1767256537.0,
      "published_datetime": "2026-01-01 08:35:37+00:00",
      "likes_count": 0,
      "shares_count": 0,
      "comments_count": 0,
      "views_count": 0,
      "reactions": null,
      "account_id": "hiimbaoo_",
      "account_name": "hiimbaoo_",
      "account_url": "https://www.threads.net/@hiimbaoo_",
      "post_id": "8110",
      "post_type": "thread",
      "raw_metadata": {
        "username": "hiimbaoo_",
        "likes": 0,
        "replies": 0,
        "reposts": 0,
        "shares": 0,
        "time": "3d",
        "datetime": "2026-01-01T08:35:37.000Z"
      },
      "is_cleaned": true,
      "data_type": "threads",
      "reposts_count": 0
    },
    {
      "url": "https://www.threads.net/@169.715.811/post/DSUC4tPkUDx",
      "source_type": "threads",
      "source": "https://www.threads.net/@169.715.811/post/DSUC4tPkUDx",
      "domain": "threads.net",
      "social_platform": "threads",
      "title": "Pass 1 cặp vé Haha Yconcert thứ 7 tuần này ở Hưng Yên em có việc đột xuất của gia đình nên không đi...",
      "content": "Pass 1 cặp vé Haha Yconcert thứ 7 tuần này ở Hưng Yên em có việc đột xuất của gia đình nên không đi gặp Lâm Anh được ai mua giùm em 1 cặp 4m8 mà lẻ vé 2m5 ạ mua cả cặp thì có fix nha cả nhà iu  Translate 12",
      "word_count": 52,
      "published_date": 1765864189.0,
      "published_datetime": "2025-12-16 05:49:49+00:00",
      "likes_count": 0,
      "shares_count": 0,
      "comments_count": 0,
      "views_count": 0,
      "reactions": null,
      "account_id": "169.715.811",
      "account_name": "169.715.811",
      "account_url": "https://www.threads.net/@169.715.811",
      "post_id": "8109",
      "post_type": "thread",
      "raw_metadata": {
        "username": "169.715.811",
        "likes": 0,
        "replies": 0,
        "reposts": 0,
        "shares": 0,
        "time": "12/16/25",
        "datetime": "2025-12-16T05:49:49.000Z"
      },
      "is_cleaned": true,
      "data_type": "threads",
      "reposts_count": 0
    },
    {
      "url": "https://www.threads.net/@ma.chiin/post/DSkZo80E3S6",
      "source_type": "threads",
      "source": "https://www.threads.net/@ma.chiin/post/DSkZo80E3S6",
      "domain": "threads.net",
      "social_platform": "threads",
      "title": "tui có thắc mắc á sao hưng yên mà bả kêu hà nội vậy ạ",
      "content": "tui có thắc mắc á sao hưng yên mà bả kêu hà nội vậy ạ",
      "word_count": 15,
      "published_date": 1766412990.0,
      "published_datetime": "2025-12-22 14:16:30+00:00",
      "likes_count": 0,
      "shares_count": 0,
      "comments_count": 0,
      "views_count": 0,
      "reactions": null,
      "account_id": "ma.chiin",
      "account_name": "ma.chiin",
      "account_url": "https://www.threads.net/@ma.chiin",
      "post_id": "8108",
      "post_type": "thread",
      "raw_metadata": {
        "username": null,
        "likes": 0,
        "replies": 0,
        "reposts": 0,
        "shares": 0,
        "time": "12/22/25",
        "datetime": "2025-12-22T14:16:30.000Z"
      },
      "is_cleaned": true,
      "data_type": "threads",
      "reposts_count": 0
    },
    {
      "url": "https://www.threads.net/@_nupooh_/post/DSmWs2OEy0v",
      "source_type": "threads",
      "source": "https://www.threads.net/@_nupooh_/post/DSmWs2OEy0v",
      "domain": "threads.net",
      "social_platform": "threads",
      "title": "Ủa uh giờ mới nhận ra là ở Hưng Yên mà ? Mèo sên bùa cho lú cấi đầu r, bả gọi Bình Thạnh ơi chắc cũn...",
      "content": "Ủa uh giờ mới nhận ra là ở Hưng Yên mà ? Mèo sên bùa cho lú cấi đầu r, bả gọi Bình Thạnh ơi chắc cũng ơi quá Translate 12",
      "word_count": 31,
      "published_date": 1766478558.0,
      "published_datetime": "2025-12-23 08:29:18+00:00",
      "likes_count": 0,
      "shares_count": 0,
      "comments_count": 0,
      "views_count": 0,
      "reactions": null,
      "account_id": "_nupooh_",
      "account_name": "_nupooh_",
      "account_url": "https://www.threads.net/@_nupooh_",
      "post_id": "8107",
      "post_type": "thread",
      "raw_metadata": {
        "username": "_nupooh_",
        "likes": 0,
        "replies": 0,
        "reposts": 0,
        "shares": 0,
        "time": "12/23/25",
        "datetime": "2025-12-23T08:29:18.000Z"
      },
      "is_cleaned": true,
      "data_type": "threads",
      "reposts_count": 0
    },
    {
      "url": "https://www.threads.net/@haquyenhr/post/DQ3zud4EjC2",
      "source_type": "threads",
      "source": "https://www.threads.net/@haquyenhr/post/DQ3zud4EjC2",
      "domain": "threads.net",
      "social_platform": "threads",
      "title": "Tui vẫn đang tuyển các job tiếng Nhật khu vực Hà Nội, Hưng Yên, Bắc Ninh nha các mom ơiiiii - Semon...",
      "content": "Tui vẫn đang tuyển các job tiếng Nhật khu vực Hà Nội, Hưng Yên, Bắc Ninh nha các mom ơiiiii - Semon CĐ ĐH DHS  JLPT N2N1 - Lương upto 20tr Ib tuiiii",
      "word_count": 33,
      "published_date": 1762769233.0,
      "published_datetime": "2025-11-10 10:07:13+00:00",
      "likes_count": 0,
      "shares_count": 0,
      "comments_count": 0,
      "views_count": 0,
      "reactions": null,
      "account_id": "haquyenhr",
      "account_name": "haquyenhr",
      "account_url": "https://www.threads.net/@haquyenhr",
      "post_id": "8106",
      "post_type": "thread",
      "raw_metadata": {
        "username": "haquyenhr",
        "likes": 0,
        "replies": 0,
        "reposts": 0,
        "shares": 0,
        "time": "11/10/25",
        "datetime": "2025-11-10T10:07:13.000Z"
      },
      "is_cleaned": true,
      "data_type": "threads",
      "reposts_count": 0
    },
    {
      "url": "https://www.threads.net/@vanl.inh20.8/post/DSxf7JwCSge",
      "source_type": "threads",
      "source": "https://www.threads.net/@vanl.inh20.8/post/DSxf7JwCSge",
      "domain": "threads.net",
      "social_platform": "threads",
      "title": "Gay nhm muốn có ngy là boy phố quá Hưng Yên",
      "content": "Gay nhm muốn có ngy là boy phố quá Hưng Yên",
      "word_count": 11,
      "published_date": 1766852492.0,
      "published_datetime": "2025-12-27 16:21:32+00:00",
      "likes_count": 0,
      "shares_count": 0,
      "comments_count": 0,
      "views_count": 0,
      "reactions": null,
      "account_id": "vanl.inh20.8",
      "account_name": "vanl.inh20.8",
      "account_url": "https://www.threads.net/@vanl.inh20.8",
      "post_id": "8105",
      "post_type": "thread",
      "raw_metadata": {
        "username": "vanl.inh20.8",
        "likes": 0,
        "replies": 0,
        "reposts": 0,
        "shares": 0,
        "time": "12/27/25",
        "datetime": "2025-12-27T16:21:32.000Z"
      },
      "is_cleaned": true,
      "data_type": "threads",
      "reposts_count": 0
    },
    {
      "url": "https://www.threads.net/@tthyy.09/post/DRpKk-_iUFX",
      "source_type": "threads",
      "source": "https://www.threads.net/@tthyy.09/post/DRpKk-_iUFX",
      "domain": "threads.net",
      "social_platform": "threads",
      "title": "Nhà gái 17 Hưng Yên ( Thái Bình ) ạ",
      "content": "Nhà gái 17 Hưng Yên ( Thái Bình ) ạ",
      "word_count": 10,
      "published_date": 1764425438.0,
      "published_datetime": "2025-11-29 14:10:38+00:00",
      "likes_count": 0,
      "shares_count": 0,
      "comments_count": 0,
      "views_count": 0,
      "reactions": null,
      "account_id": "tthyy.09",
      "account_name": "tthyy.09",
      "account_url": "https://www.threads.net/@tthyy.09",
      "post_id": "8104",
      "post_type": "thread",
      "raw_metadata": {
        "username": "tthyy.09",
        "likes": 0,
        "replies": 0,
        "reposts": 0,
        "shares": 0,
        "time": "11/29/25",
        "datetime": "2025-11-29T14:10:38.000Z"
      },
      "is_cleaned": true,
      "data_type": "threads",
      "reposts_count": 0
    },
    {
      "url": "https://www.threads.net/@dr.tun0903/post/DLc0Z6PysI1",
      "source_type": "threads",
      "source": "https://www.threads.net/@dr.tun0903/post/DLc0Z6PysI1",
      "domain": "threads.net",
      "social_platform": "threads",
      "title": "Mai chú sĩ về Xã Yên Mỹ tỉnh Hưng Yên rồi xét kèo đi chơi đi",
      "content": "Mai chú sĩ về Xã Yên Mỹ tỉnh Hưng Yên rồi xét kèo đi chơi đi",
      "word_count": 16,
      "published_date": 1751126201.0,
      "published_datetime": "2025-06-28 15:56:41+00:00",
      "likes_count": 0,
      "shares_count": 0,
      "comments_count": 0,
      "views_count": 0,
      "reactions": null,
      "account_id": "dr.tun0903",
      "account_name": "dr.tun0903",
      "account_url": "https://www.threads.net/@dr.tun0903",
      "post_id": "8103",
      "post_type": "thread",
      "raw_metadata": {
        "username": "dr.tun0903",
        "likes": 0,
        "replies": 0,
        "reposts": 0,
        "shares": 0,
        "time": "06/28/25",
        "datetime": "2025-06-28T15:56:41.000Z"
      },
      "is_cleaned": true,
      "data_type": "threads",
      "reposts_count": 0
    },
    {
      "url": "https://www.threads.net/@chang_3042007/post/DLhnAqEzOr5",
      "source_type": "threads",
      "source": "https://www.threads.net/@chang_3042007/post/DLhnAqEzOr5",
      "domain": "threads.net",
      "social_platform": "threads",
      "title": "Thái Bình với Hưng Yên sáp nhập vô mà đọc cmt đáng iu vãi cmay ạ",
      "content": "Thái Bình với Hưng Yên sáp nhập vô mà đọc cmt đáng iu vãi cmay ạ",
      "word_count": 16,
      "published_date": 1751286951.0,
      "published_datetime": "2025-06-30 12:35:51+00:00",
      "likes_count": 0,
      "shares_count": 0,
      "comments_count": 0,
      "views_count": 0,
      "reactions": null,
      "account_id": "chang_3042007",
      "account_name": "chang_3042007",
      "account_url": "https://www.threads.net/@chang_3042007",
      "post_id": "8102",
      "post_type": "thread",
      "raw_metadata": {
        "username": "chang_3042007",
        "likes": 0,
        "replies": 0,
        "reposts": 0,
        "shares": 0,
        "time": "06/30/25",
        "datetime": "2025-06-30T12:35:51.000Z"
      },
      "is_cleaned": true,
      "data_type": "threads",
      "reposts_count": 0
    },
    {
      "url": "https://www.threads.net/@_ahnhu_lv/post/DSKjfxlkys9",
      "source_type": "threads",
      "source": "https://www.threads.net/@_ahnhu_lv/post/DSKjfxlkys9",
      "domain": "threads.net",
      "social_platform": "threads",
      "title": "Hhahah Trúng fansign Hưng Yên nma hong đi đựt huhuuuuu",
      "content": "Hhahah Trúng fansign Hưng Yên nma hong đi đựt huhuuuuu",
      "word_count": 10,
      "published_date": 1765545742.0,
      "published_datetime": "2025-12-12 13:22:22+00:00",
      "likes_count": 0,
      "shares_count": 0,
      "comments_count": 0,
      "views_count": 0,
      "reactions": null,
      "account_id": "_ahnhu_lv",
      "account_name": "_ahnhu_lv",
      "account_url": "https://www.threads.net/@_ahnhu_lv",
      "post_id": "8101",
      "post_type": "thread",
      "raw_metadata": {
        "username": "_ahnhu_lv",
        "likes": 0,
        "replies": 0,
        "reposts": 0,
        "shares": 0,
        "time": "12/12/25",
        "datetime": "2025-12-12T13:22:22.000Z"
      },
      "is_cleaned": true,
      "data_type": "threads",
      "reposts_count": 0
    },
    {
      "url": "https://www.threads.net/@charmaine.mederith/post/DQLlkVaEwMD",
      "source_type": "threads",
      "source": "https://www.threads.net/@charmaine.mederith/post/DQLlkVaEwMD",
      "domain": "threads.net",
      "social_platform": "threads",
      "title": "thông điệp kêu gọi bảo vệ thú cưng tại số 216 Trần Duy Hưng, Yên Hòa, TP Hà Nội. Translate 12",
      "content": "thông điệp kêu gọi bảo vệ thú cưng tại số 216 Trần Duy Hưng, Yên Hòa, TP Hà Nội. Translate 12",
      "word_count": 21,
      "published_date": 1761285415.0,
      "published_datetime": "2025-10-24 05:56:55+00:00",
      "likes_count": 0,
      "shares_count": 0,
      "comments_count": 0,
      "views_count": 0,
      "reactions": null,
      "account_id": "charmaine.mederith",
      "account_name": "charmaine.mederith",
      "account_url": "https://www.threads.net/@charmaine.mederith",
      "post_id": "8100",
      "post_type": "thread",
      "raw_metadata": {
        "username": "charmaine.mederith",
        "likes": 0,
        "replies": 0,
        "reposts": 0,
        "shares": 0,
        "time": "10/24/25",
        "datetime": "2025-10-24T05:56:55.000Z"
      },
      "is_cleaned": true,
      "data_type": "threads",
      "reposts_count": 0
    },
    {
      "url": "https://www.threads.net/@_do.or.donut/post/DQEBw96j8Ue",
      "source_type": "threads",
      "source": "https://www.threads.net/@_do.or.donut/post/DQEBw96j8Ue",
      "domain": "threads.net",
      "social_platform": "threads",
      "title": "Yeah1 gài quảng cáo YCONCERT vào content trong hệ sinh thái Y1 vừa vừa thôi nhé :))) Nhất là Gia đìn...",
      "content": "Yeah1 gài quảng cáo YCONCERT vào content trong hệ sinh thái Y1 vừa vừa thôi nhé :))) Nhất là Gia đình Haha với Tân binh toàn năng ấy, mẹ t hay xem xong thấy lại hỏi t có đi cái concert này ko đó  Con chỉ sang Hưng Yên chơi với bạn 1 hôm thôi.",
      "word_count": 55,
      "published_date": 1761031763.0,
      "published_datetime": "2025-10-21 07:29:23+00:00",
      "likes_count": 0,
      "shares_count": 0,
      "comments_count": 0,
      "views_count": 0,
      "reactions": null,
      "account_id": "_do.or.donut",
      "account_name": "_do.or.donut",
      "account_url": "https://www.threads.net/@_do.or.donut",
      "post_id": "8099",
      "post_type": "thread",
      "raw_metadata": {
        "username": "_do.or.donut",
        "likes": 0,
        "replies": 0,
        "reposts": 0,
        "shares": 0,
        "time": "10/21/25",
        "datetime": "2025-10-21T07:29:23.000Z"
      },
      "is_cleaned": true,
      "data_type": "threads",
      "reposts_count": 0
    },
    {
      "url": "https://www.threads.net/@harie_byeol/post/DSu1AP_k6uO",
      "source_type": "threads",
      "source": "https://www.threads.net/@harie_byeol/post/DSu1AP_k6uO",
      "domain": "threads.net",
      "social_platform": "threads",
      "title": "HELP ME Có ai pass lại slot thi SAT tháng 3 tại Hải Phòng, Hà Nội hoặc Hưng Yên giúp mình với ạ. ...",
      "content": "HELP ME Có ai pass lại slot thi SAT tháng 3 tại Hải Phòng, Hà Nội hoặc Hưng Yên giúp mình với ạ. Mình lớp 12 đã thi tháng 12 nhưng điểm chưa đạt mong muốn, tha thiết mong mọi người giúp đỡ vì tháng 3 là lần cuối mình thi rùi",
      "word_count": 52,
      "published_date": 1766762881.0,
      "published_datetime": "2025-12-26 15:28:01+00:00",
      "likes_count": 0,
      "shares_count": 0,
      "comments_count": 0,
      "views_count": 0,
      "reactions": null,
      "account_id": "harie_byeol",
      "account_name": "harie_byeol",
      "account_url": "https://www.threads.net/@harie_byeol",
      "post_id": "8098",
      "post_type": "thread",
      "raw_metadata": {
        "username": "harie_byeol",
        "likes": 0,
        "replies": 0,
        "reposts": 0,
        "shares": 0,
        "time": "12/26/25",
        "datetime": "2025-12-26T15:28:01.000Z"
      },
      "is_cleaned": true,
      "data_type": "threads",
      "reposts_count": 0
    },
    {
      "url": "https://www.threads.net/@refverin/post/DS5IvEaiCwb",
      "source_type": "threads",
      "source": "https://www.threads.net/@refverin/post/DS5IvEaiCwb",
      "domain": "threads.net",
      "social_platform": "threads",
      "title": "rời cái thuyền fakenut vì chả ai lại ship hai người yêu nhau",
      "content": "rời cái thuyền fakenut vì chả ai lại ship hai người yêu nhau",
      "word_count": 13,
      "published_date": 1767108770.0,
      "published_datetime": "2025-12-30 15:32:50+00:00",
      "likes_count": 0,
      "shares_count": 0,
      "comments_count": 0,
      "views_count": 0,
      "reactions": null,
      "account_id": "refverin",
      "account_name": "refverin",
      "account_url": "https://www.threads.net/@refverin",
      "post_id": "8097",
      "post_type": "thread",
      "raw_metadata": {
        "username": "refverin",
        "likes": 0,
        "replies": 0,
        "reposts": 0,
        "shares": 0,
        "time": "4d",
        "datetime": "2025-12-30T15:32:50.000Z"
      },
      "is_cleaned": true,
      "data_type": "threads",
      "reposts_count": 0
    },
    {
      "url": "https://www.threads.net/@cua_day_queo_lua/post/DSXOoDziXI6",
      "source_type": "threads",
      "source": "https://www.threads.net/@cua_day_queo_lua/post/DSXOoDziXI6",
      "domain": "threads.net",
      "social_platform": "threads",
      "title": "Hôm qua sau sự kiện fansign của Hùng tại Hưng Yên cuối buổi em có thay áo fc ra mà quay đi quẩn lạ...",
      "content": "Hôm qua sau sự kiện fansign của Hùng tại Hưng Yên cuối buổi em có thay áo fc ra mà quay đi quẩn lại thì bị mất áo ai thấy ib e vs chứ đi đâu cũng mất đồ thì khổ quá",
      "word_count": 42,
      "published_date": 1765971007.0,
      "published_datetime": "2025-12-17 11:30:07+00:00",
      "likes_count": 0,
      "shares_count": 0,
      "comments_count": 0,
      "views_count": 0,
      "reactions": null,
      "account_id": "cua_day_queo_lua",
      "account_name": "cua_day_queo_lua",
      "account_url": "https://www.threads.net/@cua_day_queo_lua",
      "post_id": "8096",
      "post_type": "thread",
      "raw_metadata": {
        "username": "cua_day_queo_lua",
        "likes": 0,
        "replies": 0,
        "reposts": 0,
        "shares": 0,
        "time": "12/17/25",
        "datetime": "2025-12-17T11:30:07.000Z"
      },
      "is_cleaned": true,
      "data_type": "threads",
      "reposts_count": 0
    },
    {
      "url": "https://www.threads.net/@vinht693/post/DJlMY7TTgSZ",
      "source_type": "threads",
      "source": "https://www.threads.net/@vinht693/post/DJlMY7TTgSZ",
      "domain": "threads.net",
      "social_platform": "threads",
      "title": "Ơ các anh các chị chê bãi chăn bò Mỹ Đình ơi, tháng 6 các anh các chị có tính xếp hàng vào bãi chăn ...",
      "content": "Ơ các anh các chị chê bãi chăn bò Mỹ Đình ơi, tháng 6 các anh các chị có tính xếp hàng vào bãi chăn bò hái hoa cúc không ạ",
      "word_count": 31,
      "published_date": 1747112244.0,
      "published_datetime": "2025-05-13 04:57:24+00:00",
      "likes_count": 0,
      "shares_count": 0,
      "comments_count": 0,
      "views_count": 0,
      "reactions": null,
      "account_id": "vinht693",
      "account_name": "vinht693",
      "account_url": "https://www.threads.net/@vinht693",
      "post_id": "8095",
      "post_type": "thread",
      "raw_metadata": {
        "username": "vinht693",
        "likes": 0,
        "replies": 0,
        "reposts": 0,
        "shares": 0,
        "time": "05/13/25",
        "datetime": "2025-05-13T04:57:24.000Z"
      },
      "is_cleaned": true,
      "data_type": "threads",
      "reposts_count": 0
    },
    {
      "url": "https://www.threads.net/@lamhoang7806/post/DSmyzkQE9yM",
      "source_type": "threads",
      "source": "https://www.threads.net/@lamhoang7806/post/DSmyzkQE9yM",
      "domain": "threads.net",
      "social_platform": "threads",
      "title": "Có shop nào ở Hưng yên có mều cái cho thèng con t nó xả ko chứ nó vã quá mà t muốn nó có hậu duệ trư...",
      "content": "Có shop nào ở Hưng yên có mều cái cho thèng con t nó xả ko chứ nó vã quá mà t muốn nó có hậu duệ trước đi mất 2 viên cà :)))",
      "word_count": 34,
      "published_date": 1766493293.0,
      "published_datetime": "2025-12-23 12:34:53+00:00",
      "likes_count": 0,
      "shares_count": 0,
      "comments_count": 0,
      "views_count": 0,
      "reactions": null,
      "account_id": "lamhoang7806",
      "account_name": "lamhoang7806",
      "account_url": "https://www.threads.net/@lamhoang7806",
      "post_id": "8094",
      "post_type": "thread",
      "raw_metadata": {
        "username": "lamhoang7806",
        "likes": 0,
        "replies": 0,
        "reposts": 0,
        "shares": 0,
        "time": "12/23/25",
        "datetime": "2025-12-23T12:34:53.000Z"
      },
      "is_cleaned": true,
      "data_type": "threads",
      "reposts_count": 0
    },
    {
      "url": "https://www.threads.net/@chuvannie.517/post/DC_2sTQBNeW",
      "source_type": "threads",
      "source": "https://www.threads.net/@chuvannie.517/post/DC_2sTQBNeW",
      "domain": "threads.net",
      "social_platform": "threads",
      "title": "Mn ơi có ai ở khu vực hưng yên make đc ngày 2912 ko ạ, e chụp kỉ yếu ạ",
      "content": "Mn ơi có ai ở khu vực hưng yên make đc ngày 2912 ko ạ, e chụp kỉ yếu ạ",
      "word_count": 20,
      "published_date": 1732974453.0,
      "published_datetime": "2024-11-30 13:47:33+00:00",
      "likes_count": 0,
      "shares_count": 0,
      "comments_count": 0,
      "views_count": 0,
      "reactions": null,
      "account_id": "chuvannie.517",
      "account_name": "chuvannie.517",
      "account_url": "https://www.threads.net/@chuvannie.517",
      "post_id": "8093",
      "post_type": "thread",
      "raw_metadata": {
        "username": "chuvannie.517",
        "likes": 0,
        "replies": 0,
        "reposts": 0,
        "shares": 0,
        "time": "11/30/24",
        "datetime": "2024-11-30T13:47:33.000Z"
      },
      "is_cleaned": true,
      "data_type": "threads",
      "reposts_count": 0
    },
    {
      "url": "https://www.threads.net/@ceri__ceri/post/DGMpcbfBlm7",
      "source_type": "threads",
      "source": "https://www.threads.net/@ceri__ceri/post/DGMpcbfBlm7",
      "domain": "threads.net",
      "social_platform": "threads",
      "title": "@_nlv.nhim_ a nhong a xê ô  mưa to ở Hưng Yên",
      "content": "@_nlv.nhim_ a nhong a xê ô  mưa to ở Hưng Yên",
      "word_count": 11,
      "published_date": 1739846165.0,
      "published_datetime": "2025-02-18 02:36:05+00:00",
      "likes_count": 0,
      "shares_count": 0,
      "comments_count": 0,
      "views_count": 0,
      "reactions": null,
      "account_id": "ceri__ceri",
      "account_name": "ceri__ceri",
      "account_url": "https://www.threads.net/@ceri__ceri",
      "post_id": "8092",
      "post_type": "thread",
      "raw_metadata": {
        "username": "ceri__ceri",
        "likes": 0,
        "replies": 0,
        "reposts": 0,
        "shares": 0,
        "time": "02/17/25",
        "datetime": "2025-02-18T02:36:05.000Z"
      },
      "is_cleaned": true,
      "data_type": "threads",
      "reposts_count": 0
    },
    {
      "url": "https://www.threads.net/@zuyduck____/post/DRwjjetD-ol",
      "source_type": "threads",
      "source": "https://www.threads.net/@zuyduck____/post/DRwjjetD-ol",
      "domain": "threads.net",
      "social_platform": "threads",
      "title": "Du lịch Phương Việt cần: 1912: 6 Hdv đi lịch học sinh Ctp: 650k tự di chuyển về Hưng yên.",
      "content": "Du lịch Phương Việt cần: 1912: 6 Hdv đi lịch học sinh Ctp: 650k tự di chuyển về Hưng yên.",
      "word_count": 20,
      "published_date": 1764673357.0,
      "published_datetime": "2025-12-02 11:02:37+00:00",
      "likes_count": 0,
      "shares_count": 0,
      "comments_count": 0,
      "views_count": 0,
      "reactions": null,
      "account_id": "zuyduck____",
      "account_name": "zuyduck____",
      "account_url": "https://www.threads.net/@zuyduck____",
      "post_id": "8091",
      "post_type": "thread",
      "raw_metadata": {
        "username": "zuyduck____",
        "likes": 0,
        "replies": 0,
        "reposts": 0,
        "shares": 0,
        "time": "12/02/25",
        "datetime": "2025-12-02T11:02:37.000Z"
      },
      "is_cleaned": true,
      "data_type": "threads",
      "reposts_count": 0
    },
    {
      "url": "https://www.threads.net/@glaubst_du_an_schicksal/post/DSr1msoEZCx",
      "source_type": "threads",
      "source": "https://www.threads.net/@glaubst_du_an_schicksal/post/DSr1msoEZCx",
      "domain": "threads.net",
      "social_platform": "threads",
      "title": "@anhtraivuotnganchonggai.yeah1 TẤT CẢ NHỮNG CON MÃ CHƯA XUẤT HIỆN TẠI HƯNG YÊN THÌ LÊN HẾT TẠI DAY 9...",
      "content": "@anhtraivuotnganchonggai.yeah1 TẤT CẢ NHỮNG CON MÃ CHƯA XUẤT HIỆN TẠI HƯNG YÊN THÌ LÊN HẾT TẠI DAY 9-10 CHO TAO ĐI! Translate 12",
      "word_count": 23,
      "published_date": 1766662532.0,
      "published_datetime": "2025-12-25 11:35:32+00:00",
      "likes_count": 0,
      "shares_count": 0,
      "comments_count": 0,
      "views_count": 0,
      "reactions": null,
      "account_id": "glaubst_du_an_schicksal",
      "account_name": "glaubst_du_an_schicksal",
      "account_url": "https://www.threads.net/@glaubst_du_an_schicksal",
      "post_id": "8090",
      "post_type": "thread",
      "raw_metadata": {
        "username": "glaubst_du_an_schicksal",
        "likes": 0,
        "replies": 0,
        "reposts": 0,
        "shares": 0,
        "time": "12/25/25",
        "datetime": "2025-12-25T11:35:32.000Z"
      },
      "is_cleaned": true,
      "data_type": "threads",
      "reposts_count": 0
    },
    {
      "url": "https://www.threads.net/@quynhvn_lily/post/DSJTu4Rkk-4",
      "source_type": "threads",
      "source": "https://www.threads.net/@quynhvn_lily/post/DSJTu4Rkk-4",
      "domain": "threads.net",
      "social_platform": "threads",
      "title": "Công ty châu Âu ở Hưng yên đang tuyển dụng các vị trí kỹ sư, open cho các bạn mới tốt nghiệp các chu...",
      "content": "Công ty châu Âu ở Hưng yên đang tuyển dụng các vị trí kỹ sư, open cho các bạn mới tốt nghiệp các chuyên ngành về cơ khí, thủy lực, điện, cơ điện tử,... tiếng anh tốt ( sếp trực tiếp ở nước ngoài), môi trường chuyên nghiệp, làm việc từ t2-6, có xe đưa đón từ Hà Nội, lương tùy theo năng lực 1x-3x",
      "word_count": 65,
      "published_date": 1765503923.0,
      "published_datetime": "2025-12-12 01:45:23+00:00",
      "likes_count": 0,
      "shares_count": 0,
      "comments_count": 0,
      "views_count": 0,
      "reactions": null,
      "account_id": "quynhvn_lily",
      "account_name": "quynhvn_lily",
      "account_url": "https://www.threads.net/@quynhvn_lily",
      "post_id": "8089",
      "post_type": "thread",
      "raw_metadata": {
        "username": "quynhvn_lily",
        "likes": 0,
        "replies": 0,
        "reposts": 0,
        "shares": 0,
        "time": "12/11/25",
        "datetime": "2025-12-12T01:45:23.000Z"
      },
      "is_cleaned": true,
      "data_type": "threads",
      "reposts_count": 0
    },
    {
      "url": "https://www.threads.net/@trathanh7393/post/DSJuzb9k5QS",
      "source_type": "threads",
      "source": "https://www.threads.net/@trathanh7393/post/DSJuzb9k5QS",
      "domain": "threads.net",
      "social_platform": "threads",
      "title": "Em ở Bắc Ninh,muốn pass mã Fansign Bloomever vì khong đi được,tiện cho em hỏi pass thì tầm bnhiu ạ ...",
      "content": "Em ở Bắc Ninh,muốn pass mã Fansign Bloomever vì khong đi được,tiện cho em hỏi pass thì tầm bnhiu ạ Kb trúng fs Hà Nội hoặc Hưng Yên k. Translate 12",
      "word_count": 31,
      "published_date": 1765518116.0,
      "published_datetime": "2025-12-12 05:41:56+00:00",
      "likes_count": 0,
      "shares_count": 0,
      "comments_count": 0,
      "views_count": 0,
      "reactions": null,
      "account_id": "trathanh7393",
      "account_name": "trathanh7393",
      "account_url": "https://www.threads.net/@trathanh7393",
      "post_id": "8088",
      "post_type": "thread",
      "raw_metadata": {
        "username": "trathanh7393",
        "likes": 0,
        "replies": 0,
        "reposts": 0,
        "shares": 0,
        "time": "12/12/25",
        "datetime": "2025-12-12T05:41:56.000Z"
      },
      "is_cleaned": true,
      "data_type": "threads",
      "reposts_count": 0
    },
    {
      "url": "https://www.threads.net/@vergg_drzwd/post/DSr36CflMG1",
      "source_type": "threads",
      "source": "https://www.threads.net/@vergg_drzwd/post/DSr36CflMG1",
      "domain": "threads.net",
      "social_platform": "threads",
      "title": "Hưng Yên mảnh đất ân tình DAY2 CHỊ ĐẸP ĐI @chidepdapgioresong ))))))))))))))))))))))))",
      "content": "Hưng Yên mảnh đất ân tình DAY2 CHỊ ĐẸP ĐI @chidepdapgioresong ))))))))))))))))))))))))",
      "word_count": 12,
      "published_date": 1766663739.0,
      "published_datetime": "2025-12-25 11:55:39+00:00",
      "likes_count": 0,
      "shares_count": 0,
      "comments_count": 0,
      "views_count": 0,
      "reactions": null,
      "account_id": "vergg_drzwd",
      "account_name": "vergg_drzwd",
      "account_url": "https://www.threads.net/@vergg_drzwd",
      "post_id": "8087",
      "post_type": "thread",
      "raw_metadata": {
        "username": "vergg_drzwd",
        "likes": 0,
        "replies": 0,
        "reposts": 0,
        "shares": 0,
        "time": "12/25/25",
        "datetime": "2025-12-25T11:55:39.000Z"
      },
      "is_cleaned": true,
      "data_type": "threads",
      "reposts_count": 0
    },
    {
      "url": "https://www.threads.net/@hhlysm/post/DS1ZfiIkgzd",
      "source_type": "threads",
      "source": "https://www.threads.net/@hhlysm/post/DS1ZfiIkgzd",
      "domain": "threads.net",
      "social_platform": "threads",
      "title": "Một câu hỏi em chẳng thể trả lời",
      "content": "Một câu hỏi em chẳng thể trả lời",
      "word_count": 8,
      "published_date": 1766983338.0,
      "published_datetime": "2025-12-29 04:42:18+00:00",
      "likes_count": 0,
      "shares_count": 0,
      "comments_count": 0,
      "views_count": 0,
      "reactions": null,
      "account_id": "hhlysm",
      "account_name": "hhlysm",
      "account_url": "https://www.threads.net/@hhlysm",
      "post_id": "8086",
      "post_type": "thread",
      "raw_metadata": {
        "username": "hhlysm",
        "likes": 0,
        "replies": 0,
        "reposts": 0,
        "shares": 0,
        "time": "6d",
        "datetime": "2025-12-29T04:42:18.000Z"
      },
      "is_cleaned": true,
      "data_type": "threads",
      "reposts_count": 0
    },
    {
      "url": "https://www.threads.net/@squirrel.8116232/post/DS7oIiQkp80",
      "source_type": "threads",
      "source": "https://www.threads.net/@squirrel.8116232/post/DS7oIiQkp80",
      "domain": "threads.net",
      "social_platform": "threads",
      "title": "Ụa dị là năm ni hong có bồ thiệt đó hãaa Hỏng lẽ nào đây là sự thật",
      "content": "Ụa dị là năm ni hong có bồ thiệt đó hãaa Hỏng lẽ nào đây là sự thật",
      "word_count": 18,
      "published_date": 1767192340.0,
      "published_datetime": "2025-12-31 14:45:40+00:00",
      "likes_count": 0,
      "shares_count": 0,
      "comments_count": 0,
      "views_count": 0,
      "reactions": null,
      "account_id": "squirrel.8116232",
      "account_name": "squirrel.8116232",
      "account_url": "https://www.threads.net/@squirrel.8116232",
      "post_id": "8085",
      "post_type": "thread",
      "raw_metadata": {
        "username": "squirrel.8116232",
        "likes": 0,
        "replies": 0,
        "reposts": 0,
        "shares": 0,
        "time": "3d",
        "datetime": "2025-12-31T14:45:40.000Z"
      },
      "is_cleaned": true,
      "data_type": "threads",
      "reposts_count": 0
    },
    {
      "url": "https://www.threads.net/@traccyhoang/post/DTATPumEVBG",
      "source_type": "threads",
      "source": "https://www.threads.net/@traccyhoang/post/DTATPumEVBG",
      "domain": "threads.net",
      "social_platform": "threads",
      "title": "Tìm nhân sự khu vực Phố Nối- Hưng Yên Mọi người liên hệ Zalo để nhận JD nhé ạ",
      "content": "Tìm nhân sự khu vực Phố Nối- Hưng Yên Mọi người liên hệ Zalo để nhận JD nhé ạ",
      "word_count": 19,
      "published_date": 1767349161.0,
      "published_datetime": "2026-01-02 10:19:21+00:00",
      "likes_count": 0,
      "shares_count": 0,
      "comments_count": 0,
      "views_count": 0,
      "reactions": null,
      "account_id": "traccyhoang",
      "account_name": "traccyhoang",
      "account_url": "https://www.threads.net/@traccyhoang",
      "post_id": "8084",
      "post_type": "thread",
      "raw_metadata": {
        "username": "traccyhoang",
        "likes": 0,
        "replies": 0,
        "reposts": 0,
        "shares": 0,
        "time": "1d",
        "datetime": "2026-01-02T10:19:21.000Z"
      },
      "is_cleaned": true,
      "data_type": "threads",
      "reposts_count": 0
    },
    {
      "url": "https://www.threads.net/@leeloc97/post/DJeZDpjpDKE",
      "source_type": "threads",
      "source": "https://www.threads.net/@leeloc97/post/DJeZDpjpDKE",
      "domain": "threads.net",
      "social_platform": "threads",
      "title": "Có ai ở EcoPark Hưng Yên khum ạ  ebe Lộc mới ra nơi này",
      "content": "Có ai ở EcoPark Hưng Yên khum ạ  ebe Lộc mới ra nơi này",
      "word_count": 14,
      "published_date": 1746884005.0,
      "published_datetime": "2025-05-10 13:33:25+00:00",
      "likes_count": 0,
      "shares_count": 0,
      "comments_count": 0,
      "views_count": 0,
      "reactions": null,
      "account_id": "leeloc97",
      "account_name": "leeloc97",
      "account_url": "https://www.threads.net/@leeloc97",
      "post_id": "8083",
      "post_type": "thread",
      "raw_metadata": {
        "username": "leeloc97",
        "likes": 0,
        "replies": 0,
        "reposts": 0,
        "shares": 0,
        "time": "05/10/25",
        "datetime": "2025-05-10T13:33:25.000Z"
      },
      "is_cleaned": true,
      "data_type": "threads",
      "reposts_count": 0
    },
    {
      "url": "https://www.threads.net/@vothao1302/post/DPqifxtE0Pz",
      "source_type": "threads",
      "source": "https://www.threads.net/@vothao1302/post/DPqifxtE0Pz",
      "domain": "threads.net",
      "social_platform": "threads",
      "title": "Mọi người ơi. Có biết xe nào từ Hưng Yên OP3 đi Ninh Bình không ạ. Và xe từ Ninh Bình về Hà Nội ạ. E...",
      "content": "Mọi người ơi. Có biết xe nào từ Hưng Yên OP3 đi Ninh Bình không ạ. Và xe từ Ninh Bình về Hà Nội ạ. Em cảm ơn",
      "word_count": 28,
      "published_date": 1760176509.0,
      "published_datetime": "2025-10-11 09:55:09+00:00",
      "likes_count": 0,
      "shares_count": 0,
      "comments_count": 0,
      "views_count": 0,
      "reactions": null,
      "account_id": "vothao1302",
      "account_name": "vothao1302",
      "account_url": "https://www.threads.net/@vothao1302",
      "post_id": "8082",
      "post_type": "thread",
      "raw_metadata": {
        "username": "vothao1302",
        "likes": 0,
        "replies": 0,
        "reposts": 0,
        "shares": 0,
        "time": "10/11/25",
        "datetime": "2025-10-11T09:55:09.000Z"
      },
      "is_cleaned": true,
      "data_type": "threads",
      "reposts_count": 0
    },
    {
      "url": "https://www.threads.net/@dieuanndeyy08/post/DP85q8PEvB5",
      "source_type": "threads",
      "source": "https://www.threads.net/@dieuanndeyy08/post/DP85q8PEvB5",
      "domain": "threads.net",
      "social_platform": "threads",
      "title": "Em cần tìm thợ makeup kỉ yếu ở Hưng Yên đầu tháng 1 này Budget: 400k (cả make và làm tóc ạ) Mọi ngườ...",
      "content": "Em cần tìm thợ makeup kỉ yếu ở Hưng Yên đầu tháng 1 này Budget: 400k (cả make và làm tóc ạ) Mọi người ai biết giới thiệu cho em với ạ",
      "word_count": 32,
      "published_date": 1760792638.0,
      "published_datetime": "2025-10-18 13:03:58+00:00",
      "likes_count": 0,
      "shares_count": 0,
      "comments_count": 0,
      "views_count": 0,
      "reactions": null,
      "account_id": "dieuanndeyy08",
      "account_name": "dieuanndeyy08",
      "account_url": "https://www.threads.net/@dieuanndeyy08",
      "post_id": "8081",
      "post_type": "thread",
      "raw_metadata": {
        "username": "dieuanndeyy08",
        "likes": 0,
        "replies": 0,
        "reposts": 0,
        "shares": 0,
        "time": "10/18/25",
        "datetime": "2025-10-18T13:03:58.000Z"
      },
      "is_cleaned": true,
      "data_type": "threads",
      "reposts_count": 0
    },
    {
      "url": "https://www.threads.net/@gk_vuitruoctinhsau/post/DSOsKkMD0gu",
      "source_type": "threads",
      "source": "https://www.threads.net/@gk_vuitruoctinhsau/post/DSOsKkMD0gu",
      "domain": "threads.net",
      "social_platform": "threads",
      "title": "tìm make up tầm 16g thứ 3 ngày 16 gần khu vực Vincom Ocean Park Hưng Yên Translate 12",
      "content": "tìm make up tầm 16g thứ 3 ngày 16 gần khu vực Vincom Ocean Park Hưng Yên Translate 12",
      "word_count": 19,
      "published_date": 1765684505.0,
      "published_datetime": "2025-12-14 03:55:05+00:00",
      "likes_count": 0,
      "shares_count": 0,
      "comments_count": 0,
      "views_count": 0,
      "reactions": null,
      "account_id": "gk_vuitruoctinhsau",
      "account_name": "gk_vuitruoctinhsau",
      "account_url": "https://www.threads.net/@gk_vuitruoctinhsau",
      "post_id": "8080",
      "post_type": "thread",
      "raw_metadata": {
        "username": "gk_vuitruoctinhsau",
        "likes": 0,
        "replies": 0,
        "reposts": 0,
        "shares": 0,
        "time": "12/13/25",
        "datetime": "2025-12-14T03:55:05.000Z"
      },
      "is_cleaned": true,
      "data_type": "threads",
      "reposts_count": 0
    },
    {
      "url": "https://www.threads.net/@kimseojoo_0504/post/DS5JZmhkgkb",
      "source_type": "threads",
      "source": "https://www.threads.net/@kimseojoo_0504/post/DS5JZmhkgkb",
      "domain": "threads.net",
      "social_platform": "threads",
      "title": "ể thuyền bự phải thuyền mình hong ta",
      "content": "ể thuyền bự phải thuyền mình hong ta",
      "word_count": 8,
      "published_date": 1767109118.0,
      "published_datetime": "2025-12-30 15:38:38+00:00",
      "likes_count": 0,
      "shares_count": 0,
      "comments_count": 0,
      "views_count": 0,
      "reactions": null,
      "account_id": "kimseojoo_0504",
      "account_name": "kimseojoo_0504",
      "account_url": "https://www.threads.net/@kimseojoo_0504",
      "post_id": "8079",
      "post_type": "thread",
      "raw_metadata": {
        "username": "kimseojoo_0504",
        "likes": 0,
        "replies": 0,
        "reposts": 0,
        "shares": 0,
        "time": "4d",
        "datetime": "2025-12-30T15:38:38.000Z"
      },
      "is_cleaned": true,
      "data_type": "threads",
      "reposts_count": 0
    },
    {
      "url": "https://www.threads.net/@dedulovewizard/post/DS6hynHEXnF",
      "source_type": "threads",
      "source": "https://www.threads.net/@dedulovewizard/post/DS6hynHEXnF",
      "domain": "threads.net",
      "social_platform": "threads",
      "title": "Tối nay nhớ làm ĐẠI NGHI THỨC CHUYỂN GIAO nhé các emmm yêuuuu của anhhhhh Phù Thuỷ. Chỉ cần nghĩ tới...",
      "content": "Tối nay nhớ làm ĐẠI NGHI THỨC CHUYỂN GIAO nhé các emmm yêuuuu của anhhhhh Phù Thuỷ. Chỉ cần nghĩ tới năm 2026 siêu nhiều tiền, công việc, business thuận lợi, tình cảm vượt sức tưởng tượng, sao mà vui quá. 2025 gần khép lại rồi, kemeno đi, tổng tiến công năm sau nhé",
      "word_count": 54,
      "published_date": 1767155460.0,
      "published_datetime": "2025-12-31 04:31:00+00:00",
      "likes_count": 0,
      "shares_count": 0,
      "comments_count": 0,
      "views_count": 0,
      "reactions": null,
      "account_id": "dedulovewizard",
      "account_name": "dedulovewizard",
      "account_url": "https://www.threads.net/@dedulovewizard",
      "post_id": "8078",
      "post_type": "thread",
      "raw_metadata": {
        "username": "dedulovewizard",
        "likes": 0,
        "replies": 0,
        "reposts": 0,
        "shares": 0,
        "time": "4d",
        "datetime": "2025-12-31T04:31:00.000Z"
      },
      "is_cleaned": true,
      "data_type": "threads",
      "reposts_count": 0
    },
    {
      "url": "https://www.threads.net/@hoan.lch/post/DOPmjZjktPy",
      "source_type": "threads",
      "source": "https://www.threads.net/@hoan.lch/post/DOPmjZjktPy",
      "domain": "threads.net",
      "social_platform": "threads",
      "title": "Hai người nổi tiếng nhất A80 đều quê Hưng Yên. 1. Lê Hoàng Hiệp 2. Nguyễn Hữu Cường",
      "content": "Hai người nổi tiếng nhất A80 đều quê Hưng Yên. 1. Lê Hoàng Hiệp 2. Nguyễn Hữu Cường",
      "word_count": 18,
      "published_date": 1757125182.0,
      "published_datetime": "2025-09-06 02:19:42+00:00",
      "likes_count": 0,
      "shares_count": 0,
      "comments_count": 0,
      "views_count": 0,
      "reactions": null,
      "account_id": "hoan.lch",
      "account_name": "hoan.lch",
      "account_url": "https://www.threads.net/@hoan.lch",
      "post_id": "8077",
      "post_type": "thread",
      "raw_metadata": {
        "username": "hoan.lch",
        "likes": 0,
        "replies": 0,
        "reposts": 0,
        "shares": 0,
        "time": "09/05/25",
        "datetime": "2025-09-06T02:19:42.000Z"
      },
      "is_cleaned": true,
      "data_type": "threads",
      "reposts_count": 0
    },
    {
      "url": "https://www.threads.net/@l.hoang01/post/DQ5xLP0kY9D",
      "source_type": "threads",
      "source": "https://www.threads.net/@l.hoang01/post/DQ5xLP0kY9D",
      "domain": "threads.net",
      "social_platform": "threads",
      "title": "Các bác nghĩ sao về vấn đề  G-DRAGON 2025 WORLD TOUR Übermensch IN HANOI  chứ không phải IN HUNG...",
      "content": "Các bác nghĩ sao về vấn đề  G-DRAGON 2025 WORLD TOUR Übermensch IN HANOI  chứ không phải IN HUNGYEN. Từ hôm về đến giờ gặp quá nhiều người vào đính chính đấy là Hưng Yên không phải Hà Nội, nhưng cái việc mọi người đi mọi người vẫn nói là đi Hưng Yên còn BTC để tên truyền thông là HANOI mình thấy có sao đâu nhỉ? Nhắc HANOI người ta còn biết là ở Việt Nam chứ giờ để HUNGYEN chắc gì người nước ngoài người ta biết. Mình nghĩ vấn đề rất bình thường mà sao nhiều bạn cứ làm quá lên thế nhỉ Translate 12",
      "word_count": 108,
      "published_date": 1762835005.0,
      "published_datetime": "2025-11-11 04:23:25+00:00",
      "likes_count": 0,
      "shares_count": 0,
      "comments_count": 0,
      "views_count": 0,
      "reactions": null,
      "account_id": "l.hoang01",
      "account_name": "l.hoang01",
      "account_url": "https://www.threads.net/@l.hoang01",
      "post_id": "8076",
      "post_type": "thread",
      "raw_metadata": {
        "username": "l.hoang01",
        "likes": 0,
        "replies": 0,
        "reposts": 0,
        "shares": 0,
        "time": "11/10/25",
        "datetime": "2025-11-11T04:23:25.000Z"
      },
      "is_cleaned": true,
      "data_type": "threads",
      "reposts_count": 0
    },
    {
      "url": "https://www.threads.net/@phuong281201/post/DOdsTPPk-b3",
      "source_type": "threads",
      "source": "https://www.threads.net/@phuong281201/post/DOdsTPPk-b3",
      "domain": "threads.net",
      "social_platform": "threads",
      "title": "Hà Nội, Hưng yên văn lâm Ib lw k K quan trọng tuổi tác",
      "content": "Hà Nội, Hưng yên văn lâm Ib lw k K quan trọng tuổi tác",
      "word_count": 14,
      "published_date": 1757597958.0,
      "published_datetime": "2025-09-11 13:39:18+00:00",
      "likes_count": 0,
      "shares_count": 0,
      "comments_count": 0,
      "views_count": 0,
      "reactions": null,
      "account_id": "phuong281201",
      "account_name": "phuong281201",
      "account_url": "https://www.threads.net/@phuong281201",
      "post_id": "8075",
      "post_type": "thread",
      "raw_metadata": {
        "username": "phuong281201",
        "likes": 0,
        "replies": 0,
        "reposts": 0,
        "shares": 0,
        "time": "09/11/25",
        "datetime": "2025-09-11T13:39:18.000Z"
      },
      "is_cleaned": true,
      "data_type": "threads",
      "reposts_count": 0
    },
    {
      "url": "https://www.threads.net/@lhint.15/post/DROdzSIkpI8",
      "source_type": "threads",
      "source": "https://www.threads.net/@lhint.15/post/DROdzSIkpI8",
      "domain": "threads.net",
      "social_platform": "threads",
      "title": "Mk muốn kiếm vc vp đồng nghiệp thân thiện cười cả ngày quanh hưng yên gần khoái châu càng tốt",
      "content": "Mk muốn kiếm vc vp đồng nghiệp thân thiện cười cả ngày quanh hưng yên gần khoái châu càng tốt",
      "word_count": 20,
      "published_date": 1763529490.0,
      "published_datetime": "2025-11-19 05:18:10+00:00",
      "likes_count": 0,
      "shares_count": 0,
      "comments_count": 0,
      "views_count": 0,
      "reactions": null,
      "account_id": "lhint.15",
      "account_name": "lhint.15",
      "account_url": "https://www.threads.net/@lhint.15",
      "post_id": "8074",
      "post_type": "thread",
      "raw_metadata": {
        "username": "lhint.15",
        "likes": 0,
        "replies": 0,
        "reposts": 0,
        "shares": 0,
        "time": "11/19/25",
        "datetime": "2025-11-19T05:18:10.000Z"
      },
      "is_cleaned": true,
      "data_type": "threads",
      "reposts_count": 0
    },
    {
      "url": "https://www.threads.net/@hongl.uong/post/DDhzKDdTtDo",
      "source_type": "threads",
      "source": "https://www.threads.net/@hongl.uong/post/DDhzKDdTtDo",
      "domain": "threads.net",
      "social_platform": "threads",
      "title": "Con có đi Mỹ Đình đâu, con đi Hưng Yên mà Translate 12",
      "content": "Con có đi Mỹ Đình đâu, con đi Hưng Yên mà Translate 12",
      "word_count": 13,
      "published_date": 1734113450.0,
      "published_datetime": "2024-12-13 18:10:50+00:00",
      "likes_count": 0,
      "shares_count": 0,
      "comments_count": 0,
      "views_count": 0,
      "reactions": null,
      "account_id": "hongl.uong",
      "account_name": "hongl.uong",
      "account_url": "https://www.threads.net/@hongl.uong",
      "post_id": "8073",
      "post_type": "thread",
      "raw_metadata": {
        "username": "hongl.uong",
        "likes": 0,
        "replies": 0,
        "reposts": 0,
        "shares": 0,
        "time": "12/13/24",
        "datetime": "2024-12-13T18:10:50.000Z"
      },
      "is_cleaned": true,
      "data_type": "threads",
      "reposts_count": 0
    },
    {
      "url": "https://www.threads.net/@hiep10610/post/DTEnNXcklvI",
      "source_type": "threads",
      "source": "https://www.threads.net/@hiep10610/post/DTEnNXcklvI",
      "domain": "threads.net",
      "social_platform": "threads",
      "title": "Cần bán lô đất Ngô duy phỡn cầu các già tiền Hải thái bình cũ ( Hưng yên mới) Dt 90m kinh doanh buôn...",
      "content": "Cần bán lô đất Ngô duy phỡn cầu các già tiền Hải thái bình cũ ( Hưng yên mới) Dt 90m kinh doanh buôn bán tấp nập (bệnh viện - khu công nghiệp ngay cạnh Giá thỏa thuận lh 0987527095 Translate 12",
      "word_count": 42,
      "published_date": 1767493845.0,
      "published_datetime": "2026-01-04 02:30:45+00:00",
      "likes_count": 0,
      "shares_count": 0,
      "comments_count": 0,
      "views_count": 0,
      "reactions": null,
      "account_id": "hiep10610",
      "account_name": "hiep10610",
      "account_url": "https://www.threads.net/@hiep10610",
      "post_id": "8072",
      "post_type": "thread",
      "raw_metadata": {
        "username": "hiep10610",
        "likes": 0,
        "replies": 0,
        "reposts": 0,
        "shares": 0,
        "time": "7h",
        "datetime": "2026-01-04T02:30:45.000Z"
      },
      "is_cleaned": true,
      "data_type": "threads",
      "reposts_count": 0
    },
    {
      "url": "https://www.threads.net/@sirein_24/post/DS4s_rzifcM",
      "source_type": "threads",
      "source": "https://www.threads.net/@sirein_24/post/DS4s_rzifcM",
      "domain": "threads.net",
      "social_platform": "threads",
      "title": "Phải công nhận, 2025 là năm đỉnh cao sự nghiệp của QuangHungMasterD!",
      "content": "Phải công nhận, 2025 là năm đỉnh cao sự nghiệp của QuangHungMasterD!",
      "word_count": 12,
      "published_date": 1767094226.0,
      "published_datetime": "2025-12-30 11:30:26+00:00",
      "likes_count": 0,
      "shares_count": 0,
      "comments_count": 0,
      "views_count": 0,
      "reactions": null,
      "account_id": "sirein_24",
      "account_name": "sirein_24",
      "account_url": "https://www.threads.net/@sirein_24",
      "post_id": "8071",
      "post_type": "thread",
      "raw_metadata": {
        "username": "sirein_24",
        "likes": 0,
        "replies": 0,
        "reposts": 0,
        "shares": 0,
        "time": "4d",
        "datetime": "2025-12-30T11:30:26.000Z"
      },
      "is_cleaned": true,
      "data_type": "threads",
      "reposts_count": 0
    },
    {
      "url": "https://www.threads.net/@_chiemsieunhan/post/DL24c1aBXpN",
      "source_type": "threads",
      "source": "https://www.threads.net/@_chiemsieunhan/post/DL24c1aBXpN",
      "domain": "threads.net",
      "social_platform": "threads",
      "title": "Quán Phở Huy ở Cửa Đông thật sự đáng để Cheap moment Vừa lết xác từ chung kết khởi nghiệp cùng Kawa...",
      "content": "Quán Phở Huy ở Cửa Đông thật sự đáng để Cheap moment Vừa lết xác từ chung kết khởi nghiệp cùng Kawai, chào cô Hương tân hiệu trưởng FTU xong phi từ cung Việt Xô ra ăn thì lại gặp cô  4p sau thì anh Long Hạt Nhài và cậu Xéng của Pam bước vào Chưa kể ban đầu chúng tôi đến để cheap moment với anh Sibun và anh Hưng Yên Bái ))) Translate 12",
      "word_count": 76,
      "published_date": 1752000737.0,
      "published_datetime": "2025-07-08 18:52:17+00:00",
      "likes_count": 0,
      "shares_count": 0,
      "comments_count": 0,
      "views_count": 0,
      "reactions": null,
      "account_id": "_chiemsieunhan",
      "account_name": "_chiemsieunhan",
      "account_url": "https://www.threads.net/@_chiemsieunhan",
      "post_id": "8070",
      "post_type": "thread",
      "raw_metadata": {
        "username": "_chiemsieunhan",
        "likes": 0,
        "replies": 0,
        "reposts": 0,
        "shares": 0,
        "time": "07/08/25",
        "datetime": "2025-07-08T18:52:17.000Z"
      },
      "is_cleaned": true,
      "data_type": "threads",
      "reposts_count": 0
    },
    {
      "url": "https://www.threads.net/@cchanro26/post/DRzufmlk-h7",
      "source_type": "threads",
      "source": "https://www.threads.net/@cchanro26/post/DRzufmlk-h7",
      "domain": "threads.net",
      "social_platform": "threads",
      "title": "Hiện tại mình cần tìm gấp 1 quay dựng mv âm nhạc có thể đi quay cả ngày vào thứ 7 (ngày 612) địa đi...",
      "content": "Hiện tại mình cần tìm gấp 1 quay dựng mv âm nhạc có thể đi quay cả ngày vào thứ 7 (ngày 612) địa điểm tại ecopark Hưng Yên Cast: thương lượng, có hỗ trợ chi phí đi lại. Vì đây là bài dự án hết môn nếu anhchị nào có thể nhận được thì ib mình hoặc liên hệ zl 0348468109. Mình cảm ơn ạ",
      "word_count": 66,
      "published_date": 1764779756.0,
      "published_datetime": "2025-12-03 16:35:56+00:00",
      "likes_count": 0,
      "shares_count": 0,
      "comments_count": 0,
      "views_count": 0,
      "reactions": null,
      "account_id": "cchanro26",
      "account_name": "cchanro26",
      "account_url": "https://www.threads.net/@cchanro26",
      "post_id": "8069",
      "post_type": "thread",
      "raw_metadata": {
        "username": "cchanro26",
        "likes": 0,
        "replies": 0,
        "reposts": 0,
        "shares": 0,
        "time": "12/03/25",
        "datetime": "2025-12-03T16:35:56.000Z"
      },
      "is_cleaned": true,
      "data_type": "threads",
      "reposts_count": 0
    },
    {
      "url": "https://www.threads.net/@49287gr/post/DRmwXSzEnkr",
      "source_type": "threads",
      "source": "https://www.threads.net/@49287gr/post/DRmwXSzEnkr",
      "domain": "threads.net",
      "social_platform": "threads",
      "title": "Trà chiều ở Hưng Yên, trước kì giáng sinh 2025",
      "content": "Trà chiều ở Hưng Yên, trước kì giáng sinh 2025",
      "word_count": 10,
      "published_date": 1764344529.0,
      "published_datetime": "2025-11-28 15:42:09+00:00",
      "likes_count": 0,
      "shares_count": 0,
      "comments_count": 0,
      "views_count": 0,
      "reactions": null,
      "account_id": "49287gr",
      "account_name": "49287gr",
      "account_url": "https://www.threads.net/@49287gr",
      "post_id": "8068",
      "post_type": "thread",
      "raw_metadata": {
        "username": "49287gr",
        "likes": 0,
        "replies": 0,
        "reposts": 0,
        "shares": 0,
        "time": "11/28/25",
        "datetime": "2025-11-28T15:42:09.000Z"
      },
      "is_cleaned": true,
      "data_type": "threads",
      "reposts_count": 0
    },
    {
      "url": "https://www.threads.net/@gauxenh26/post/DKeK_ZcBr6T",
      "source_type": "threads",
      "source": "https://www.threads.net/@gauxenh26/post/DKeK_ZcBr6T",
      "domain": "threads.net",
      "social_platform": "threads",
      "title": "tìm việc làm ở văn lâm hưng yên",
      "content": "tìm việc làm ở văn lâm hưng yên",
      "word_count": 8,
      "published_date": 1749024113.0,
      "published_datetime": "2025-06-04 08:01:53+00:00",
      "likes_count": 0,
      "shares_count": 0,
      "comments_count": 0,
      "views_count": 0,
      "reactions": null,
      "account_id": "gauxenh26",
      "account_name": "gauxenh26",
      "account_url": "https://www.threads.net/@gauxenh26",
      "post_id": "8067",
      "post_type": "thread",
      "raw_metadata": {
        "username": "gauxenh26",
        "likes": 0,
        "replies": 0,
        "reposts": 0,
        "shares": 0,
        "time": "06/04/25",
        "datetime": "2025-06-04T08:01:53.000Z"
      },
      "is_cleaned": true,
      "data_type": "threads",
      "reposts_count": 0
    },
    {
      "url": "https://www.threads.net/@linhpk99/post/DIdMIoDOGQv",
      "source_type": "threads",
      "source": "https://www.threads.net/@linhpk99/post/DIdMIoDOGQv",
      "domain": "threads.net",
      "social_platform": "threads",
      "title": "1 xinh gái dịu kha đến từ Hưng Yên",
      "content": "1 xinh gái dịu kha đến từ Hưng Yên",
      "word_count": 9,
      "published_date": 1744696192.0,
      "published_datetime": "2025-04-15 05:49:52+00:00",
      "likes_count": 0,
      "shares_count": 0,
      "comments_count": 0,
      "views_count": 0,
      "reactions": null,
      "account_id": "linhpk99",
      "account_name": "linhpk99",
      "account_url": "https://www.threads.net/@linhpk99",
      "post_id": "8066",
      "post_type": "thread",
      "raw_metadata": {
        "username": "linhpk99",
        "likes": 0,
        "replies": 0,
        "reposts": 0,
        "shares": 0,
        "time": "04/15/25",
        "datetime": "2025-04-15T05:49:52.000Z"
      },
      "is_cleaned": true,
      "data_type": "threads",
      "reposts_count": 0
    },
    {
      "url": "https://www.threads.net/@phuonggthaok4/post/DFfLz9FTN0i",
      "source_type": "threads",
      "source": "https://www.threads.net/@phuonggthaok4/post/DFfLz9FTN0i",
      "domain": "threads.net",
      "social_platform": "threads",
      "title": "Kết bạn Hưng Yên  New year - New Me Tui muốn yêu bản thân mình  dũng cảm hơn, cho phép mình phá...",
      "content": "Kết bạn Hưng Yên  New year - New Me Tui muốn yêu bản thân mình  dũng cảm hơn, cho phép mình phá vỡ niềm tin cũ và những giới hạn. Do đó, tui muốn thử tìm bạn (gender  age nào cũng đc) cùng tần số với mình trên TP này  Mình ở Văn Lâm Hưng Yên nhaaa",
      "word_count": 57,
      "published_date": 1738320680.0,
      "published_datetime": "2025-01-31 10:51:20+00:00",
      "likes_count": 0,
      "shares_count": 0,
      "comments_count": 0,
      "views_count": 0,
      "reactions": null,
      "account_id": "phuonggthaok4",
      "account_name": "phuonggthaok4",
      "account_url": "https://www.threads.net/@phuonggthaok4",
      "post_id": "8065",
      "post_type": "thread",
      "raw_metadata": {
        "username": "phuonggthaok4",
        "likes": 0,
        "replies": 0,
        "reposts": 0,
        "shares": 0,
        "time": "01/31/25",
        "datetime": "2025-01-31T10:51:20.000Z"
      },
      "is_cleaned": true,
      "data_type": "threads",
      "reposts_count": 0
    },
    {
      "url": "https://www.threads.net/@_ln.693_/post/DRZ4iRSD9ZH",
      "source_type": "threads",
      "source": "https://www.threads.net/@_ln.693_/post/DRZ4iRSD9ZH",
      "domain": "threads.net",
      "social_platform": "threads",
      "title": "gái Hưng Yên 10 điểm kh có nhưng",
      "content": "gái Hưng Yên 10 điểm kh có nhưng",
      "word_count": 8,
      "published_date": 1763912892.0,
      "published_datetime": "2025-11-23 15:48:12+00:00",
      "likes_count": 0,
      "shares_count": 0,
      "comments_count": 0,
      "views_count": 0,
      "reactions": null,
      "account_id": "_ln.693_",
      "account_name": "_ln.693_",
      "account_url": "https://www.threads.net/@_ln.693_",
      "post_id": "8064",
      "post_type": "thread",
      "raw_metadata": {
        "username": "_ln.693_",
        "likes": 0,
        "replies": 0,
        "reposts": 0,
        "shares": 0,
        "time": "11/23/25",
        "datetime": "2025-11-23T15:48:12.000Z"
      },
      "is_cleaned": true,
      "data_type": "threads",
      "reposts_count": 0
    },
    {
      "url": "https://www.threads.net/@__camille_6/post/DSMwckIj0RW",
      "source_type": "threads",
      "source": "https://www.threads.net/@__camille_6/post/DSMwckIj0RW",
      "domain": "threads.net",
      "social_platform": "threads",
      "title": "Mới được TCB tặng cái vé Y concert zone Vượt trông gai 1 cũng muốn đi nhưng do hong ai đi cùng nên m...",
      "content": "Mới được TCB tặng cái vé Y concert zone Vượt trông gai 1 cũng muốn đi nhưng do hong ai đi cùng nên mình pass cho bạn nào muốn đi nhaaa. Giá mềm thoi ạ GDTT tại OCP 3 cũng được tại tui quê Hưng Yên gần đó",
      "word_count": 48,
      "published_date": 1765619640.0,
      "published_datetime": "2025-12-13 09:54:00+00:00",
      "likes_count": 0,
      "shares_count": 0,
      "comments_count": 0,
      "views_count": 0,
      "reactions": null,
      "account_id": "__camille_6",
      "account_name": "__camille_6",
      "account_url": "https://www.threads.net/@__camille_6",
      "post_id": "8063",
      "post_type": "thread",
      "raw_metadata": {
        "username": "__camille_6",
        "likes": 0,
        "replies": 0,
        "reposts": 0,
        "shares": 0,
        "time": "12/13/25",
        "datetime": "2025-12-13T09:54:00.000Z"
      },
      "is_cleaned": true,
      "data_type": "threads",
      "reposts_count": 0
    },
    {
      "url": "https://www.threads.net/@hoacomay1976vn/post/DSnYbSYjhft",
      "source_type": "threads",
      "source": "https://www.threads.net/@hoacomay1976vn/post/DSnYbSYjhft",
      "domain": "threads.net",
      "social_platform": "threads",
      "title": "Nghe đồn 213 sẽ có concert, nếu: - Là concert ATVNCG day 9, 10 hay gì gì đó miễn sao có 33 anh nhà...",
      "content": "Nghe đồn 213 sẽ có concert, nếu: - Là concert ATVNCG day 9, 10 hay gì gì đó miễn sao có 33 anh nhà thì tui đổi vé máy bay liền. Bay ra Hưng Yên cũng bay luôn. - Là YCC day 2, dù tổ chức ở SG thì tui phải chờ line up xem có bao nhiêu anh nhà thì mới quyết định có nên all in không. Xin lỗi vì mình là cốt Gai nên mình vẫn thích ATVNCG hơn.",
      "word_count": 82,
      "published_date": 1766513017.0,
      "published_datetime": "2025-12-23 18:03:37+00:00",
      "likes_count": 0,
      "shares_count": 0,
      "comments_count": 0,
      "views_count": 0,
      "reactions": null,
      "account_id": "hoacomay1976vn",
      "account_name": "hoacomay1976vn",
      "account_url": "https://www.threads.net/@hoacomay1976vn",
      "post_id": "8062",
      "post_type": "thread",
      "raw_metadata": {
        "username": "hoacomay1976vn",
        "likes": 0,
        "replies": 0,
        "reposts": 0,
        "shares": 0,
        "time": "12/23/25",
        "datetime": "2025-12-23T18:03:37.000Z"
      },
      "is_cleaned": true,
      "data_type": "threads",
      "reposts_count": 0
    },
    {
      "url": "https://www.threads.net/@katynguyen_99/post/DO1GtXEE6TD",
      "source_type": "threads",
      "source": "https://www.threads.net/@katynguyen_99/post/DO1GtXEE6TD",
      "domain": "threads.net",
      "social_platform": "threads",
      "title": "Em cần lắm các dâu recommend chỗ makeup cô dâu xinh ạ. E cưới ngày 111 mà giờ mãi vẫn chưa book đc ...",
      "content": "Em cần lắm các dâu recommend chỗ makeup cô dâu xinh ạ. E cưới ngày 111 mà giờ mãi vẫn chưa book đc makeup ưng. E ở Hưng Yên ạ, mong muốn bạn make đến sớm đc do sáng ăn hỏi  chiều tiệc cưới luôn trong ngày. Take care đc cô dâu . Cảm ơn mn nhiều lắm. Cần lắm những lời review có tâm",
      "word_count": 65,
      "published_date": 1758383555.0,
      "published_datetime": "2025-09-20 15:52:35+00:00",
      "likes_count": 0,
      "shares_count": 0,
      "comments_count": 0,
      "views_count": 0,
      "reactions": null,
      "account_id": "katynguyen_99",
      "account_name": "katynguyen_99",
      "account_url": "https://www.threads.net/@katynguyen_99",
      "post_id": "8061",
      "post_type": "thread",
      "raw_metadata": {
        "username": "katynguyen_99",
        "likes": 0,
        "replies": 0,
        "reposts": 0,
        "shares": 0,
        "time": "09/20/25",
        "datetime": "2025-09-20T15:52:35.000Z"
      },
      "is_cleaned": true,
      "data_type": "threads",
      "reposts_count": 0
    },
    {
      "url": "https://www.threads.net/@phuongthu.ngn/post/DSJla2Tj2fW",
      "source_type": "threads",
      "source": "https://www.threads.net/@phuongthu.ngn/post/DSJla2Tj2fW",
      "domain": "threads.net",
      "social_platform": "threads",
      "title": "Hi mọi người. Có bác nào cuối năm mà đang loay hoay tìm việc liên quan đến tiếng Nhật tại Hưng Yên, ...",
      "content": "Hi mọi người. Có bác nào cuối năm mà đang loay hoay tìm việc liên quan đến tiếng Nhật tại Hưng Yên, Hải Dương, Hà Nội,... không ạ? Em là headhunter, bên em chuyên tuyển nhân sự cho các công ty của Nhật tại Việt Nam, mức lương thưởng cạnh tranh. Bác nào đang muốn chuyển việc thì nhắn em nhé ạ.",
      "word_count": 62,
      "published_date": 1765513196.0,
      "published_datetime": "2025-12-12 04:19:56+00:00",
      "likes_count": 0,
      "shares_count": 0,
      "comments_count": 0,
      "views_count": 0,
      "reactions": null,
      "account_id": "phuongthu.ngn",
      "account_name": "phuongthu.ngn",
      "account_url": "https://www.threads.net/@phuongthu.ngn",
      "post_id": "8060",
      "post_type": "thread",
      "raw_metadata": {
        "username": "phuongthu.ngn",
        "likes": 0,
        "replies": 0,
        "reposts": 0,
        "shares": 0,
        "time": "12/11/25",
        "datetime": "2025-12-12T04:19:56.000Z"
      },
      "is_cleaned": true,
      "data_type": "threads",
      "reposts_count": 0
    },
    {
      "url": "https://www.threads.net/@phgthao_38/post/DS6uw_0EXnS",
      "source_type": "threads",
      "source": "https://www.threads.net/@phgthao_38/post/DS6uw_0EXnS",
      "domain": "threads.net",
      "social_platform": "threads",
      "title": "bộ người Hàn hông biếc lạnh hả ???",
      "content": "bộ người Hàn hông biếc lạnh hả ???",
      "word_count": 8,
      "published_date": 1767162281.0,
      "published_datetime": "2025-12-31 06:24:41+00:00",
      "likes_count": 0,
      "shares_count": 0,
      "comments_count": 0,
      "views_count": 0,
      "reactions": null,
      "account_id": "phgthao_38",
      "account_name": "phgthao_38",
      "account_url": "https://www.threads.net/@phgthao_38",
      "post_id": "8059",
      "post_type": "thread",
      "raw_metadata": {
        "username": "phgthao_38",
        "likes": 0,
        "replies": 0,
        "reposts": 0,
        "shares": 0,
        "time": "4d",
        "datetime": "2025-12-31T06:24:41.000Z"
      },
      "is_cleaned": true,
      "data_type": "threads",
      "reposts_count": 0
    },
    {
      "url": "https://www.threads.net/@_hadwmai/post/DGlHFnqTdPw",
      "source_type": "threads",
      "source": "https://www.threads.net/@_hadwmai/post/DGlHFnqTdPw",
      "domain": "threads.net",
      "social_platform": "threads",
      "title": "Có ai cho thuê máy ảnh canon hoặc fujifilm gần văn giang hưng yên ngày 23 k ạ Giá hssv tầm hơn trăm...",
      "content": "Có ai cho thuê máy ảnh canon hoặc fujifilm gần văn giang hưng yên ngày 23 k ạ Giá hssv tầm hơn trăm  ngày ạ",
      "word_count": 25,
      "published_date": 1740667014.0,
      "published_datetime": "2025-02-27 14:36:54+00:00",
      "likes_count": 0,
      "shares_count": 0,
      "comments_count": 0,
      "views_count": 0,
      "reactions": null,
      "account_id": "_hadwmai",
      "account_name": "_hadwmai",
      "account_url": "https://www.threads.net/@_hadwmai",
      "post_id": "8058",
      "post_type": "thread",
      "raw_metadata": {
        "username": "_hadwmai",
        "likes": 0,
        "replies": 0,
        "reposts": 0,
        "shares": 0,
        "time": "02/27/25",
        "datetime": "2025-02-27T14:36:54.000Z"
      },
      "is_cleaned": true,
      "data_type": "threads",
      "reposts_count": 0
    },
    {
      "url": "https://www.threads.net/@huien.day/post/DSNEftzD9Ay",
      "source_type": "threads",
      "source": "https://www.threads.net/@huien.day/post/DSNEftzD9Ay",
      "domain": "threads.net",
      "social_platform": "threads",
      "title": "Người Ninh Bình-gốc Hưng Yên",
      "content": "Người Ninh Bình-gốc Hưng Yên",
      "word_count": 5,
      "published_date": 1765630152.0,
      "published_datetime": "2025-12-13 12:49:12+00:00",
      "likes_count": 0,
      "shares_count": 0,
      "comments_count": 0,
      "views_count": 0,
      "reactions": null,
      "account_id": "huien.day",
      "account_name": "huien.day",
      "account_url": "https://www.threads.net/@huien.day",
      "post_id": "8057",
      "post_type": "thread",
      "raw_metadata": {
        "username": "huien.day",
        "likes": 0,
        "replies": 0,
        "reposts": 0,
        "shares": 0,
        "time": "12/13/25",
        "datetime": "2025-12-13T12:49:12.000Z"
      },
      "is_cleaned": true,
      "data_type": "threads",
      "reposts_count": 0
    },
    {
      "url": "https://www.threads.net/@baogiogaimecoday910thidoiten/post/DSxxb_aE4ck",
      "source_type": "threads",
      "source": "https://www.threads.net/@baogiogaimecoday910thidoiten/post/DSxxb_aE4ck",
      "domain": "threads.net",
      "social_platform": "threads",
      "title": "VÃI L NHẬN RA RECAP 2025 TOÀN CONCERT :)",
      "content": "VÃI L NHẬN RA RECAP 2025 TOÀN CONCERT :)",
      "word_count": 9,
      "published_date": 1766861674.0,
      "published_datetime": "2025-12-27 18:54:34+00:00",
      "likes_count": 0,
      "shares_count": 0,
      "comments_count": 0,
      "views_count": 0,
      "reactions": null,
      "account_id": "baogiogaimecoday910thidoiten",
      "account_name": "baogiogaimecoday910thidoiten",
      "account_url": "https://www.threads.net/@baogiogaimecoday910thidoiten",
      "post_id": "8056",
      "post_type": "thread",
      "raw_metadata": {
        "username": null,
        "likes": 0,
        "replies": 0,
        "reposts": 0,
        "shares": 0,
        "time": "12/27/25",
        "datetime": "2025-12-27T18:54:34.000Z"
      },
      "is_cleaned": true,
      "data_type": "threads",
      "reposts_count": 0
    },
    {
      "url": "https://www.threads.net/@_then.2410/post/DSzlU26knm8",
      "source_type": "threads",
      "source": "https://www.threads.net/@_then.2410/post/DSzlU26knm8",
      "domain": "threads.net",
      "social_platform": "threads",
      "title": "Ờm thì khom có gì để cãi vì cách 6 tháng lại thấy về Hưng Yên 1 lần :)))",
      "content": "Ờm thì khom có gì để cãi vì cách 6 tháng lại thấy về Hưng Yên 1 lần :)))",
      "word_count": 19,
      "published_date": 1766922433.0,
      "published_datetime": "2025-12-28 11:47:13+00:00",
      "likes_count": 0,
      "shares_count": 0,
      "comments_count": 0,
      "views_count": 0,
      "reactions": null,
      "account_id": "_then.2410",
      "account_name": "_then.2410",
      "account_url": "https://www.threads.net/@_then.2410",
      "post_id": "8055",
      "post_type": "thread",
      "raw_metadata": {
        "username": "_then.2410",
        "likes": 0,
        "replies": 0,
        "reposts": 0,
        "shares": 0,
        "time": "6d",
        "datetime": "2025-12-28T11:47:13.000Z"
      },
      "is_cleaned": true,
      "data_type": "threads",
      "reposts_count": 0
    },
    {
      "url": "https://www.threads.net/@thaoco_furu/post/DSk5G4Ajovo",
      "source_type": "threads",
      "source": "https://www.threads.net/@thaoco_furu/post/DSk5G4Ajovo",
      "domain": "threads.net",
      "social_platform": "threads",
      "title": "20.12.2025: Y-concert  Quá trình chạy xô của con bé từ Hà Nội sang Hưng Yên để hoá điêng làm Gai ...",
      "content": "20.12.2025: Y-concert  Quá trình chạy xô của con bé từ Hà Nội sang Hưng Yên để hoá điêng làm Gai con, Bé Năng",
      "word_count": 23,
      "published_date": 1766429489.0,
      "published_datetime": "2025-12-22 18:51:29+00:00",
      "likes_count": 0,
      "shares_count": 0,
      "comments_count": 0,
      "views_count": 0,
      "reactions": null,
      "account_id": "thaoco_furu",
      "account_name": "thaoco_furu",
      "account_url": "https://www.threads.net/@thaoco_furu",
      "post_id": "8054",
      "post_type": "thread",
      "raw_metadata": {
        "username": "thaoco_furu",
        "likes": 0,
        "replies": 0,
        "reposts": 0,
        "shares": 0,
        "time": "12/22/25",
        "datetime": "2025-12-22T18:51:29.000Z"
      },
      "is_cleaned": true,
      "data_type": "threads",
      "reposts_count": 0
    },
    {
      "url": "https://www.threads.net/@hieeus_ctr/post/DDRnq8aPy5M",
      "source_type": "threads",
      "source": "https://www.threads.net/@hieeus_ctr/post/DDRnq8aPy5M",
      "domain": "threads.net",
      "social_platform": "threads",
      "title": "Có b nào chơi giải lq ở hưng yên dị tui cần 2 b-)) Hưng Yên",
      "content": "Có b nào chơi giải lq ở hưng yên dị tui cần 2 b-)) Hưng Yên",
      "word_count": 16,
      "published_date": 1733570557.0,
      "published_datetime": "2024-12-07 11:22:37+00:00",
      "likes_count": 0,
      "shares_count": 0,
      "comments_count": 0,
      "views_count": 0,
      "reactions": null,
      "account_id": "hieeus_ctr",
      "account_name": "hieeus_ctr",
      "account_url": "https://www.threads.net/@hieeus_ctr",
      "post_id": "8053",
      "post_type": "thread",
      "raw_metadata": {
        "username": "hieeus_ctr",
        "likes": 0,
        "replies": 0,
        "reposts": 0,
        "shares": 0,
        "time": "12/07/24",
        "datetime": "2024-12-07T11:22:37.000Z"
      },
      "is_cleaned": true,
      "data_type": "threads",
      "reposts_count": 0
    },
    {
      "url": "https://www.threads.net/@the.toan51/post/DOvPzRxkmoN",
      "source_type": "threads",
      "source": "https://www.threads.net/@the.toan51/post/DOvPzRxkmoN",
      "domain": "threads.net",
      "social_platform": "threads",
      "title": "Ai làm phiền mình đi ạ",
      "content": "Ai làm phiền mình đi ạ",
      "word_count": 6,
      "published_date": 1758186995.0,
      "published_datetime": "2025-09-18 09:16:35+00:00",
      "likes_count": 0,
      "shares_count": 0,
      "comments_count": 0,
      "views_count": 0,
      "reactions": null,
      "account_id": "the.toan51",
      "account_name": "the.toan51",
      "account_url": "https://www.threads.net/@the.toan51",
      "post_id": "8052",
      "post_type": "thread",
      "raw_metadata": {
        "username": "the.toan51",
        "likes": 0,
        "replies": 0,
        "reposts": 0,
        "shares": 0,
        "time": "09/18/25",
        "datetime": "2025-09-18T09:16:35.000Z"
      },
      "is_cleaned": true,
      "data_type": "threads",
      "reposts_count": 0
    },
    {
      "url": "https://www.threads.net/@nam.doc12/post/DNNpHXtyvQq",
      "source_type": "threads",
      "source": "https://www.threads.net/@nam.doc12/post/DNNpHXtyvQq",
      "domain": "threads.net",
      "social_platform": "threads",
      "title": "BÀI VIẾT NÀY CHỈ MUỐN NÓI ĐẾN SỰ CHỈN CHU, TINH TẾ phía ekip và anh QH MASTERD ạ!!! Sự kiện 7UP 108...",
      "content": "BÀI VIẾT NÀY CHỈ MUỐN NÓI ĐẾN SỰ CHỈN CHU, TINH TẾ phía ekip và anh QH MASTERD ạ!!! Sự kiện 7UP 108 đc tổ chức ở Quảng trường K-Town - Vinhomes Ocean Park 2 thuộc Văn Giang - Hưng Yên. Lúc diễn ra sự kiện có 1 số nghệ sĩ nhầm vs Vinhomes Ocean Park 1 thuộc Gia Lâm - Hà Nội. Nhưng khi anh Quang Hùng bước ra, anh đã gọi \"Hưng Yên ơiiii\", lm mình rất respect sự chỉn chu trg công việc của cả ekip và anh QH MasterD ạ",
      "word_count": 94,
      "published_date": 1754911933.0,
      "published_datetime": "2025-08-11 11:32:13+00:00",
      "likes_count": 0,
      "shares_count": 0,
      "comments_count": 0,
      "views_count": 0,
      "reactions": null,
      "account_id": "nam.doc12",
      "account_name": "nam.doc12",
      "account_url": "https://www.threads.net/@nam.doc12",
      "post_id": "8051",
      "post_type": "thread",
      "raw_metadata": {
        "username": "nam.doc12",
        "likes": 0,
        "replies": 0,
        "reposts": 0,
        "shares": 0,
        "time": "08/11/25",
        "datetime": "2025-08-11T11:32:13.000Z"
      },
      "is_cleaned": true,
      "data_type": "threads",
      "reposts_count": 0
    },
    {
      "url": "https://www.threads.net/@hungyen6782024/post/DTDllPhE-rt",
      "source_type": "threads",
      "source": "https://www.threads.net/@hungyen6782024/post/DTDllPhE-rt",
      "domain": "threads.net",
      "social_platform": "threads",
      "title": "Ai ở khoái châu hưng yên giờ còn thức k Grli nhé",
      "content": "Ai ở khoái châu hưng yên giờ còn thức k Grli nhé",
      "word_count": 12,
      "published_date": 1767459438.0,
      "published_datetime": "2026-01-03 16:57:18+00:00",
      "likes_count": 0,
      "shares_count": 0,
      "comments_count": 0,
      "views_count": 0,
      "reactions": null,
      "account_id": "hungyen6782024",
      "account_name": "hungyen6782024",
      "account_url": "https://www.threads.net/@hungyen6782024",
      "post_id": "8050",
      "post_type": "thread",
      "raw_metadata": {
        "username": "hungyen6782024",
        "likes": 0,
        "replies": 0,
        "reposts": 0,
        "shares": 0,
        "time": "17h",
        "datetime": "2026-01-03T16:57:18.000Z"
      },
      "is_cleaned": true,
      "data_type": "threads",
      "reposts_count": 0
    },
    {
      "url": "https://www.threads.net/@_aliceintheera_/post/DSxQ6JcE8M_",
      "source_type": "threads",
      "source": "https://www.threads.net/@_aliceintheera_/post/DSxQ6JcE8M_",
      "domain": "threads.net",
      "social_platform": "threads",
      "title": "S.T: ai biết đâu, cứ tưởng có Hoả Ca như mọi lần nên cứ may rồi mặc thôii hoá ra anh tài cũng liệu...",
      "content": "S.T: ai biết đâu, cứ tưởng có Hoả Ca như mọi lần nên cứ may rồi mặc thôii hoá ra anh tài cũng liệu như Gai Con xaoo ))))))) cứ concert là Hoả Ca, cứ về Hưng Yên về TGC là sẽ nhớ đến Hoả ca, cứ là 33 người ấy là Hoả Ca  có thê là sang 2026 những t vẫn nhớ về bài hát được nghe năm 2024",
      "word_count": 70,
      "published_date": 1766844619.0,
      "published_datetime": "2025-12-27 14:10:19+00:00",
      "likes_count": 0,
      "shares_count": 0,
      "comments_count": 0,
      "views_count": 0,
      "reactions": null,
      "account_id": "_aliceintheera_",
      "account_name": "_aliceintheera_",
      "account_url": "https://www.threads.net/@_aliceintheera_",
      "post_id": "8049",
      "post_type": "thread",
      "raw_metadata": {
        "username": "_aliceintheera_",
        "likes": 0,
        "replies": 0,
        "reposts": 0,
        "shares": 0,
        "time": "12/27/25",
        "datetime": "2025-12-27T14:10:19.000Z"
      },
      "is_cleaned": true,
      "data_type": "threads",
      "reposts_count": 0
    },
    {
      "url": "https://www.threads.net/@boy.kasumi.9/post/DR1PTS1Ejcw",
      "source_type": "threads",
      "source": "https://www.threads.net/@boy.kasumi.9/post/DR1PTS1Ejcw",
      "domain": "threads.net",
      "social_platform": "threads",
      "title": "@thinhthutran e muốn hỏi job QLSX ở Hải dương và Hưng yên còn tuyển không ah. E muốn ứng tuyển ah",
      "content": "@thinhthutran e muốn hỏi job QLSX ở Hải dương và Hưng yên còn tuyển không ah. E muốn ứng tuyển ah",
      "word_count": 21,
      "published_date": 1764830511.0,
      "published_datetime": "2025-12-04 06:41:51+00:00",
      "likes_count": 0,
      "shares_count": 0,
      "comments_count": 0,
      "views_count": 0,
      "reactions": null,
      "account_id": "boy.kasumi.9",
      "account_name": "boy.kasumi.9",
      "account_url": "https://www.threads.net/@boy.kasumi.9",
      "post_id": "8048",
      "post_type": "thread",
      "raw_metadata": {
        "username": "boy.kasumi.9",
        "likes": 0,
        "replies": 0,
        "reposts": 0,
        "shares": 0,
        "time": "12/04/25",
        "datetime": "2025-12-04T06:41:51.000Z"
      },
      "is_cleaned": true,
      "data_type": "threads",
      "reposts_count": 0
    },
    {
      "url": "https://www.threads.net/@nhungbui2643/post/DPy0Cr3EwUY",
      "source_type": "threads",
      "source": "https://www.threads.net/@nhungbui2643/post/DPy0Cr3EwUY",
      "domain": "threads.net",
      "social_platform": "threads",
      "title": "Có ai về Yên Mỹ Hưng Yên làm ở kho Masan không nhỉ? Mức lương bình quân từ 8 đến 12 triệu. Chăm chỉ...",
      "content": "Có ai về Yên Mỹ Hưng Yên làm ở kho Masan không nhỉ? Mức lương bình quân từ 8 đến 12 triệu. Chăm chỉ nhanh nhẹn cộng thêm tăng ca thì từ 12 đến 15 triệu. Ở Hưng Yên chi phí ăn uống, thuê trọ cũng thấp. Yêu cầu nho nhỏ: chăm chỉ, nhanh nhẹn và biết sử dụng smartphone.",
      "word_count": 60,
      "published_date": 1760454143.0,
      "published_datetime": "2025-10-14 15:02:23+00:00",
      "likes_count": 0,
      "shares_count": 0,
      "comments_count": 0,
      "views_count": 0,
      "reactions": null,
      "account_id": "nhungbui2643",
      "account_name": "nhungbui2643",
      "account_url": "https://www.threads.net/@nhungbui2643",
      "post_id": "8047",
      "post_type": "thread",
      "raw_metadata": {
        "username": "nhungbui2643",
        "likes": 0,
        "replies": 0,
        "reposts": 0,
        "shares": 0,
        "time": "10/14/25",
        "datetime": "2025-10-14T15:02:23.000Z"
      },
      "is_cleaned": true,
      "data_type": "threads",
      "reposts_count": 0
    },
    {
      "url": "https://www.threads.net/@teepiti.11/post/DQzeGl_ktf4",
      "source_type": "threads",
      "source": "https://www.threads.net/@teepiti.11/post/DQzeGl_ktf4",
      "domain": "threads.net",
      "social_platform": "threads",
      "title": "Hôm nay bao nhiêu nhái con đi Hưng Yên xem concert? - Ko đếm đc, ko đếm đc  Này thì hoa cúc ko ...",
      "content": "Hôm nay bao nhiêu nhái con đi Hưng Yên xem concert? - Ko đếm đc, ko đếm đc  Này thì hoa cúc ko mọc ở Hưng Yên ))))))",
      "word_count": 28,
      "published_date": 1762623679.0,
      "published_datetime": "2025-11-08 17:41:19+00:00",
      "likes_count": 0,
      "shares_count": 0,
      "comments_count": 0,
      "views_count": 0,
      "reactions": null,
      "account_id": "teepiti.11",
      "account_name": "teepiti.11",
      "account_url": "https://www.threads.net/@teepiti.11",
      "post_id": "8046",
      "post_type": "thread",
      "raw_metadata": {
        "username": "teepiti.11",
        "likes": 0,
        "replies": 0,
        "reposts": 0,
        "shares": 0,
        "time": "11/08/25",
        "datetime": "2025-11-08T17:41:19.000Z"
      },
      "is_cleaned": true,
      "data_type": "threads",
      "reposts_count": 0
    },
    {
      "url": "https://www.threads.net/@thulinhloaibo0203/post/DIdfkugJxXr",
      "source_type": "threads",
      "source": "https://www.threads.net/@thulinhloaibo0203/post/DIdfkugJxXr",
      "domain": "threads.net",
      "social_platform": "threads",
      "title": "Du học sinh Hà Nội Về quê thành người Hưng Yên Translate 12",
      "content": "Du học sinh Hà Nội Về quê thành người Hưng Yên Translate 12",
      "word_count": 13,
      "published_date": 1744706383.0,
      "published_datetime": "2025-04-15 08:39:43+00:00",
      "likes_count": 0,
      "shares_count": 0,
      "comments_count": 0,
      "views_count": 0,
      "reactions": null,
      "account_id": "thulinhloaibo0203",
      "account_name": "thulinhloaibo0203",
      "account_url": "https://www.threads.net/@thulinhloaibo0203",
      "post_id": "8045",
      "post_type": "thread",
      "raw_metadata": {
        "username": "thulinhloaibo0203",
        "likes": 0,
        "replies": 0,
        "reposts": 0,
        "shares": 0,
        "time": "04/15/25",
        "datetime": "2025-04-15T08:39:43.000Z"
      },
      "is_cleaned": true,
      "data_type": "threads",
      "reposts_count": 0
    },
    {
      "url": "https://www.threads.net/@replica_shipher/post/DSEfLCegRcW",
      "source_type": "threads",
      "source": "https://www.threads.net/@replica_shipher/post/DSEfLCegRcW",
      "domain": "threads.net",
      "social_platform": "threads",
      "title": "Lập văn phòng tổng đại lý ở Hưng Yên rồi thì ngại gì mà không làm 2 days fanfest vậy @hle.official? ...",
      "content": "Lập văn phòng tổng đại lý ở Hưng Yên rồi thì ngại gì mà không làm 2 days fanfest vậy @hle.official? Why not đúng khum? 1 day ở HCM, 1 day ở Hưng Yên. T có thể đi cả hai lun á Cam mẹ ơi :))",
      "word_count": 46,
      "published_date": 1765342148.0,
      "published_datetime": "2025-12-10 04:49:08+00:00",
      "likes_count": 0,
      "shares_count": 0,
      "comments_count": 0,
      "views_count": 0,
      "reactions": null,
      "account_id": "replica_shipher",
      "account_name": "replica_shipher",
      "account_url": "https://www.threads.net/@replica_shipher",
      "post_id": "8044",
      "post_type": "thread",
      "raw_metadata": {
        "username": "replica_shipher",
        "likes": 0,
        "replies": 0,
        "reposts": 0,
        "shares": 0,
        "time": "12/09/25",
        "datetime": "2025-12-10T04:49:08.000Z"
      },
      "is_cleaned": true,
      "data_type": "threads",
      "reposts_count": 0
    },
    {
      "url": "https://www.threads.net/@leomilo17/post/DScqP2Mk24o",
      "source_type": "threads",
      "source": "https://www.threads.net/@leomilo17/post/DScqP2Mk24o",
      "domain": "threads.net",
      "social_platform": "threads",
      "title": "Hey Siri, 23h đêm ngày 2012 tại Hưng Yên, công bố Yconcert D2 - T32026",
      "content": "Hey Siri, 23h đêm ngày 2012 tại Hưng Yên, công bố Yconcert D2 - T32026",
      "word_count": 15,
      "published_date": 1766153261.0,
      "published_datetime": "2025-12-19 14:07:41+00:00",
      "likes_count": 0,
      "shares_count": 0,
      "comments_count": 0,
      "views_count": 0,
      "reactions": null,
      "account_id": "leomilo17",
      "account_name": "leomilo17",
      "account_url": "https://www.threads.net/@leomilo17",
      "post_id": "8043",
      "post_type": "thread",
      "raw_metadata": {
        "username": "leomilo17",
        "likes": 0,
        "replies": 0,
        "reposts": 0,
        "shares": 0,
        "time": "12/19/25",
        "datetime": "2025-12-19T14:07:41.000Z"
      },
      "is_cleaned": true,
      "data_type": "threads",
      "reposts_count": 0
    },
    {
      "url": "https://www.threads.net/@jennaleeinah/post/DSsbODQD3JC",
      "source_type": "threads",
      "source": "https://www.threads.net/@jennaleeinah/post/DSsbODQD3JC",
      "domain": "threads.net",
      "social_platform": "threads",
      "title": ")) hài, th em thật sự kính nghiệp, chạy một mạch từ sân bay đi check Led những phút cuối cùng rồi đ...",
      "content": ")) hài, th em thật sự kính nghiệp, chạy một mạch từ sân bay đi check Led những phút cuối cùng rồi đi thẳng ra Hưng Yên mà ko để ai làm gián đoạn nó.",
      "word_count": 35,
      "published_date": 1766682253.0,
      "published_datetime": "2025-12-25 17:04:13+00:00",
      "likes_count": 0,
      "shares_count": 0,
      "comments_count": 0,
      "views_count": 0,
      "reactions": null,
      "account_id": "jennaleeinah",
      "account_name": "jennaleeinah",
      "account_url": "https://www.threads.net/@jennaleeinah",
      "post_id": "8042",
      "post_type": "thread",
      "raw_metadata": {
        "username": "jennaleeinah",
        "likes": 0,
        "replies": 0,
        "reposts": 0,
        "shares": 0,
        "time": "12/25/25",
        "datetime": "2025-12-25T17:04:13.000Z"
      },
      "is_cleaned": true,
      "data_type": "threads",
      "reposts_count": 0
    },
    {
      "url": "https://www.threads.net/@thanhnhan_141008/post/DSClcDMkoUo",
      "source_type": "threads",
      "source": "https://www.threads.net/@thanhnhan_141008/post/DSClcDMkoUo",
      "domain": "threads.net",
      "social_platform": "threads",
      "title": "Có ai còn nhận chụp kỷ yếu cá nhân hôm 11, khu vực Hưng Yên ko ạ? Em muốn book nửa buổi (buổi sáng)...",
      "content": "Có ai còn nhận chụp kỷ yếu cá nhân hôm 11, khu vực Hưng Yên ko ạ? Em muốn book nửa buổi (buổi sáng) giá dao động từ 500-600k ạ",
      "word_count": 30,
      "published_date": 1765278325.0,
      "published_datetime": "2025-12-09 11:05:25+00:00",
      "likes_count": 0,
      "shares_count": 0,
      "comments_count": 0,
      "views_count": 0,
      "reactions": null,
      "account_id": "thanhnhan_141008",
      "account_name": "thanhnhan_141008",
      "account_url": "https://www.threads.net/@thanhnhan_141008",
      "post_id": "8041",
      "post_type": "thread",
      "raw_metadata": {
        "username": "thanhnhan_141008",
        "likes": 0,
        "replies": 0,
        "reposts": 0,
        "shares": 0,
        "time": "12/09/25",
        "datetime": "2025-12-09T11:05:25.000Z"
      },
      "is_cleaned": true,
      "data_type": "threads",
      "reposts_count": 0
    },
    {
      "url": "https://www.threads.net/@vitakibidi.08/post/DSFEI1QEhSx",
      "source_type": "threads",
      "source": "https://www.threads.net/@vitakibidi.08/post/DSFEI1QEhSx",
      "domain": "threads.net",
      "social_platform": "threads",
      "title": "Em cần tìm thợ chụp ảnh kỉ yếu vào ngày 111 sắp tới ạ . Giá hssv, tối ưu nhất có thể thui ạ Em ở ...",
      "content": "Em cần tìm thợ chụp ảnh kỉ yếu vào ngày 111 sắp tới ạ . Giá hssv, tối ưu nhất có thể thui ạ Em ở tp Hưng Yên Threads hãy mang cho tui 1 thợ ảnh cho kỉ yếu !!!",
      "word_count": 41,
      "published_date": 1765361529.0,
      "published_datetime": "2025-12-10 10:12:09+00:00",
      "likes_count": 0,
      "shares_count": 0,
      "comments_count": 0,
      "views_count": 0,
      "reactions": null,
      "account_id": "vitakibidi.08",
      "account_name": "vitakibidi.08",
      "account_url": "https://www.threads.net/@vitakibidi.08",
      "post_id": "8040",
      "post_type": "thread",
      "raw_metadata": {
        "username": "vitakibidi.08",
        "likes": 0,
        "replies": 0,
        "reposts": 0,
        "shares": 0,
        "time": "12/10/25",
        "datetime": "2025-12-10T10:12:09.000Z"
      },
      "is_cleaned": true,
      "data_type": "threads",
      "reposts_count": 0
    },
    {
      "url": "https://www.threads.net/@hpnguyen.nn/post/DSC576NCerq",
      "source_type": "threads",
      "source": "https://www.threads.net/@hpnguyen.nn/post/DSC576NCerq",
      "domain": "threads.net",
      "social_platform": "threads",
      "title": "hanoi.st x 12 Sử Chuyên Hưng Yên - Hưng Yên",
      "content": "hanoi.st x 12 Sử Chuyên Hưng Yên - Hưng Yên",
      "word_count": 10,
      "published_date": 1765289071.0,
      "published_datetime": "2025-12-09 14:04:31+00:00",
      "likes_count": 0,
      "shares_count": 0,
      "comments_count": 0,
      "views_count": 0,
      "reactions": null,
      "account_id": "hpnguyen.nn",
      "account_name": "hpnguyen.nn",
      "account_url": "https://www.threads.net/@hpnguyen.nn",
      "post_id": "8039",
      "post_type": "thread",
      "raw_metadata": {
        "username": "hpnguyen.nn",
        "likes": 0,
        "replies": 0,
        "reposts": 0,
        "shares": 0,
        "time": "12/09/25",
        "datetime": "2025-12-09T14:04:31.000Z"
      },
      "is_cleaned": true,
      "data_type": "threads",
      "reposts_count": 0
    },
    {
      "url": "https://www.threads.net/@mymimeee_/post/DSEZCDJEymO",
      "source_type": "threads",
      "source": "https://www.threads.net/@mymimeee_/post/DSEZCDJEymO",
      "domain": "threads.net",
      "social_platform": "threads",
      "title": "Mình là nữ, đang muốn chuyển trọ để tiện đi làm hơn. Có ai ở trọ mạn Yên Hoà, Trần Duy Hưng, Lê Văn ...",
      "content": "Mình là nữ, đang muốn chuyển trọ để tiện đi làm hơn. Có ai ở trọ mạn Yên Hoà, Trần Duy Hưng, Lê Văn Lương, Mễ Trì cần tìm người ở ghép khum ạ  Translate 12",
      "word_count": 36,
      "published_date": 1765338929.0,
      "published_datetime": "2025-12-10 03:55:29+00:00",
      "likes_count": 0,
      "shares_count": 0,
      "comments_count": 0,
      "views_count": 0,
      "reactions": null,
      "account_id": "mymimeee_",
      "account_name": "mymimeee_",
      "account_url": "https://www.threads.net/@mymimeee_",
      "post_id": "8038",
      "post_type": "thread",
      "raw_metadata": {
        "username": "mymimeee_",
        "likes": 0,
        "replies": 0,
        "reposts": 0,
        "shares": 0,
        "time": "12/09/25",
        "datetime": "2025-12-10T03:55:29.000Z"
      },
      "is_cleaned": true,
      "data_type": "threads",
      "reposts_count": 0
    },
    {
      "url": "https://www.threads.net/@hunghim1984/post/DO8w_MEk2ze",
      "source_type": "threads",
      "source": "https://www.threads.net/@hunghim1984/post/DO8w_MEk2ze",
      "domain": "threads.net",
      "social_platform": "threads",
      "title": "Leo rank cùng phụ huynh Hưng Yên",
      "content": "Leo rank cùng phụ huynh Hưng Yên",
      "word_count": 7,
      "published_date": 1758640602.0,
      "published_datetime": "2025-09-23 15:16:42+00:00",
      "likes_count": 0,
      "shares_count": 0,
      "comments_count": 0,
      "views_count": 0,
      "reactions": null,
      "account_id": "hunghim1984",
      "account_name": "hunghim1984",
      "account_url": "https://www.threads.net/@hunghim1984",
      "post_id": "8037",
      "post_type": "thread",
      "raw_metadata": {
        "username": "hunghim1984",
        "likes": 0,
        "replies": 0,
        "reposts": 0,
        "shares": 0,
        "time": "09/23/25",
        "datetime": "2025-09-23T15:16:42.000Z"
      },
      "is_cleaned": true,
      "data_type": "threads",
      "reposts_count": 0
    },
    {
      "url": "https://www.threads.net/@trabuta02/post/DPMHU_ajxBr",
      "source_type": "threads",
      "source": "https://www.threads.net/@trabuta02/post/DPMHU_ajxBr",
      "domain": "threads.net",
      "social_platform": "threads",
      "title": "Ảnh chống lưng 24 năm rồi  Translate 12",
      "content": "Ảnh chống lưng 24 năm rồi  Translate 12",
      "word_count": 8,
      "published_date": 1759155700.0,
      "published_datetime": "2025-09-29 14:21:40+00:00",
      "likes_count": 0,
      "shares_count": 0,
      "comments_count": 0,
      "views_count": 0,
      "reactions": null,
      "account_id": "trabuta02",
      "account_name": "trabuta02",
      "account_url": "https://www.threads.net/@trabuta02",
      "post_id": "8036",
      "post_type": "thread",
      "raw_metadata": {
        "username": "trabuta02",
        "likes": 0,
        "replies": 0,
        "reposts": 0,
        "shares": 0,
        "time": "09/29/25",
        "datetime": "2025-09-29T14:21:40.000Z"
      },
      "is_cleaned": true,
      "data_type": "threads",
      "reposts_count": 0
    },
    {
      "url": "https://www.threads.net/@bich.nguyen89/post/DRjWituD49s",
      "source_type": "threads",
      "source": "https://www.threads.net/@bich.nguyen89/post/DRjWituD49s",
      "domain": "threads.net",
      "social_platform": "threads",
      "title": "Xin chào mọi người Mình là Bích sinh năm 2002 Quê quán Hưng Yên Rất vui được làm quen với mọi ngư...",
      "content": "Xin chào mọi người Mình là Bích sinh năm 2002 Quê quán Hưng Yên Rất vui được làm quen với mọi người",
      "word_count": 22,
      "published_date": 1764230328.0,
      "published_datetime": "2025-11-27 07:58:48+00:00",
      "likes_count": 0,
      "shares_count": 0,
      "comments_count": 0,
      "views_count": 0,
      "reactions": null,
      "account_id": "bich.nguyen89",
      "account_name": "bich.nguyen89",
      "account_url": "https://www.threads.net/@bich.nguyen89",
      "post_id": "8035",
      "post_type": "thread",
      "raw_metadata": {
        "username": "bich.nguyen89",
        "likes": 0,
        "replies": 0,
        "reposts": 0,
        "shares": 0,
        "time": "11/27/25",
        "datetime": "2025-11-27T07:58:48.000Z"
      },
      "is_cleaned": true,
      "data_type": "threads",
      "reposts_count": 0
    },
    {
      "url": "https://www.threads.net/@th.talay/post/DSSl0ykAUA2",
      "source_type": "threads",
      "source": "https://www.threads.net/@th.talay/post/DSSl0ykAUA2",
      "domain": "threads.net",
      "social_platform": "threads",
      "title": "Lê Quang Hùng spoil outfit với tóc tai ngày mai trc đc k ))) để t suy nghĩ việc có nên đi Hưng Yên ...",
      "content": "Lê Quang Hùng spoil outfit với tóc tai ngày mai trc đc k ))) để t suy nghĩ việc có nên đi Hưng Yên ko )))))))))))) nay chụp chưa đã lắm )))))) giờ vẫn chưa muốn đi Hưng Yên cho lắm huhu",
      "word_count": 42,
      "published_date": 1765815398.0,
      "published_datetime": "2025-12-15 16:16:38+00:00",
      "likes_count": 0,
      "shares_count": 0,
      "comments_count": 0,
      "views_count": 0,
      "reactions": null,
      "account_id": "th.talay",
      "account_name": "th.talay",
      "account_url": "https://www.threads.net/@th.talay",
      "post_id": "8034",
      "post_type": "thread",
      "raw_metadata": {
        "username": "th.talay",
        "likes": 0,
        "replies": 0,
        "reposts": 0,
        "shares": 0,
        "time": "12/15/25",
        "datetime": "2025-12-15T16:16:38.000Z"
      },
      "is_cleaned": true,
      "data_type": "threads",
      "reposts_count": 0
    },
    {
      "url": "https://www.threads.net/@iamthoi/post/DRsDvp1E0c5",
      "source_type": "threads",
      "source": "https://www.threads.net/@iamthoi/post/DRsDvp1E0c5",
      "domain": "threads.net",
      "social_platform": "threads",
      "title": "Cả nhà ơi, em cần tìm phòng cho ngày 20 ạ, em từ nội thành ra hưng yên cơ mà em tính là xem concert ...",
      "content": "Cả nhà ơi, em cần tìm phòng cho ngày 20 ạ, em từ nội thành ra hưng yên cơ mà em tính là xem concert xong thì ở lại ngủ 1 tối tới sáng mới rời về nội thành ấy ạ, vì là đi 1 mình di chuyển đêm ko có xe cũng ngại. Ai còn slot ở ghép cưu mang em với. Mua được vé là ko thèm tính việc tiếp theo là gì nước đến cổ mới bơi. Em đã đến 1 nhà Năng con ạaaa nhảy đc nhà nào cũng nhảy mn cho em ké với không chắc xem concert xong lang thang ngoài đường quáaaaa",
      "word_count": 109,
      "published_date": 1764522462.0,
      "published_datetime": "2025-11-30 17:07:42+00:00",
      "likes_count": 0,
      "shares_count": 0,
      "comments_count": 0,
      "views_count": 0,
      "reactions": null,
      "account_id": "iamthoi",
      "account_name": "iamthoi",
      "account_url": "https://www.threads.net/@iamthoi",
      "post_id": "8033",
      "post_type": "thread",
      "raw_metadata": {
        "username": "iamthoi",
        "likes": 0,
        "replies": 0,
        "reposts": 0,
        "shares": 0,
        "time": "11/30/25",
        "datetime": "2025-11-30T17:07:42.000Z"
      },
      "is_cleaned": true,
      "data_type": "threads",
      "reposts_count": 0
    },
    {
      "url": "https://www.threads.net/@minniemouseee101/post/DR1E1F7iZ38",
      "source_type": "threads",
      "source": "https://www.threads.net/@minniemouseee101/post/DR1E1F7iZ38",
      "domain": "threads.net",
      "social_platform": "threads",
      "title": "Mn có ai biết ở đâu thuê áo dài ship hưng yên vs có sz lớn k ạ",
      "content": "Mn có ai biết ở đâu thuê áo dài ship hưng yên vs có sz lớn k ạ",
      "word_count": 18,
      "published_date": 1764825021.0,
      "published_datetime": "2025-12-04 05:10:21+00:00",
      "likes_count": 0,
      "shares_count": 0,
      "comments_count": 0,
      "views_count": 0,
      "reactions": null,
      "account_id": "minniemouseee101",
      "account_name": "minniemouseee101",
      "account_url": "https://www.threads.net/@minniemouseee101",
      "post_id": "8032",
      "post_type": "thread",
      "raw_metadata": {
        "username": "minniemouseee101",
        "likes": 0,
        "replies": 0,
        "reposts": 0,
        "shares": 0,
        "time": "12/04/25",
        "datetime": "2025-12-04T05:10:21.000Z"
      },
      "is_cleaned": true,
      "data_type": "threads",
      "reposts_count": 0
    },
    {
      "url": "https://www.threads.net/@super._.market___/post/DE2gqOpzujJ",
      "source_type": "threads",
      "source": "https://www.threads.net/@super._.market___/post/DE2gqOpzujJ",
      "domain": "threads.net",
      "social_platform": "threads",
      "title": "Người khác: nhận cup xong quay về chỗ có mic để phát biểu SHN: chú Hưng dắt lên đằng trước nhận cup...",
      "content": "Người khác: nhận cup xong quay về chỗ có mic để phát biểu SHN: chú Hưng dắt lên đằng trước nhận cup xong ảnh đứg yên chú xách mic lên cho ảnh nói luôn brotherhood của ATVNCG vẫn là cgi đó rất  Translate 12",
      "word_count": 44,
      "published_date": 1736955890.0,
      "published_datetime": "2025-01-15 15:44:50+00:00",
      "likes_count": 0,
      "shares_count": 0,
      "comments_count": 0,
      "views_count": 0,
      "reactions": null,
      "account_id": "super._.market___",
      "account_name": "super._.market___",
      "account_url": "https://www.threads.net/@super._.market___",
      "post_id": "8031",
      "post_type": "thread",
      "raw_metadata": {
        "username": "super._.market___",
        "likes": 0,
        "replies": 0,
        "reposts": 0,
        "shares": 0,
        "time": "01/15/25",
        "datetime": "2025-01-15T15:44:50.000Z"
      },
      "is_cleaned": true,
      "data_type": "threads",
      "reposts_count": 0
    },
    {
      "url": "https://www.threads.net/@mingfan2466/post/DSr3UpXgVg3",
      "source_type": "threads",
      "source": "https://www.threads.net/@mingfan2466/post/DSr3UpXgVg3",
      "domain": "threads.net",
      "social_platform": "threads",
      "title": "Tôi đã nghĩ ra bài intro cho conmegai tại Hưng Yên tháng 4 này đó chính là Em còn nhớ anh không? Má ...",
      "content": "Tôi đã nghĩ ra bài intro cho conmegai tại Hưng Yên tháng 4 này đó chính là Em còn nhớ anh không? Má con mã này gai nước cháy vcl giờ mà intro 1 phát chắc gai con khóc hết...",
      "word_count": 40,
      "published_date": 1766663433.0,
      "published_datetime": "2025-12-25 11:50:33+00:00",
      "likes_count": 0,
      "shares_count": 0,
      "comments_count": 0,
      "views_count": 0,
      "reactions": null,
      "account_id": "mingfan2466",
      "account_name": "mingfan2466",
      "account_url": "https://www.threads.net/@mingfan2466",
      "post_id": "8030",
      "post_type": "thread",
      "raw_metadata": {
        "username": "mingfan2466",
        "likes": 0,
        "replies": 0,
        "reposts": 0,
        "shares": 0,
        "time": "12/25/25",
        "datetime": "2025-12-25T11:50:33.000Z"
      },
      "is_cleaned": true,
      "data_type": "threads",
      "reposts_count": 0
    },
    {
      "url": "https://www.threads.net/@linh_khai12/post/DTCsEsJEodx",
      "source_type": "threads",
      "source": "https://www.threads.net/@linh_khai12/post/DTCsEsJEodx",
      "domain": "threads.net",
      "social_platform": "threads",
      "title": "Ở hưng yên thì tốt r",
      "content": "Ở hưng yên thì tốt r",
      "word_count": 6,
      "published_date": 1767429287.0,
      "published_datetime": "2026-01-03 08:34:47+00:00",
      "likes_count": 0,
      "shares_count": 0,
      "comments_count": 0,
      "views_count": 0,
      "reactions": null,
      "account_id": "linh_khai12",
      "account_name": "linh_khai12",
      "account_url": "https://www.threads.net/@linh_khai12",
      "post_id": "8029",
      "post_type": "thread",
      "raw_metadata": {
        "username": "linh_khai12",
        "likes": 0,
        "replies": 0,
        "reposts": 0,
        "shares": 0,
        "time": "1d",
        "datetime": "2026-01-03T08:34:47.000Z"
      },
      "is_cleaned": true,
      "data_type": "threads",
      "reposts_count": 0
    },
    {
      "url": "https://www.threads.net/@huong.phanthimai/post/DQ9s_Kjk0F4",
      "source_type": "threads",
      "source": "https://www.threads.net/@huong.phanthimai/post/DQ9s_Kjk0F4",
      "domain": "threads.net",
      "social_platform": "threads",
      "title": "muốn tìm trọ TC 4tr  trung hoà ,tú mỡ , trung kính , yên hoà , trần duy hưng  nhà để xe rộng rãi ...",
      "content": "muốn tìm trọ TC 4tr  trung hoà ,tú mỡ , trung kính , yên hoà , trần duy hưng  nhà để xe rộng rãi (3 xe) để xe điện,nuôi pet",
      "word_count": 30,
      "published_date": 1762967027.0,
      "published_datetime": "2025-11-12 17:03:47+00:00",
      "likes_count": 0,
      "shares_count": 0,
      "comments_count": 0,
      "views_count": 0,
      "reactions": null,
      "account_id": "huong.phanthimai",
      "account_name": "huong.phanthimai",
      "account_url": "https://www.threads.net/@huong.phanthimai",
      "post_id": "8028",
      "post_type": "thread",
      "raw_metadata": {
        "username": "huong.phanthimai",
        "likes": 0,
        "replies": 0,
        "reposts": 0,
        "shares": 0,
        "time": "11/12/25",
        "datetime": "2025-11-12T17:03:47.000Z"
      },
      "is_cleaned": true,
      "data_type": "threads",
      "reposts_count": 0
    },
    {
      "url": "https://www.threads.net/@lassiedeluxe/post/DQzs6HZk4qf",
      "source_type": "threads",
      "source": "https://www.threads.net/@lassiedeluxe/post/DQzs6HZk4qf",
      "domain": "threads.net",
      "social_platform": "threads",
      "title": "nma đi concert ở Hưng Yên mới thấy yêu concert ở svđ Mỹ Đình  Translate 12",
      "content": "nma đi concert ở Hưng Yên mới thấy yêu concert ở svđ Mỹ Đình  Translate 12",
      "word_count": 16,
      "published_date": 1762631441.0,
      "published_datetime": "2025-11-08 19:50:41+00:00",
      "likes_count": 0,
      "shares_count": 0,
      "comments_count": 0,
      "views_count": 0,
      "reactions": null,
      "account_id": "lassiedeluxe",
      "account_name": "lassiedeluxe",
      "account_url": "https://www.threads.net/@lassiedeluxe",
      "post_id": "8027",
      "post_type": "thread",
      "raw_metadata": {
        "username": "lassiedeluxe",
        "likes": 0,
        "replies": 0,
        "reposts": 0,
        "shares": 0,
        "time": "11/08/25",
        "datetime": "2025-11-08T19:50:41.000Z"
      },
      "is_cleaned": true,
      "data_type": "threads",
      "reposts_count": 0
    },
    {
      "url": "https://www.threads.net/@hieu.thu.bay/post/DSLvx03kj4g",
      "source_type": "threads",
      "source": "https://www.threads.net/@hieu.thu.bay/post/DSLvx03kj4g",
      "domain": "threads.net",
      "social_platform": "threads",
      "title": "Đệch mịa, công ty ở Hưng Yên mà đi làm như ở Luân Đôn",
      "content": "Đệch mịa, công ty ở Hưng Yên mà đi làm như ở Luân Đôn",
      "word_count": 14,
      "published_date": 1765585736.0,
      "published_datetime": "2025-12-13 00:28:56+00:00",
      "likes_count": 0,
      "shares_count": 0,
      "comments_count": 0,
      "views_count": 0,
      "reactions": null,
      "account_id": "hieu.thu.bay",
      "account_name": "hieu.thu.bay",
      "account_url": "https://www.threads.net/@hieu.thu.bay",
      "post_id": "8026",
      "post_type": "thread",
      "raw_metadata": {
        "username": "hieu.thu.bay",
        "likes": 0,
        "replies": 0,
        "reposts": 0,
        "shares": 0,
        "time": "12/12/25",
        "datetime": "2025-12-13T00:28:56.000Z"
      },
      "is_cleaned": true,
      "data_type": "threads",
      "reposts_count": 0
    },
    {
      "url": "https://www.threads.net/@narci_jan/post/DS6szbjkZz2",
      "source_type": "threads",
      "source": "https://www.threads.net/@narci_jan/post/DS6szbjkZz2",
      "domain": "threads.net",
      "social_platform": "threads",
      "title": "Tối nay có ai ở hnoi vẫn 1m ko. Tui cần 1 người đi chơi cùngggg",
      "content": "Tối nay có ai ở hnoi vẫn 1m ko. Tui cần 1 người đi chơi cùngggg",
      "word_count": 16,
      "published_date": 1767161234.0,
      "published_datetime": "2025-12-31 06:07:14+00:00",
      "likes_count": 0,
      "shares_count": 0,
      "comments_count": 0,
      "views_count": 0,
      "reactions": null,
      "account_id": "narci_jan",
      "account_name": "narci_jan",
      "account_url": "https://www.threads.net/@narci_jan",
      "post_id": "8025",
      "post_type": "thread",
      "raw_metadata": {
        "username": "narci_jan",
        "likes": 0,
        "replies": 0,
        "reposts": 0,
        "shares": 0,
        "time": "4d",
        "datetime": "2025-12-31T06:07:14.000Z"
      },
      "is_cleaned": true,
      "data_type": "threads",
      "reposts_count": 0
    },
    {
      "url": "https://www.threads.net/@yxze43_/post/DPGEFIFkoAd",
      "source_type": "threads",
      "source": "https://www.threads.net/@yxze43_/post/DPGEFIFkoAd",
      "domain": "threads.net",
      "social_platform": "threads",
      "title": "Em muốn tìm thợ chụp kỉ yếu ở hưng yên hôm 2112 ạa ( chụp đơn full ngày) Giá tầm  1tr5 với ạ  M...",
      "content": "Em muốn tìm thợ chụp kỉ yếu ở hưng yên hôm 2112 ạa ( chụp đơn full ngày) Giá tầm  1tr5 với ạ  Màu ảnh trong, tươi , take cảe nhiệt tình với ạa",
      "word_count": 34,
      "published_date": 1758952602.0,
      "published_datetime": "2025-09-27 05:56:42+00:00",
      "likes_count": 0,
      "shares_count": 0,
      "comments_count": 0,
      "views_count": 0,
      "reactions": null,
      "account_id": "yxze43_",
      "account_name": "yxze43_",
      "account_url": "https://www.threads.net/@yxze43_",
      "post_id": "8024",
      "post_type": "thread",
      "raw_metadata": {
        "username": "yxze43_",
        "likes": 0,
        "replies": 0,
        "reposts": 0,
        "shares": 0,
        "time": "09/27/25",
        "datetime": "2025-09-27T05:56:42.000Z"
      },
      "is_cleaned": true,
      "data_type": "threads",
      "reposts_count": 0
    },
    {
      "url": "https://www.threads.net/@_cham.anhh_/post/DSJXBULAXxL",
      "source_type": "threads",
      "source": "https://www.threads.net/@_cham.anhh_/post/DSJXBULAXxL",
      "domain": "threads.net",
      "social_platform": "threads",
      "title": "Em muốn tham khảo makeup cô dâu vào 93 ở khu vực #HưngYên . Tha thiết, em xin giá make test luôn ạ ...",
      "content": "Em muốn tham khảo makeup cô dâu vào 93 ở khu vực #HưngYên . Tha thiết, em xin giá make test luôn ạ",
      "word_count": 23,
      "published_date": 1765505647.0,
      "published_datetime": "2025-12-12 02:14:07+00:00",
      "likes_count": 0,
      "shares_count": 0,
      "comments_count": 0,
      "views_count": 0,
      "reactions": null,
      "account_id": "_cham.anhh_",
      "account_name": "_cham.anhh_",
      "account_url": "https://www.threads.net/@_cham.anhh_",
      "post_id": "8023",
      "post_type": "thread",
      "raw_metadata": {
        "username": "_cham.anhh_",
        "likes": 0,
        "replies": 0,
        "reposts": 0,
        "shares": 0,
        "time": "12/11/25",
        "datetime": "2025-12-12T02:14:07.000Z"
      },
      "is_cleaned": true,
      "data_type": "threads",
      "reposts_count": 0
    },
    {
      "url": "https://www.threads.net/@lhchy_/post/DS9H-5QkToO",
      "source_type": "threads",
      "source": "https://www.threads.net/@lhchy_/post/DS9H-5QkToO",
      "domain": "threads.net",
      "social_platform": "threads",
      "title": "Xả suộc pháo hoa hồ gươm tối qua HPNY 2026",
      "content": "Xả suộc pháo hoa hồ gươm tối qua HPNY 2026",
      "word_count": 10,
      "published_date": 1767242593.0,
      "published_datetime": "2026-01-01 04:43:13+00:00",
      "likes_count": 0,
      "shares_count": 0,
      "comments_count": 0,
      "views_count": 0,
      "reactions": null,
      "account_id": "lhchy_",
      "account_name": "lhchy_",
      "account_url": "https://www.threads.net/@lhchy_",
      "post_id": "8022",
      "post_type": "thread",
      "raw_metadata": {
        "username": "lhchy_",
        "likes": 0,
        "replies": 0,
        "reposts": 0,
        "shares": 0,
        "time": "3d",
        "datetime": "2026-01-01T04:43:13.000Z"
      },
      "is_cleaned": true,
      "data_type": "threads",
      "reposts_count": 0
    },
    {
      "url": "https://www.threads.net/@acclapradeduchonggai/post/DSOuvIxEvx3",
      "source_type": "threads",
      "source": "https://www.threads.net/@acclapradeduchonggai/post/DSOuvIxEvx3",
      "domain": "threads.net",
      "social_platform": "threads",
      "title": "Hôm nay là kỉ niệm 1 năm rất nhiều \"lần đầu\" của t - Lần đầu đi concert - Lần đầu đi xe buú - Lần đ...",
      "content": "Hôm nay là kỉ niệm 1 năm rất nhiều \"lần đầu\" của t - Lần đầu đi concert - Lần đầu đi xe buú - Lần đầu xếp hàng từ HN đến Hưng Yên - Lần đầu đi chơi qua đêm mà ko phải đi với trường - Lần đầu đi hạng vé 800 nhg mua giá 1tr6 , fomo thì s1tg - Lần đầu nhìn thấy 33 đồng an chia tay nhau mà suýt khóc",
      "word_count": 76,
      "published_date": 1765685853.0,
      "published_datetime": "2025-12-14 04:17:33+00:00",
      "likes_count": 0,
      "shares_count": 0,
      "comments_count": 0,
      "views_count": 0,
      "reactions": null,
      "account_id": "acclapradeduchonggai",
      "account_name": "acclapradeduchonggai",
      "account_url": "https://www.threads.net/@acclapradeduchonggai",
      "post_id": "8021",
      "post_type": "thread",
      "raw_metadata": {
        "username": "acclapradeduchonggai",
        "likes": 0,
        "replies": 0,
        "reposts": 0,
        "shares": 0,
        "time": "12/13/25",
        "datetime": "2025-12-14T04:17:33.000Z"
      },
      "is_cleaned": true,
      "data_type": "threads",
      "reposts_count": 0
    },
    {
      "url": "https://www.threads.net/@mrsgg.duyenmy/post/DS71xxlk7Jc",
      "source_type": "threads",
      "source": "https://www.threads.net/@mrsgg.duyenmy/post/DS71xxlk7Jc",
      "domain": "threads.net",
      "social_platform": "threads",
      "title": "Nhờ có tiếng Trung mà 2025 của mình đã: - Nhận học bổng toàn phần của chính phủ Trung Quốc cho 3 ...",
      "content": "Nhờ có tiếng Trung mà 2025 của mình đã: - Nhận học bổng toàn phần của chính phủ Trung Quốc cho 3 năm học Thạc Sĩ - Hoàn thành dự án phiên dịch gấp nhất đời (306 tốt nghiệp, tối bay vô Đà Nẵng làm phiên dịch cho dự án đường sắt 2 tháng) - Tham dự tiệc tại đài Truyền Hình Bắc Kinh - Gặp được 1 anh zai Trùng Khánh chữa lành những tổn thương không phải ảnh gây ra  Translate 12",
      "word_count": 84,
      "published_date": 1767199494.0,
      "published_datetime": "2025-12-31 16:44:54+00:00",
      "likes_count": 0,
      "shares_count": 0,
      "comments_count": 0,
      "views_count": 0,
      "reactions": null,
      "account_id": "mrsgg.duyenmy",
      "account_name": "mrsgg.duyenmy",
      "account_url": "https://www.threads.net/@mrsgg.duyenmy",
      "post_id": "8020",
      "post_type": "thread",
      "raw_metadata": {
        "username": "mrsgg.duyenmy",
        "likes": 0,
        "replies": 0,
        "reposts": 0,
        "shares": 0,
        "time": "3d",
        "datetime": "2025-12-31T16:44:54.000Z"
      },
      "is_cleaned": true,
      "data_type": "threads",
      "reposts_count": 0
    },
    {
      "url": "https://www.threads.net/@lanvyyyyy/post/DLiyg27yDP-",
      "source_type": "threads",
      "source": "https://www.threads.net/@lanvyyyyy/post/DLiyg27yDP-",
      "domain": "threads.net",
      "social_platform": "threads",
      "title": "Tự nhiên mình cũng thấy buồn lắm nha. Chắc có lẽ từ ngày yêu anh mình cũng yêu luôn vùng đất và con ...",
      "content": "Tự nhiên mình cũng thấy buồn lắm nha. Chắc có lẽ từ ngày yêu anh mình cũng yêu luôn vùng đất và con người nơi đó, yêu luôn cả 2 tiếng Thái Bình thân thương.",
      "word_count": 35,
      "published_date": 1751326536.0,
      "published_datetime": "2025-06-30 23:35:36+00:00",
      "likes_count": 0,
      "shares_count": 0,
      "comments_count": 0,
      "views_count": 0,
      "reactions": null,
      "account_id": "lanvyyyyy",
      "account_name": "lanvyyyyy",
      "account_url": "https://www.threads.net/@lanvyyyyy",
      "post_id": "8019",
      "post_type": "thread",
      "raw_metadata": {
        "username": "lanvyyyyy",
        "likes": 0,
        "replies": 0,
        "reposts": 0,
        "shares": 0,
        "time": "06/30/25",
        "datetime": "2025-06-30T23:35:36.000Z"
      },
      "is_cleaned": true,
      "data_type": "threads",
      "reposts_count": 0
    },
    {
      "url": "https://www.threads.net/@xanhdovangtim_tc20/post/DRHWG2Uj-OV",
      "source_type": "threads",
      "source": "https://www.threads.net/@xanhdovangtim_tc20/post/DRHWG2Uj-OV",
      "domain": "threads.net",
      "social_platform": "threads",
      "title": "Mn ơi vì lần đầu tiên ra Hà Nội cũng như Hưng Yên nên mình xin một số lưu ý với ạ để tối ưu hoá chi ...",
      "content": "Mn ơi vì lần đầu tiên ra Hà Nội cũng như Hưng Yên nên mình xin một số lưu ý với ạ để tối ưu hoá chi phí nhất tại budget của mình cũng eo hẹp ấy 1. Mình đáp lúc 0h ngày 20 thì có xe để về nội thành không á, sẵn tiện có ai cũng đáp tầm giờ này có thể share tiền xe về nội thành chung thì càng tốt ạ 2. Thuê ks ở đâu hợp lý để di chuyển ra OCP cũng như đi chơi ăn uống này kia á Với mình cũng tìm 2 vé Đã đến 2, thiên thần nào đó hãy pass vé cho mình với Cảm ơn mọi người nhiều ạ",
      "word_count": 121,
      "published_date": 1763290575.0,
      "published_datetime": "2025-11-16 10:56:15+00:00",
      "likes_count": 0,
      "shares_count": 0,
      "comments_count": 0,
      "views_count": 0,
      "reactions": null,
      "account_id": "xanhdovangtim_tc20",
      "account_name": "xanhdovangtim_tc20",
      "account_url": "https://www.threads.net/@xanhdovangtim_tc20",
      "post_id": "8018",
      "post_type": "thread",
      "raw_metadata": {
        "username": "xanhdovangtim_tc20",
        "likes": 0,
        "replies": 0,
        "reposts": 0,
        "shares": 0,
        "time": "11/16/25",
        "datetime": "2025-11-16T10:56:15.000Z"
      },
      "is_cleaned": true,
      "data_type": "threads",
      "reposts_count": 0
    },
    {
      "url": "https://www.threads.net/@bibi.yen.18/post/DJx0HSuSQ13",
      "source_type": "threads",
      "source": "https://www.threads.net/@bibi.yen.18/post/DJx0HSuSQ13",
      "domain": "threads.net",
      "social_platform": "threads",
      "title": "Chiều em cần xe ghép từ Hà Nội về Hưng Yên ạ. Bác nào có số xe ghép cho em xin với",
      "content": "Chiều em cần xe ghép từ Hà Nội về Hưng Yên ạ. Bác nào có số xe ghép cho em xin với",
      "word_count": 22,
      "published_date": 1747535724.0,
      "published_datetime": "2025-05-18 02:35:24+00:00",
      "likes_count": 0,
      "shares_count": 0,
      "comments_count": 0,
      "views_count": 0,
      "reactions": null,
      "account_id": "bibi.yen.18",
      "account_name": "bibi.yen.18",
      "account_url": "https://www.threads.net/@bibi.yen.18",
      "post_id": "8017",
      "post_type": "thread",
      "raw_metadata": {
        "username": "bibi.yen.18",
        "likes": 0,
        "replies": 0,
        "reposts": 0,
        "shares": 0,
        "time": "05/17/25",
        "datetime": "2025-05-18T02:35:24.000Z"
      },
      "is_cleaned": true,
      "data_type": "threads",
      "reposts_count": 0
    },
    {
      "url": "https://www.threads.net/@hathu598/post/DTASTe1ElNz",
      "source_type": "threads",
      "source": "https://www.threads.net/@hathu598/post/DTASTe1ElNz",
      "domain": "threads.net",
      "social_platform": "threads",
      "title": "GÓC TÌM NGƯỜI QUEN CŨ.Mình cần tìm lại bạn Nguyễn Thu Thảo sinh năm 1992 (con bố Tuấn) ở Hưng Yên tr...",
      "content": "GÓC TÌM NGƯỜI QUEN CŨ.Mình cần tìm lại bạn Nguyễn Thu Thảo sinh năm 1992 (con bố Tuấn) ở Hưng Yên trọ tại Triều Khúc, không biết bạn còn nhớ mình không. Ai biết thông tin liên hệ của bạn cho mình xin nhé. Mình cảm ơn. Translate 12",
      "word_count": 49,
      "published_date": 1767348668.0,
      "published_datetime": "2026-01-02 10:11:08+00:00",
      "likes_count": 0,
      "shares_count": 0,
      "comments_count": 0,
      "views_count": 0,
      "reactions": null,
      "account_id": "hathu598",
      "account_name": "hathu598",
      "account_url": "https://www.threads.net/@hathu598",
      "post_id": "8016",
      "post_type": "thread",
      "raw_metadata": {
        "username": "hathu598",
        "likes": 0,
        "replies": 0,
        "reposts": 0,
        "shares": 0,
        "time": "2d",
        "datetime": "2026-01-02T10:11:08.000Z"
      },
      "is_cleaned": true,
      "data_type": "threads",
      "reposts_count": 0
    },
    {
      "url": "https://www.threads.net/@yuring.yuan/post/DSVMExUCesv",
      "source_type": "threads",
      "source": "https://www.threads.net/@yuring.yuan/post/DSVMExUCesv",
      "domain": "threads.net",
      "social_platform": "threads",
      "title": "Sg 36 độ em ấy mặc áo thun dài tay Hanoi 27 độ em ấy vẫn mặc áo thun dài tay Đêm hưng yên 19 độ em ấ...",
      "content": "Sg 36 độ em ấy mặc áo thun dài tay Hanoi 27 độ em ấy vẫn mặc áo thun dài tay Đêm hưng yên 19 độ em ấy vẫn mặc áo thun dài tay",
      "word_count": 34,
      "published_date": 1765902561.0,
      "published_datetime": "2025-12-16 16:29:21+00:00",
      "likes_count": 0,
      "shares_count": 0,
      "comments_count": 0,
      "views_count": 0,
      "reactions": null,
      "account_id": "yuring.yuan",
      "account_name": "yuring.yuan",
      "account_url": "https://www.threads.net/@yuring.yuan",
      "post_id": "8015",
      "post_type": "thread",
      "raw_metadata": {
        "username": "yuring.yuan",
        "likes": 0,
        "replies": 0,
        "reposts": 0,
        "shares": 0,
        "time": "12/16/25",
        "datetime": "2025-12-16T16:29:21.000Z"
      },
      "is_cleaned": true,
      "data_type": "threads",
      "reposts_count": 0
    },
    {
      "url": "https://www.threads.net/@khlinhtran/post/C6GZ7Ljxdv6",
      "source_type": "threads",
      "source": "https://www.threads.net/@khlinhtran/post/C6GZ7Ljxdv6",
      "domain": "threads.net",
      "social_platform": "threads",
      "title": "Một chiếc homestay gấc xinh gấc yêu, view xanh ngát, trốn ở một góc yên tĩnh trên đảo Bình Hưng đầy ...",
      "content": "Một chiếc homestay gấc xinh gấc yêu, view xanh ngát, trốn ở một góc yên tĩnh trên đảo Bình Hưng đầy khách du lịch qua lại",
      "word_count": 26,
      "published_date": 1713866898.0,
      "published_datetime": "2024-04-23 10:08:18+00:00",
      "likes_count": 0,
      "shares_count": 0,
      "comments_count": 0,
      "views_count": 0,
      "reactions": null,
      "account_id": "khlinhtran",
      "account_name": "khlinhtran",
      "account_url": "https://www.threads.net/@khlinhtran",
      "post_id": "8014",
      "post_type": "thread",
      "raw_metadata": {
        "username": "khlinhtran",
        "likes": 0,
        "replies": 0,
        "reposts": 0,
        "shares": 0,
        "time": "04/23/24",
        "datetime": "2024-04-23T10:08:18.000Z"
      },
      "is_cleaned": true,
      "data_type": "threads",
      "reposts_count": 0
    },
    {
      "url": "https://www.threads.net/@_mei.flower_/post/DPyqTWmAXbJ",
      "source_type": "threads",
      "source": "https://www.threads.net/@_mei.flower_/post/DPyqTWmAXbJ",
      "domain": "threads.net",
      "social_platform": "threads",
      "title": "Sos cho em tìm thợ makeup kỉ yếu ở hưng yên (cũ) cuối tháng 11 này với ạ",
      "content": "Sos cho em tìm thợ makeup kỉ yếu ở hưng yên (cũ) cuối tháng 11 này với ạ",
      "word_count": 18,
      "published_date": 1760449037.0,
      "published_datetime": "2025-10-14 13:37:17+00:00",
      "likes_count": 0,
      "shares_count": 0,
      "comments_count": 0,
      "views_count": 0,
      "reactions": null,
      "account_id": "_mei.flower_",
      "account_name": "_mei.flower_",
      "account_url": "https://www.threads.net/@_mei.flower_",
      "post_id": "8013",
      "post_type": "thread",
      "raw_metadata": {
        "username": "_mei.flower_",
        "likes": 0,
        "replies": 0,
        "reposts": 0,
        "shares": 0,
        "time": "10/14/25",
        "datetime": "2025-10-14T13:37:17.000Z"
      },
      "is_cleaned": true,
      "data_type": "threads",
      "reposts_count": 0
    },
    {
      "url": "https://www.threads.net/@xoaikchua_/post/DRtxfn4ESVk",
      "source_type": "threads",
      "source": "https://www.threads.net/@xoaikchua_/post/DRtxfn4ESVk",
      "domain": "threads.net",
      "social_platform": "threads",
      "title": "Cần tìm thợ make kỉ yếu 41 cho nhóm 4 ng giá cả 400ng kèm phí đi lại em ở kv tp Hưng Yên a",
      "content": "Cần tìm thợ make kỉ yếu 41 cho nhóm 4 ng giá cả 400ng kèm phí đi lại em ở kv tp Hưng Yên a",
      "word_count": 25,
      "published_date": 1764580002.0,
      "published_datetime": "2025-12-01 09:06:42+00:00",
      "likes_count": 0,
      "shares_count": 0,
      "comments_count": 0,
      "views_count": 0,
      "reactions": null,
      "account_id": "xoaikchua_",
      "account_name": "xoaikchua_",
      "account_url": "https://www.threads.net/@xoaikchua_",
      "post_id": "8012",
      "post_type": "thread",
      "raw_metadata": {
        "username": "xoaikchua_",
        "likes": 0,
        "replies": 0,
        "reposts": 0,
        "shares": 0,
        "time": "12/01/25",
        "datetime": "2025-12-01T09:06:42.000Z"
      },
      "is_cleaned": true,
      "data_type": "threads",
      "reposts_count": 0
    },
    {
      "url": "https://www.threads.net/@hachiyo_222/post/DJmr6d_zkoD",
      "source_type": "threads",
      "source": "https://www.threads.net/@hachiyo_222/post/DJmr6d_zkoD",
      "domain": "threads.net",
      "social_platform": "threads",
      "title": "Có cái này vui lắm Huyền ơi  anh Long về VN diễn ở Mỹ Đình do VPbank tài trợ Huyền có đi coi ko",
      "content": "Có cái này vui lắm Huyền ơi  anh Long về VN diễn ở Mỹ Đình do VPbank tài trợ Huyền có đi coi ko",
      "word_count": 24,
      "published_date": 1747162326.0,
      "published_datetime": "2025-05-13 18:52:06+00:00",
      "likes_count": 0,
      "shares_count": 0,
      "comments_count": 0,
      "views_count": 0,
      "reactions": null,
      "account_id": "hachiyo_222",
      "account_name": "hachiyo_222",
      "account_url": "https://www.threads.net/@hachiyo_222",
      "post_id": "8011",
      "post_type": "thread",
      "raw_metadata": {
        "username": null,
        "likes": 0,
        "replies": 0,
        "reposts": 0,
        "shares": 0,
        "time": "05/13/25",
        "datetime": "2025-05-13T18:52:06.000Z"
      },
      "is_cleaned": true,
      "data_type": "threads",
      "reposts_count": 0
    },
    {
      "url": "https://www.threads.net/@hihuyen_nek/post/DSsAKKgERHW",
      "source_type": "threads",
      "source": "https://www.threads.net/@hihuyen_nek/post/DSsAKKgERHW",
      "domain": "threads.net",
      "social_platform": "threads",
      "title": "@hachiyo_222 Hello :)) Kịp đón GD ở OCP3 Hưng Yên rồi nè Giờ tớ đang hóng VPBank ở nhà ga T1, bạn r...",
      "content": "@hachiyo_222 Hello :)) Kịp đón GD ở OCP3 Hưng Yên rồi nè Giờ tớ đang hóng VPBank ở nhà ga T1, bạn ra hóng hong cho vui?",
      "word_count": 27,
      "published_date": 1766668066.0,
      "published_datetime": "2025-12-25 13:07:46+00:00",
      "likes_count": 0,
      "shares_count": 0,
      "comments_count": 0,
      "views_count": 0,
      "reactions": null,
      "account_id": "hihuyen_nek",
      "account_name": "hihuyen_nek",
      "account_url": "https://www.threads.net/@hihuyen_nek",
      "post_id": "8010",
      "post_type": "thread",
      "raw_metadata": {
        "username": "hihuyen_nek",
        "likes": 0,
        "replies": 0,
        "reposts": 0,
        "shares": 0,
        "time": "12/25/25",
        "datetime": "2025-12-25T13:07:46.000Z"
      },
      "is_cleaned": true,
      "data_type": "threads",
      "reposts_count": 0
    },
    {
      "url": "https://www.threads.net/@littlebunni._/post/DSRNWLYAYMP",
      "source_type": "threads",
      "source": "https://www.threads.net/@littlebunni._/post/DSRNWLYAYMP",
      "domain": "threads.net",
      "social_platform": "threads",
      "title": "e tìm thợ chụp địa điểm: hưng yên tgian: 251 phụ kiện đầy đủ hắt sánggiả nắng súng bong bóng.... ...",
      "content": "e tìm thợ chụp địa điểm: hưng yên tgian: 251 phụ kiện đầy đủ hắt sánggiả nắng súng bong bóng.... giá tầm 1tr đổ về cho 1 người 1 ngày ạ  dc chọn tone màu theo yêu cầu",
      "word_count": 38,
      "published_date": 1765769010.0,
      "published_datetime": "2025-12-15 03:23:30+00:00",
      "likes_count": 0,
      "shares_count": 0,
      "comments_count": 0,
      "views_count": 0,
      "reactions": null,
      "account_id": "littlebunni._",
      "account_name": "littlebunni._",
      "account_url": "https://www.threads.net/@littlebunni._",
      "post_id": "8009",
      "post_type": "thread",
      "raw_metadata": {
        "username": "littlebunni._",
        "likes": 0,
        "replies": 0,
        "reposts": 0,
        "shares": 0,
        "time": "12/14/25",
        "datetime": "2025-12-15T03:23:30.000Z"
      },
      "is_cleaned": true,
      "data_type": "threads",
      "reposts_count": 0
    },
    {
      "url": "https://www.threads.net/@username1628_/post/DPJGCJKkiBi",
      "source_type": "threads",
      "source": "https://www.threads.net/@username1628_/post/DPJGCJKkiBi",
      "domain": "threads.net",
      "social_platform": "threads",
      "title": "em tìm thợ chụp kỉ yếu 1 người ạ, ở Hưng Yên thì càng tốt ạ mng báo giá em nửa ngày với một ngày như...",
      "content": "em tìm thợ chụp kỉ yếu 1 người ạ, ở Hưng Yên thì càng tốt ạ mng báo giá em nửa ngày với một ngày như nào ạ",
      "word_count": 28,
      "published_date": 1759054290.0,
      "published_datetime": "2025-09-28 10:11:30+00:00",
      "likes_count": 0,
      "shares_count": 0,
      "comments_count": 0,
      "views_count": 0,
      "reactions": null,
      "account_id": "username1628_",
      "account_name": "username1628_",
      "account_url": "https://www.threads.net/@username1628_",
      "post_id": "8008",
      "post_type": "thread",
      "raw_metadata": {
        "username": "username1628_",
        "likes": 0,
        "replies": 0,
        "reposts": 0,
        "shares": 0,
        "time": "09/28/25",
        "datetime": "2025-09-28T10:11:30.000Z"
      },
      "is_cleaned": true,
      "data_type": "threads",
      "reposts_count": 0
    },
    {
      "url": "https://www.threads.net/@anhphuongvux/post/DPA4RL4k7pv",
      "source_type": "threads",
      "source": "https://www.threads.net/@anhphuongvux/post/DPA4RL4k7pv",
      "domain": "threads.net",
      "social_platform": "threads",
      "title": "Ship 10c bcs ra Hưng Yên cho anh. Tiền ship không là vấn đề!!!",
      "content": "Ship 10c bcs ra Hưng Yên cho anh. Tiền ship không là vấn đề!!!",
      "word_count": 14,
      "published_date": 1758778638.0,
      "published_datetime": "2025-09-25 05:37:18+00:00",
      "likes_count": 0,
      "shares_count": 0,
      "comments_count": 0,
      "views_count": 0,
      "reactions": null,
      "account_id": "anhphuongvux",
      "account_name": "anhphuongvux",
      "account_url": "https://www.threads.net/@anhphuongvux",
      "post_id": "8007",
      "post_type": "thread",
      "raw_metadata": {
        "username": "anhphuongvux",
        "likes": 0,
        "replies": 0,
        "reposts": 0,
        "shares": 0,
        "time": "09/25/25",
        "datetime": "2025-09-25T05:37:18.000Z"
      },
      "is_cleaned": true,
      "data_type": "threads",
      "reposts_count": 0
    },
    {
      "url": "https://www.threads.net/@minh08nt/post/DAPnDcAPhJs",
      "source_type": "threads",
      "source": "https://www.threads.net/@minh08nt/post/DAPnDcAPhJs",
      "domain": "threads.net",
      "social_platform": "threads",
      "title": "FB facebook.comptdat - tớ là nam - tuổi 2k7 - lương tháng 2jack - sống ở Hưng Yên - đặc biết ngoan...",
      "content": "FB facebook.comptdat - tớ là nam - tuổi 2k7 - lương tháng 2jack - sống ở Hưng Yên - đặc biết ngoan , ngu đần - không không xấu trai - không lùn 1800mm - muốn có người yêu ( vì ế lâu quá ròii mà hk biết tán gái ) mong k gặp mấy bạn thích chơi đùa , có người yêu sẽ bỏ app luôn. - k thể ko hút thuốc, k chơi đồ Có bạn nào ế hkkkkkk",
      "word_count": 81,
      "published_date": 1727060674.0,
      "published_datetime": "2024-09-23 03:04:34+00:00",
      "likes_count": 0,
      "shares_count": 0,
      "comments_count": 0,
      "views_count": 0,
      "reactions": null,
      "account_id": "minh08nt",
      "account_name": "minh08nt",
      "account_url": "https://www.threads.net/@minh08nt",
      "post_id": "8006",
      "post_type": "thread",
      "raw_metadata": {
        "username": "minh08nt",
        "likes": 0,
        "replies": 0,
        "reposts": 0,
        "shares": 0,
        "time": "09/22/24",
        "datetime": "2024-09-23T03:04:34.000Z"
      },
      "is_cleaned": true,
      "data_type": "threads",
      "reposts_count": 0
    },
    {
      "url": "https://www.threads.net/@markeu1407_/post/DLiKNm3yb7p",
      "source_type": "threads",
      "source": "https://www.threads.net/@markeu1407_/post/DLiKNm3yb7p",
      "domain": "threads.net",
      "social_platform": "threads",
      "title": "KỂ TỪ NGÀY HÔM NAY, Xin chúc mừng Má Bảo, Anh Chủ Chợ và Đa Đa đã trở thành người đồng hương (An Gi...",
      "content": "KỂ TỪ NGÀY HÔM NAY, Xin chúc mừng Má Bảo, Anh Chủ Chợ và Đa Đa đã trở thành người đồng hương (An Giang), anh chủ tiệm Nui nay đã chuyển sang hái dừa ở Phú Yên thay vì Đăk Lăk, anh Huy Rờ thay vì dắt Đậu đi chợ ở Vĩnh Phúc thì nay chuyển sang đi ở Phú Thọ, ...",
      "word_count": 62,
      "published_date": 1751305407.0,
      "published_datetime": "2025-06-30 17:43:27+00:00",
      "likes_count": 0,
      "shares_count": 0,
      "comments_count": 0,
      "views_count": 0,
      "reactions": null,
      "account_id": "markeu1407_",
      "account_name": "markeu1407_",
      "account_url": "https://www.threads.net/@markeu1407_",
      "post_id": "8005",
      "post_type": "thread",
      "raw_metadata": {
        "username": "markeu1407_",
        "likes": 0,
        "replies": 0,
        "reposts": 0,
        "shares": 0,
        "time": "06/30/25",
        "datetime": "2025-06-30T17:43:27.000Z"
      },
      "is_cleaned": true,
      "data_type": "threads",
      "reposts_count": 0
    },
    {
      "url": "https://www.threads.net/@maii.p26/post/DSfDiWSkpqU",
      "source_type": "threads",
      "source": "https://www.threads.net/@maii.p26/post/DSfDiWSkpqU",
      "domain": "threads.net",
      "social_platform": "threads",
      "title": "Vì một số lí do trong đó có lí do tự biết lượng sức khỏe, t đã không mua vé Ycc mà chỉ đến chơi bời,...",
      "content": "Vì một số lí do trong đó có lí do tự biết lượng sức khỏe, t đã không mua vé Ycc mà chỉ đến chơi bời, mua cạc, mói fibi rồi về. (Thế mà cũng bị chuột rút wtf???) Về đến nhà rồi ngất đến giờ mới dậy đi zone thờ rét. Cái đầu tiên t thấy là LMFYLTN 20 người đàn ông??? Thực sự nếu giờ này t ở Hưng Yên thì t sẽ chếc bởi đàn ông, đàn bà và 11 cháu thiếu niên  Translate 12",
      "word_count": 88,
      "published_date": 1766233629.0,
      "published_datetime": "2025-12-20 12:27:09+00:00",
      "likes_count": 0,
      "shares_count": 0,
      "comments_count": 0,
      "views_count": 0,
      "reactions": null,
      "account_id": "maii.p26",
      "account_name": "maii.p26",
      "account_url": "https://www.threads.net/@maii.p26",
      "post_id": "8004",
      "post_type": "thread",
      "raw_metadata": {
        "username": "maii.p26",
        "likes": 0,
        "replies": 0,
        "reposts": 0,
        "shares": 0,
        "time": "12/20/25",
        "datetime": "2025-12-20T12:27:09.000Z"
      },
      "is_cleaned": true,
      "data_type": "threads",
      "reposts_count": 0
    },
    {
      "url": "https://www.threads.net/@ihhiqajef_/post/DPoZ5kjCd0e",
      "source_type": "threads",
      "source": "https://www.threads.net/@ihhiqajef_/post/DPoZ5kjCd0e",
      "domain": "threads.net",
      "social_platform": "threads",
      "title": "Có ai nhận makeup kỉ yếu ở Hưng Yên k ạ tiện em tìm thợ chụp luôn nữa ạ",
      "content": "Có ai nhận makeup kỉ yếu ở Hưng Yên k ạ tiện em tìm thợ chụp luôn nữa ạ",
      "word_count": 19,
      "published_date": 1760104893.0,
      "published_datetime": "2025-10-10 14:01:33+00:00",
      "likes_count": 0,
      "shares_count": 0,
      "comments_count": 0,
      "views_count": 0,
      "reactions": null,
      "account_id": "ihhiqajef_",
      "account_name": "ihhiqajef_",
      "account_url": "https://www.threads.net/@ihhiqajef_",
      "post_id": "8003",
      "post_type": "thread",
      "raw_metadata": {
        "username": "ihhiqajef_",
        "likes": 0,
        "replies": 0,
        "reposts": 0,
        "shares": 0,
        "time": "10/10/25",
        "datetime": "2025-10-10T14:01:33.000Z"
      },
      "is_cleaned": true,
      "data_type": "threads",
      "reposts_count": 0
    },
    {
      "url": "https://www.threads.net/@iam.inz28/post/DO_PHe5j7gJ",
      "source_type": "threads",
      "source": "https://www.threads.net/@iam.inz28/post/DO_PHe5j7gJ",
      "domain": "threads.net",
      "social_platform": "threads",
      "title": "em cần tìm thợ chụp kỉ yếu ở quanh Hà Nội Hưng Yên ạ",
      "content": "em cần tìm thợ chụp kỉ yếu ở quanh Hà Nội Hưng Yên ạ",
      "word_count": 14,
      "published_date": 1758723508.0,
      "published_datetime": "2025-09-24 14:18:28+00:00",
      "likes_count": 0,
      "shares_count": 0,
      "comments_count": 0,
      "views_count": 0,
      "reactions": null,
      "account_id": "iam.inz28",
      "account_name": "iam.inz28",
      "account_url": "https://www.threads.net/@iam.inz28",
      "post_id": "8002",
      "post_type": "thread",
      "raw_metadata": {
        "username": "iam.inz28",
        "likes": 0,
        "replies": 0,
        "reposts": 0,
        "shares": 0,
        "time": "09/24/25",
        "datetime": "2025-09-24T14:18:28.000Z"
      },
      "is_cleaned": true,
      "data_type": "threads",
      "reposts_count": 0
    },
    {
      "url": "https://www.threads.net/@prescilla_behappy/post/DPpuTw5Ebgx",
      "source_type": "threads",
      "source": "https://www.threads.net/@prescilla_behappy/post/DPpuTw5Ebgx",
      "domain": "threads.net",
      "social_platform": "threads",
      "title": "Đây là timeline của mình: 2011: nghe bài Pháp duy nhất và đầu tiên về Duyên khởi ở Dharamshala, Ấn Đ...",
      "content": "Đây là timeline của mình: 2011: nghe bài Pháp duy nhất và đầu tiên về Duyên khởi ở Dharamshala, Ấn Độ do Ngài Đạt Lai Lạt Ma giảng 2016: tháng 5, khoá thiền Vipassana đầu tiên ở Củ Chi, VN Cùng năm tháng 9: khoá 2 ở Penang, Malaysia. Thực chứng lần đầu. 2018: tháng 9, khoá thứ 3 ở Chiba, Nhật Bản 2019: khoá thứ 4 ở Chiba, Nhật Bản 2023: khoá thứ 5 ở Hưng Yên, VN Cùng năm: khoá phục vụ. 2025: mình nghe nhiều Pháp thầy Viên Minh giảng nhưng cũng đã đến giai đoạn không cần nghe thêm gì.",
      "word_count": 104,
      "published_date": 1760149147.0,
      "published_datetime": "2025-10-11 02:19:07+00:00",
      "likes_count": 0,
      "shares_count": 0,
      "comments_count": 0,
      "views_count": 0,
      "reactions": null,
      "account_id": "prescilla_behappy",
      "account_name": "prescilla_behappy",
      "account_url": "https://www.threads.net/@prescilla_behappy",
      "post_id": "8001",
      "post_type": "thread",
      "raw_metadata": {
        "username": "prescilla_behappy",
        "likes": 0,
        "replies": 0,
        "reposts": 0,
        "shares": 0,
        "time": "10/10/25",
        "datetime": "2025-10-11T02:19:07.000Z"
      },
      "is_cleaned": true,
      "data_type": "threads",
      "reposts_count": 0
    },
    {
      "url": "https://www.threads.net/@cao.minhvuong/post/DCIhFgBB7U4",
      "source_type": "threads",
      "source": "https://www.threads.net/@cao.minhvuong/post/DCIhFgBB7U4",
      "domain": "threads.net",
      "social_platform": "threads",
      "title": "NHỮNG LÝ DO PHE VÉ KHÔNG NÊN ÔM VÉ ConcertATVNCG2024 1. Địa điểm tổ chức ở Hưng Yên, sẽ khá nhiều g...",
      "content": "NHỮNG LÝ DO PHE VÉ KHÔNG NÊN ÔM VÉ ConcertATVNCG2024 1. Địa điểm tổ chức ở Hưng Yên, sẽ khá nhiều gia đình nội thành từ bỏ ý định đi xem show. 2. Chỉ có số ít Gai con là \"Phú bà\", đa số lương 1x-2x, nên việc bỏ 4-5tr để mua vé pass là hơi đau ví. 3. Tech đang ôm 20k vé, tỷ lệ quay trúng cao, với yc bỏ 15tr vào tech để đc quay vé thì Gai con làm được. 4. Vì ở Hưng Yên, nên những bạn k có vé cx k đánh liều đu rào ở cc để săn vé. Translate 12",
      "word_count": 108,
      "published_date": 1731117631.0,
      "published_datetime": "2024-11-09 02:00:31+00:00",
      "likes_count": 0,
      "shares_count": 0,
      "comments_count": 0,
      "views_count": 0,
      "reactions": null,
      "account_id": "cao.minhvuong",
      "account_name": "cao.minhvuong",
      "account_url": "https://www.threads.net/@cao.minhvuong",
      "post_id": "8000",
      "post_type": "thread",
      "raw_metadata": {
        "username": "cao.minhvuong",
        "likes": 0,
        "replies": 0,
        "reposts": 0,
        "shares": 0,
        "time": "11/08/24",
        "datetime": "2024-11-09T02:00:31.000Z"
      },
      "is_cleaned": true,
      "data_type": "threads",
      "reposts_count": 0
    },
    {
      "url": "https://www.threads.net/@production.crew88/post/DBnTP82zkkk",
      "source_type": "threads",
      "source": "https://www.threads.net/@production.crew88/post/DBnTP82zkkk",
      "domain": "threads.net",
      "social_platform": "threads",
      "title": "Có khi các mom ở xa tìm dần homestay ở Ocean Park 2-3 đi. Di chuyển từ HN thì yên tâm Vinbus  Xanh ...",
      "content": "Có khi các mom ở xa tìm dần homestay ở Ocean Park 2-3 đi. Di chuyển từ HN thì yên tâm Vinbus  Xanh sm lo. ATVNCGConcertHaNoi  Hưng Yên Translate 12",
      "word_count": 30,
      "published_date": 1730003080.0,
      "published_datetime": "2024-10-27 04:24:40+00:00",
      "likes_count": 0,
      "shares_count": 0,
      "comments_count": 0,
      "views_count": 0,
      "reactions": null,
      "account_id": "production.crew88",
      "account_name": "production.crew88",
      "account_url": "https://www.threads.net/@production.crew88",
      "post_id": "7999",
      "post_type": "thread",
      "raw_metadata": {
        "username": "production.crew88",
        "likes": 0,
        "replies": 0,
        "reposts": 0,
        "shares": 0,
        "time": "10/27/24",
        "datetime": "2024-10-27T04:24:40.000Z"
      },
      "is_cleaned": true,
      "data_type": "threads",
      "reposts_count": 0
    },
    {
      "url": "https://www.threads.net/@noinghe.community/post/DSFIP8rE0-0",
      "source_type": "threads",
      "source": "https://www.threads.net/@noinghe.community/post/DSFIP8rE0-0",
      "domain": "threads.net",
      "social_platform": "threads",
      "title": "FACT TÂM LÝ: Thật ra, tình yêu có hai giai đoạn hóa chất: - Giai đoạn đầu, dopamine bùng nổ: khiế...",
      "content": "FACT TÂM LÝ: Thật ra, tình yêu có hai giai đoạn hóa chất: - Giai đoạn đầu, dopamine bùng nổ: khiến bạn cảm thấy nghiện nhau, tim đập nhanh, nghĩ về người đó liên tục và hưng phấn mỗi lần gặp. - Giai đoạn sau, oxytocin và vasopressin giúp duy trì mối quan hệ: tạo cảm giác an toàn, bình yên khi bên cạnh và chia sẻ khoảnh khắc đời thường cùng nhau. Translate 13",
      "word_count": 75,
      "published_date": 1765363684.0,
      "published_datetime": "2025-12-10 10:48:04+00:00",
      "likes_count": 0,
      "shares_count": 0,
      "comments_count": 0,
      "views_count": 0,
      "reactions": null,
      "account_id": "noinghe.community",
      "account_name": "noinghe.community",
      "account_url": "https://www.threads.net/@noinghe.community",
      "post_id": "7998",
      "post_type": "thread",
      "raw_metadata": {
        "username": "noinghe.community",
        "likes": 0,
        "replies": 0,
        "reposts": 0,
        "shares": 0,
        "time": "12/10/25",
        "datetime": "2025-12-10T10:48:04.000Z"
      },
      "is_cleaned": true,
      "data_type": "threads",
      "reposts_count": 0
    },
    {
      "url": "https://www.threads.net/@_hnq.1704_/post/DRo9muMEfND",
      "source_type": "threads",
      "source": "https://www.threads.net/@_hnq.1704_/post/DRo9muMEfND",
      "domain": "threads.net",
      "social_platform": "threads",
      "title": "Đã quá Hưng Yên oi",
      "content": "Đã quá Hưng Yên oi",
      "word_count": 5,
      "published_date": 1764418580.0,
      "published_datetime": "2025-11-29 12:16:20+00:00",
      "likes_count": 0,
      "shares_count": 0,
      "comments_count": 0,
      "views_count": 0,
      "reactions": null,
      "account_id": "_hnq.1704_",
      "account_name": "_hnq.1704_",
      "account_url": "https://www.threads.net/@_hnq.1704_",
      "post_id": "7997",
      "post_type": "thread",
      "raw_metadata": {
        "username": "_hnq.1704_",
        "likes": 0,
        "replies": 0,
        "reposts": 0,
        "shares": 0,
        "time": "11/29/25",
        "datetime": "2025-11-29T12:16:20.000Z"
      },
      "is_cleaned": true,
      "data_type": "threads",
      "reposts_count": 0
    },
    {
      "url": "https://www.threads.net/@luongminh2000/post/C8uN9AwSaZN",
      "source_type": "threads",
      "source": "https://www.threads.net/@luongminh2000/post/C8uN9AwSaZN",
      "domain": "threads.net",
      "social_platform": "threads",
      "title": "Ý là không biết tìm nhà ở Ecopark Hưng Yên trên này liệu có được không nhỉ?  T cần tìm nhà Ecopark ...",
      "content": "Ý là không biết tìm nhà ở Ecopark Hưng Yên trên này liệu có được không nhỉ?  T cần tìm nhà Ecopark 1N1K budget 5.5tr quay đầu ban công hướng mát, khu nào cũng được. Xin Threads hãy gửi đi thông điệp này",
      "word_count": 43,
      "published_date": 1719497766.0,
      "published_datetime": "2024-06-27 14:16:06+00:00",
      "likes_count": 0,
      "shares_count": 0,
      "comments_count": 0,
      "views_count": 0,
      "reactions": null,
      "account_id": "luongminh2000",
      "account_name": "luongminh2000",
      "account_url": "https://www.threads.net/@luongminh2000",
      "post_id": "7996",
      "post_type": "thread",
      "raw_metadata": {
        "username": "luongminh2000",
        "likes": 0,
        "replies": 0,
        "reposts": 0,
        "shares": 0,
        "time": "06/27/24",
        "datetime": "2024-06-27T14:16:06.000Z"
      },
      "is_cleaned": true,
      "data_type": "threads",
      "reposts_count": 0
    },
    {
      "url": "https://www.threads.net/@bonginheruni_/post/DSNdOl3kmba",
      "source_type": "threads",
      "source": "https://www.threads.net/@bonginheruni_/post/DSNdOl3kmba",
      "domain": "threads.net",
      "social_platform": "threads",
      "title": "Vl mua xong soundcheck nghe quả ttin mã qr soundcheck random ; quét ra anh tàitân binhchị đẹp trú...",
      "content": "Vl mua xong soundcheck nghe quả ttin mã qr soundcheck random ; quét ra anh tàitân binhchị đẹp trúng 1 trong 3 cái nào thì đi cái đó. Ý là bữa anh tài chị đẹp t đi làm á Tech ơi sao t đi được vậy ? T đi tân binh vì 7h30 t còn kịp từ tỉnh khác đi sang Hưng Yên kịp á . Translate 12",
      "word_count": 68,
      "published_date": 1765643119.0,
      "published_datetime": "2025-12-13 16:25:19+00:00",
      "likes_count": 0,
      "shares_count": 0,
      "comments_count": 0,
      "views_count": 0,
      "reactions": null,
      "account_id": "bonginheruni_",
      "account_name": "bonginheruni_",
      "account_url": "https://www.threads.net/@bonginheruni_",
      "post_id": "7995",
      "post_type": "thread",
      "raw_metadata": {
        "username": "bonginheruni_",
        "likes": 0,
        "replies": 0,
        "reposts": 0,
        "shares": 0,
        "time": "12/13/25",
        "datetime": "2025-12-13T16:25:19.000Z"
      },
      "is_cleaned": true,
      "data_type": "threads",
      "reposts_count": 0
    },
    {
      "url": "https://www.threads.net/@solaceisu/post/DR_RuYQkuvK",
      "source_type": "threads",
      "source": "https://www.threads.net/@solaceisu/post/DR_RuYQkuvK",
      "domain": "threads.net",
      "social_platform": "threads",
      "title": "mình ở SG ra HN thì nên đặt phòng ở quận nào để tiện đi Hưng Yên Y-Concert và VEC vậy mọi người. hel...",
      "content": "mình ở SG ra HN thì nên đặt phòng ở quận nào để tiện đi Hưng Yên Y-Concert và VEC vậy mọi người. help meee",
      "word_count": 25,
      "published_date": 1765167326.0,
      "published_datetime": "2025-12-08 04:15:26+00:00",
      "likes_count": 0,
      "shares_count": 0,
      "comments_count": 0,
      "views_count": 0,
      "reactions": null,
      "account_id": "solaceisu",
      "account_name": "solaceisu",
      "account_url": "https://www.threads.net/@solaceisu",
      "post_id": "7994",
      "post_type": "thread",
      "raw_metadata": {
        "username": "solaceisu",
        "likes": 0,
        "replies": 0,
        "reposts": 0,
        "shares": 0,
        "time": "12/07/25",
        "datetime": "2025-12-08T04:15:26.000Z"
      },
      "is_cleaned": true,
      "data_type": "threads",
      "reposts_count": 0
    },
    {
      "url": "https://www.threads.net/@nthuyen030298/post/DRwWYPGEs81",
      "source_type": "threads",
      "source": "https://www.threads.net/@nthuyen030298/post/DRwWYPGEs81",
      "domain": "threads.net",
      "social_platform": "threads",
      "title": "Nhà máy mới của Nhật tại KCN Thăng Long 2, Hưng Yên cần tuyển 3 Kỹ thuật - Yêu cầu: Nam, tuổi 1997-...",
      "content": "Nhà máy mới của Nhật tại KCN Thăng Long 2, Hưng Yên cần tuyển 3 Kỹ thuật - Yêu cầu: Nam, tuổi 1997-2003, tốt nghiệp CDDH ngành kỹ thuật - Lương gross: 10-11tr - Làm việc từ t2-t6 Quan tâm nhắn mình nhé",
      "word_count": 43,
      "published_date": 1764666449.0,
      "published_datetime": "2025-12-02 09:07:29+00:00",
      "likes_count": 0,
      "shares_count": 0,
      "comments_count": 0,
      "views_count": 0,
      "reactions": null,
      "account_id": "nthuyen030298",
      "account_name": "nthuyen030298",
      "account_url": "https://www.threads.net/@nthuyen030298",
      "post_id": "7993",
      "post_type": "thread",
      "raw_metadata": {
        "username": "nthuyen030298",
        "likes": 0,
        "replies": 0,
        "reposts": 0,
        "shares": 0,
        "time": "12/02/25",
        "datetime": "2025-12-02T09:07:29.000Z"
      },
      "is_cleaned": true,
      "data_type": "threads",
      "reposts_count": 0
    },
    {
      "url": "https://www.threads.net/@vyyenz__/post/DSEyMuqEppE",
      "source_type": "threads",
      "source": "https://www.threads.net/@vyyenz__/post/DSEyMuqEppE",
      "domain": "threads.net",
      "social_platform": "threads",
      "title": "gấp gấp em cần tìm thợ chụp kỉ yếu ngày 181 nhóm 4ng, em ở Hưng Yên ạ",
      "content": "gấp gấp em cần tìm thợ chụp kỉ yếu ngày 181 nhóm 4ng, em ở Hưng Yên ạ",
      "word_count": 18,
      "published_date": 1765352124.0,
      "published_datetime": "2025-12-10 07:35:24+00:00",
      "likes_count": 0,
      "shares_count": 0,
      "comments_count": 0,
      "views_count": 0,
      "reactions": null,
      "account_id": "vyyenz__",
      "account_name": "vyyenz__",
      "account_url": "https://www.threads.net/@vyyenz__",
      "post_id": "7992",
      "post_type": "thread",
      "raw_metadata": {
        "username": "vyyenz__",
        "likes": 0,
        "replies": 0,
        "reposts": 0,
        "shares": 0,
        "time": "12/10/25",
        "datetime": "2025-12-10T07:35:24.000Z"
      },
      "is_cleaned": true,
      "data_type": "threads",
      "reposts_count": 0
    },
    {
      "url": "https://www.threads.net/@_ducws.tieens_/post/DRvdKcCkmnp",
      "source_type": "threads",
      "source": "https://www.threads.net/@_ducws.tieens_/post/DRvdKcCkmnp",
      "domain": "threads.net",
      "social_platform": "threads",
      "title": "Tìm thợ kỉ yếu 181 tại THPT nguyễn thiện thuật(mỹ hào hưng yên) nhóm 4ng 1 buổi sáng budget 500ng ...",
      "content": "Tìm thợ kỉ yếu 181 tại THPT nguyễn thiện thuật(mỹ hào hưng yên) nhóm 4ng 1 buổi sáng budget 500ng ạ Translate 12",
      "word_count": 23,
      "published_date": 1764636452.0,
      "published_datetime": "2025-12-02 00:47:32+00:00",
      "likes_count": 0,
      "shares_count": 0,
      "comments_count": 0,
      "views_count": 0,
      "reactions": null,
      "account_id": "_ducws.tieens_",
      "account_name": "_ducws.tieens_",
      "account_url": "https://www.threads.net/@_ducws.tieens_",
      "post_id": "7991",
      "post_type": "thread",
      "raw_metadata": {
        "username": "_ducws.tieens_",
        "likes": 0,
        "replies": 0,
        "reposts": 0,
        "shares": 0,
        "time": "12/01/25",
        "datetime": "2025-12-02T00:47:32.000Z"
      },
      "is_cleaned": true,
      "data_type": "threads",
      "reposts_count": 0
    },
    {
      "url": "https://www.threads.net/@p.traw.unu/post/DPpr2hCCT82",
      "source_type": "threads",
      "source": "https://www.threads.net/@p.traw.unu/post/DPpr2hCCT82",
      "domain": "threads.net",
      "social_platform": "threads",
      "title": "Em muốn tìm thợ chụp ảnh kỉ yếu 122026 ở Khoái Châu- Hưng Yên ạ - Nhóm 2 người cả ngày (800k1 n...",
      "content": "Em muốn tìm thợ chụp ảnh kỉ yếu 122026 ở Khoái Châu- Hưng Yên ạ - Nhóm 2 người cả ngày (800k1 người) - Có hỗ trợ hắt sáng, chỉnh dáng,.. Ưu tiên đa dạng góc chụp ạ",
      "word_count": 38,
      "published_date": 1760147859.0,
      "published_datetime": "2025-10-11 01:57:39+00:00",
      "likes_count": 0,
      "shares_count": 0,
      "comments_count": 0,
      "views_count": 0,
      "reactions": null,
      "account_id": "p.traw.unu",
      "account_name": "p.traw.unu",
      "account_url": "https://www.threads.net/@p.traw.unu",
      "post_id": "7990",
      "post_type": "thread",
      "raw_metadata": {
        "username": "p.traw.unu",
        "likes": 0,
        "replies": 0,
        "reposts": 0,
        "shares": 0,
        "time": "10/10/25",
        "datetime": "2025-10-11T01:57:39.000Z"
      },
      "is_cleaned": true,
      "data_type": "threads",
      "reposts_count": 0
    },
    {
      "url": "https://www.threads.net/@mtlt_08/post/DTCniyHkizp",
      "source_type": "threads",
      "source": "https://www.threads.net/@mtlt_08/post/DTCniyHkizp",
      "domain": "threads.net",
      "social_platform": "threads",
      "title": "tìm người đi chơi cùng là gái thì càng tốt ạ( ymi -hưng yên)",
      "content": "tìm người đi chơi cùng là gái thì càng tốt ạ( ymi -hưng yên)",
      "word_count": 14,
      "published_date": 1767426912.0,
      "published_datetime": "2026-01-03 07:55:12+00:00",
      "likes_count": 0,
      "shares_count": 0,
      "comments_count": 0,
      "views_count": 0,
      "reactions": null,
      "account_id": "mtlt_08",
      "account_name": "mtlt_08",
      "account_url": "https://www.threads.net/@mtlt_08",
      "post_id": "7989",
      "post_type": "thread",
      "raw_metadata": {
        "username": "mtlt_08",
        "likes": 0,
        "replies": 0,
        "reposts": 0,
        "shares": 0,
        "time": "1d",
        "datetime": "2026-01-03T07:55:12.000Z"
      },
      "is_cleaned": true,
      "data_type": "threads",
      "reposts_count": 0
    },
    {
      "url": "https://www.threads.net/@pnee._/post/DSe9X6IEltM",
      "source_type": "threads",
      "source": "https://www.threads.net/@pnee._/post/DSe9X6IEltM",
      "domain": "threads.net",
      "social_platform": "threads",
      "title": "Mọi người ơi, em muốn tìm combo make chụp vào ngày 82 ạ. Budget 1tr5 ạ. Em cảm ơnnnn Em ở Hưng Yên ...",
      "content": "Mọi người ơi, em muốn tìm combo make chụp vào ngày 82 ạ. Budget 1tr5 ạ. Em cảm ơnnnn Em ở Hưng Yên ạ",
      "word_count": 24,
      "published_date": 1766230398.0,
      "published_datetime": "2025-12-20 11:33:18+00:00",
      "likes_count": 0,
      "shares_count": 0,
      "comments_count": 0,
      "views_count": 0,
      "reactions": null,
      "account_id": "pnee._",
      "account_name": "pnee._",
      "account_url": "https://www.threads.net/@pnee._",
      "post_id": "7988",
      "post_type": "thread",
      "raw_metadata": {
        "username": "pnee._",
        "likes": 0,
        "replies": 0,
        "reposts": 0,
        "shares": 0,
        "time": "12/20/25",
        "datetime": "2025-12-20T11:33:18.000Z"
      },
      "is_cleaned": true,
      "data_type": "threads",
      "reposts_count": 0
    },
    {
      "url": "https://www.threads.net/@tuineuaalo/post/DObVVHfEmwT",
      "source_type": "threads",
      "source": "https://www.threads.net/@tuineuaalo/post/DObVVHfEmwT",
      "domain": "threads.net",
      "social_platform": "threads",
      "title": "Mọi người ơi tuần này có ai từ Hưng Yên lên Hà Nội đi xe máy không ạ cho em đi ké với. Em có xe, chỉ...",
      "content": "Mọi người ơi tuần này có ai từ Hưng Yên lên Hà Nội đi xe máy không ạ cho em đi ké với. Em có xe, chỉ cần người để đi theo thui ạ",
      "word_count": 34,
      "published_date": 1757518805.0,
      "published_datetime": "2025-09-10 15:40:05+00:00",
      "likes_count": 0,
      "shares_count": 0,
      "comments_count": 0,
      "views_count": 0,
      "reactions": null,
      "account_id": "tuineuaalo",
      "account_name": "tuineuaalo",
      "account_url": "https://www.threads.net/@tuineuaalo",
      "post_id": "7987",
      "post_type": "thread",
      "raw_metadata": {
        "username": "tuineuaalo",
        "likes": 0,
        "replies": 0,
        "reposts": 0,
        "shares": 0,
        "time": "09/10/25",
        "datetime": "2025-09-10T15:40:05.000Z"
      },
      "is_cleaned": true,
      "data_type": "threads",
      "reposts_count": 0
    },
    {
      "url": "https://www.threads.net/@uien211/post/DPPBWCPkhFc",
      "source_type": "threads",
      "source": "https://www.threads.net/@uien211/post/DPPBWCPkhFc",
      "domain": "threads.net",
      "social_platform": "threads",
      "title": "Tìm ng đi chs trung thu cùng  t ở Hưng yên",
      "content": "Tìm ng đi chs trung thu cùng  t ở Hưng yên",
      "word_count": 11,
      "published_date": 1759253259.0,
      "published_datetime": "2025-09-30 17:27:39+00:00",
      "likes_count": 0,
      "shares_count": 0,
      "comments_count": 0,
      "views_count": 0,
      "reactions": null,
      "account_id": "uien211",
      "account_name": "uien211",
      "account_url": "https://www.threads.net/@uien211",
      "post_id": "7986",
      "post_type": "thread",
      "raw_metadata": {
        "username": "uien211",
        "likes": 0,
        "replies": 0,
        "reposts": 0,
        "shares": 0,
        "time": "09/30/25",
        "datetime": "2025-09-30T17:27:39.000Z"
      },
      "is_cleaned": true,
      "data_type": "threads",
      "reposts_count": 0
    },
    {
      "url": "https://www.threads.net/@rijingyu/post/DRUl0wdkQ1o",
      "source_type": "threads",
      "source": "https://www.threads.net/@rijingyu/post/DRUl0wdkQ1o",
      "domain": "threads.net",
      "social_platform": "threads",
      "title": "Có ní nào luỵ concert giống tôi khônggg. Đã qua được một tuần rồi mà hồn tôi vẫn Hưng Yên!",
      "content": "Có ní nào luỵ concert giống tôi khônggg. Đã qua được một tuần rồi mà hồn tôi vẫn Hưng Yên!",
      "word_count": 20,
      "published_date": 1763735023.0,
      "published_datetime": "2025-11-21 14:23:43+00:00",
      "likes_count": 0,
      "shares_count": 0,
      "comments_count": 0,
      "views_count": 0,
      "reactions": null,
      "account_id": "rijingyu",
      "account_name": "rijingyu",
      "account_url": "https://www.threads.net/@rijingyu",
      "post_id": "7985",
      "post_type": "thread",
      "raw_metadata": {
        "username": "rijingyu",
        "likes": 0,
        "replies": 0,
        "reposts": 0,
        "shares": 0,
        "time": "11/21/25",
        "datetime": "2025-11-21T14:23:43.000Z"
      },
      "is_cleaned": true,
      "data_type": "threads",
      "reposts_count": 0
    },
    {
      "url": "https://www.threads.net/@thuy.duong243/post/DLiGRsEvw-e",
      "source_type": "threads",
      "source": "https://www.threads.net/@thuy.duong243/post/DLiGRsEvw-e",
      "domain": "threads.net",
      "social_platform": "threads",
      "title": "Hôm nay đọc đc tin Thái Bình chính thức sáp nhập với Hưng Yên xong vào đọc cmt thấy mọi người nhắc đ...",
      "content": "Hôm nay đọc đc tin Thái Bình chính thức sáp nhập với Hưng Yên xong vào đọc cmt thấy mọi người nhắc đến bài này nhiều quá phải mò lên Youtube nghe lại, được cái vẫn hay như ngày đầu vậy",
      "word_count": 41,
      "published_date": 1751303484.0,
      "published_datetime": "2025-06-30 17:11:24+00:00",
      "likes_count": 0,
      "shares_count": 0,
      "comments_count": 0,
      "views_count": 0,
      "reactions": null,
      "account_id": "thuy.duong243",
      "account_name": "thuy.duong243",
      "account_url": "https://www.threads.net/@thuy.duong243",
      "post_id": "7984",
      "post_type": "thread",
      "raw_metadata": {
        "username": "thuy.duong243",
        "likes": 0,
        "replies": 0,
        "reposts": 0,
        "shares": 0,
        "time": "06/30/25",
        "datetime": "2025-06-30T17:11:24.000Z"
      },
      "is_cleaned": true,
      "data_type": "threads",
      "reposts_count": 0
    },
    {
      "url": "https://www.threads.net/@quanphanboi.hkbl/post/DSrLsDmj394",
      "source_type": "threads",
      "source": "https://www.threads.net/@quanphanboi.hkbl/post/DSrLsDmj394",
      "domain": "threads.net",
      "social_platform": "threads",
      "title": "89 Hưng Yên - Chông Gai",
      "content": "89 Hưng Yên - Chông Gai",
      "word_count": 6,
      "published_date": 1766640556.0,
      "published_datetime": "2025-12-25 05:29:16+00:00",
      "likes_count": 0,
      "shares_count": 0,
      "comments_count": 0,
      "views_count": 0,
      "reactions": null,
      "account_id": "quanphanboi.hkbl",
      "account_name": "quanphanboi.hkbl",
      "account_url": "https://www.threads.net/@quanphanboi.hkbl",
      "post_id": "7983",
      "post_type": "thread",
      "raw_metadata": {
        "username": "quanphanboi.hkbl",
        "likes": 0,
        "replies": 0,
        "reposts": 0,
        "shares": 0,
        "time": "12/25/25",
        "datetime": "2025-12-25T05:29:16.000Z"
      },
      "is_cleaned": true,
      "data_type": "threads",
      "reposts_count": 0
    },
    {
      "url": "https://www.threads.net/@roanh_roang/post/DS7jqikEfsL",
      "source_type": "threads",
      "source": "https://www.threads.net/@roanh_roang/post/DS7jqikEfsL",
      "domain": "threads.net",
      "social_platform": "threads",
      "title": "Pháo hoa concert ở Hưng Yên của Mẹ đẹp lắm Mẹ ơi! Mẹ cho con về nhà nơi OCP3 rực rỡ đi mẹ! Mẹ Gai ơi...",
      "content": "Pháo hoa concert ở Hưng Yên của Mẹ đẹp lắm Mẹ ơi! Mẹ cho con về nhà nơi OCP3 rực rỡ đi mẹ! Mẹ Gai ơi, Bố Teck ơi",
      "word_count": 29,
      "published_date": 1767190117.0,
      "published_datetime": "2025-12-31 14:08:37+00:00",
      "likes_count": 0,
      "shares_count": 0,
      "comments_count": 0,
      "views_count": 0,
      "reactions": null,
      "account_id": "roanh_roang",
      "account_name": "roanh_roang",
      "account_url": "https://www.threads.net/@roanh_roang",
      "post_id": "7982",
      "post_type": "thread",
      "raw_metadata": {
        "username": "roanh_roang",
        "likes": 0,
        "replies": 0,
        "reposts": 0,
        "shares": 0,
        "time": "3d",
        "datetime": "2025-12-31T14:08:37.000Z"
      },
      "is_cleaned": true,
      "data_type": "threads",
      "reposts_count": 0
    },
    {
      "url": "https://www.threads.net/@ph.lyh_08/post/DP3hDLREqWF",
      "source_type": "threads",
      "source": "https://www.threads.net/@ph.lyh_08/post/DP3hDLREqWF",
      "domain": "threads.net",
      "social_platform": "threads",
      "title": "E muốn tìm thợ make up chụp kỉ yếu đầu tháng 1 này ở Hưng Yên ạ. Budget : khoảng 500 trở xuống ạ E m...",
      "content": "E muốn tìm thợ make up chụp kỉ yếu đầu tháng 1 này ở Hưng Yên ạ. Budget : khoảng 500 trở xuống ạ E muốn make hồng nhẹ nhàng như hình thui ạ.",
      "word_count": 34,
      "published_date": 1760611958.0,
      "published_datetime": "2025-10-16 10:52:38+00:00",
      "likes_count": 0,
      "shares_count": 0,
      "comments_count": 0,
      "views_count": 0,
      "reactions": null,
      "account_id": "ph.lyh_08",
      "account_name": "ph.lyh_08",
      "account_url": "https://www.threads.net/@ph.lyh_08",
      "post_id": "7981",
      "post_type": "thread",
      "raw_metadata": {
        "username": "ph.lyh_08",
        "likes": 0,
        "replies": 0,
        "reposts": 0,
        "shares": 0,
        "time": "10/16/25",
        "datetime": "2025-10-16T10:52:38.000Z"
      },
      "is_cleaned": true,
      "data_type": "threads",
      "reposts_count": 0
    },
    {
      "url": "https://www.threads.net/@khaipharm92/post/DS9-AX2jhWB",
      "source_type": "threads",
      "source": "https://www.threads.net/@khaipharm92/post/DS9-AX2jhWB",
      "domain": "threads.net",
      "social_platform": "threads",
      "title": "Gieo một quẻ kinh dịch đầu năm cho những ai hữu duyên đọc được. Nhưng trước hết phải tóm tắt không k...",
      "content": "Gieo một quẻ kinh dịch đầu năm cho những ai hữu duyên đọc được. Nhưng trước hết phải tóm tắt không khí chung của năm 2026: Năm nay hứa hẹn sẽ là một năm đầy biến động, nhiều mâu thuẫn và những sự khẩn trương (vì chúng ta đang bước vào năng lượng Siêu trăng Cự Giải, sao Hoả 135 độ Thiên vương và rất nhiều hành tinh ở Ma Kết). Translate 112",
      "word_count": 73,
      "published_date": 1767270917.0,
      "published_datetime": "2026-01-01 12:35:17+00:00",
      "likes_count": 0,
      "shares_count": 0,
      "comments_count": 0,
      "views_count": 0,
      "reactions": null,
      "account_id": "khaipharm92",
      "account_name": "khaipharm92",
      "account_url": "https://www.threads.net/@khaipharm92",
      "post_id": "7980",
      "post_type": "thread",
      "raw_metadata": {
        "username": "khaipharm92",
        "likes": 0,
        "replies": 0,
        "reposts": 0,
        "shares": 0,
        "time": "2d",
        "datetime": "2026-01-01T12:35:17.000Z"
      },
      "is_cleaned": true,
      "data_type": "threads",
      "reposts_count": 0
    },
    {
      "url": "https://www.threads.net/@rain.knd/post/DHVdOW6vx1Q",
      "source_type": "threads",
      "source": "https://www.threads.net/@rain.knd/post/DHVdOW6vx1Q",
      "domain": "threads.net",
      "social_platform": "threads",
      "title": "Ai hỏi quê mày có đặc sản gì? Bánh cáy! À 17 Thái Bình Ko tao Hưng Yên",
      "content": "Ai hỏi quê mày có đặc sản gì? Bánh cáy! À 17 Thái Bình Ko tao Hưng Yên",
      "word_count": 18,
      "published_date": 1742289232.0,
      "published_datetime": "2025-03-18 09:13:52+00:00",
      "likes_count": 0,
      "shares_count": 0,
      "comments_count": 0,
      "views_count": 0,
      "reactions": null,
      "account_id": "rain.knd",
      "account_name": "rain.knd",
      "account_url": "https://www.threads.net/@rain.knd",
      "post_id": "7979",
      "post_type": "thread",
      "raw_metadata": {
        "username": "rain.knd",
        "likes": 0,
        "replies": 0,
        "reposts": 0,
        "shares": 0,
        "time": "03/18/25",
        "datetime": "2025-03-18T09:13:52.000Z"
      },
      "is_cleaned": true,
      "data_type": "threads",
      "reposts_count": 0
    },
    {
      "url": "https://www.threads.net/@ringco.nh/post/DMnuu0GBDaK",
      "source_type": "threads",
      "source": "https://www.threads.net/@ringco.nh/post/DMnuu0GBDaK",
      "domain": "threads.net",
      "social_platform": "threads",
      "title": "a gỡ bài đi ạ, ngta đi kiếm sống, ăn cơm nhiều lấy sức làm việc (toàn cơm trắng chứ thức ăn chả có b...",
      "content": "a gỡ bài đi ạ, ngta đi kiếm sống, ăn cơm nhiều lấy sức làm việc (toàn cơm trắng chứ thức ăn chả có bao nhiêu) mà a up bài như thế, nhỡ vợ con ng quen ngta thấy thì sao ạ? Chạnh lòng tủi thân vch ấy mà thấy thương thay cho anh đấy khi có đồng nghiệp hãm như anh. Làm việc đã mệt, bao nhiêu thứ phải gồng gánh đến ăn miếng cơm cũng k yên, cũng bị chụp trộm xong up lên mạng câu like, tỏ ra cho mng biết bản chất của mình.",
      "word_count": 98,
      "published_date": 1753639809.0,
      "published_datetime": "2025-07-27 18:10:09+00:00",
      "likes_count": 0,
      "shares_count": 0,
      "comments_count": 0,
      "views_count": 0,
      "reactions": null,
      "account_id": "ringco.nh",
      "account_name": "ringco.nh",
      "account_url": "https://www.threads.net/@ringco.nh",
      "post_id": "7978",
      "post_type": "thread",
      "raw_metadata": {
        "username": "ringco.nh",
        "likes": 0,
        "replies": 0,
        "reposts": 0,
        "shares": 0,
        "time": "07/27/25",
        "datetime": "2025-07-27T18:10:09.000Z"
      },
      "is_cleaned": true,
      "data_type": "threads",
      "reposts_count": 0
    },
    {
      "url": "https://www.threads.net/@hat91936/post/DMkTeoAtj2S",
      "source_type": "threads",
      "source": "https://www.threads.net/@hat91936/post/DMkTeoAtj2S",
      "domain": "threads.net",
      "social_platform": "threads",
      "title": "Sao CTY ko đuổi thằng này...: @nêu bật",
      "content": "Sao CTY ko đuổi thằng này...: @nêu bật",
      "word_count": 8,
      "published_date": 1753524858.0,
      "published_datetime": "2025-07-26 10:14:18+00:00",
      "likes_count": 0,
      "shares_count": 0,
      "comments_count": 0,
      "views_count": 0,
      "reactions": null,
      "account_id": "hat91936",
      "account_name": "hat91936",
      "account_url": "https://www.threads.net/@hat91936",
      "post_id": "7977",
      "post_type": "thread",
      "raw_metadata": {
        "username": "hat91936",
        "likes": 0,
        "replies": 0,
        "reposts": 0,
        "shares": 0,
        "time": "07/26/25",
        "datetime": "2025-07-26T10:14:18.000Z"
      },
      "is_cleaned": true,
      "data_type": "threads",
      "reposts_count": 0
    },
    {
      "url": "https://www.threads.net/@duchuy892k5/post/DS2wbSFE0gh",
      "source_type": "threads",
      "source": "https://www.threads.net/@duchuy892k5/post/DS2wbSFE0gh",
      "domain": "threads.net",
      "social_platform": "threads",
      "title": "Xin chào mọi người Mình tên Đức Huy - 2005 - Đang sống ( ở trọ ) tại Mỹ Hào - Hưng Yên Chiều cao 1...",
      "content": "Xin chào mọi người Mình tên Đức Huy - 2005 - Đang sống ( ở trọ ) tại Mỹ Hào - Hưng Yên Chiều cao 1m73, 55kg, 15 ... Mong muốn được làm quen với các bạn nữ ở gần. Đi chơi, đi bộ, đi dạo, nói chuyện những ngày tháng cô đơn. Ưu điểm : ít nói Nhược điểm : nói nhiều Nhiều khi hơi ngây thơ và đôi lúc lại hơi ngớ ngẩn. Thích ăn vặt và uống nước lọc.",
      "word_count": 82,
      "published_date": 1767028916.0,
      "published_datetime": "2025-12-29 17:21:56+00:00",
      "likes_count": 0,
      "shares_count": 0,
      "comments_count": 0,
      "views_count": 0,
      "reactions": null,
      "account_id": "duchuy892k5",
      "account_name": "duchuy892k5",
      "account_url": "https://www.threads.net/@duchuy892k5",
      "post_id": "7976",
      "post_type": "thread",
      "raw_metadata": {
        "username": "duchuy892k5",
        "likes": 0,
        "replies": 0,
        "reposts": 0,
        "shares": 0,
        "time": "5d",
        "datetime": "2025-12-29T17:21:56.000Z"
      },
      "is_cleaned": true,
      "data_type": "threads",
      "reposts_count": 0
    },
    {
      "url": "https://www.threads.net/@_n.rang_wqqp/post/DS4YrcKkgsb",
      "source_type": "threads",
      "source": "https://www.threads.net/@_n.rang_wqqp/post/DS4YrcKkgsb",
      "domain": "threads.net",
      "social_platform": "threads",
      "title": "Khúc này hài vãi, ê ai khều chương trình mời Huỳnh Lập tham gia tập nữa đi, mấy khúc có Huỳnh Lập, Q...",
      "content": "Khúc này hài vãi, ê ai khều chương trình mời Huỳnh Lập tham gia tập nữa đi, mấy khúc có Huỳnh Lập, Quang Trung, Lê Nhân cười muốn chết. Translate 12",
      "word_count": 31,
      "published_date": 1767083670.0,
      "published_datetime": "2025-12-30 08:34:30+00:00",
      "likes_count": 0,
      "shares_count": 0,
      "comments_count": 0,
      "views_count": 0,
      "reactions": null,
      "account_id": "_n.rang_wqqp",
      "account_name": "_n.rang_wqqp",
      "account_url": "https://www.threads.net/@_n.rang_wqqp",
      "post_id": "7975",
      "post_type": "thread",
      "raw_metadata": {
        "username": "_n.rang_wqqp",
        "likes": 0,
        "replies": 0,
        "reposts": 0,
        "shares": 0,
        "time": "5d",
        "datetime": "2025-12-30T08:34:30.000Z"
      },
      "is_cleaned": true,
      "data_type": "threads",
      "reposts_count": 0
    },
    {
      "url": "https://www.threads.net/@xiao_fan219/post/DHjIYKyTffc",
      "source_type": "threads",
      "source": "https://www.threads.net/@xiao_fan219/post/DHjIYKyTffc",
      "domain": "threads.net",
      "social_platform": "threads",
      "title": "Đang trông mong thông báo Day 5, 6 Hưng Yên. Huhu có thông báo phát, sốp sẽ ra mắt thêm khăn nha các...",
      "content": "Đang trông mong thông báo Day 5, 6 Hưng Yên. Huhu có thông báo phát, sốp sẽ ra mắt thêm khăn nha các bác . Huhu sốt ruột vô cùng",
      "word_count": 30,
      "published_date": 1742748065.0,
      "published_datetime": "2025-03-23 16:41:05+00:00",
      "likes_count": 0,
      "shares_count": 0,
      "comments_count": 0,
      "views_count": 0,
      "reactions": null,
      "account_id": "xiao_fan219",
      "account_name": "xiao_fan219",
      "account_url": "https://www.threads.net/@xiao_fan219",
      "post_id": "7974",
      "post_type": "thread",
      "raw_metadata": {
        "username": "xiao_fan219",
        "likes": 0,
        "replies": 0,
        "reposts": 0,
        "shares": 0,
        "time": "03/23/25",
        "datetime": "2025-03-23T16:41:05.000Z"
      },
      "is_cleaned": true,
      "data_type": "threads",
      "reposts_count": 0
    },
    {
      "url": "https://www.threads.net/@thnh.haoif_/post/DSxXhJLkgvo",
      "source_type": "threads",
      "source": "https://www.threads.net/@thnh.haoif_/post/DSxXhJLkgvo",
      "domain": "threads.net",
      "social_platform": "threads",
      "title": "em cần tìm thợ chụp kỷ yếu khu vực Hưng Yên ạ màu ảnh trong như này ạ",
      "content": "em cần tìm thợ chụp kỷ yếu khu vực Hưng Yên ạ màu ảnh trong như này ạ",
      "word_count": 18,
      "published_date": 1766848085.0,
      "published_datetime": "2025-12-27 15:08:05+00:00",
      "likes_count": 0,
      "shares_count": 0,
      "comments_count": 0,
      "views_count": 0,
      "reactions": null,
      "account_id": "thnh.haoif_",
      "account_name": "thnh.haoif_",
      "account_url": "https://www.threads.net/@thnh.haoif_",
      "post_id": "7973",
      "post_type": "thread",
      "raw_metadata": {
        "username": "thnh.haoif_",
        "likes": 0,
        "replies": 0,
        "reposts": 0,
        "shares": 0,
        "time": "12/27/25",
        "datetime": "2025-12-27T15:08:05.000Z"
      },
      "is_cleaned": true,
      "data_type": "threads",
      "reposts_count": 0
    },
    {
      "url": "https://www.threads.net/@maisong_me/post/DSMeU4Kk933",
      "source_type": "threads",
      "source": "https://www.threads.net/@maisong_me/post/DSMeU4Kk933",
      "domain": "threads.net",
      "social_platform": "threads",
      "title": "Mã 1581 trúng fs Hưng Yên không biết đã có chủ được ạ  em mua pass sợ scam quá ạ mong mng hỗ trợ e...",
      "content": "Mã 1581 trúng fs Hưng Yên không biết đã có chủ được ạ  em mua pass sợ scam quá ạ mong mng hỗ trợ em",
      "word_count": 25,
      "published_date": 1765610140.0,
      "published_datetime": "2025-12-13 07:15:40+00:00",
      "likes_count": 0,
      "shares_count": 0,
      "comments_count": 0,
      "views_count": 0,
      "reactions": null,
      "account_id": "maisong_me",
      "account_name": "maisong_me",
      "account_url": "https://www.threads.net/@maisong_me",
      "post_id": "7972",
      "post_type": "thread",
      "raw_metadata": {
        "username": "maisong_me",
        "likes": 0,
        "replies": 0,
        "reposts": 0,
        "shares": 0,
        "time": "12/13/25",
        "datetime": "2025-12-13T07:15:40.000Z"
      },
      "is_cleaned": true,
      "data_type": "threads",
      "reposts_count": 0
    },
    {
      "url": "https://www.threads.net/@nguyen_oanh_hr/post/DIoRtevTXHm",
      "source_type": "threads",
      "source": "https://www.threads.net/@nguyen_oanh_hr/post/DIoRtevTXHm",
      "domain": "threads.net",
      "social_platform": "threads",
      "title": "Có bạn nào ở Khoái Châu - Hưng Yên tìm việc làm Hành chính nhân sự ko ak. Mình đang có job lương cơ ...",
      "content": "Có bạn nào ở Khoái Châu - Hưng Yên tìm việc làm Hành chính nhân sự ko ak. Mình đang có job lương cơ bản 9tr phụ cấp trách nhiệm 3tr phụ cấp ăn trưa..., Full chế độ theo qđ nhà nước. Chi tiết ib m",
      "word_count": 46,
      "published_date": 1745068214.0,
      "published_datetime": "2025-04-19 13:10:14+00:00",
      "likes_count": 0,
      "shares_count": 0,
      "comments_count": 0,
      "views_count": 0,
      "reactions": null,
      "account_id": "nguyen_oanh_hr",
      "account_name": "nguyen_oanh_hr",
      "account_url": "https://www.threads.net/@nguyen_oanh_hr",
      "post_id": "7971",
      "post_type": "thread",
      "raw_metadata": {
        "username": "nguyen_oanh_hr",
        "likes": 0,
        "replies": 0,
        "reposts": 0,
        "shares": 0,
        "time": "04/19/25",
        "datetime": "2025-04-19T13:10:14.000Z"
      },
      "is_cleaned": true,
      "data_type": "threads",
      "reposts_count": 0
    },
    {
      "url": "https://www.threads.net/@phuclinh_1906/post/DBGNa6AvoTK",
      "source_type": "threads",
      "source": "https://www.threads.net/@phuclinh_1906/post/DBGNa6AvoTK",
      "domain": "threads.net",
      "social_platform": "threads",
      "title": "Mình 2000 Ở hưng yên - là công nhân sang nhạc - hướng nội - đang độc toàn thân :)))) - mặt mũi cũng...",
      "content": "Mình 2000 Ở hưng yên - là công nhân sang nhạc - hướng nội - đang độc toàn thân :)))) - mặt mũi cũng dễ nhìn -cao m7 ạ theo trend frofile ạ",
      "word_count": 33,
      "published_date": 1728892728.0,
      "published_datetime": "2024-10-14 07:58:48+00:00",
      "likes_count": 0,
      "shares_count": 0,
      "comments_count": 0,
      "views_count": 0,
      "reactions": null,
      "account_id": "phuclinh_1906",
      "account_name": "phuclinh_1906",
      "account_url": "https://www.threads.net/@phuclinh_1906",
      "post_id": "7970",
      "post_type": "thread",
      "raw_metadata": {
        "username": "phuclinh_1906",
        "likes": 0,
        "replies": 0,
        "reposts": 0,
        "shares": 0,
        "time": "10/14/24",
        "datetime": "2024-10-14T07:58:48.000Z"
      },
      "is_cleaned": true,
      "data_type": "threads",
      "reposts_count": 0
    },
    {
      "url": "https://www.threads.net/@nql_stock_93/post/DFMTMU_P84y",
      "source_type": "threads",
      "source": "https://www.threads.net/@nql_stock_93/post/DFMTMU_P84y",
      "domain": "threads.net",
      "social_platform": "threads",
      "title": "Hưng yên như thế mới là Hưng yên",
      "content": "Hưng yên như thế mới là Hưng yên",
      "word_count": 8,
      "published_date": 1737687016.0,
      "published_datetime": "2025-01-24 02:50:16+00:00",
      "likes_count": 0,
      "shares_count": 0,
      "comments_count": 0,
      "views_count": 0,
      "reactions": null,
      "account_id": "nql_stock_93",
      "account_name": "nql_stock_93",
      "account_url": "https://www.threads.net/@nql_stock_93",
      "post_id": "7969",
      "post_type": "thread",
      "raw_metadata": {
        "username": "nql_stock_93",
        "likes": 0,
        "replies": 0,
        "reposts": 0,
        "shares": 0,
        "time": "01/23/25",
        "datetime": "2025-01-24T02:50:16.000Z"
      },
      "is_cleaned": true,
      "data_type": "threads",
      "reposts_count": 0
    },
    {
      "url": "https://www.threads.net/@thutrang_le12/post/DTFPee3DlK1",
      "source_type": "threads",
      "source": "https://www.threads.net/@thutrang_le12/post/DTFPee3DlK1",
      "domain": "threads.net",
      "social_platform": "threads",
      "title": "9xx triệu có ngay lô đất ô tô đỗ cửa tại Đoàn Đào, Phù Cừ, Hưng Yên MT 5m, thoáng trước sau, gần khu...",
      "content": "9xx triệu có ngay lô đất ô tô đỗ cửa tại Đoàn Đào, Phù Cừ, Hưng Yên MT 5m, thoáng trước sau, gần khu CN. LH chi tiết 0983121206",
      "word_count": 29,
      "published_date": 1767514957.0,
      "published_datetime": "2026-01-04 08:22:37+00:00",
      "likes_count": 0,
      "shares_count": 0,
      "comments_count": 0,
      "views_count": 0,
      "reactions": null,
      "account_id": "thutrang_le12",
      "account_name": "thutrang_le12",
      "account_url": "https://www.threads.net/@thutrang_le12",
      "post_id": "7968",
      "post_type": "thread",
      "raw_metadata": {
        "username": "thutrang_le12",
        "likes": 0,
        "replies": 0,
        "reposts": 0,
        "shares": 0,
        "time": "1h",
        "datetime": "2026-01-04T08:22:37.000Z"
      },
      "is_cleaned": true,
      "data_type": "threads",
      "reposts_count": 0
    },
    {
      "url": "https://www.threads.net/@karideptry/post/DS7IQsBkljR",
      "source_type": "threads",
      "source": "https://www.threads.net/@karideptry/post/DS7IQsBkljR",
      "domain": "threads.net",
      "social_platform": "threads",
      "title": "Hay vcl, t khoái cái con khỉ màu hồng tên Lí Lắc nhất )))) Translate 12",
      "content": "Hay vcl, t khoái cái con khỉ màu hồng tên Lí Lắc nhất )))) Translate 12",
      "word_count": 16,
      "published_date": 1767175712.0,
      "published_datetime": "2025-12-31 10:08:32+00:00",
      "likes_count": 0,
      "shares_count": 0,
      "comments_count": 0,
      "views_count": 0,
      "reactions": null,
      "account_id": "karideptry",
      "account_name": "karideptry",
      "account_url": "https://www.threads.net/@karideptry",
      "post_id": "7967",
      "post_type": "thread",
      "raw_metadata": {
        "username": "karideptry",
        "likes": 0,
        "replies": 0,
        "reposts": 0,
        "shares": 0,
        "time": "4d",
        "datetime": "2025-12-31T10:08:32.000Z"
      },
      "is_cleaned": true,
      "data_type": "threads",
      "reposts_count": 0
    },
    {
      "url": "https://www.threads.net/@_.saudoichutt._/post/DHsXHPxyslW",
      "source_type": "threads",
      "source": "https://www.threads.net/@_.saudoichutt._/post/DHsXHPxyslW",
      "domain": "threads.net",
      "social_platform": "threads",
      "title": "B nào ở Hưng yên cho mình hỏi có chỗ nào khám da liễu uy tín khum ạ nếu có thì tiện thể cho em hỏi c...",
      "content": "B nào ở Hưng yên cho mình hỏi có chỗ nào khám da liễu uy tín khum ạ nếu có thì tiện thể cho em hỏi chi phí thế nào với ạ",
      "word_count": 32,
      "published_date": 1743057780.0,
      "published_datetime": "2025-03-27 06:43:00+00:00",
      "likes_count": 0,
      "shares_count": 0,
      "comments_count": 0,
      "views_count": 0,
      "reactions": null,
      "account_id": "_.saudoichutt._",
      "account_name": "_.saudoichutt._",
      "account_url": "https://www.threads.net/@_.saudoichutt._",
      "post_id": "7966",
      "post_type": "thread",
      "raw_metadata": {
        "username": "_.saudoichutt._",
        "likes": 0,
        "replies": 0,
        "reposts": 0,
        "shares": 0,
        "time": "03/27/25",
        "datetime": "2025-03-27T06:43:00.000Z"
      },
      "is_cleaned": true,
      "data_type": "threads",
      "reposts_count": 0
    },
    {
      "url": "https://www.threads.net/@nbdt_2401/post/DS6uY7IifA1",
      "source_type": "threads",
      "source": "https://www.threads.net/@nbdt_2401/post/DS6uY7IifA1",
      "domain": "threads.net",
      "social_platform": "threads",
      "title": "Thú thật gu t ko phải e ghệ tone hồng, mà là các chị cá tính, ngầu ngầu, xăm mình xỏ khuyên nhưng gặ...",
      "content": "Thú thật gu t ko phải e ghệ tone hồng, mà là các chị cá tính, ngầu ngầu, xăm mình xỏ khuyên nhưng gặp người lớn là chào, iu động vật, thấy con nít là mắt sáng như đèn pha. Một người biết nhõng nhẽo bên cạnh t, và cũng sẵn sàng vỗ về khi t nhõng nhẽo ngược lại. Trẻ con đúng lúc và người lớn đúng chỗ.",
      "word_count": 69,
      "published_date": 1767162066.0,
      "published_datetime": "2025-12-31 06:21:06+00:00",
      "likes_count": 0,
      "shares_count": 0,
      "comments_count": 0,
      "views_count": 0,
      "reactions": null,
      "account_id": "nbdt_2401",
      "account_name": "nbdt_2401",
      "account_url": "https://www.threads.net/@nbdt_2401",
      "post_id": "7965",
      "post_type": "thread",
      "raw_metadata": {
        "username": "nbdt_2401",
        "likes": 0,
        "replies": 0,
        "reposts": 0,
        "shares": 0,
        "time": "4d",
        "datetime": "2025-12-31T06:21:06.000Z"
      },
      "is_cleaned": true,
      "data_type": "threads",
      "reposts_count": 0
    },
    {
      "url": "https://www.threads.net/@innerroomm/post/DOU61BHgYxV",
      "source_type": "threads",
      "source": "https://www.threads.net/@innerroomm/post/DOU61BHgYxV",
      "domain": "threads.net",
      "social_platform": "threads",
      "title": "Thông điệp : \" Mình là cái cây mà bố mẹ đã dành cả cuộc đời để chăm sóc Sau này nhất định phải tỏa ...",
      "content": "Thông điệp : \" Mình là cái cây mà bố mẹ đã dành cả cuộc đời để chăm sóc Sau này nhất định phải tỏa bóng mát để bố mẹ được an yên tuổi già\"",
      "word_count": 35,
      "published_date": 1757303584.0,
      "published_datetime": "2025-09-08 03:53:04+00:00",
      "likes_count": 0,
      "shares_count": 0,
      "comments_count": 0,
      "views_count": 0,
      "reactions": null,
      "account_id": "innerroomm",
      "account_name": "innerroomm",
      "account_url": "https://www.threads.net/@innerroomm",
      "post_id": "7964",
      "post_type": "thread",
      "raw_metadata": {
        "username": "innerroomm",
        "likes": 0,
        "replies": 0,
        "reposts": 0,
        "shares": 0,
        "time": "09/07/25",
        "datetime": "2025-09-08T03:53:04.000Z"
      },
      "is_cleaned": true,
      "data_type": "threads",
      "reposts_count": 0
    },
    {
      "url": "https://www.threads.net/@raeju_02/post/DSfJGR8klzi",
      "source_type": "threads",
      "source": "https://www.threads.net/@raeju_02/post/DSfJGR8klzi",
      "domain": "threads.net",
      "social_platform": "threads",
      "title": "e hỏi lại lần cuối nhá RỐT CUỘC LÀ ĐẤT HƯNG YÊN CÓ CÁI GÌ VẬY Ạ!?!?!?!",
      "content": "e hỏi lại lần cuối nhá RỐT CUỘC LÀ ĐẤT HƯNG YÊN CÓ CÁI GÌ VẬY Ạ!?!?!?!",
      "word_count": 17,
      "published_date": 1766236545.0,
      "published_datetime": "2025-12-20 13:15:45+00:00",
      "likes_count": 0,
      "shares_count": 0,
      "comments_count": 0,
      "views_count": 0,
      "reactions": null,
      "account_id": "raeju_02",
      "account_name": "raeju_02",
      "account_url": "https://www.threads.net/@raeju_02",
      "post_id": "7963",
      "post_type": "thread",
      "raw_metadata": {
        "username": "raeju_02",
        "likes": 0,
        "replies": 0,
        "reposts": 0,
        "shares": 0,
        "time": "12/20/25",
        "datetime": "2025-12-20T13:15:45.000Z"
      },
      "is_cleaned": true,
      "data_type": "threads",
      "reposts_count": 0
    },
    {
      "url": "https://www.threads.net/@dinobeos.77/post/DLqyMtSTG-n",
      "source_type": "threads",
      "source": "https://www.threads.net/@dinobeos.77/post/DLqyMtSTG-n",
      "domain": "threads.net",
      "social_platform": "threads",
      "title": "Size gap đúng nghĩa  Quê quán: Thái Bình giờ là Hưng Yên )) Chiều cao: 1m86  Cân nặng: 90kg Thể...",
      "content": "Size gap đúng nghĩa  Quê quán: Thái Bình giờ là Hưng Yên )) Chiều cao: 1m86  Cân nặng: 90kg Thể thao: Gym,Bóng rổ Sở thích: Xem phim, Nấu ăn",
      "word_count": 29,
      "published_date": 1751594806.0,
      "published_datetime": "2025-07-04 02:06:46+00:00",
      "likes_count": 0,
      "shares_count": 0,
      "comments_count": 0,
      "views_count": 0,
      "reactions": null,
      "account_id": "dinobeos.77",
      "account_name": "dinobeos.77",
      "account_url": "https://www.threads.net/@dinobeos.77",
      "post_id": "7962",
      "post_type": "thread",
      "raw_metadata": {
        "username": "dinobeos.77",
        "likes": 0,
        "replies": 0,
        "reposts": 0,
        "shares": 0,
        "time": "07/03/25",
        "datetime": "2025-07-04T02:06:46.000Z"
      },
      "is_cleaned": true,
      "data_type": "threads",
      "reposts_count": 0
    },
    {
      "url": "https://www.threads.net/@_tmy.17/post/DSuyEKeCZmj",
      "source_type": "threads",
      "source": "https://www.threads.net/@_tmy.17/post/DSuyEKeCZmj",
      "domain": "threads.net",
      "social_platform": "threads",
      "title": "Có bác nào ở Hưng Yên đi show Bia 28 khum ạa, tui có vé rùi mà đi 1 mình nên tìm cạ đi chung về cho ...",
      "content": "Có bác nào ở Hưng Yên đi show Bia 28 khum ạa, tui có vé rùi mà đi 1 mình nên tìm cạ đi chung về cho đỡ sợ ạaaa. Tui ở Yên Mỹ ạ",
      "word_count": 35,
      "published_date": 1766761340.0,
      "published_datetime": "2025-12-26 15:02:20+00:00",
      "likes_count": 0,
      "shares_count": 0,
      "comments_count": 0,
      "views_count": 0,
      "reactions": null,
      "account_id": "_tmy.17",
      "account_name": "_tmy.17",
      "account_url": "https://www.threads.net/@_tmy.17",
      "post_id": "7961",
      "post_type": "thread",
      "raw_metadata": {
        "username": "_tmy.17",
        "likes": 0,
        "replies": 0,
        "reposts": 0,
        "shares": 0,
        "time": "12/26/25",
        "datetime": "2025-12-26T15:02:20.000Z"
      },
      "is_cleaned": true,
      "data_type": "threads",
      "reposts_count": 0
    },
    {
      "url": "https://www.threads.net/@ddidaoxiuuu/post/DSmssRjEkog",
      "source_type": "threads",
      "source": "https://www.threads.net/@ddidaoxiuuu/post/DSmssRjEkog",
      "domain": "threads.net",
      "social_platform": "threads",
      "title": "THẬT SỰ KHÔNG KHÍ HƯNG YÊN ĐÓ ĐÃ CÓ GÌ VẬY",
      "content": "THẬT SỰ KHÔNG KHÍ HƯNG YÊN ĐÓ ĐÃ CÓ GÌ VẬY",
      "word_count": 11,
      "published_date": 1766490087.0,
      "published_datetime": "2025-12-23 11:41:27+00:00",
      "likes_count": 0,
      "shares_count": 0,
      "comments_count": 0,
      "views_count": 0,
      "reactions": null,
      "account_id": "ddidaoxiuuu",
      "account_name": "ddidaoxiuuu",
      "account_url": "https://www.threads.net/@ddidaoxiuuu",
      "post_id": "7960",
      "post_type": "thread",
      "raw_metadata": {
        "username": "ddidaoxiuuu",
        "likes": 0,
        "replies": 0,
        "reposts": 0,
        "shares": 0,
        "time": "12/23/25",
        "datetime": "2025-12-23T11:41:27.000Z"
      },
      "is_cleaned": true,
      "data_type": "threads",
      "reposts_count": 0
    },
    {
      "url": "https://www.threads.net/@haquyenhr/post/DRdyrriEjrZ",
      "source_type": "threads",
      "source": "https://www.threads.net/@haquyenhr/post/DRdyrriEjrZ",
      "domain": "threads.net",
      "social_platform": "threads",
      "title": "Có bạn nào ở Hưng Yên đang tìm job không ạ. Tui đang có job về Phiên dịch và trợ ký kinh doanh tiếng...",
      "content": "Có bạn nào ở Hưng Yên đang tìm job không ạ. Tui đang có job về Phiên dịch và trợ ký kinh doanh tiếng Nhật. Lương upto 22tr. Chấp nhận UV mới về nước chưa kn  Làm cho công ty sản xuất Nhật ạ  Ib tui nhaaa",
      "word_count": 47,
      "published_date": 1764043754.0,
      "published_datetime": "2025-11-25 04:09:14+00:00",
      "likes_count": 0,
      "shares_count": 0,
      "comments_count": 0,
      "views_count": 0,
      "reactions": null,
      "account_id": "haquyenhr",
      "account_name": "haquyenhr",
      "account_url": "https://www.threads.net/@haquyenhr",
      "post_id": "7959",
      "post_type": "thread",
      "raw_metadata": {
        "username": "haquyenhr",
        "likes": 0,
        "replies": 0,
        "reposts": 0,
        "shares": 0,
        "time": "11/24/25",
        "datetime": "2025-11-25T04:09:14.000Z"
      },
      "is_cleaned": true,
      "data_type": "threads",
      "reposts_count": 0
    },
    {
      "url": "https://www.threads.net/@_edelweiss.ng_/post/DQT-C16kVO7",
      "source_type": "threads",
      "source": "https://www.threads.net/@_edelweiss.ng_/post/DQT-C16kVO7",
      "domain": "threads.net",
      "social_platform": "threads",
      "title": "Đào suộc day2 mùa đông Hưng Yên để lưu trữ  Translate 12",
      "content": "Đào suộc day2 mùa đông Hưng Yên để lưu trữ  Translate 12",
      "word_count": 12,
      "published_date": 1761566683.0,
      "published_datetime": "2025-10-27 12:04:43+00:00",
      "likes_count": 0,
      "shares_count": 0,
      "comments_count": 0,
      "views_count": 0,
      "reactions": null,
      "account_id": "_edelweiss.ng_",
      "account_name": "_edelweiss.ng_",
      "account_url": "https://www.threads.net/@_edelweiss.ng_",
      "post_id": "7958",
      "post_type": "thread",
      "raw_metadata": {
        "username": "_edelweiss.ng_",
        "likes": 0,
        "replies": 0,
        "reposts": 0,
        "shares": 0,
        "time": "10/27/25",
        "datetime": "2025-10-27T12:04:43.000Z"
      },
      "is_cleaned": true,
      "data_type": "threads",
      "reposts_count": 0
    },
    {
      "url": "https://www.threads.net/@quyt_va_ca/post/DSsO6YKE4OB",
      "source_type": "threads",
      "source": "https://www.threads.net/@quyt_va_ca/post/DSsO6YKE4OB",
      "domain": "threads.net",
      "social_platform": "threads",
      "title": "ai có nhu cầu nhượng lại kì tháng 3 ở hà nội hay hưng yên không ạ,  em 2k8 rất rất cần ạ, các bác n...",
      "content": "ai có nhu cầu nhượng lại kì tháng 3 ở hà nội hay hưng yên không ạ,  em 2k8 rất rất cần ạ, các bác nào chưa vội có thể nhượng lại cho em được k ạ Translate 12",
      "word_count": 39,
      "published_date": 1766675801.0,
      "published_datetime": "2025-12-25 15:16:41+00:00",
      "likes_count": 0,
      "shares_count": 0,
      "comments_count": 0,
      "views_count": 0,
      "reactions": null,
      "account_id": "quyt_va_ca",
      "account_name": "quyt_va_ca",
      "account_url": "https://www.threads.net/@quyt_va_ca",
      "post_id": "7957",
      "post_type": "thread",
      "raw_metadata": {
        "username": "quyt_va_ca",
        "likes": 0,
        "replies": 0,
        "reposts": 0,
        "shares": 0,
        "time": "12/25/25",
        "datetime": "2025-12-25T15:16:41.000Z"
      },
      "is_cleaned": true,
      "data_type": "threads",
      "reposts_count": 0
    },
    {
      "url": "https://www.threads.net/@tiemvethom/post/DOfN35vEgmI",
      "source_type": "threads",
      "source": "https://www.threads.net/@tiemvethom/post/DOfN35vEgmI",
      "domain": "threads.net",
      "social_platform": "threads",
      "title": "Tụi mình - fan G-Dragon và BIGBANG - xin Gai con truyền kinh nghiệm đu concert ở Ocean về phương tiệ...",
      "content": "Tụi mình - fan G-Dragon và BIGBANG - xin Gai con truyền kinh nghiệm đu concert ở Ocean về phương tiện đi lại, thuê chỗ ở, chỗ ăn uống  Đặc biệt từ các tỉnh trong Nam bay ra Hà Nội đi ra Hưng Yên  Translate 12",
      "word_count": 46,
      "published_date": 1757649114.0,
      "published_datetime": "2025-09-12 03:51:54+00:00",
      "likes_count": 0,
      "shares_count": 0,
      "comments_count": 0,
      "views_count": 0,
      "reactions": null,
      "account_id": "tiemvethom",
      "account_name": "tiemvethom",
      "account_url": "https://www.threads.net/@tiemvethom",
      "post_id": "7956",
      "post_type": "thread",
      "raw_metadata": {
        "username": "tiemvethom",
        "likes": 0,
        "replies": 0,
        "reposts": 0,
        "shares": 0,
        "time": "09/11/25",
        "datetime": "2025-09-12T03:51:54.000Z"
      },
      "is_cleaned": true,
      "data_type": "threads",
      "reposts_count": 0
    },
    {
      "url": "https://www.threads.net/@embedanglamhr/post/DQ5t7LJk2v2",
      "source_type": "threads",
      "source": "https://www.threads.net/@embedanglamhr/post/DQ5t7LJk2v2",
      "domain": "threads.net",
      "social_platform": "threads",
      "title": "Chỉ cần bạn: Tốt nghiệp Cao đẳng trở lên, Biết chút về QAQC (chưa biết sẽ được đào tạo tận nơi )...",
      "content": "Chỉ cần bạn: Tốt nghiệp Cao đẳng trở lên, Biết chút về QAQC (chưa biết sẽ được đào tạo tận nơi ), Có tiếng Nhật N3 trở lên",
      "word_count": 28,
      "published_date": 1762833300.0,
      "published_datetime": "2025-11-11 03:55:00+00:00",
      "likes_count": 0,
      "shares_count": 0,
      "comments_count": 0,
      "views_count": 0,
      "reactions": null,
      "account_id": "embedanglamhr",
      "account_name": "embedanglamhr",
      "account_url": "https://www.threads.net/@embedanglamhr",
      "post_id": "7955",
      "post_type": "thread",
      "raw_metadata": {
        "username": "embedanglamhr",
        "likes": 0,
        "replies": 0,
        "reposts": 0,
        "shares": 0,
        "time": "11/10/25",
        "datetime": "2025-11-11T03:55:00.000Z"
      },
      "is_cleaned": true,
      "data_type": "threads",
      "reposts_count": 0
    },
    {
      "url": "https://www.threads.net/@dangthicamly05/post/DN17YbU5JtX",
      "source_type": "threads",
      "source": "https://www.threads.net/@dangthicamly05/post/DN17YbU5JtX",
      "domain": "threads.net",
      "social_platform": "threads",
      "title": "Mình sinh năm 2000 và đến từ Ân Thi, Hưng Yên",
      "content": "Mình sinh năm 2000 và đến từ Ân Thi, Hưng Yên",
      "word_count": 11,
      "published_date": 1756263695.0,
      "published_datetime": "2025-08-27 03:01:35+00:00",
      "likes_count": 0,
      "shares_count": 0,
      "comments_count": 0,
      "views_count": 0,
      "reactions": null,
      "account_id": "dangthicamly05",
      "account_name": "dangthicamly05",
      "account_url": "https://www.threads.net/@dangthicamly05",
      "post_id": "7954",
      "post_type": "thread",
      "raw_metadata": {
        "username": "dangthicamly05",
        "likes": 0,
        "replies": 0,
        "reposts": 0,
        "shares": 0,
        "time": "08/26/25",
        "datetime": "2025-08-27T03:01:35.000Z"
      },
      "is_cleaned": true,
      "data_type": "threads",
      "reposts_count": 0
    },
    {
      "url": "https://www.threads.net/@hangansocola/post/DK2NmYuplPE",
      "source_type": "threads",
      "source": "https://www.threads.net/@hangansocola/post/DK2NmYuplPE",
      "domain": "threads.net",
      "social_platform": "threads",
      "title": "Từ OCP3 về Hà Nội bằng cách nào??? Ngoài bằng grabbexanhsm các bạn có thể gọi taxi Hưng Yên nhé. H...",
      "content": "Từ OCP3 về Hà Nội bằng cách nào??? Ngoài bằng grabbexanhsm các bạn có thể gọi taxi Hưng Yên nhé. Hôm đi gieo mầm tui có đặt hãng này giá theo đồng hồ ko chặt chém. Share cho các bạn mai di chuyển ạ.",
      "word_count": 44,
      "published_date": 1749830788.0,
      "published_datetime": "2025-06-13 16:06:28+00:00",
      "likes_count": 0,
      "shares_count": 0,
      "comments_count": 0,
      "views_count": 0,
      "reactions": null,
      "account_id": "hangansocola",
      "account_name": "hangansocola",
      "account_url": "https://www.threads.net/@hangansocola",
      "post_id": "7953",
      "post_type": "thread",
      "raw_metadata": {
        "username": "hangansocola",
        "likes": 0,
        "replies": 0,
        "reposts": 0,
        "shares": 0,
        "time": "06/13/25",
        "datetime": "2025-06-13T16:06:28.000Z"
      },
      "is_cleaned": true,
      "data_type": "threads",
      "reposts_count": 0
    },
    {
      "url": "https://www.threads.net/@vansnams/post/DSMtpPRksxn",
      "source_type": "threads",
      "source": "https://www.threads.net/@vansnams/post/DSMtpPRksxn",
      "domain": "threads.net",
      "social_platform": "threads",
      "title": "Mình đang muốn book make up ở khu vực Ecorpark- Hưng Yên ngày 2012 ạ.",
      "content": "Mình đang muốn book make up ở khu vực Ecorpark- Hưng Yên ngày 2012 ạ.",
      "word_count": 15,
      "published_date": 1765618171.0,
      "published_datetime": "2025-12-13 09:29:31+00:00",
      "likes_count": 0,
      "shares_count": 0,
      "comments_count": 0,
      "views_count": 0,
      "reactions": null,
      "account_id": "vansnams",
      "account_name": "vansnams",
      "account_url": "https://www.threads.net/@vansnams",
      "post_id": "7952",
      "post_type": "thread",
      "raw_metadata": {
        "username": "vansnams",
        "likes": 0,
        "replies": 0,
        "reposts": 0,
        "shares": 0,
        "time": "12/13/25",
        "datetime": "2025-12-13T09:29:31.000Z"
      },
      "is_cleaned": true,
      "data_type": "threads",
      "reposts_count": 0
    },
    {
      "url": "https://www.threads.net/@_quynn_125/post/DP8MzaRDzXU",
      "source_type": "threads",
      "source": "https://www.threads.net/@_quynn_125/post/DP8MzaRDzXU",
      "domain": "threads.net",
      "social_platform": "threads",
      "title": "mn có thể rcm cho e vài thợ chụp cá nhân ảnh đẹp đc kh ạ e ở Hưng Yên đừng seeding ạ, e cảm ơn nhì...",
      "content": "mn có thể rcm cho e vài thợ chụp cá nhân ảnh đẹp đc kh ạ e ở Hưng Yên đừng seeding ạ, e cảm ơn nhìu",
      "word_count": 27,
      "published_date": 1760769115.0,
      "published_datetime": "2025-10-18 06:31:55+00:00",
      "likes_count": 0,
      "shares_count": 0,
      "comments_count": 0,
      "views_count": 0,
      "reactions": null,
      "account_id": "_quynn_125",
      "account_name": "_quynn_125",
      "account_url": "https://www.threads.net/@_quynn_125",
      "post_id": "7951",
      "post_type": "thread",
      "raw_metadata": {
        "username": "_quynn_125",
        "likes": 0,
        "replies": 0,
        "reposts": 0,
        "shares": 0,
        "time": "10/18/25",
        "datetime": "2025-10-18T06:31:55.000Z"
      },
      "is_cleaned": true,
      "data_type": "threads",
      "reposts_count": 0
    },
    {
      "url": "https://www.threads.net/@quynhtrag6/post/DPBCpROgb8s",
      "source_type": "threads",
      "source": "https://www.threads.net/@quynhtrag6/post/DPBCpROgb8s",
      "domain": "threads.net",
      "social_platform": "threads",
      "title": "Mọi người ơi !! Em đag tìm thợ chụp ảnh nhóm 3ng , chụp full ngày 3011 budget600-800 ạ e ở hưng ...",
      "content": "Mọi người ơi !! Em đag tìm thợ chụp ảnh nhóm 3ng , chụp full ngày 3011 budget600-800 ạ e ở hưng yên (màu ảnh như dưới nhé ạ )",
      "word_count": 30,
      "published_date": 1758784077.0,
      "published_datetime": "2025-09-25 07:07:57+00:00",
      "likes_count": 0,
      "shares_count": 0,
      "comments_count": 0,
      "views_count": 0,
      "reactions": null,
      "account_id": "quynhtrag6",
      "account_name": "quynhtrag6",
      "account_url": "https://www.threads.net/@quynhtrag6",
      "post_id": "7950",
      "post_type": "thread",
      "raw_metadata": {
        "username": "quynhtrag6",
        "likes": 0,
        "replies": 0,
        "reposts": 0,
        "shares": 0,
        "time": "09/25/25",
        "datetime": "2025-09-25T07:07:57.000Z"
      },
      "is_cleaned": true,
      "data_type": "threads",
      "reposts_count": 0
    },
    {
      "url": "https://www.threads.net/@hvidangiuu/post/DSW9Xtsk7aY",
      "source_type": "threads",
      "source": "https://www.threads.net/@hvidangiuu/post/DSW9Xtsk7aY",
      "domain": "threads.net",
      "social_platform": "threads",
      "title": "khẩn cầu tìm thợ make kỷ íu ở hưng yên ạaa",
      "content": "khẩn cầu tìm thợ make kỷ íu ở hưng yên ạaa",
      "word_count": 11,
      "published_date": 1765961961.0,
      "published_datetime": "2025-12-17 08:59:21+00:00",
      "likes_count": 0,
      "shares_count": 0,
      "comments_count": 0,
      "views_count": 0,
      "reactions": null,
      "account_id": "hvidangiuu",
      "account_name": "hvidangiuu",
      "account_url": "https://www.threads.net/@hvidangiuu",
      "post_id": "7949",
      "post_type": "thread",
      "raw_metadata": {
        "username": "hvidangiuu",
        "likes": 0,
        "replies": 0,
        "reposts": 0,
        "shares": 0,
        "time": "12/17/25",
        "datetime": "2025-12-17T08:59:21.000Z"
      },
      "is_cleaned": true,
      "data_type": "threads",
      "reposts_count": 0
    },
    {
      "url": "https://www.threads.net/@aohtu._/post/DLKUBfZxsTe",
      "source_type": "threads",
      "source": "https://www.threads.net/@aohtu._/post/DLKUBfZxsTe",
      "domain": "threads.net",
      "social_platform": "threads",
      "title": "Không makecolor đâu nhé Huhu mệt ẻ Ai Thái Bình- Hưng Yên thì qua phơi thóc giùm iii",
      "content": "Không makecolor đâu nhé Huhu mệt ẻ Ai Thái Bình- Hưng Yên thì qua phơi thóc giùm iii",
      "word_count": 18,
      "published_date": 1750505244.0,
      "published_datetime": "2025-06-21 11:27:24+00:00",
      "likes_count": 0,
      "shares_count": 0,
      "comments_count": 0,
      "views_count": 0,
      "reactions": null,
      "account_id": "aohtu._",
      "account_name": "aohtu._",
      "account_url": "https://www.threads.net/@aohtu._",
      "post_id": "7948",
      "post_type": "thread",
      "raw_metadata": {
        "username": "aohtu._",
        "likes": 0,
        "replies": 0,
        "reposts": 0,
        "shares": 0,
        "time": "06/21/25",
        "datetime": "2025-06-21T11:27:24.000Z"
      },
      "is_cleaned": true,
      "data_type": "threads",
      "reposts_count": 0
    },
    {
      "url": "https://www.threads.net/@nhu.huyen94/post/DSyjJunD5r4",
      "source_type": "threads",
      "source": "https://www.threads.net/@nhu.huyen94/post/DSyjJunD5r4",
      "domain": "threads.net",
      "social_platform": "threads",
      "title": "-Mình đang sống và làm việc tại Nhật -Thu nhập 5x-7x tháng - Chiều cao 1m57,ngoại hình bình thường ...",
      "content": "-Mình đang sống và làm việc tại Nhật -Thu nhập 5x-7x tháng - Chiều cao 1m57,ngoại hình bình thường -Lý do độc thân lâu như vậy vì mình cũng muốn chuẩn bị cho sự nghiệp, tài chính của bản thân vững 1 chút để giảm gánh nặng cho bạn trai -Mình mong quen được 1 bạn nam trưởng thành, tử tế, có đạo đức, tài chính hơn mình chút - Chấp nhận yêu xa miễn nghiêm túc hướng tới kết quả tốt đẹp - Quê quán miền Bắc, gần Hưng Yên Hà Nội - Hữu duyên thấy phù hợp hãy ib cho mình nhé! Translate 12",
      "word_count": 106,
      "published_date": 1766887739.0,
      "published_datetime": "2025-12-28 02:08:59+00:00",
      "likes_count": 0,
      "shares_count": 0,
      "comments_count": 0,
      "views_count": 0,
      "reactions": null,
      "account_id": "nhu.huyen94",
      "account_name": "nhu.huyen94",
      "account_url": "https://www.threads.net/@nhu.huyen94",
      "post_id": "7947",
      "post_type": "thread",
      "raw_metadata": {
        "username": "nhu.huyen94",
        "likes": 0,
        "replies": 0,
        "reposts": 0,
        "shares": 0,
        "time": "12/27/25",
        "datetime": "2025-12-28T02:08:59.000Z"
      },
      "is_cleaned": true,
      "data_type": "threads",
      "reposts_count": 0
    },
    {
      "url": "https://www.threads.net/@jamia_9933/post/C_IsqzlhoeL",
      "source_type": "threads",
      "source": "https://www.threads.net/@jamia_9933/post/C_IsqzlhoeL",
      "domain": "threads.net",
      "social_platform": "threads",
      "title": "Tìm phòng trọ mà stress quá mấy ní ơi  Tui đang muốn tìm phòng trọ cho 1 nữ, tài chính 3tr, vskk,...",
      "content": "Tìm phòng trọ mà stress quá mấy ní ơi  Tui đang muốn tìm phòng trọ cho 1 nữ, tài chính 3tr, vskk, quanh khu vực Yên Hoà, Trung Kính, Hoa Bằng, Tú Mỡ, Trần Duy Hưng ạ. Có ai biết chỗ nào đang có phòng trống cho thuê cho tui xin thông tin với ạ",
      "word_count": 55,
      "published_date": 1724681253.0,
      "published_datetime": "2024-08-26 14:07:33+00:00",
      "likes_count": 0,
      "shares_count": 0,
      "comments_count": 0,
      "views_count": 0,
      "reactions": null,
      "account_id": "jamia_9933",
      "account_name": "jamia_9933",
      "account_url": "https://www.threads.net/@jamia_9933",
      "post_id": "7946",
      "post_type": "thread",
      "raw_metadata": {
        "username": "jamia_9933",
        "likes": 0,
        "replies": 0,
        "reposts": 0,
        "shares": 0,
        "time": "08/26/24",
        "datetime": "2024-08-26T14:07:33.000Z"
      },
      "is_cleaned": true,
      "data_type": "threads",
      "reposts_count": 0
    },
    {
      "url": "https://www.threads.net/@kimyenn2000/post/DS7XjrCkuQv",
      "source_type": "threads",
      "source": "https://www.threads.net/@kimyenn2000/post/DS7XjrCkuQv",
      "domain": "threads.net",
      "social_platform": "threads",
      "title": "ai ở HN rủ tuii đi nhậu coaii",
      "content": "ai ở HN rủ tuii đi nhậu coaii",
      "word_count": 8,
      "published_date": 1767183650.0,
      "published_datetime": "2025-12-31 12:20:50+00:00",
      "likes_count": 0,
      "shares_count": 0,
      "comments_count": 0,
      "views_count": 0,
      "reactions": null,
      "account_id": "kimyenn2000",
      "account_name": "kimyenn2000",
      "account_url": "https://www.threads.net/@kimyenn2000",
      "post_id": "7945",
      "post_type": "thread",
      "raw_metadata": {
        "username": "kimyenn2000",
        "likes": 0,
        "replies": 0,
        "reposts": 0,
        "shares": 0,
        "time": "3d",
        "datetime": "2025-12-31T12:20:50.000Z"
      },
      "is_cleaned": true,
      "data_type": "threads",
      "reposts_count": 0
    },
    {
      "url": "https://www.threads.net/@nguyenlan62088/post/DRxHC2gjy7h",
      "source_type": "threads",
      "source": "https://www.threads.net/@nguyenlan62088/post/DRxHC2gjy7h",
      "domain": "threads.net",
      "social_platform": "threads",
      "title": "em cần book thợ chụp ảnh sáng 2812 tại đông hưng thái bình cũ ( xã đông hưng - hưng yên ) Translat...",
      "content": "em cần book thợ chụp ảnh sáng 2812 tại đông hưng thái bình cũ ( xã đông hưng - hưng yên ) Translate 12",
      "word_count": 24,
      "published_date": 1764691964.0,
      "published_datetime": "2025-12-02 16:12:44+00:00",
      "likes_count": 0,
      "shares_count": 0,
      "comments_count": 0,
      "views_count": 0,
      "reactions": null,
      "account_id": "nguyenlan62088",
      "account_name": "nguyenlan62088",
      "account_url": "https://www.threads.net/@nguyenlan62088",
      "post_id": "7944",
      "post_type": "thread",
      "raw_metadata": {
        "username": "nguyenlan62088",
        "likes": 0,
        "replies": 0,
        "reposts": 0,
        "shares": 0,
        "time": "12/02/25",
        "datetime": "2025-12-02T16:12:44.000Z"
      },
      "is_cleaned": true,
      "data_type": "threads",
      "reposts_count": 0
    },
    {
      "url": "https://www.threads.net/@nguyenchien27/post/DP-Fvm2E43N",
      "source_type": "threads",
      "source": "https://www.threads.net/@nguyenchien27/post/DP-Fvm2E43N",
      "domain": "threads.net",
      "social_platform": "threads",
      "title": "Ngày mai 1910 Khởi công sân vận động tổ chim 50.000 chỗ ngồi tại thôn Sở Đông - xã Nghĩa Trụ ( đối...",
      "content": "Ngày mai 1910 Khởi công sân vận động tổ chim 50.000 chỗ ngồi tại thôn Sở Đông - xã Nghĩa Trụ ( đối diện đại học Bách Khoa - HN cơ sở 2 ) mặt đường 379.",
      "word_count": 37,
      "published_date": 1760832523.0,
      "published_datetime": "2025-10-19 00:08:43+00:00",
      "likes_count": 0,
      "shares_count": 0,
      "comments_count": 0,
      "views_count": 0,
      "reactions": null,
      "account_id": "nguyenchien27",
      "account_name": "nguyenchien27",
      "account_url": "https://www.threads.net/@nguyenchien27",
      "post_id": "7943",
      "post_type": "thread",
      "raw_metadata": {
        "username": "nguyenchien27",
        "likes": 0,
        "replies": 0,
        "reposts": 0,
        "shares": 0,
        "time": "10/18/25",
        "datetime": "2025-10-19T00:08:43.000Z"
      },
      "is_cleaned": true,
      "data_type": "threads",
      "reposts_count": 0
    },
    {
      "url": "https://www.threads.net/@tr.ann28/post/C7OyRezvXx-",
      "source_type": "threads",
      "source": "https://www.threads.net/@tr.ann28/post/C7OyRezvXx-",
      "domain": "threads.net",
      "social_platform": "threads",
      "title": "len lỏi giữa những đám mây  bị mê Ecopark Hưng Yên",
      "content": "len lỏi giữa những đám mây  bị mê Ecopark Hưng Yên",
      "word_count": 11,
      "published_date": 1716295583.0,
      "published_datetime": "2024-05-21 12:46:23+00:00",
      "likes_count": 0,
      "shares_count": 0,
      "comments_count": 0,
      "views_count": 0,
      "reactions": null,
      "account_id": "tr.ann28",
      "account_name": "tr.ann28",
      "account_url": "https://www.threads.net/@tr.ann28",
      "post_id": "7942",
      "post_type": "thread",
      "raw_metadata": {
        "username": "tr.ann28",
        "likes": 0,
        "replies": 0,
        "reposts": 0,
        "shares": 0,
        "time": "05/21/24",
        "datetime": "2024-05-21T12:46:23.000Z"
      },
      "is_cleaned": true,
      "data_type": "threads",
      "reposts_count": 0
    },
    {
      "url": "https://www.threads.net/@trabuta02/post/DPGqeb3jz0M",
      "source_type": "threads",
      "source": "https://www.threads.net/@trabuta02/post/DPGqeb3jz0M",
      "domain": "threads.net",
      "social_platform": "threads",
      "title": "Lớp nền ra ngoài về không lỡ tẩy trang  Dù cổ có lệch tone",
      "content": "Lớp nền ra ngoài về không lỡ tẩy trang  Dù cổ có lệch tone",
      "word_count": 14,
      "published_date": 1758972803.0,
      "published_datetime": "2025-09-27 11:33:23+00:00",
      "likes_count": 0,
      "shares_count": 0,
      "comments_count": 0,
      "views_count": 0,
      "reactions": null,
      "account_id": "trabuta02",
      "account_name": "trabuta02",
      "account_url": "https://www.threads.net/@trabuta02",
      "post_id": "7941",
      "post_type": "thread",
      "raw_metadata": {
        "username": "trabuta02",
        "likes": 0,
        "replies": 0,
        "reposts": 0,
        "shares": 0,
        "time": "09/27/25",
        "datetime": "2025-09-27T11:33:23.000Z"
      },
      "is_cleaned": true,
      "data_type": "threads",
      "reposts_count": 0
    },
    {
      "url": "https://www.threads.net/@lumis._allforkaypisu/post/DK3JLQ3Tju-",
      "source_type": "threads",
      "source": "https://www.threads.net/@lumis._allforkaypisu/post/DK3JLQ3Tju-",
      "domain": "threads.net",
      "social_platform": "threads",
      "title": "Thật sự...là encore ở Hưng Yên rồi",
      "content": "Thật sự...là encore ở Hưng Yên rồi",
      "word_count": 7,
      "published_date": 1749862023.0,
      "published_datetime": "2025-06-14 00:47:03+00:00",
      "likes_count": 0,
      "shares_count": 0,
      "comments_count": 0,
      "views_count": 0,
      "reactions": null,
      "account_id": "lumis._allforkaypisu",
      "account_name": "lumis._allforkaypisu",
      "account_url": "https://www.threads.net/@lumis._allforkaypisu",
      "post_id": "7940",
      "post_type": "thread",
      "raw_metadata": {
        "username": "lumis._allforkaypisu",
        "likes": 0,
        "replies": 0,
        "reposts": 0,
        "shares": 0,
        "time": "06/13/25",
        "datetime": "2025-06-14T00:47:03.000Z"
      },
      "is_cleaned": true,
      "data_type": "threads",
      "reposts_count": 0
    },
    {
      "url": "https://www.threads.net/@mei._xsan/post/DS5Sg2ek6GU",
      "source_type": "threads",
      "source": "https://www.threads.net/@mei._xsan/post/DS5Sg2ek6GU",
      "domain": "threads.net",
      "social_platform": "threads",
      "title": "giao thừa ăn 12 quả nho thì có được hẹn hò với eom seonghyeon không vậy? Translate 13",
      "content": "giao thừa ăn 12 quả nho thì có được hẹn hò với eom seonghyeon không vậy? Translate 13",
      "word_count": 18,
      "published_date": 1767113896.0,
      "published_datetime": "2025-12-30 16:58:16+00:00",
      "likes_count": 0,
      "shares_count": 0,
      "comments_count": 0,
      "views_count": 0,
      "reactions": null,
      "account_id": "mei._xsan",
      "account_name": "mei._xsan",
      "account_url": "https://www.threads.net/@mei._xsan",
      "post_id": "7939",
      "post_type": "thread",
      "raw_metadata": {
        "username": "mei._xsan",
        "likes": 0,
        "replies": 0,
        "reposts": 0,
        "shares": 0,
        "time": "4d",
        "datetime": "2025-12-30T16:58:16.000Z"
      },
      "is_cleaned": true,
      "data_type": "threads",
      "reposts_count": 0
    },
    {
      "url": "https://www.threads.net/@lilylinh89/post/DSMNWeBj9d0",
      "source_type": "threads",
      "source": "https://www.threads.net/@lilylinh89/post/DSMNWeBj9d0",
      "domain": "threads.net",
      "social_platform": "threads",
      "title": "Cuối năm rồi bạn nào cần nuôi hok  Cty tui HQ ở Hưng Yên cần tuyển 1 bạn Tuyển dụng - Đào tạo có cầ...",
      "content": "Cuối năm rồi bạn nào cần nuôi hok  Cty tui HQ ở Hưng Yên cần tuyển 1 bạn Tuyển dụng - Đào tạo có cầm tay chỉ việc, hỗ trỡ nhà ở (Ecopark) , xe đưa đón, môi trường làm việc nhiều cơ hội rèn luyện ngôn ngữ. Quan tâm cmt t gửi JD nha",
      "word_count": 55,
      "published_date": 1765601240.0,
      "published_datetime": "2025-12-13 04:47:20+00:00",
      "likes_count": 0,
      "shares_count": 0,
      "comments_count": 0,
      "views_count": 0,
      "reactions": null,
      "account_id": "lilylinh89",
      "account_name": "lilylinh89",
      "account_url": "https://www.threads.net/@lilylinh89",
      "post_id": "7938",
      "post_type": "thread",
      "raw_metadata": {
        "username": "lilylinh89",
        "likes": 0,
        "replies": 0,
        "reposts": 0,
        "shares": 0,
        "time": "12/12/25",
        "datetime": "2025-12-13T04:47:20.000Z"
      },
      "is_cleaned": true,
      "data_type": "threads",
      "reposts_count": 0
    },
    {
      "url": "https://www.threads.net/@m_helennnnn/post/DObVAy2Ehyn",
      "source_type": "threads",
      "source": "https://www.threads.net/@m_helennnnn/post/DObVAy2Ehyn",
      "domain": "threads.net",
      "social_platform": "threads",
      "title": "Cả nhà ơi, mình quê ở Thái Bình cũ (giờ là Hưng Yên), mua xe ở Hà Nội thì có đăng ký lấy biển ở HN l...",
      "content": "Cả nhà ơi, mình quê ở Thái Bình cũ (giờ là Hưng Yên), mua xe ở Hà Nội thì có đăng ký lấy biển ở HN luôn k nhỉ Nhờ cả nhà giải đáp thắc mắc với ạ",
      "word_count": 38,
      "published_date": 1757518639.0,
      "published_datetime": "2025-09-10 15:37:19+00:00",
      "likes_count": 0,
      "shares_count": 0,
      "comments_count": 0,
      "views_count": 0,
      "reactions": null,
      "account_id": "m_helennnnn",
      "account_name": "m_helennnnn",
      "account_url": "https://www.threads.net/@m_helennnnn",
      "post_id": "7937",
      "post_type": "thread",
      "raw_metadata": {
        "username": "m_helennnnn",
        "likes": 0,
        "replies": 0,
        "reposts": 0,
        "shares": 0,
        "time": "09/10/25",
        "datetime": "2025-09-10T15:37:19.000Z"
      },
      "is_cleaned": true,
      "data_type": "threads",
      "reposts_count": 0
    },
    {
      "url": "https://www.threads.net/@callmebysoul/post/DSxNmgvAYvL",
      "source_type": "threads",
      "source": "https://www.threads.net/@callmebysoul/post/DSxNmgvAYvL",
      "domain": "threads.net",
      "social_platform": "threads",
      "title": "Má nào hỏi khôn thế: Tháng 4 hai có lịch Hưng Yên không ạ )))))))))) May ổng tỉnh ổng kêu biết sao ...",
      "content": "Má nào hỏi khôn thế: Tháng 4 hai có lịch Hưng Yên không ạ )))))))))) May ổng tỉnh ổng kêu biết sao được em",
      "word_count": 24,
      "published_date": 1766842886.0,
      "published_datetime": "2025-12-27 13:41:26+00:00",
      "likes_count": 0,
      "shares_count": 0,
      "comments_count": 0,
      "views_count": 0,
      "reactions": null,
      "account_id": "callmebysoul",
      "account_name": "callmebysoul",
      "account_url": "https://www.threads.net/@callmebysoul",
      "post_id": "7936",
      "post_type": "thread",
      "raw_metadata": {
        "username": "callmebysoul",
        "likes": 0,
        "replies": 0,
        "reposts": 0,
        "shares": 0,
        "time": "12/27/25",
        "datetime": "2025-12-27T13:41:26.000Z"
      },
      "is_cleaned": true,
      "data_type": "threads",
      "reposts_count": 0
    },
    {
      "url": "https://www.threads.net/@thanh6211huyen/post/DR1MycHEsDB",
      "source_type": "threads",
      "source": "https://www.threads.net/@thanh6211huyen/post/DR1MycHEsDB",
      "domain": "threads.net",
      "social_platform": "threads",
      "title": "Nghe nói đăng bài trên này , nhiều người biết đến . Nữ sn 1985 cần tìm 1 công việc bán thời gian ( ...",
      "content": "Nghe nói đăng bài trên này , nhiều người biết đến . Nữ sn 1985 cần tìm 1 công việc bán thời gian ( từ 9h sáng _ 16h ) quanh khu vực tphy.",
      "word_count": 34,
      "published_date": 1764829193.0,
      "published_datetime": "2025-12-04 06:19:53+00:00",
      "likes_count": 0,
      "shares_count": 0,
      "comments_count": 0,
      "views_count": 0,
      "reactions": null,
      "account_id": "thanh6211huyen",
      "account_name": "thanh6211huyen",
      "account_url": "https://www.threads.net/@thanh6211huyen",
      "post_id": "7935",
      "post_type": "thread",
      "raw_metadata": {
        "username": "thanh6211huyen",
        "likes": 0,
        "replies": 0,
        "reposts": 0,
        "shares": 0,
        "time": "12/04/25",
        "datetime": "2025-12-04T06:19:53.000Z"
      },
      "is_cleaned": true,
      "data_type": "threads",
      "reposts_count": 0
    },
    {
      "url": "https://www.threads.net/@_lendohs_/post/DSu4oNYE9Ez",
      "source_type": "threads",
      "source": "https://www.threads.net/@_lendohs_/post/DSu4oNYE9Ez",
      "domain": "threads.net",
      "social_platform": "threads",
      "title": "VIRAL Tìm shop cho thuê máy ảnh ở Gia Lâm-Hà Nội, Hưng Yên ạa",
      "content": "VIRAL Tìm shop cho thuê máy ảnh ở Gia Lâm-Hà Nội, Hưng Yên ạa",
      "word_count": 14,
      "published_date": 1766764781.0,
      "published_datetime": "2025-12-26 15:59:41+00:00",
      "likes_count": 0,
      "shares_count": 0,
      "comments_count": 0,
      "views_count": 0,
      "reactions": null,
      "account_id": "_lendohs_",
      "account_name": "_lendohs_",
      "account_url": "https://www.threads.net/@_lendohs_",
      "post_id": "7934",
      "post_type": "thread",
      "raw_metadata": {
        "username": "_lendohs_",
        "likes": 0,
        "replies": 0,
        "reposts": 0,
        "shares": 0,
        "time": "12/26/25",
        "datetime": "2025-12-26T15:59:41.000Z"
      },
      "is_cleaned": true,
      "data_type": "threads",
      "reposts_count": 0
    },
    {
      "url": "https://www.threads.net/@thiendinh.0202/post/DSy5kbujxH3",
      "source_type": "threads",
      "source": "https://www.threads.net/@thiendinh.0202/post/DSy5kbujxH3",
      "domain": "threads.net",
      "social_platform": "threads",
      "title": "Một câu hỏi em chẳng thể trả lời",
      "content": "Một câu hỏi em chẳng thể trả lời",
      "word_count": 8,
      "published_date": 1766899492.0,
      "published_datetime": "2025-12-28 05:24:52+00:00",
      "likes_count": 0,
      "shares_count": 0,
      "comments_count": 0,
      "views_count": 0,
      "reactions": null,
      "account_id": "thiendinh.0202",
      "account_name": "thiendinh.0202",
      "account_url": "https://www.threads.net/@thiendinh.0202",
      "post_id": "7933",
      "post_type": "thread",
      "raw_metadata": {
        "username": null,
        "likes": 0,
        "replies": 0,
        "reposts": 0,
        "shares": 0,
        "time": "12/28/25",
        "datetime": "2025-12-28T05:24:52.000Z"
      },
      "is_cleaned": true,
      "data_type": "threads",
      "reposts_count": 0
    },
    {
      "url": "https://www.threads.net/@hipp0704/post/DS0KsbYEj7k",
      "source_type": "threads",
      "source": "https://www.threads.net/@hipp0704/post/DS0KsbYEj7k",
      "domain": "threads.net",
      "social_platform": "threads",
      "title": "Một câu hỏi em chẳng thể trả lời",
      "content": "Một câu hỏi em chẳng thể trả lời",
      "word_count": 8,
      "published_date": 1766942025.0,
      "published_datetime": "2025-12-28 17:13:45+00:00",
      "likes_count": 0,
      "shares_count": 0,
      "comments_count": 0,
      "views_count": 0,
      "reactions": null,
      "account_id": "hipp0704",
      "account_name": "hipp0704",
      "account_url": "https://www.threads.net/@hipp0704",
      "post_id": "7932",
      "post_type": "thread",
      "raw_metadata": {
        "username": "hipp0704",
        "likes": 0,
        "replies": 0,
        "reposts": 0,
        "shares": 0,
        "time": "6d",
        "datetime": "2025-12-28T17:13:45.000Z"
      },
      "is_cleaned": true,
      "data_type": "threads",
      "reposts_count": 0
    },
    {
      "url": "https://www.threads.net/@nguyenhopper/post/DPky3briVv9",
      "source_type": "threads",
      "source": "https://www.threads.net/@nguyenhopper/post/DPky3briVv9",
      "domain": "threads.net",
      "social_platform": "threads",
      "title": "Uớc j đc như mấy bạn xem concert ở Mỹ Đình. Ê hề vé mà còn giảm giá, chứ mấy concert ở Hưng Yên vé đ...",
      "content": "Uớc j đc như mấy bạn xem concert ở Mỹ Đình. Ê hề vé mà còn giảm giá, chứ mấy concert ở Hưng Yên vé đã k giảm giá mà lúc nào cũng sold out trong 1-2h Translate 12",
      "word_count": 39,
      "published_date": 1759983764.0,
      "published_datetime": "2025-10-09 04:22:44+00:00",
      "likes_count": 0,
      "shares_count": 0,
      "comments_count": 0,
      "views_count": 0,
      "reactions": null,
      "account_id": "nguyenhopper",
      "account_name": "nguyenhopper",
      "account_url": "https://www.threads.net/@nguyenhopper",
      "post_id": "7931",
      "post_type": "thread",
      "raw_metadata": {
        "username": "nguyenhopper",
        "likes": 0,
        "replies": 0,
        "reposts": 0,
        "shares": 0,
        "time": "10/09/25",
        "datetime": "2025-10-09T04:22:44.000Z"
      },
      "is_cleaned": true,
      "data_type": "threads",
      "reposts_count": 0
    },
    {
      "url": "https://www.threads.net/@nhieethichhoc/post/DQgwayhkklD",
      "source_type": "threads",
      "source": "https://www.threads.net/@nhieethichhoc/post/DQgwayhkklD",
      "domain": "threads.net",
      "social_platform": "threads",
      "title": "HỌC SINH HƯNG YÊN HÔM NAY KIỂU: Ưu điểm: Làm hết đề không bỏ sót câu nào Nhược điểm: Tiếng Anh 3đ,...",
      "content": "HỌC SINH HƯNG YÊN HÔM NAY KIỂU: Ưu điểm: Làm hết đề không bỏ sót câu nào Nhược điểm: Tiếng Anh 3đ, Toán 2đ",
      "word_count": 24,
      "published_date": 1761995747.0,
      "published_datetime": "2025-11-01 11:15:47+00:00",
      "likes_count": 0,
      "shares_count": 0,
      "comments_count": 0,
      "views_count": 0,
      "reactions": null,
      "account_id": "nhieethichhoc",
      "account_name": "nhieethichhoc",
      "account_url": "https://www.threads.net/@nhieethichhoc",
      "post_id": "7930",
      "post_type": "thread",
      "raw_metadata": {
        "username": "nhieethichhoc",
        "likes": 0,
        "replies": 0,
        "reposts": 0,
        "shares": 0,
        "time": "11/01/25",
        "datetime": "2025-11-01T11:15:47.000Z"
      },
      "is_cleaned": true,
      "data_type": "threads",
      "reposts_count": 0
    },
    {
      "url": "https://www.threads.net/@itstoored_/post/DS7qjqCkmUI",
      "source_type": "threads",
      "source": "https://www.threads.net/@itstoored_/post/DS7qjqCkmUI",
      "domain": "threads.net",
      "social_platform": "threads",
      "title": "Nhưng mà em Bội iu vừa nhìn là đã thấy rất có duyên với động vật rùi ý. Có những người họ mát tay, n...",
      "content": "Nhưng mà em Bội iu vừa nhìn là đã thấy rất có duyên với động vật rùi ý. Có những người họ mát tay, năng lượng hiền lành nên tụi động vật nó thích, nó bám dính lấy luôn á",
      "word_count": 40,
      "published_date": 1767193611.0,
      "published_datetime": "2025-12-31 15:06:51+00:00",
      "likes_count": 0,
      "shares_count": 0,
      "comments_count": 0,
      "views_count": 0,
      "reactions": null,
      "account_id": "itstoored_",
      "account_name": "itstoored_",
      "account_url": "https://www.threads.net/@itstoored_",
      "post_id": "7929",
      "post_type": "thread",
      "raw_metadata": {
        "username": "itstoored_",
        "likes": 0,
        "replies": 0,
        "reposts": 0,
        "shares": 0,
        "time": "3d",
        "datetime": "2025-12-31T15:06:51.000Z"
      },
      "is_cleaned": true,
      "data_type": "threads",
      "reposts_count": 0
    },
    {
      "url": "https://www.threads.net/@thao.nguyett_/post/DQgqFN4E5tD",
      "source_type": "threads",
      "source": "https://www.threads.net/@thao.nguyett_/post/DQgqFN4E5tD",
      "domain": "threads.net",
      "social_platform": "threads",
      "title": "Nay thi thử đề sở Hưng Yên, nhìn điểm toán 5.75 và văn (tự dựa barem tính - 6.0) tui biết mình hiện ...",
      "content": "Nay thi thử đề sở Hưng Yên, nhìn điểm toán 5.75 và văn (tự dựa barem tính - 6.0) tui biết mình hiện tại đang sống dựa hết vào Anh. Đúng là THPTQG chưa bao giờ là lựa chọn. Buồn quá, toán làm rất cẩn thận mà vẫn sai các câu Đúng - Sai (mất điểm hầu hết ở đây)",
      "word_count": 60,
      "published_date": 1761992425.0,
      "published_datetime": "2025-11-01 10:20:25+00:00",
      "likes_count": 0,
      "shares_count": 0,
      "comments_count": 0,
      "views_count": 0,
      "reactions": null,
      "account_id": "thao.nguyett_",
      "account_name": "thao.nguyett_",
      "account_url": "https://www.threads.net/@thao.nguyett_",
      "post_id": "7928",
      "post_type": "thread",
      "raw_metadata": {
        "username": "thao.nguyett_",
        "likes": 0,
        "replies": 0,
        "reposts": 0,
        "shares": 0,
        "time": "11/01/25",
        "datetime": "2025-11-01T10:20:25.000Z"
      },
      "is_cleaned": true,
      "data_type": "threads",
      "reposts_count": 0
    },
    {
      "url": "https://www.threads.net/@lethaonguyen0_0/post/DKz7yFgTb3H",
      "source_type": "threads",
      "source": "https://www.threads.net/@lethaonguyen0_0/post/DKz7yFgTb3H",
      "domain": "threads.net",
      "social_platform": "threads",
      "title": "Có shop nào cho thuê máy ảnh ship đến Ocean Park 3 Hưng Yên không ạ",
      "content": "Có shop nào cho thuê máy ảnh ship đến Ocean Park 3 Hưng Yên không ạ",
      "word_count": 16,
      "published_date": 1749754337.0,
      "published_datetime": "2025-06-12 18:52:17+00:00",
      "likes_count": 0,
      "shares_count": 0,
      "comments_count": 0,
      "views_count": 0,
      "reactions": null,
      "account_id": "lethaonguyen0_0",
      "account_name": "lethaonguyen0_0",
      "account_url": "https://www.threads.net/@lethaonguyen0_0",
      "post_id": "7927",
      "post_type": "thread",
      "raw_metadata": {
        "username": "lethaonguyen0_0",
        "likes": 0,
        "replies": 0,
        "reposts": 0,
        "shares": 0,
        "time": "06/12/25",
        "datetime": "2025-06-12T18:52:17.000Z"
      },
      "is_cleaned": true,
      "data_type": "threads",
      "reposts_count": 0
    },
    {
      "url": "https://www.threads.net/@chuin_socute/post/DQaqCZEgUdm",
      "source_type": "threads",
      "source": "https://www.threads.net/@chuin_socute/post/DQaqCZEgUdm",
      "domain": "threads.net",
      "social_platform": "threads",
      "title": "Tui đang tìm các bác có tiếng Nhật N2 làm ở Hà Nội, Hưng Yên, Bắc Ninh. Lương: 14M - 17M. Có bác nào...",
      "content": "Tui đang tìm các bác có tiếng Nhật N2 làm ở Hà Nội, Hưng Yên, Bắc Ninh. Lương: 14M - 17M. Có bác nào đang tìm job k ạ?",
      "word_count": 29,
      "published_date": 1761791075.0,
      "published_datetime": "2025-10-30 02:24:35+00:00",
      "likes_count": 0,
      "shares_count": 0,
      "comments_count": 0,
      "views_count": 0,
      "reactions": null,
      "account_id": "chuin_socute",
      "account_name": "chuin_socute",
      "account_url": "https://www.threads.net/@chuin_socute",
      "post_id": "7926",
      "post_type": "thread",
      "raw_metadata": {
        "username": "chuin_socute",
        "likes": 0,
        "replies": 0,
        "reposts": 0,
        "shares": 0,
        "time": "10/29/25",
        "datetime": "2025-10-30T02:24:35.000Z"
      },
      "is_cleaned": true,
      "data_type": "threads",
      "reposts_count": 0
    },
    {
      "url": "https://www.threads.net/@hh3838663/post/DSUUIFekvOk",
      "source_type": "threads",
      "source": "https://www.threads.net/@hh3838663/post/DSUUIFekvOk",
      "domain": "threads.net",
      "social_platform": "threads",
      "title": "Tý ra một hồi xong vào lại thấy một đống suộc Quang Hùng MasterD ở Hưng Yên",
      "content": "Tý ra một hồi xong vào lại thấy một đống suộc Quang Hùng MasterD ở Hưng Yên",
      "word_count": 17,
      "published_date": 1765873228.0,
      "published_datetime": "2025-12-16 08:20:28+00:00",
      "likes_count": 0,
      "shares_count": 0,
      "comments_count": 0,
      "views_count": 0,
      "reactions": null,
      "account_id": "hh3838663",
      "account_name": "hh3838663",
      "account_url": "https://www.threads.net/@hh3838663",
      "post_id": "7925",
      "post_type": "thread",
      "raw_metadata": {
        "username": "hh3838663",
        "likes": 0,
        "replies": 0,
        "reposts": 0,
        "shares": 0,
        "time": "12/16/25",
        "datetime": "2025-12-16T08:20:28.000Z"
      },
      "is_cleaned": true,
      "data_type": "threads",
      "reposts_count": 0
    },
    {
      "url": "https://www.threads.net/@tthuy236_/post/DS5cVGakivc",
      "source_type": "threads",
      "source": "https://www.threads.net/@tthuy236_/post/DS5cVGakivc",
      "domain": "threads.net",
      "social_platform": "threads",
      "title": "quảng ngãi nề mai ai đi hong alooo",
      "content": "quảng ngãi nề mai ai đi hong alooo",
      "word_count": 8,
      "published_date": 1767119043.0,
      "published_datetime": "2025-12-30 18:24:03+00:00",
      "likes_count": 0,
      "shares_count": 0,
      "comments_count": 0,
      "views_count": 0,
      "reactions": null,
      "account_id": "tthuy236_",
      "account_name": "tthuy236_",
      "account_url": "https://www.threads.net/@tthuy236_",
      "post_id": "7924",
      "post_type": "thread",
      "raw_metadata": {
        "username": "tthuy236_",
        "likes": 0,
        "replies": 0,
        "reposts": 0,
        "shares": 0,
        "time": "4d",
        "datetime": "2025-12-30T18:24:03.000Z"
      },
      "is_cleaned": true,
      "data_type": "threads",
      "reposts_count": 0
    },
    {
      "url": "https://www.threads.net/@w.nqocahn/post/DPQj4RhE-b9",
      "source_type": "threads",
      "source": "https://www.threads.net/@w.nqocahn/post/DPQj4RhE-b9",
      "domain": "threads.net",
      "social_platform": "threads",
      "title": "mn có biết ai make kỉ yếu đẹp quanh khực khoái châu hưng yên không ạ.",
      "content": "mn có biết ai make kỉ yếu đẹp quanh khực khoái châu hưng yên không ạ.",
      "word_count": 16,
      "published_date": 1759304818.0,
      "published_datetime": "2025-10-01 07:46:58+00:00",
      "likes_count": 0,
      "shares_count": 0,
      "comments_count": 0,
      "views_count": 0,
      "reactions": null,
      "account_id": "w.nqocahn",
      "account_name": "w.nqocahn",
      "account_url": "https://www.threads.net/@w.nqocahn",
      "post_id": "7923",
      "post_type": "thread",
      "raw_metadata": {
        "username": "w.nqocahn",
        "likes": 0,
        "replies": 0,
        "reposts": 0,
        "shares": 0,
        "time": "10/01/25",
        "datetime": "2025-10-01T07:46:58.000Z"
      },
      "is_cleaned": true,
      "data_type": "threads",
      "reposts_count": 0
    },
    {
      "url": "https://www.threads.net/@shimeji_oo/post/DJbSqAoxVKD",
      "source_type": "threads",
      "source": "https://www.threads.net/@shimeji_oo/post/DJbSqAoxVKD",
      "domain": "threads.net",
      "social_platform": "threads",
      "title": "Chị Hạnh Real xác nhận concert ATVNCG ở Hưng Yên đón hơn 100.000 người cho 2 đêm, từng có ý định mở ...",
      "content": "Chị Hạnh Real xác nhận concert ATVNCG ở Hưng Yên đón hơn 100.000 người cho 2 đêm, từng có ý định mở concert ở Ninh Bình ATVNCGConcert Translate 12",
      "word_count": 29,
      "published_date": 1746780099.0,
      "published_datetime": "2025-05-09 08:41:39+00:00",
      "likes_count": 0,
      "shares_count": 0,
      "comments_count": 0,
      "views_count": 0,
      "reactions": null,
      "account_id": "shimeji_oo",
      "account_name": "shimeji_oo",
      "account_url": "https://www.threads.net/@shimeji_oo",
      "post_id": "7922",
      "post_type": "thread",
      "raw_metadata": {
        "username": "shimeji_oo",
        "likes": 0,
        "replies": 0,
        "reposts": 0,
        "shares": 0,
        "time": "05/09/25",
        "datetime": "2025-05-09T08:41:39.000Z"
      },
      "is_cleaned": true,
      "data_type": "threads",
      "reposts_count": 0
    },
    {
      "url": "https://www.threads.net/@xghoerr/post/DP_1E0Sj3YY",
      "source_type": "threads",
      "source": "https://www.threads.net/@xghoerr/post/DP_1E0Sj3YY",
      "domain": "threads.net",
      "social_platform": "threads",
      "title": "Nói thật chứ suy nghĩ sao mà lại lấy cái việc xâ dựng sân vận động mới ở Hưng Yên là ta có thể suy r...",
      "content": "Nói thật chứ suy nghĩ sao mà lại lấy cái việc xâ dựng sân vận động mới ở Hưng Yên là ta có thể suy ra việc đất nước dời thủ đô về Hưng Yên , con lạy mấy cụ ạ .",
      "word_count": 42,
      "published_date": 1760890892.0,
      "published_datetime": "2025-10-19 16:21:32+00:00",
      "likes_count": 0,
      "shares_count": 0,
      "comments_count": 0,
      "views_count": 0,
      "reactions": null,
      "account_id": "xghoerr",
      "account_name": "xghoerr",
      "account_url": "https://www.threads.net/@xghoerr",
      "post_id": "7921",
      "post_type": "thread",
      "raw_metadata": {
        "username": "xghoerr",
        "likes": 0,
        "replies": 0,
        "reposts": 0,
        "shares": 0,
        "time": "10/19/25",
        "datetime": "2025-10-19T16:21:32.000Z"
      },
      "is_cleaned": true,
      "data_type": "threads",
      "reposts_count": 0
    },
    {
      "url": "https://www.threads.net/@kimdoann_sluooo/post/DO51_3RDwTZ",
      "source_type": "threads",
      "source": "https://www.threads.net/@kimdoann_sluooo/post/DO51_3RDwTZ",
      "domain": "threads.net",
      "social_platform": "threads",
      "title": "Mình ở Văn Giang, Hưng Yên muốn tìm trung tâm ielts quanh khu eco, xuân quan, vin, phụng công Mọi ng...",
      "content": "Mình ở Văn Giang, Hưng Yên muốn tìm trung tâm ielts quanh khu eco, xuân quan, vin, phụng công Mọi người ai biết trung tâm nào ổn ổn share cho mình với ạ",
      "word_count": 33,
      "published_date": 1758542566.0,
      "published_datetime": "2025-09-22 12:02:46+00:00",
      "likes_count": 0,
      "shares_count": 0,
      "comments_count": 0,
      "views_count": 0,
      "reactions": null,
      "account_id": "kimdoann_sluooo",
      "account_name": "kimdoann_sluooo",
      "account_url": "https://www.threads.net/@kimdoann_sluooo",
      "post_id": "7920",
      "post_type": "thread",
      "raw_metadata": {
        "username": "kimdoann_sluooo",
        "likes": 0,
        "replies": 0,
        "reposts": 0,
        "shares": 0,
        "time": "09/22/25",
        "datetime": "2025-09-22T12:02:46.000Z"
      },
      "is_cleaned": true,
      "data_type": "threads",
      "reposts_count": 0
    },
    {
      "url": "https://www.threads.net/@gnobpihc/post/DFjlCV1zEil",
      "source_type": "threads",
      "source": "https://www.threads.net/@gnobpihc/post/DFjlCV1zEil",
      "domain": "threads.net",
      "social_platform": "threads",
      "title": "Vậy chắc lyric này mới vừa lòng các bạn ý EM THÈM HÀ NỘI ĐỂ ĐƯA EM QUA HƯNG YÊN  Translate 12",
      "content": "Vậy chắc lyric này mới vừa lòng các bạn ý EM THÈM HÀ NỘI ĐỂ ĐƯA EM QUA HƯNG YÊN  Translate 12",
      "word_count": 22,
      "published_date": 1738468123.0,
      "published_datetime": "2025-02-02 03:48:43+00:00",
      "likes_count": 0,
      "shares_count": 0,
      "comments_count": 0,
      "views_count": 0,
      "reactions": null,
      "account_id": "gnobpihc",
      "account_name": "gnobpihc",
      "account_url": "https://www.threads.net/@gnobpihc",
      "post_id": "7919",
      "post_type": "thread",
      "raw_metadata": {
        "username": "gnobpihc",
        "likes": 0,
        "replies": 0,
        "reposts": 0,
        "shares": 0,
        "time": "02/01/25",
        "datetime": "2025-02-02T03:48:43.000Z"
      },
      "is_cleaned": true,
      "data_type": "threads",
      "reposts_count": 0
    },
    {
      "url": "https://www.threads.net/@tracy.29120/post/DLxD441PjKR",
      "source_type": "threads",
      "source": "https://www.threads.net/@tracy.29120/post/DLxD441PjKR",
      "domain": "threads.net",
      "social_platform": "threads",
      "title": "Quê ở Thái Bình( nay là Hưng Yên ) thì đường về quê sẽ kiểu Hà Nội- Hưng Yên- Hải Dương-Hải Phỏng- H...",
      "content": "Quê ở Thái Bình( nay là Hưng Yên ) thì đường về quê sẽ kiểu Hà Nội- Hưng Yên- Hải Dương-Hải Phỏng- Hưng Yên Translate 12",
      "word_count": 26,
      "published_date": 1751805408.0,
      "published_datetime": "2025-07-06 12:36:48+00:00",
      "likes_count": 0,
      "shares_count": 0,
      "comments_count": 0,
      "views_count": 0,
      "reactions": null,
      "account_id": "tracy.29120",
      "account_name": "tracy.29120",
      "account_url": "https://www.threads.net/@tracy.29120",
      "post_id": "7918",
      "post_type": "thread",
      "raw_metadata": {
        "username": "tracy.29120",
        "likes": 0,
        "replies": 0,
        "reposts": 0,
        "shares": 0,
        "time": "07/06/25",
        "datetime": "2025-07-06T12:36:48.000Z"
      },
      "is_cleaned": true,
      "data_type": "threads",
      "reposts_count": 0
    },
    {
      "url": "https://www.threads.net/@huyen.25.05/post/DDzFIvNByNj",
      "source_type": "threads",
      "source": "https://www.threads.net/@huyen.25.05/post/DDzFIvNByNj",
      "domain": "threads.net",
      "social_platform": "threads",
      "title": "Tìm bạn trên thread ạ, có bạn nào quê ở Hưng Yên mà đang làm việc tại Vĩnh phúc hông??",
      "content": "Tìm bạn trên thread ạ, có bạn nào quê ở Hưng Yên mà đang làm việc tại Vĩnh phúc hông??",
      "word_count": 20,
      "published_date": 1734693302.0,
      "published_datetime": "2024-12-20 11:15:02+00:00",
      "likes_count": 0,
      "shares_count": 0,
      "comments_count": 0,
      "views_count": 0,
      "reactions": null,
      "account_id": "huyen.25.05",
      "account_name": "huyen.25.05",
      "account_url": "https://www.threads.net/@huyen.25.05",
      "post_id": "7917",
      "post_type": "thread",
      "raw_metadata": {
        "username": "huyen.25.05",
        "likes": 0,
        "replies": 0,
        "reposts": 0,
        "shares": 0,
        "time": "12/20/24",
        "datetime": "2024-12-20T11:15:02.000Z"
      },
      "is_cleaned": true,
      "data_type": "threads",
      "reposts_count": 0
    },
    {
      "url": "https://www.threads.net/@gvr.nd/post/DHS6R96Twnj",
      "source_type": "threads",
      "source": "https://www.threads.net/@gvr.nd/post/DHS6R96Twnj",
      "domain": "threads.net",
      "social_platform": "threads",
      "title": "Thế là giờ Hưng Yên lại giáp biển xịn thật sự",
      "content": "Thế là giờ Hưng Yên lại giáp biển xịn thật sự",
      "word_count": 11,
      "published_date": 1742203803.0,
      "published_datetime": "2025-03-17 09:30:03+00:00",
      "likes_count": 0,
      "shares_count": 0,
      "comments_count": 0,
      "views_count": 0,
      "reactions": null,
      "account_id": "gvr.nd",
      "account_name": "gvr.nd",
      "account_url": "https://www.threads.net/@gvr.nd",
      "post_id": "7916",
      "post_type": "thread",
      "raw_metadata": {
        "username": "gvr.nd",
        "likes": 0,
        "replies": 0,
        "reposts": 0,
        "shares": 0,
        "time": "03/17/25",
        "datetime": "2025-03-17T09:30:03.000Z"
      },
      "is_cleaned": true,
      "data_type": "threads",
      "reposts_count": 0
    },
    {
      "url": "https://www.threads.net/@khoivu.official/post/DS9TvztE-9z",
      "source_type": "threads",
      "source": "https://www.threads.net/@khoivu.official/post/DS9TvztE-9z",
      "domain": "threads.net",
      "social_platform": "threads",
      "title": "2026 hắn chúc mng không ngừng bỏ cuộc",
      "content": "2026 hắn chúc mng không ngừng bỏ cuộc",
      "word_count": 8,
      "published_date": 1767248761.0,
      "published_datetime": "2026-01-01 06:26:01+00:00",
      "likes_count": 0,
      "shares_count": 0,
      "comments_count": 0,
      "views_count": 0,
      "reactions": null,
      "account_id": "khoivu.official",
      "account_name": "khoivu.official",
      "account_url": "https://www.threads.net/@khoivu.official",
      "post_id": "7915",
      "post_type": "thread",
      "raw_metadata": {
        "username": "khoivu.official",
        "likes": 0,
        "replies": 0,
        "reposts": 0,
        "shares": 0,
        "time": "3d",
        "datetime": "2026-01-01T06:26:01.000Z"
      },
      "is_cleaned": true,
      "data_type": "threads",
      "reposts_count": 0
    },
    {
      "url": "https://www.threads.net/@nhoobrie/post/DS7aaFMkwt0",
      "source_type": "threads",
      "source": "https://www.threads.net/@nhoobrie/post/DS7aaFMkwt0",
      "domain": "threads.net",
      "social_platform": "threads",
      "title": "Biên Hoà ơi có ai đón giao thừa không? Qua đón tao đi chung được không",
      "content": "Biên Hoà ơi có ai đón giao thừa không? Qua đón tao đi chung được không",
      "word_count": 16,
      "published_date": 1767185144.0,
      "published_datetime": "2025-12-31 12:45:44+00:00",
      "likes_count": 0,
      "shares_count": 0,
      "comments_count": 0,
      "views_count": 0,
      "reactions": null,
      "account_id": "nhoobrie",
      "account_name": "nhoobrie",
      "account_url": "https://www.threads.net/@nhoobrie",
      "post_id": "7914",
      "post_type": "thread",
      "raw_metadata": {
        "username": "nhoobrie",
        "likes": 0,
        "replies": 0,
        "reposts": 0,
        "shares": 0,
        "time": "3d",
        "datetime": "2025-12-31T12:45:44.000Z"
      },
      "is_cleaned": true,
      "data_type": "threads",
      "reposts_count": 0
    },
    {
      "url": "https://www.threads.net/@ken.lim9/post/DO5LZ0yCUxy",
      "source_type": "threads",
      "source": "https://www.threads.net/@ken.lim9/post/DO5LZ0yCUxy",
      "domain": "threads.net",
      "social_platform": "threads",
      "title": "mn ơi rcm cho e thợ chụp ảnh cá nhân ở Hưng Yên( cũ là Thái Bình ) với ặ giá mềm mềm 1 tẹo vs ạ",
      "content": "mn ơi rcm cho e thợ chụp ảnh cá nhân ở Hưng Yên( cũ là Thái Bình ) với ặ giá mềm mềm 1 tẹo vs ạ",
      "word_count": 27,
      "published_date": 1758520234.0,
      "published_datetime": "2025-09-22 05:50:34+00:00",
      "likes_count": 0,
      "shares_count": 0,
      "comments_count": 0,
      "views_count": 0,
      "reactions": null,
      "account_id": "ken.lim9",
      "account_name": "ken.lim9",
      "account_url": "https://www.threads.net/@ken.lim9",
      "post_id": "7913",
      "post_type": "thread",
      "raw_metadata": {
        "username": "ken.lim9",
        "likes": 0,
        "replies": 0,
        "reposts": 0,
        "shares": 0,
        "time": "09/22/25",
        "datetime": "2025-09-22T05:50:34.000Z"
      },
      "is_cleaned": true,
      "data_type": "threads",
      "reposts_count": 0
    },
    {
      "url": "https://www.threads.net/@amaricano._/post/DSZT-TWj873",
      "source_type": "threads",
      "source": "https://www.threads.net/@amaricano._/post/DSZT-TWj873",
      "domain": "threads.net",
      "social_platform": "threads",
      "title": "Nghe đồn có team làm cờ phướn cho Faker nhưng đội thi công mang nhầm qua Hưng Yên treo? Anh trai San...",
      "content": "Nghe đồn có team làm cờ phướn cho Faker nhưng đội thi công mang nhầm qua Hưng Yên treo? Anh trai Sang Hyuk vượt ngàn chông gai",
      "word_count": 27,
      "published_date": 1766040920.0,
      "published_datetime": "2025-12-18 06:55:20+00:00",
      "likes_count": 0,
      "shares_count": 0,
      "comments_count": 0,
      "views_count": 0,
      "reactions": null,
      "account_id": "amaricano._",
      "account_name": "amaricano._",
      "account_url": "https://www.threads.net/@amaricano._",
      "post_id": "7912",
      "post_type": "thread",
      "raw_metadata": {
        "username": "amaricano._",
        "likes": 0,
        "replies": 0,
        "reposts": 0,
        "shares": 0,
        "time": "12/18/25",
        "datetime": "2025-12-18T06:55:20.000Z"
      },
      "is_cleaned": true,
      "data_type": "threads",
      "reposts_count": 0
    },
    {
      "url": "https://www.threads.net/@anhthonoi9/post/DS4Jyyzkzvz",
      "source_type": "threads",
      "source": "https://www.threads.net/@anhthonoi9/post/DS4Jyyzkzvz",
      "domain": "threads.net",
      "social_platform": "threads",
      "title": "Cần tìm sale BĐS khu vực Hưng Yên , Hà Nội kết nối mình nhé 0869438518",
      "content": "Cần tìm sale BĐS khu vực Hưng Yên , Hà Nội kết nối mình nhé 0869438518",
      "word_count": 16,
      "published_date": 1767075770.0,
      "published_datetime": "2025-12-30 06:22:50+00:00",
      "likes_count": 0,
      "shares_count": 0,
      "comments_count": 0,
      "views_count": 0,
      "reactions": null,
      "account_id": "anhthonoi9",
      "account_name": "anhthonoi9",
      "account_url": "https://www.threads.net/@anhthonoi9",
      "post_id": "7911",
      "post_type": "thread",
      "raw_metadata": {
        "username": "anhthonoi9",
        "likes": 0,
        "replies": 0,
        "reposts": 0,
        "shares": 0,
        "time": "5d",
        "datetime": "2025-12-30T06:22:50.000Z"
      },
      "is_cleaned": true,
      "data_type": "threads",
      "reposts_count": 0
    },
    {
      "url": "https://www.threads.net/@huyennsugar/post/DN12Rwt5Hm0",
      "source_type": "threads",
      "source": "https://www.threads.net/@huyennsugar/post/DN12Rwt5Hm0",
      "domain": "threads.net",
      "social_platform": "threads",
      "title": "Có ai ở Hưng Yên k ạ. em muốn gửi hàng từ Hưng Yên về Vinh. xe đi qua ngã tư Lực Điền với ạ",
      "content": "Có ai ở Hưng Yên k ạ. em muốn gửi hàng từ Hưng Yên về Vinh. xe đi qua ngã tư Lực Điền với ạ",
      "word_count": 25,
      "published_date": 1756261011.0,
      "published_datetime": "2025-08-27 02:16:51+00:00",
      "likes_count": 0,
      "shares_count": 0,
      "comments_count": 0,
      "views_count": 0,
      "reactions": null,
      "account_id": "huyennsugar",
      "account_name": "huyennsugar",
      "account_url": "https://www.threads.net/@huyennsugar",
      "post_id": "7910",
      "post_type": "thread",
      "raw_metadata": {
        "username": "huyennsugar",
        "likes": 0,
        "replies": 0,
        "reposts": 0,
        "shares": 0,
        "time": "08/26/25",
        "datetime": "2025-08-27T02:16:51.000Z"
      },
      "is_cleaned": true,
      "data_type": "threads",
      "reposts_count": 0
    },
    {
      "url": "https://www.threads.net/@thisgirlneeds.leep.tudy/post/DSudZA9CQM6",
      "source_type": "threads",
      "source": "https://www.threads.net/@thisgirlneeds.leep.tudy/post/DSudZA9CQM6",
      "domain": "threads.net",
      "social_platform": "threads",
      "title": "Có ai pass slot SAT T3 HN, Hưng Yên, Hải Phòng ko ạ  Translate 12",
      "content": "Có ai pass slot SAT T3 HN, Hưng Yên, Hải Phòng ko ạ  Translate 12",
      "word_count": 15,
      "published_date": 1766750500.0,
      "published_datetime": "2025-12-26 12:01:40+00:00",
      "likes_count": 0,
      "shares_count": 0,
      "comments_count": 0,
      "views_count": 0,
      "reactions": null,
      "account_id": "thisgirlneeds.leep.tudy",
      "account_name": "thisgirlneeds.leep.tudy",
      "account_url": "https://www.threads.net/@thisgirlneeds.leep.tudy",
      "post_id": "7909",
      "post_type": "thread",
      "raw_metadata": {
        "username": "thisgirlneeds.leep.tudy",
        "likes": 0,
        "replies": 0,
        "reposts": 0,
        "shares": 0,
        "time": "12/26/25",
        "datetime": "2025-12-26T12:01:40.000Z"
      },
      "is_cleaned": true,
      "data_type": "threads",
      "reposts_count": 0
    },
    {
      "url": "https://www.threads.net/@design.master.9x/post/DMAeNm0PYJw",
      "source_type": "threads",
      "source": "https://www.threads.net/@design.master.9x/post/DMAeNm0PYJw",
      "domain": "threads.net",
      "social_platform": "threads",
      "title": "Tên : Phạm Quang Trung Năm sinh : 1994 Quê quán : Hưng Yên cụ thể là xã hiệp cường Công việc hiện tạ...",
      "content": "Tên : Phạm Quang Trung Năm sinh : 1994 Quê quán : Hưng Yên cụ thể là xã hiệp cường Công việc hiện tại : làm việc tại Hàn Nơi ở hiện tại : 거제 Tính hướng nội Mong muốn tìm 1 nửa còn thiếu",
      "word_count": 45,
      "published_date": 1752322526.0,
      "published_datetime": "2025-07-12 12:15:26+00:00",
      "likes_count": 0,
      "shares_count": 0,
      "comments_count": 0,
      "views_count": 0,
      "reactions": null,
      "account_id": "design.master.9x",
      "account_name": "design.master.9x",
      "account_url": "https://www.threads.net/@design.master.9x",
      "post_id": "7908",
      "post_type": "thread",
      "raw_metadata": {
        "username": "design.master.9x",
        "likes": 0,
        "replies": 0,
        "reposts": 0,
        "shares": 0,
        "time": "07/12/25",
        "datetime": "2025-07-12T12:15:26.000Z"
      },
      "is_cleaned": true,
      "data_type": "threads",
      "reposts_count": 0
    },
    {
      "url": "https://www.threads.net/@_dzung.72_/post/DRC1eO6kitE",
      "source_type": "threads",
      "source": "https://www.threads.net/@_dzung.72_/post/DRC1eO6kitE",
      "domain": "threads.net",
      "social_platform": "threads",
      "title": "Hội chợ Quảng trường Hưng yên",
      "content": "Hội chợ Quảng trường Hưng yên",
      "word_count": 6,
      "published_date": 1763139247.0,
      "published_datetime": "2025-11-14 16:54:07+00:00",
      "likes_count": 0,
      "shares_count": 0,
      "comments_count": 0,
      "views_count": 0,
      "reactions": null,
      "account_id": "_dzung.72_",
      "account_name": "_dzung.72_",
      "account_url": "https://www.threads.net/@_dzung.72_",
      "post_id": "7907",
      "post_type": "thread",
      "raw_metadata": {
        "username": "_dzung.72_",
        "likes": 0,
        "replies": 0,
        "reposts": 0,
        "shares": 0,
        "time": "11/14/25",
        "datetime": "2025-11-14T16:54:07.000Z"
      },
      "is_cleaned": true,
      "data_type": "threads",
      "reposts_count": 0
    },
    {
      "url": "https://www.threads.net/@dlqhhh_/post/DRw5pqAj42y",
      "source_type": "threads",
      "source": "https://www.threads.net/@dlqhhh_/post/DRw5pqAj42y",
      "domain": "threads.net",
      "social_platform": "threads",
      "title": "Thật sự là k có đồng đội nào đu Quang Hùng ở Hưng Yên ạ?? Translate 12",
      "content": "Thật sự là k có đồng đội nào đu Quang Hùng ở Hưng Yên ạ?? Translate 12",
      "word_count": 17,
      "published_date": 1764684942.0,
      "published_datetime": "2025-12-02 14:15:42+00:00",
      "likes_count": 0,
      "shares_count": 0,
      "comments_count": 0,
      "views_count": 0,
      "reactions": null,
      "account_id": "dlqhhh_",
      "account_name": "dlqhhh_",
      "account_url": "https://www.threads.net/@dlqhhh_",
      "post_id": "7906",
      "post_type": "thread",
      "raw_metadata": {
        "username": "dlqhhh_",
        "likes": 0,
        "replies": 0,
        "reposts": 0,
        "shares": 0,
        "time": "12/02/25",
        "datetime": "2025-12-02T14:15:42.000Z"
      },
      "is_cleaned": true,
      "data_type": "threads",
      "reposts_count": 0
    },
    {
      "url": "https://www.threads.net/@tliwh.5th1/post/DSutu5gkcTF",
      "source_type": "threads",
      "source": "https://www.threads.net/@tliwh.5th1/post/DSutu5gkcTF",
      "domain": "threads.net",
      "social_platform": "threads",
      "title": "E muốn tìm thợ chụp kỷ yếu hôm 18-1 ạ . Em ở Hưng yên ạ",
      "content": "E muốn tìm thợ chụp kỷ yếu hôm 18-1 ạ . Em ở Hưng yên ạ",
      "word_count": 16,
      "published_date": 1766759068.0,
      "published_datetime": "2025-12-26 14:24:28+00:00",
      "likes_count": 0,
      "shares_count": 0,
      "comments_count": 0,
      "views_count": 0,
      "reactions": null,
      "account_id": "tliwh.5th1",
      "account_name": "tliwh.5th1",
      "account_url": "https://www.threads.net/@tliwh.5th1",
      "post_id": "7905",
      "post_type": "thread",
      "raw_metadata": {
        "username": "tliwh.5th1",
        "likes": 0,
        "replies": 0,
        "reposts": 0,
        "shares": 0,
        "time": "12/26/25",
        "datetime": "2025-12-26T14:24:28.000Z"
      },
      "is_cleaned": true,
      "data_type": "threads",
      "reposts_count": 0
    },
    {
      "url": "https://www.threads.net/@thanhthanhlovezhnglm/post/DSXlyZ8iXtp",
      "source_type": "threads",
      "source": "https://www.threads.net/@thanhthanhlovezhnglm/post/DSXlyZ8iXtp",
      "domain": "threads.net",
      "social_platform": "threads",
      "title": "Anh tài có Anh Trần Phan Quốc Bảo Chị đẹp có chị Trương Tiểu My Họ xách hết cả tủ đồ ra Hưng Yên qu...",
      "content": "Anh tài có Anh Trần Phan Quốc Bảo Chị đẹp có chị Trương Tiểu My Họ xách hết cả tủ đồ ra Hưng Yên quyết tâm hơn thua chuyến này Khổ nhất chắc mấy đứa nhỏ toàn đồ nhóm đi diễn  Nghĩ cái cảnh bài úm ba là mặc đồ chó đốm diễn sau mấy anh chị mặc cái quần cái áo ta nói nhìn rõ khổ. Đề nghị cấp sổ hộ nghèo cho tụi nhỏ để được hưởng chính sách xã hội",
      "word_count": 83,
      "published_date": 1765983151.0,
      "published_datetime": "2025-12-17 14:52:31+00:00",
      "likes_count": 0,
      "shares_count": 0,
      "comments_count": 0,
      "views_count": 0,
      "reactions": null,
      "account_id": "thanhthanhlovezhnglm",
      "account_name": "thanhthanhlovezhnglm",
      "account_url": "https://www.threads.net/@thanhthanhlovezhnglm",
      "post_id": "7904",
      "post_type": "thread",
      "raw_metadata": {
        "username": "thanhthanhlovezhnglm",
        "likes": 0,
        "replies": 0,
        "reposts": 0,
        "shares": 0,
        "time": "12/17/25",
        "datetime": "2025-12-17T14:52:31.000Z"
      },
      "is_cleaned": true,
      "data_type": "threads",
      "reposts_count": 0
    },
    {
      "url": "https://www.threads.net/@hangtvd_/post/DSuoQ1Wkh8t",
      "source_type": "threads",
      "source": "https://www.threads.net/@hangtvd_/post/DSuoQ1Wkh8t",
      "domain": "threads.net",
      "social_platform": "threads",
      "title": "mn cứ bảo t12 điểm SAT toàn 1500 1600 thế mà check slot th3 ở Hà Nội, Hải Phòng, Hưng Yên đều unava...",
      "content": "mn cứ bảo t12 điểm SAT toàn 1500 1600 thế mà check slot th3 ở Hà Nội, Hải Phòng, Hưng Yên đều unavailable  Translate 12",
      "word_count": 25,
      "published_date": 1766756201.0,
      "published_datetime": "2025-12-26 13:36:41+00:00",
      "likes_count": 0,
      "shares_count": 0,
      "comments_count": 0,
      "views_count": 0,
      "reactions": null,
      "account_id": "hangtvd_",
      "account_name": "hangtvd_",
      "account_url": "https://www.threads.net/@hangtvd_",
      "post_id": "7903",
      "post_type": "thread",
      "raw_metadata": {
        "username": "hangtvd_",
        "likes": 0,
        "replies": 0,
        "reposts": 0,
        "shares": 0,
        "time": "12/26/25",
        "datetime": "2025-12-26T13:36:41.000Z"
      },
      "is_cleaned": true,
      "data_type": "threads",
      "reposts_count": 0
    },
    {
      "url": "https://www.threads.net/@sunflower_smile_86/post/DPft86MkoBN",
      "source_type": "threads",
      "source": "https://www.threads.net/@sunflower_smile_86/post/DPft86MkoBN",
      "domain": "threads.net",
      "social_platform": "threads",
      "title": "Bạn bè có chồng có con mấy tuổi rồi mà t vẫn chưa hẹn hò lần nào ai cuuu t với :33 Nhân tiện có ai ở...",
      "content": "Bạn bè có chồng có con mấy tuổi rồi mà t vẫn chưa hẹn hò lần nào ai cuuu t với :33 Nhân tiện có ai ở quanh Hưng Yên tìm mqh nghiêm túc kh v T sinh năm 2000 :))",
      "word_count": 41,
      "published_date": 1759813416.0,
      "published_datetime": "2025-10-07 05:03:36+00:00",
      "likes_count": 0,
      "shares_count": 0,
      "comments_count": 0,
      "views_count": 0,
      "reactions": null,
      "account_id": "sunflower_smile_86",
      "account_name": "sunflower_smile_86",
      "account_url": "https://www.threads.net/@sunflower_smile_86",
      "post_id": "7902",
      "post_type": "thread",
      "raw_metadata": {
        "username": "sunflower_smile_86",
        "likes": 0,
        "replies": 0,
        "reposts": 0,
        "shares": 0,
        "time": "10/07/25",
        "datetime": "2025-10-07T05:03:36.000Z"
      },
      "is_cleaned": true,
      "data_type": "threads",
      "reposts_count": 0
    },
    {
      "url": "https://www.threads.net/@mieunuongg/post/DS5MejwAfk4",
      "source_type": "threads",
      "source": "https://www.threads.net/@mieunuongg/post/DS5MejwAfk4",
      "domain": "threads.net",
      "social_platform": "threads",
      "title": "- Tập 34 buổituần, lưng đỡ mỏi, người nhẹ hơn. - Ăn uống cân bằng lành mạnh nhưng k ép mình. - Ý t...",
      "content": "- Tập 34 buổituần, lưng đỡ mỏi, người nhẹ hơn. - Ăn uống cân bằng lành mạnh nhưng k ép mình. - Ý thức chăm da giảm nọng, giảm chảy xệ mỗi ngày. - Giữ thói quen nhỏ mỗi ngày, không chờ động lực lớn. - Theo dõi chu kì kinh nguyệt để hiểu mình hơn! - Có ý thức trong từng lời nói, dáng đi, cách tiếp nhận hay đánh giá,... Translate 12",
      "word_count": 74,
      "published_date": 1767110732.0,
      "published_datetime": "2025-12-30 16:05:32+00:00",
      "likes_count": 0,
      "shares_count": 0,
      "comments_count": 0,
      "views_count": 0,
      "reactions": null,
      "account_id": "mieunuongg",
      "account_name": "mieunuongg",
      "account_url": "https://www.threads.net/@mieunuongg",
      "post_id": "7901",
      "post_type": "thread",
      "raw_metadata": {
        "username": "mieunuongg",
        "likes": 0,
        "replies": 0,
        "reposts": 0,
        "shares": 0,
        "time": "4d",
        "datetime": "2025-12-30T16:05:32.000Z"
      },
      "is_cleaned": true,
      "data_type": "threads",
      "reposts_count": 0
    },
    {
      "url": "https://www.threads.net/@minh_anh.0806/post/DQ5voKTD0OO",
      "source_type": "threads",
      "source": "https://www.threads.net/@minh_anh.0806/post/DQ5voKTD0OO",
      "domain": "threads.net",
      "social_platform": "threads",
      "title": "Bác nào mà có ngoại ngữ tiếng Nhật, Anh, Trung không ạ? Tui đang có job Không yêu cầu kinh nghiệm. L...",
      "content": "Bác nào mà có ngoại ngữ tiếng Nhật, Anh, Trung không ạ? Tui đang có job Không yêu cầu kinh nghiệm. Làm việc tại Hà Nội, Hà Nam, Hưng Yên, Bắc Ninh. Quan tâm ib tui gửi job nha!",
      "word_count": 39,
      "published_date": 1762834193.0,
      "published_datetime": "2025-11-11 04:09:53+00:00",
      "likes_count": 0,
      "shares_count": 0,
      "comments_count": 0,
      "views_count": 0,
      "reactions": null,
      "account_id": "minh_anh.0806",
      "account_name": "minh_anh.0806",
      "account_url": "https://www.threads.net/@minh_anh.0806",
      "post_id": "7900",
      "post_type": "thread",
      "raw_metadata": {
        "username": "minh_anh.0806",
        "likes": 0,
        "replies": 0,
        "reposts": 0,
        "shares": 0,
        "time": "11/10/25",
        "datetime": "2025-11-11T04:09:53.000Z"
      },
      "is_cleaned": true,
      "data_type": "threads",
      "reposts_count": 0
    },
    {
      "url": "https://www.threads.net/@iam_junn02/post/DMna05gBXTs",
      "source_type": "threads",
      "source": "https://www.threads.net/@iam_junn02/post/DMna05gBXTs",
      "domain": "threads.net",
      "social_platform": "threads",
      "title": "Fl nhau iii cả nhà uiii. Tui đến từ Hưng Yên nhaaa, các ông bà Hưng Yên đâu nhở.",
      "content": "Fl nhau iii cả nhà uiii. Tui đến từ Hưng Yên nhaaa, các ông bà Hưng Yên đâu nhở.",
      "word_count": 19,
      "published_date": 1753629373.0,
      "published_datetime": "2025-07-27 15:16:13+00:00",
      "likes_count": 0,
      "shares_count": 0,
      "comments_count": 0,
      "views_count": 0,
      "reactions": null,
      "account_id": "iam_junn02",
      "account_name": "iam_junn02",
      "account_url": "https://www.threads.net/@iam_junn02",
      "post_id": "7899",
      "post_type": "thread",
      "raw_metadata": {
        "username": "iam_junn02",
        "likes": 0,
        "replies": 0,
        "reposts": 0,
        "shares": 0,
        "time": "07/27/25",
        "datetime": "2025-07-27T15:16:13.000Z"
      },
      "is_cleaned": true,
      "data_type": "threads",
      "reposts_count": 0
    },
    {
      "url": "https://www.threads.net/@covuthimaiphuong/post/DL3gsfBSH1I",
      "source_type": "threads",
      "source": "https://www.threads.net/@covuthimaiphuong/post/DL3gsfBSH1I",
      "domain": "threads.net",
      "social_platform": "threads",
      "title": "Chấm thi THPT 2025 tại Hưng Yên: Một số giám khảo bất ngờ khi chất lượng bài làm của thí sinh tốt hơ...",
      "content": "Chấm thi THPT 2025 tại Hưng Yên: Một số giám khảo bất ngờ khi chất lượng bài làm của thí sinh tốt hơn dự kiến. Tại tổ chấm đã xuất hiện những bài viết đạt 9 điểm.",
      "word_count": 37,
      "published_date": 1752021837.0,
      "published_datetime": "2025-07-09 00:43:57+00:00",
      "likes_count": 0,
      "shares_count": 0,
      "comments_count": 0,
      "views_count": 0,
      "reactions": null,
      "account_id": "covuthimaiphuong",
      "account_name": "covuthimaiphuong",
      "account_url": "https://www.threads.net/@covuthimaiphuong",
      "post_id": "7898",
      "post_type": "thread",
      "raw_metadata": {
        "username": "covuthimaiphuong",
        "likes": 0,
        "replies": 0,
        "reposts": 0,
        "shares": 0,
        "time": "07/08/25",
        "datetime": "2025-07-09T00:43:57.000Z"
      },
      "is_cleaned": true,
      "data_type": "threads",
      "reposts_count": 0
    },
    {
      "url": "https://www.threads.net/@banhmiluudan/post/DSsU7vugfwu",
      "source_type": "threads",
      "source": "https://www.threads.net/@banhmiluudan/post/DSsU7vugfwu",
      "domain": "threads.net",
      "social_platform": "threads",
      "title": "Ê giỡn hả, nếu mà CG d9, CĐ d2 thì ae Hưng Yên thắng đậm r, KHÔNG ĐƯỢC, thả 11 em zai tươi mát sáng ...",
      "content": "Ê giỡn hả, nếu mà CG d9, CĐ d2 thì ae Hưng Yên thắng đậm r, KHÔNG ĐƯỢC, thả 11 em zai tươi mát sáng toả khoẻ khoắn ra Thành Phố Toàn Cầu nhảy nhót hát hò cho tôi!!!!! Translate 12",
      "word_count": 41,
      "published_date": 1766678958.0,
      "published_datetime": "2025-12-25 16:09:18+00:00",
      "likes_count": 0,
      "shares_count": 0,
      "comments_count": 0,
      "views_count": 0,
      "reactions": null,
      "account_id": "banhmiluudan",
      "account_name": "banhmiluudan",
      "account_url": "https://www.threads.net/@banhmiluudan",
      "post_id": "7897",
      "post_type": "thread",
      "raw_metadata": {
        "username": "banhmiluudan",
        "likes": 0,
        "replies": 0,
        "reposts": 0,
        "shares": 0,
        "time": "12/25/25",
        "datetime": "2025-12-25T16:09:18.000Z"
      },
      "is_cleaned": true,
      "data_type": "threads",
      "reposts_count": 0
    },
    {
      "url": "https://www.threads.net/@poysiess/post/DSWSdB7ky9_",
      "source_type": "threads",
      "source": "https://www.threads.net/@poysiess/post/DSWSdB7ky9_",
      "domain": "threads.net",
      "social_platform": "threads",
      "title": "Có ai nhận make kỉ yếu ở Hưng Yên khum ạa  có thì ib cho e vớii",
      "content": "Có ai nhận make kỉ yếu ở Hưng Yên khum ạa  có thì ib cho e vớii",
      "word_count": 17,
      "published_date": 1765939460.0,
      "published_datetime": "2025-12-17 02:44:20+00:00",
      "likes_count": 0,
      "shares_count": 0,
      "comments_count": 0,
      "views_count": 0,
      "reactions": null,
      "account_id": "poysiess",
      "account_name": "poysiess",
      "account_url": "https://www.threads.net/@poysiess",
      "post_id": "7896",
      "post_type": "thread",
      "raw_metadata": {
        "username": "poysiess",
        "likes": 0,
        "replies": 0,
        "reposts": 0,
        "shares": 0,
        "time": "12/16/25",
        "datetime": "2025-12-17T02:44:20.000Z"
      },
      "is_cleaned": true,
      "data_type": "threads",
      "reposts_count": 0
    },
    {
      "url": "https://www.threads.net/@_._26.10_._/post/DR91Ysskx-A",
      "source_type": "threads",
      "source": "https://www.threads.net/@_._26.10_._/post/DR91Ysskx-A",
      "domain": "threads.net",
      "social_platform": "threads",
      "title": "Lịch tuần sau kiểu: 20 Hưng Yên 21 Hạ Long 22 Hải Phòng  Translate 12",
      "content": "Lịch tuần sau kiểu: 20 Hưng Yên 21 Hạ Long 22 Hải Phòng  Translate 12",
      "word_count": 15,
      "published_date": 1765118914.0,
      "published_datetime": "2025-12-07 14:48:34+00:00",
      "likes_count": 0,
      "shares_count": 0,
      "comments_count": 0,
      "views_count": 0,
      "reactions": null,
      "account_id": "_._26.10_._",
      "account_name": "_._26.10_._",
      "account_url": "https://www.threads.net/@_._26.10_._",
      "post_id": "7895",
      "post_type": "thread",
      "raw_metadata": {
        "username": "_._26.10_._",
        "likes": 0,
        "replies": 0,
        "reposts": 0,
        "shares": 0,
        "time": "12/07/25",
        "datetime": "2025-12-07T14:48:34.000Z"
      },
      "is_cleaned": true,
      "data_type": "threads",
      "reposts_count": 0
    },
    {
      "url": "https://www.threads.net/@bo.ils/post/DSdBT_aEj_E",
      "source_type": "threads",
      "source": "https://www.threads.net/@bo.ils/post/DSdBT_aEj_E",
      "domain": "threads.net",
      "social_platform": "threads",
      "title": "Khai sinh t ở Hưng Yên",
      "content": "Khai sinh t ở Hưng Yên",
      "word_count": 6,
      "published_date": 1766165354.0,
      "published_datetime": "2025-12-19 17:29:14+00:00",
      "likes_count": 0,
      "shares_count": 0,
      "comments_count": 0,
      "views_count": 0,
      "reactions": null,
      "account_id": "bo.ils",
      "account_name": "bo.ils",
      "account_url": "https://www.threads.net/@bo.ils",
      "post_id": "7894",
      "post_type": "thread",
      "raw_metadata": {
        "username": "bo.ils",
        "likes": 0,
        "replies": 0,
        "reposts": 0,
        "shares": 0,
        "time": "12/19/25",
        "datetime": "2025-12-19T17:29:14.000Z"
      },
      "is_cleaned": true,
      "data_type": "threads",
      "reposts_count": 0
    },
    {
      "url": "https://www.threads.net/@lingxenh/post/DSKVoIskUNS",
      "source_type": "threads",
      "source": "https://www.threads.net/@lingxenh/post/DSKVoIskUNS",
      "domain": "threads.net",
      "social_platform": "threads",
      "title": "Em cần tìm một thợ chụp ảnh kỉ yếu cho ngày 181 sắp tới ạ. Em ở khu vực Kim Động Hưng Yên. Budget: ...",
      "content": "Em cần tìm một thợ chụp ảnh kỉ yếu cho ngày 181 sắp tới ạ. Em ở khu vực Kim Động Hưng Yên. Budget: 600k người Em chụp nhóm 2-3 bạn ạ",
      "word_count": 32,
      "published_date": 1765538470.0,
      "published_datetime": "2025-12-12 11:21:10+00:00",
      "likes_count": 0,
      "shares_count": 0,
      "comments_count": 0,
      "views_count": 0,
      "reactions": null,
      "account_id": "lingxenh",
      "account_name": "lingxenh",
      "account_url": "https://www.threads.net/@lingxenh",
      "post_id": "7893",
      "post_type": "thread",
      "raw_metadata": {
        "username": "lingxenh",
        "likes": 0,
        "replies": 0,
        "reposts": 0,
        "shares": 0,
        "time": "12/12/25",
        "datetime": "2025-12-12T11:21:10.000Z"
      },
      "is_cleaned": true,
      "data_type": "threads",
      "reposts_count": 0
    },
    {
      "url": "https://www.threads.net/@_bhtrangnhes/post/DRT3j4iCbjQ",
      "source_type": "threads",
      "source": "https://www.threads.net/@_bhtrangnhes/post/DRT3j4iCbjQ",
      "domain": "threads.net",
      "social_platform": "threads",
      "title": "Ai ở Thái Bình cần tìm việc ib tôi ngay để tôi gửi JD lẹ  Hà Nội, Hưng Yên cũng có luôn nhen",
      "content": "Ai ở Thái Bình cần tìm việc ib tôi ngay để tôi gửi JD lẹ  Hà Nội, Hưng Yên cũng có luôn nhen",
      "word_count": 23,
      "published_date": 1763710768.0,
      "published_datetime": "2025-11-21 07:39:28+00:00",
      "likes_count": 0,
      "shares_count": 0,
      "comments_count": 0,
      "views_count": 0,
      "reactions": null,
      "account_id": "_bhtrangnhes",
      "account_name": "_bhtrangnhes",
      "account_url": "https://www.threads.net/@_bhtrangnhes",
      "post_id": "7892",
      "post_type": "thread",
      "raw_metadata": {
        "username": "_bhtrangnhes",
        "likes": 0,
        "replies": 0,
        "reposts": 0,
        "shares": 0,
        "time": "11/21/25",
        "datetime": "2025-11-21T07:39:28.000Z"
      },
      "is_cleaned": true,
      "data_type": "threads",
      "reposts_count": 0
    },
    {
      "url": "https://www.threads.net/@lovemyfriend.iubanminh/post/DSZOKdnEWX5",
      "source_type": "threads",
      "source": "https://www.threads.net/@lovemyfriend.iubanminh/post/DSZOKdnEWX5",
      "domain": "threads.net",
      "social_platform": "threads",
      "title": "Hưng Yên mảnh đất trữ tình, tình đống",
      "content": "Hưng Yên mảnh đất trữ tình, tình đống",
      "word_count": 8,
      "published_date": 1766037874.0,
      "published_datetime": "2025-12-18 06:04:34+00:00",
      "likes_count": 0,
      "shares_count": 0,
      "comments_count": 0,
      "views_count": 0,
      "reactions": null,
      "account_id": "lovemyfriend.iubanminh",
      "account_name": "lovemyfriend.iubanminh",
      "account_url": "https://www.threads.net/@lovemyfriend.iubanminh",
      "post_id": "7891",
      "post_type": "thread",
      "raw_metadata": {
        "username": "lovemyfriend.iubanminh",
        "likes": 0,
        "replies": 0,
        "reposts": 0,
        "shares": 0,
        "time": "12/18/25",
        "datetime": "2025-12-18T06:04:34.000Z"
      },
      "is_cleaned": true,
      "data_type": "threads",
      "reposts_count": 0
    },
    {
      "url": "https://www.threads.net/@nguyennga14_05/post/DO3UAE4CY17",
      "source_type": "threads",
      "source": "https://www.threads.net/@nguyennga14_05/post/DO3UAE4CY17",
      "domain": "threads.net",
      "social_platform": "threads",
      "title": "Thái Bình cũ, Hưng Yên mới có ai ở đây ko nhỉ",
      "content": "Thái Bình cũ, Hưng Yên mới có ai ở đây ko nhỉ",
      "word_count": 12,
      "published_date": 1758457633.0,
      "published_datetime": "2025-09-21 12:27:13+00:00",
      "likes_count": 0,
      "shares_count": 0,
      "comments_count": 0,
      "views_count": 0,
      "reactions": null,
      "account_id": "nguyennga14_05",
      "account_name": "nguyennga14_05",
      "account_url": "https://www.threads.net/@nguyennga14_05",
      "post_id": "7890",
      "post_type": "thread",
      "raw_metadata": {
        "username": "nguyennga14_05",
        "likes": 0,
        "replies": 0,
        "reposts": 0,
        "shares": 0,
        "time": "09/21/25",
        "datetime": "2025-09-21T12:27:13.000Z"
      },
      "is_cleaned": true,
      "data_type": "threads",
      "reposts_count": 0
    },
    {
      "url": "https://www.threads.net/@giangtshirt/post/DPflkx7D5v-",
      "source_type": "threads",
      "source": "https://www.threads.net/@giangtshirt/post/DPflkx7D5v-",
      "domain": "threads.net",
      "social_platform": "threads",
      "title": "Hay là các bác về Hưng Yên sống với em đi, ngay địa phận Hà Nội- Hưng Yên luôn. Hiện tại không thấy ...",
      "content": "Hay là các bác về Hưng Yên sống với em đi, ngay địa phận Hà Nội- Hưng Yên luôn. Hiện tại không thấy mưa ngập gì.",
      "word_count": 26,
      "published_date": 1759809024.0,
      "published_datetime": "2025-10-07 03:50:24+00:00",
      "likes_count": 0,
      "shares_count": 0,
      "comments_count": 0,
      "views_count": 0,
      "reactions": null,
      "account_id": "giangtshirt",
      "account_name": "giangtshirt",
      "account_url": "https://www.threads.net/@giangtshirt",
      "post_id": "7889",
      "post_type": "thread",
      "raw_metadata": {
        "username": "giangtshirt",
        "likes": 0,
        "replies": 0,
        "reposts": 0,
        "shares": 0,
        "time": "10/06/25",
        "datetime": "2025-10-07T03:50:24.000Z"
      },
      "is_cleaned": true,
      "data_type": "threads",
      "reposts_count": 0
    },
    {
      "url": "https://www.threads.net/@minhhangcva/post/DSxQRZiDWMf",
      "source_type": "threads",
      "source": "https://www.threads.net/@minhhangcva/post/DSxQRZiDWMf",
      "domain": "threads.net",
      "social_platform": "threads",
      "title": "Em cần gấp 1 Shipper phục vụ riêng khu vực Ecopark Hưng Yên ạ.",
      "content": "Em cần gấp 1 Shipper phục vụ riêng khu vực Ecopark Hưng Yên ạ.",
      "word_count": 14,
      "published_date": 1766844286.0,
      "published_datetime": "2025-12-27 14:04:46+00:00",
      "likes_count": 0,
      "shares_count": 0,
      "comments_count": 0,
      "views_count": 0,
      "reactions": null,
      "account_id": "minhhangcva",
      "account_name": "minhhangcva",
      "account_url": "https://www.threads.net/@minhhangcva",
      "post_id": "7888",
      "post_type": "thread",
      "raw_metadata": {
        "username": "minhhangcva",
        "likes": 0,
        "replies": 0,
        "reposts": 0,
        "shares": 0,
        "time": "12/27/25",
        "datetime": "2025-12-27T14:04:46.000Z"
      },
      "is_cleaned": true,
      "data_type": "threads",
      "reposts_count": 0
    },
    {
      "url": "https://www.threads.net/@dwi.hng/post/DS4JltKEQEz",
      "source_type": "threads",
      "source": "https://www.threads.net/@dwi.hng/post/DS4JltKEQEz",
      "domain": "threads.net",
      "social_platform": "threads",
      "title": "Trong ngành kiến trúcquy hoạch thì Vin bị ghét vì cách họ hoạt động. Họ mua cổ phần của các nhà máy...",
      "content": "Trong ngành kiến trúcquy hoạch thì Vin bị ghét vì cách họ hoạt động. Họ mua cổ phần của các nhà máy cũ ở HN (cơ khí Trần Hưng Đạo, cơ khí Hà Nội, dệt 83), lấy đất nhà máy để xây dựng trung tâm thương mạiKĐTM (Vin Bà Triệu, Royal, Times). Đổi lại họ đàm phán với chính quyền để xây dựng cơ sở hạ tầng nối các KĐT của họ (đường VĐ 2 trên cao) theo thể thức BT (Building - Transfer).",
      "word_count": 84,
      "published_date": 1767075663.0,
      "published_datetime": "2025-12-30 06:21:03+00:00",
      "likes_count": 0,
      "shares_count": 0,
      "comments_count": 0,
      "views_count": 0,
      "reactions": null,
      "account_id": "dwi.hng",
      "account_name": "dwi.hng",
      "account_url": "https://www.threads.net/@dwi.hng",
      "post_id": "7887",
      "post_type": "thread",
      "raw_metadata": {
        "username": "dwi.hng",
        "likes": 0,
        "replies": 0,
        "reposts": 0,
        "shares": 0,
        "time": "5d",
        "datetime": "2025-12-30T06:21:03.000Z"
      },
      "is_cleaned": true,
      "data_type": "threads",
      "reposts_count": 0
    },
    {
      "url": "https://www.threads.net/@yoo1903x/post/DS2cwNYky8p",
      "source_type": "threads",
      "source": "https://www.threads.net/@yoo1903x/post/DS2cwNYky8p",
      "domain": "threads.net",
      "social_platform": "threads",
      "title": "Mình bị ngu nên cho mình hỏi vì sao nhiều người ghét Vin vậy? Cứ lướt 1 tí thì dính 1 bài chửi Vin n...",
      "content": "Mình bị ngu nên cho mình hỏi vì sao nhiều người ghét Vin vậy? Cứ lướt 1 tí thì dính 1 bài chửi Vin nô, Vin ng.u này nọ nó khá là khó hiểu ấy :v",
      "word_count": 36,
      "published_date": 1767018602.0,
      "published_datetime": "2025-12-29 14:30:02+00:00",
      "likes_count": 0,
      "shares_count": 0,
      "comments_count": 0,
      "views_count": 0,
      "reactions": null,
      "account_id": "yoo1903x",
      "account_name": "yoo1903x",
      "account_url": "https://www.threads.net/@yoo1903x",
      "post_id": "7886",
      "post_type": "thread",
      "raw_metadata": {
        "username": "yoo1903x",
        "likes": 0,
        "replies": 0,
        "reposts": 0,
        "shares": 0,
        "time": "5d",
        "datetime": "2025-12-29T14:30:02.000Z"
      },
      "is_cleaned": true,
      "data_type": "threads",
      "reposts_count": 0
    },
    {
      "url": "https://www.threads.net/@quangtri1952/post/DS9HMcTDEzv",
      "source_type": "threads",
      "source": "https://www.threads.net/@quangtri1952/post/DS9HMcTDEzv",
      "domain": "threads.net",
      "social_platform": "threads",
      "title": "Quang Hưng Master ĐNguyen Thi Be Thắm Translate 12",
      "content": "Quang Hưng Master ĐNguyen Thi Be Thắm Translate 12",
      "word_count": 9,
      "published_date": 1767242180.0,
      "published_datetime": "2026-01-01 04:36:20+00:00",
      "likes_count": 0,
      "shares_count": 0,
      "comments_count": 0,
      "views_count": 0,
      "reactions": null,
      "account_id": "quangtri1952",
      "account_name": "quangtri1952",
      "account_url": "https://www.threads.net/@quangtri1952",
      "post_id": "7885",
      "post_type": "thread",
      "raw_metadata": {
        "username": "quangtri1952",
        "likes": 0,
        "replies": 0,
        "reposts": 0,
        "shares": 0,
        "time": "3d",
        "datetime": "2026-01-01T04:36:20.000Z"
      },
      "is_cleaned": true,
      "data_type": "threads",
      "reposts_count": 0
    },
    {
      "url": "https://www.threads.net/@wt1.yi_/post/DPMI_aHkt2-",
      "source_type": "threads",
      "source": "https://www.threads.net/@wt1.yi_/post/DPMI_aHkt2-",
      "domain": "threads.net",
      "social_platform": "threads",
      "title": "ng quen xin hãy giả mù  em cần tìm thợ kỷ yếu, 2 người, 3011, TP Hưng Yên ạ budget 1trng",
      "content": "ng quen xin hãy giả mù  em cần tìm thợ kỷ yếu, 2 người, 3011, TP Hưng Yên ạ budget 1trng",
      "word_count": 21,
      "published_date": 1759156503.0,
      "published_datetime": "2025-09-29 14:35:03+00:00",
      "likes_count": 0,
      "shares_count": 0,
      "comments_count": 0,
      "views_count": 0,
      "reactions": null,
      "account_id": "wt1.yi_",
      "account_name": "wt1.yi_",
      "account_url": "https://www.threads.net/@wt1.yi_",
      "post_id": "7884",
      "post_type": "thread",
      "raw_metadata": {
        "username": "wt1.yi_",
        "likes": 0,
        "replies": 0,
        "reposts": 0,
        "shares": 0,
        "time": "09/29/25",
        "datetime": "2025-09-29T14:35:03.000Z"
      },
      "is_cleaned": true,
      "data_type": "threads",
      "reposts_count": 0
    },
    {
      "url": "https://www.threads.net/@thaoanh.cassey/post/DLkkrUahFkB",
      "source_type": "threads",
      "source": "https://www.threads.net/@thaoanh.cassey/post/DLkkrUahFkB",
      "domain": "threads.net",
      "social_platform": "threads",
      "title": "Nguyên quán Thái Bình giờ nghe Hưng Yên là hoắc",
      "content": "Nguyên quán Thái Bình giờ nghe Hưng Yên là hoắc",
      "word_count": 10,
      "published_date": 1751386391.0,
      "published_datetime": "2025-07-01 16:13:11+00:00",
      "likes_count": 0,
      "shares_count": 0,
      "comments_count": 0,
      "views_count": 0,
      "reactions": null,
      "account_id": "thaoanh.cassey",
      "account_name": "thaoanh.cassey",
      "account_url": "https://www.threads.net/@thaoanh.cassey",
      "post_id": "7883",
      "post_type": "thread",
      "raw_metadata": {
        "username": "thaoanh.cassey",
        "likes": 0,
        "replies": 0,
        "reposts": 0,
        "shares": 0,
        "time": "07/01/25",
        "datetime": "2025-07-01T16:13:11.000Z"
      },
      "is_cleaned": true,
      "data_type": "threads",
      "reposts_count": 0
    },
    {
      "url": "https://www.threads.net/@kierababby/post/DSumHgPEkhQ",
      "source_type": "threads",
      "source": "https://www.threads.net/@kierababby/post/DSumHgPEkhQ",
      "domain": "threads.net",
      "social_platform": "threads",
      "title": "Quê Hưng Yên có 50k bạn",
      "content": "Quê Hưng Yên có 50k bạn",
      "word_count": 6,
      "published_date": 1766755076.0,
      "published_datetime": "2025-12-26 13:17:56+00:00",
      "likes_count": 0,
      "shares_count": 0,
      "comments_count": 0,
      "views_count": 0,
      "reactions": null,
      "account_id": "kierababby",
      "account_name": "kierababby",
      "account_url": "https://www.threads.net/@kierababby",
      "post_id": "7882",
      "post_type": "thread",
      "raw_metadata": {
        "username": "kierababby",
        "likes": 0,
        "replies": 0,
        "reposts": 0,
        "shares": 0,
        "time": "12/26/25",
        "datetime": "2025-12-26T13:17:56.000Z"
      },
      "is_cleaned": true,
      "data_type": "threads",
      "reposts_count": 0
    },
    {
      "url": "https://www.threads.net/@do3133/post/DSrtTjdEt4C",
      "source_type": "threads",
      "source": "https://www.threads.net/@do3133/post/DSrtTjdEt4C",
      "domain": "threads.net",
      "social_platform": "threads",
      "title": "Ở đây có ai khu khoái châu và yên mỹ Hưng yên không vậy",
      "content": "Ở đây có ai khu khoái châu và yên mỹ Hưng yên không vậy",
      "word_count": 14,
      "published_date": 1766658181.0,
      "published_datetime": "2025-12-25 10:23:01+00:00",
      "likes_count": 0,
      "shares_count": 0,
      "comments_count": 0,
      "views_count": 0,
      "reactions": null,
      "account_id": "do3133",
      "account_name": "do3133",
      "account_url": "https://www.threads.net/@do3133",
      "post_id": "7881",
      "post_type": "thread",
      "raw_metadata": {
        "username": "do3133",
        "likes": 0,
        "replies": 0,
        "reposts": 0,
        "shares": 0,
        "time": "12/25/25",
        "datetime": "2025-12-25T10:23:01.000Z"
      },
      "is_cleaned": true,
      "data_type": "threads",
      "reposts_count": 0
    },
    {
      "url": "https://www.threads.net/@phatkindadumb/post/DRcSLLSEhJJ",
      "source_type": "threads",
      "source": "https://www.threads.net/@phatkindadumb/post/DRcSLLSEhJJ",
      "domain": "threads.net",
      "social_platform": "threads",
      "title": "no one mourns phạm nhật vượng the girl in the vinfast no place like vinhome (sáp nhập) for good the ...",
      "content": "no one mourns phạm nhật vượng the girl in the vinfast no place like vinhome (sáp nhập) for good the wicked witch of hưng yên võ hoàng yên and i one short day (in khu du lịch đại nam) im not nguyễn phương hằng everyday more inflated are people born in vinmec or do they have vinmec thrust upon them",
      "word_count": 60,
      "published_date": 1763993157.0,
      "published_datetime": "2025-11-24 14:05:57+00:00",
      "likes_count": 0,
      "shares_count": 0,
      "comments_count": 0,
      "views_count": 0,
      "reactions": null,
      "account_id": "phatkindadumb",
      "account_name": "phatkindadumb",
      "account_url": "https://www.threads.net/@phatkindadumb",
      "post_id": "7880",
      "post_type": "thread",
      "raw_metadata": {
        "username": "phatkindadumb",
        "likes": 0,
        "replies": 0,
        "reposts": 0,
        "shares": 0,
        "time": "11/24/25",
        "datetime": "2025-11-24T14:05:57.000Z"
      },
      "is_cleaned": true,
      "data_type": "threads",
      "reposts_count": 0
    },
    {
      "url": "https://www.threads.net/@gnlhain/post/DS6qRZ1DwHI",
      "source_type": "threads",
      "source": "https://www.threads.net/@gnlhain/post/DS6qRZ1DwHI",
      "domain": "threads.net",
      "social_platform": "threads",
      "title": "ae có ai yên định thanh hoá tối nay 9h làm kèo nhậu đi ))",
      "content": "ae có ai yên định thanh hoá tối nay 9h làm kèo nhậu đi ))",
      "word_count": 15,
      "published_date": 1767159907.0,
      "published_datetime": "2025-12-31 05:45:07+00:00",
      "likes_count": 0,
      "shares_count": 0,
      "comments_count": 0,
      "views_count": 0,
      "reactions": null,
      "account_id": "gnlhain",
      "account_name": "gnlhain",
      "account_url": "https://www.threads.net/@gnlhain",
      "post_id": "7879",
      "post_type": "thread",
      "raw_metadata": {
        "username": "gnlhain",
        "likes": 0,
        "replies": 0,
        "reposts": 0,
        "shares": 0,
        "time": "4d",
        "datetime": "2025-12-31T05:45:07.000Z"
      },
      "is_cleaned": true,
      "data_type": "threads",
      "reposts_count": 0
    },
    {
      "url": "https://www.threads.net/@huong28505/post/DSiD0tlD1yN",
      "source_type": "threads",
      "source": "https://www.threads.net/@huong28505/post/DSiD0tlD1yN",
      "domain": "threads.net",
      "social_platform": "threads",
      "title": "t đã bị sốc văn hoá! t sinh ra và lớn lên ở Hưng Yên và đó cũng là quê gốc của t. Quê ngoại t ở Mộc ...",
      "content": "t đã bị sốc văn hoá! t sinh ra và lớn lên ở Hưng Yên và đó cũng là quê gốc của t. Quê ngoại t ở Mộc Châu - Sơn La. ở hưng yên từ bé đến lớn t hay quen mồm xưng con với tất cả mọi người xung quanh chỉ cần là từ vai vế bố mẹ t trở lên kể cả người lạ. hồi t lớp 2 t về quê ngoại là mộc châu, quen mồm xưng con với dì ruột với bác ruột mà đhs bọn trẻ con cứ cười xong t cũng xưng con với bà ngoại thì bà bảo là:\"kh sao cả bé nó xưng con cho nó thân mật\" giây phút nhận ra sai lầm của bản thân",
      "word_count": 126,
      "published_date": 1766334443.0,
      "published_datetime": "2025-12-21 16:27:23+00:00",
      "likes_count": 0,
      "shares_count": 0,
      "comments_count": 0,
      "views_count": 0,
      "reactions": null,
      "account_id": "huong28505",
      "account_name": "huong28505",
      "account_url": "https://www.threads.net/@huong28505",
      "post_id": "7878",
      "post_type": "thread",
      "raw_metadata": {
        "username": "huong28505",
        "likes": 0,
        "replies": 0,
        "reposts": 0,
        "shares": 0,
        "time": "12/21/25",
        "datetime": "2025-12-21T16:27:23.000Z"
      },
      "is_cleaned": true,
      "data_type": "threads",
      "reposts_count": 0
    },
    {
      "url": "https://www.threads.net/@_tnganh/post/DScnu21Dxnk",
      "source_type": "threads",
      "source": "https://www.threads.net/@_tnganh/post/DScnu21Dxnk",
      "domain": "threads.net",
      "social_platform": "threads",
      "title": "chuyện là mọi người cho em hỏi có thợ chụp cá nhân nào giá cả dao động tầm 400-600 không ạ? mọi ngườ...",
      "content": "chuyện là mọi người cho em hỏi có thợ chụp cá nhân nào giá cả dao động tầm 400-600 không ạ? mọi người recommend cho em vài người với, đặc biệt là khu vực Hưng Yên hoặc gần Hưng Yên cũng được",
      "word_count": 42,
      "published_date": 1766151942.0,
      "published_datetime": "2025-12-19 13:45:42+00:00",
      "likes_count": 0,
      "shares_count": 0,
      "comments_count": 0,
      "views_count": 0,
      "reactions": null,
      "account_id": "_tnganh",
      "account_name": "_tnganh",
      "account_url": "https://www.threads.net/@_tnganh",
      "post_id": "7877",
      "post_type": "thread",
      "raw_metadata": {
        "username": "_tnganh",
        "likes": 0,
        "replies": 0,
        "reposts": 0,
        "shares": 0,
        "time": "12/19/25",
        "datetime": "2025-12-19T13:45:42.000Z"
      },
      "is_cleaned": true,
      "data_type": "threads",
      "reposts_count": 0
    },
    {
      "url": "https://www.threads.net/@tntt.2511/post/DSfAVrskUrr",
      "source_type": "threads",
      "source": "https://www.threads.net/@tntt.2511/post/DSfAVrskUrr",
      "domain": "threads.net",
      "social_platform": "threads",
      "title": "Sao t không ở Hưng Yên?????????????",
      "content": "Sao t không ở Hưng Yên?????????????",
      "word_count": 6,
      "published_date": 1766231952.0,
      "published_datetime": "2025-12-20 11:59:12+00:00",
      "likes_count": 0,
      "shares_count": 0,
      "comments_count": 0,
      "views_count": 0,
      "reactions": null,
      "account_id": "tntt.2511",
      "account_name": "tntt.2511",
      "account_url": "https://www.threads.net/@tntt.2511",
      "post_id": "7876",
      "post_type": "thread",
      "raw_metadata": {
        "username": "tntt.2511",
        "likes": 0,
        "replies": 0,
        "reposts": 0,
        "shares": 0,
        "time": "12/20/25",
        "datetime": "2025-12-20T11:59:12.000Z"
      },
      "is_cleaned": true,
      "data_type": "threads",
      "reposts_count": 0
    },
    {
      "url": "https://www.threads.net/@nmh22.12/post/DPh46BdEuNj",
      "source_type": "threads",
      "source": "https://www.threads.net/@nmh22.12/post/DPh46BdEuNj",
      "domain": "threads.net",
      "social_platform": "threads",
      "title": "Nhân Hoà - Mỹ Hào - Hưng Yên có ai không #top",
      "content": "Nhân Hoà - Mỹ Hào - Hưng Yên có ai không #top",
      "word_count": 12,
      "published_date": 1759886268.0,
      "published_datetime": "2025-10-08 01:17:48+00:00",
      "likes_count": 0,
      "shares_count": 0,
      "comments_count": 0,
      "views_count": 0,
      "reactions": null,
      "account_id": "nmh22.12",
      "account_name": "nmh22.12",
      "account_url": "https://www.threads.net/@nmh22.12",
      "post_id": "7875",
      "post_type": "thread",
      "raw_metadata": {
        "username": "nmh22.12",
        "likes": 0,
        "replies": 0,
        "reposts": 0,
        "shares": 0,
        "time": "10/07/25",
        "datetime": "2025-10-08T01:17:48.000Z"
      },
      "is_cleaned": true,
      "data_type": "threads",
      "reposts_count": 0
    },
    {
      "url": "https://www.threads.net/@jhn.nguynhen/post/DSfr89tkwXg",
      "source_type": "threads",
      "source": "https://www.threads.net/@jhn.nguynhen/post/DSfr89tkwXg",
      "domain": "threads.net",
      "social_platform": "threads",
      "title": "Giờ mới có mạng update tình hình thế giới  Huhuhu em yêu Hưng Yên Không hổ danh Hưng Yên mảnh đất ...",
      "content": "Giờ mới có mạng update tình hình thế giới  Huhuhu em yêu Hưng Yên Không hổ danh Hưng Yên mảnh đất hữu tình :",
      "word_count": 24,
      "published_date": 1766254819.0,
      "published_datetime": "2025-12-20 18:20:19+00:00",
      "likes_count": 0,
      "shares_count": 0,
      "comments_count": 0,
      "views_count": 0,
      "reactions": null,
      "account_id": "jhn.nguynhen",
      "account_name": "jhn.nguynhen",
      "account_url": "https://www.threads.net/@jhn.nguynhen",
      "post_id": "7874",
      "post_type": "thread",
      "raw_metadata": {
        "username": "jhn.nguynhen",
        "likes": 0,
        "replies": 0,
        "reposts": 0,
        "shares": 0,
        "time": "12/20/25",
        "datetime": "2025-12-20T18:20:19.000Z"
      },
      "is_cleaned": true,
      "data_type": "threads",
      "reposts_count": 0
    },
    {
      "url": "https://www.threads.net/@the.toan51/post/DOsLwfQklQl",
      "source_type": "threads",
      "source": "https://www.threads.net/@the.toan51/post/DOsLwfQklQl",
      "domain": "threads.net",
      "social_platform": "threads",
      "title": "Muốn tìm hậu phương híc",
      "content": "Muốn tìm hậu phương híc",
      "word_count": 5,
      "published_date": 1758084212.0,
      "published_datetime": "2025-09-17 04:43:32+00:00",
      "likes_count": 0,
      "shares_count": 0,
      "comments_count": 0,
      "views_count": 0,
      "reactions": null,
      "account_id": "the.toan51",
      "account_name": "the.toan51",
      "account_url": "https://www.threads.net/@the.toan51",
      "post_id": "7873",
      "post_type": "thread",
      "raw_metadata": {
        "username": "the.toan51",
        "likes": 0,
        "replies": 0,
        "reposts": 0,
        "shares": 0,
        "time": "09/17/25",
        "datetime": "2025-09-17T04:43:32.000Z"
      },
      "is_cleaned": true,
      "data_type": "threads",
      "reposts_count": 0
    },
    {
      "url": "https://www.threads.net/@dphong_cte/post/DSha-L6D9vd",
      "source_type": "threads",
      "source": "https://www.threads.net/@dphong_cte/post/DSha-L6D9vd",
      "domain": "threads.net",
      "social_platform": "threads",
      "title": "Muốn có ny ở Hưng Yên",
      "content": "Muốn có ny ở Hưng Yên",
      "word_count": 6,
      "published_date": 1766313025.0,
      "published_datetime": "2025-12-21 10:30:25+00:00",
      "likes_count": 0,
      "shares_count": 0,
      "comments_count": 0,
      "views_count": 0,
      "reactions": null,
      "account_id": "dphong_cte",
      "account_name": "dphong_cte",
      "account_url": "https://www.threads.net/@dphong_cte",
      "post_id": "7872",
      "post_type": "thread",
      "raw_metadata": {
        "username": "dphong_cte",
        "likes": 0,
        "replies": 0,
        "reposts": 0,
        "shares": 0,
        "time": "12/21/25",
        "datetime": "2025-12-21T10:30:25.000Z"
      },
      "is_cleaned": true,
      "data_type": "threads",
      "reposts_count": 0
    },
    {
      "url": "https://www.threads.net/@nththuy12/post/DPvmwkAEePK",
      "source_type": "threads",
      "source": "https://www.threads.net/@nththuy12/post/DPvmwkAEePK",
      "domain": "threads.net",
      "social_platform": "threads",
      "title": "Ủa không có ai ở Hưng Yên thật hỏ?",
      "content": "Ủa không có ai ở Hưng Yên thật hỏ?",
      "word_count": 9,
      "published_date": 1760346515.0,
      "published_datetime": "2025-10-13 09:08:35+00:00",
      "likes_count": 0,
      "shares_count": 0,
      "comments_count": 0,
      "views_count": 0,
      "reactions": null,
      "account_id": "nththuy12",
      "account_name": "nththuy12",
      "account_url": "https://www.threads.net/@nththuy12",
      "post_id": "7871",
      "post_type": "thread",
      "raw_metadata": {
        "username": "nththuy12",
        "likes": 0,
        "replies": 0,
        "reposts": 0,
        "shares": 0,
        "time": "10/13/25",
        "datetime": "2025-10-13T09:08:35.000Z"
      },
      "is_cleaned": true,
      "data_type": "threads",
      "reposts_count": 0
    },
    {
      "url": "https://www.threads.net/@ch._.uys/post/DPMmT1_Ehyd",
      "source_type": "threads",
      "source": "https://www.threads.net/@ch._.uys/post/DPMmT1_Ehyd",
      "domain": "threads.net",
      "social_platform": "threads",
      "title": "Ai ở Hưng Yên add nhau khum",
      "content": "Ai ở Hưng Yên add nhau khum",
      "word_count": 7,
      "published_date": 1759171875.0,
      "published_datetime": "2025-09-29 18:51:15+00:00",
      "likes_count": 0,
      "shares_count": 0,
      "comments_count": 0,
      "views_count": 0,
      "reactions": null,
      "account_id": "ch._.uys",
      "account_name": "ch._.uys",
      "account_url": "https://www.threads.net/@ch._.uys",
      "post_id": "7870",
      "post_type": "thread",
      "raw_metadata": {
        "username": "ch._.uys",
        "likes": 0,
        "replies": 0,
        "reposts": 0,
        "shares": 0,
        "time": "09/29/25",
        "datetime": "2025-09-29T18:51:15.000Z"
      },
      "is_cleaned": true,
      "data_type": "threads",
      "reposts_count": 0
    },
    {
      "url": "https://www.threads.net/@puppi.fied/post/DB8Z9GRyFOD",
      "source_type": "threads",
      "source": "https://www.threads.net/@puppi.fied/post/DB8Z9GRyFOD",
      "domain": "threads.net",
      "social_platform": "threads",
      "title": "thế này 1412 phải ra đường đi chơi thôi tại người Hà Nội về HƯNG YÊN xem concert hết rồi",
      "content": "thế này 1412 phải ra đường đi chơi thôi tại người Hà Nội về HƯNG YÊN xem concert hết rồi",
      "word_count": 20,
      "published_date": 1730711239.0,
      "published_datetime": "2024-11-04 09:07:19+00:00",
      "likes_count": 0,
      "shares_count": 0,
      "comments_count": 0,
      "views_count": 0,
      "reactions": null,
      "account_id": "puppi.fied",
      "account_name": "puppi.fied",
      "account_url": "https://www.threads.net/@puppi.fied",
      "post_id": "7869",
      "post_type": "thread",
      "raw_metadata": {
        "username": "puppi.fied",
        "likes": 0,
        "replies": 0,
        "reposts": 0,
        "shares": 0,
        "time": "11/04/24",
        "datetime": "2024-11-04T09:07:19.000Z"
      },
      "is_cleaned": true,
      "data_type": "threads",
      "reposts_count": 0
    },
    {
      "url": "https://www.threads.net/@hh3838663/post/DS66mI7Eof4",
      "source_type": "threads",
      "source": "https://www.threads.net/@hh3838663/post/DS66mI7Eof4",
      "domain": "threads.net",
      "social_platform": "threads",
      "title": "Trời ơi Vieon hãy nghe tiếng lòng của em Day 3 concert ATSH về Hưng Yên nhé",
      "content": "Trời ơi Vieon hãy nghe tiếng lòng của em Day 3 concert ATSH về Hưng Yên nhé",
      "word_count": 17,
      "published_date": 1767168466.0,
      "published_datetime": "2025-12-31 08:07:46+00:00",
      "likes_count": 0,
      "shares_count": 0,
      "comments_count": 0,
      "views_count": 0,
      "reactions": null,
      "account_id": "hh3838663",
      "account_name": "hh3838663",
      "account_url": "https://www.threads.net/@hh3838663",
      "post_id": "7868",
      "post_type": "thread",
      "raw_metadata": {
        "username": "hh3838663",
        "likes": 0,
        "replies": 0,
        "reposts": 0,
        "shares": 0,
        "time": "4d",
        "datetime": "2025-12-31T08:07:46.000Z"
      },
      "is_cleaned": true,
      "data_type": "threads",
      "reposts_count": 0
    },
    {
      "url": "https://www.threads.net/@thfduognn/post/DSZn94tiQ5y",
      "source_type": "threads",
      "source": "https://www.threads.net/@thfduognn/post/DSZn94tiQ5y",
      "domain": "threads.net",
      "social_platform": "threads",
      "title": "ỐI DỒI ÔI THI XONG RỒI T SẼ Ở HƯNG YÊN NGAY TRONG TỐI NAY  Translate 12",
      "content": "ỐI DỒI ÔI THI XONG RỒI T SẼ Ở HƯNG YÊN NGAY TRONG TỐI NAY  Translate 12",
      "word_count": 17,
      "published_date": 1766051402.0,
      "published_datetime": "2025-12-18 09:50:02+00:00",
      "likes_count": 0,
      "shares_count": 0,
      "comments_count": 0,
      "views_count": 0,
      "reactions": null,
      "account_id": "thfduognn",
      "account_name": "thfduognn",
      "account_url": "https://www.threads.net/@thfduognn",
      "post_id": "7867",
      "post_type": "thread",
      "raw_metadata": {
        "username": "thfduognn",
        "likes": 0,
        "replies": 0,
        "reposts": 0,
        "shares": 0,
        "time": "12/18/25",
        "datetime": "2025-12-18T09:50:02.000Z"
      },
      "is_cleaned": true,
      "data_type": "threads",
      "reposts_count": 0
    },
    {
      "url": "https://www.threads.net/@pham.anhhiep.1991/post/DR929G6kp0K",
      "source_type": "threads",
      "source": "https://www.threads.net/@pham.anhhiep.1991/post/DR929G6kp0K",
      "domain": "threads.net",
      "social_platform": "threads",
      "title": "Mình ở Hiệp Cường Hưng Yên.. Tìm bạn ..!",
      "content": "Mình ở Hiệp Cường Hưng Yên.. Tìm bạn ..!",
      "word_count": 9,
      "published_date": 1765119736.0,
      "published_datetime": "2025-12-07 15:02:16+00:00",
      "likes_count": 0,
      "shares_count": 0,
      "comments_count": 0,
      "views_count": 0,
      "reactions": null,
      "account_id": "pham.anhhiep.1991",
      "account_name": "pham.anhhiep.1991",
      "account_url": "https://www.threads.net/@pham.anhhiep.1991",
      "post_id": "7866",
      "post_type": "thread",
      "raw_metadata": {
        "username": "pham.anhhiep.1991",
        "likes": 0,
        "replies": 0,
        "reposts": 0,
        "shares": 0,
        "time": "12/07/25",
        "datetime": "2025-12-07T15:02:16.000Z"
      },
      "is_cleaned": true,
      "data_type": "threads",
      "reposts_count": 0
    },
    {
      "url": "https://www.threads.net/@_.thehmk._/post/DSjXItPAY2u",
      "source_type": "threads",
      "source": "https://www.threads.net/@_.thehmk._/post/DSjXItPAY2u",
      "domain": "threads.net",
      "social_platform": "threads",
      "title": "Góc tự hào Bố mình - Một người đã thuộc hội U70 và sống một cuộc sống bình yên. Bố mình cũng rất gi...",
      "content": "Góc tự hào Bố mình - Một người đã thuộc hội U70 và sống một cuộc sống bình yên. Bố mình cũng rất giỏi khi đã có thể đi lên từ 2 bàn tay trắng. Mình sống ở thủ đô nhưng không phải dân gốc và bản thân lớn lên rất ngưỡng mộ người bố của mình. Bố mình sinh ra ở Thị xã Mỹ Hào, Hưng Yên và từ rất sớm đã phải lo lắng cho cuộc sống của bản thân. Vì vậy, ít nhiều bố mình rất quý trọng đồng tiền và luôn cố gắng để có các nguồn thu, tài sản khác nhau. Translate 12",
      "word_count": 108,
      "published_date": 1766378122.0,
      "published_datetime": "2025-12-22 04:35:22+00:00",
      "likes_count": 0,
      "shares_count": 0,
      "comments_count": 0,
      "views_count": 0,
      "reactions": null,
      "account_id": "_.thehmk._",
      "account_name": "_.thehmk._",
      "account_url": "https://www.threads.net/@_.thehmk._",
      "post_id": "7865",
      "post_type": "thread",
      "raw_metadata": {
        "username": "_.thehmk._",
        "likes": 0,
        "replies": 0,
        "reposts": 0,
        "shares": 0,
        "time": "12/21/25",
        "datetime": "2025-12-22T04:35:22.000Z"
      },
      "is_cleaned": true,
      "data_type": "threads",
      "reposts_count": 0
    },
    {
      "url": "https://www.threads.net/@anh1704na/post/DSeURPVERou",
      "source_type": "threads",
      "source": "https://www.threads.net/@anh1704na/post/DSeURPVERou",
      "domain": "threads.net",
      "social_platform": "threads",
      "title": "Khu nghỉ dưỡng đông nhất Hưng Yên hiện tại",
      "content": "Khu nghỉ dưỡng đông nhất Hưng Yên hiện tại",
      "word_count": 9,
      "published_date": 1766208961.0,
      "published_datetime": "2025-12-20 05:36:01+00:00",
      "likes_count": 0,
      "shares_count": 0,
      "comments_count": 0,
      "views_count": 0,
      "reactions": null,
      "account_id": "anh1704na",
      "account_name": "anh1704na",
      "account_url": "https://www.threads.net/@anh1704na",
      "post_id": "7864",
      "post_type": "thread",
      "raw_metadata": {
        "username": "anh1704na",
        "likes": 0,
        "replies": 0,
        "reposts": 0,
        "shares": 0,
        "time": "12/20/25",
        "datetime": "2025-12-20T05:36:01.000Z"
      },
      "is_cleaned": true,
      "data_type": "threads",
      "reposts_count": 0
    },
    {
      "url": "https://www.threads.net/@embedanglamhr/post/DSjXXvUkx5l",
      "source_type": "threads",
      "source": "https://www.threads.net/@embedanglamhr/post/DSjXXvUkx5l",
      "domain": "threads.net",
      "social_platform": "threads",
      "title": "Tui đang tuyển 1 bạn Nhân viên Marketing làm tại KCN Thăng Long 2, khoảng 6 tháng - 1 năm kn, WELCOM...",
      "content": "Tui đang tuyển 1 bạn Nhân viên Marketing làm tại KCN Thăng Long 2, khoảng 6 tháng - 1 năm kn, WELCOME FRESHER lun nếu base tốt Lương deal tẹt ga, upto 20M",
      "word_count": 33,
      "published_date": 1766378246.0,
      "published_datetime": "2025-12-22 04:37:26+00:00",
      "likes_count": 0,
      "shares_count": 0,
      "comments_count": 0,
      "views_count": 0,
      "reactions": null,
      "account_id": "embedanglamhr",
      "account_name": "embedanglamhr",
      "account_url": "https://www.threads.net/@embedanglamhr",
      "post_id": "7863",
      "post_type": "thread",
      "raw_metadata": {
        "username": "embedanglamhr",
        "likes": 0,
        "replies": 0,
        "reposts": 0,
        "shares": 0,
        "time": "12/21/25",
        "datetime": "2025-12-22T04:37:26.000Z"
      },
      "is_cleaned": true,
      "data_type": "threads",
      "reposts_count": 0
    },
    {
      "url": "https://www.threads.net/@ttny110907/post/DSCwP-QEx-R",
      "source_type": "threads",
      "source": "https://www.threads.net/@ttny110907/post/DSCwP-QEx-R",
      "domain": "threads.net",
      "social_platform": "threads",
      "title": "hưng yên ( hồ thiên nga )",
      "content": "hưng yên ( hồ thiên nga )",
      "word_count": 7,
      "published_date": 1765283993.0,
      "published_datetime": "2025-12-09 12:39:53+00:00",
      "likes_count": 0,
      "shares_count": 0,
      "comments_count": 0,
      "views_count": 0,
      "reactions": null,
      "account_id": "ttny110907",
      "account_name": "ttny110907",
      "account_url": "https://www.threads.net/@ttny110907",
      "post_id": "7862",
      "post_type": "thread",
      "raw_metadata": {
        "username": "ttny110907",
        "likes": 0,
        "replies": 0,
        "reposts": 0,
        "shares": 0,
        "time": "12/09/25",
        "datetime": "2025-12-09T12:39:53.000Z"
      },
      "is_cleaned": true,
      "data_type": "threads",
      "reposts_count": 0
    },
    {
      "url": "https://www.threads.net/@_chauuu.le/post/DDbiGcoPgeb",
      "source_type": "threads",
      "source": "https://www.threads.net/@_chauuu.le/post/DDbiGcoPgeb",
      "domain": "threads.net",
      "social_platform": "threads",
      "title": "Hai chữ \"HƯNG YÊN\" khó viết đến thế sao? ??? viral Translate 12",
      "content": "Hai chữ \"HƯNG YÊN\" khó viết đến thế sao? ??? viral Translate 12",
      "word_count": 13,
      "published_date": 1733903181.0,
      "published_datetime": "2024-12-11 07:46:21+00:00",
      "likes_count": 0,
      "shares_count": 0,
      "comments_count": 0,
      "views_count": 0,
      "reactions": null,
      "account_id": "_chauuu.le",
      "account_name": "_chauuu.le",
      "account_url": "https://www.threads.net/@_chauuu.le",
      "post_id": "7861",
      "post_type": "thread",
      "raw_metadata": {
        "username": "_chauuu.le",
        "likes": 0,
        "replies": 0,
        "reposts": 0,
        "shares": 0,
        "time": "12/11/24",
        "datetime": "2024-12-11T07:46:21.000Z"
      },
      "is_cleaned": true,
      "data_type": "threads",
      "reposts_count": 0
    },
    {
      "url": "https://www.threads.net/@pl.hlan/post/DM8WYKszX_C",
      "source_type": "threads",
      "source": "https://www.threads.net/@pl.hlan/post/DM8WYKszX_C",
      "domain": "threads.net",
      "social_platform": "threads",
      "title": "ê t đi từ Thái Nguyên  HN rồi maps chỉ t đi cái đường này  Trời ơi view vua chúa gì đây? Ngoài nó...",
      "content": "ê t đi từ Thái Nguyên  HN rồi maps chỉ t đi cái đường này  Trời ơi view vua chúa gì đây? Ngoài nó đẹp x5 lần luôn ấy. Chỗ nào Phổ Yên- Thái Nguyên ấy. Tôi chỉ biết đoạn này đi hết đường Hồ Suối Lạnh thôi Translate 12",
      "word_count": 50,
      "published_date": 1754331783.0,
      "published_datetime": "2025-08-04 18:23:03+00:00",
      "likes_count": 0,
      "shares_count": 0,
      "comments_count": 0,
      "views_count": 0,
      "reactions": null,
      "account_id": "pl.hlan",
      "account_name": "pl.hlan",
      "account_url": "https://www.threads.net/@pl.hlan",
      "post_id": "7860",
      "post_type": "thread",
      "raw_metadata": {
        "username": "pl.hlan",
        "likes": 0,
        "replies": 0,
        "reposts": 0,
        "shares": 0,
        "time": "08/04/25",
        "datetime": "2025-08-04T18:23:03.000Z"
      },
      "is_cleaned": true,
      "data_type": "threads",
      "reposts_count": 0
    },
    {
      "url": "https://www.threads.net/@punnie._05/post/DSkRZGcEfD9",
      "source_type": "threads",
      "source": "https://www.threads.net/@punnie._05/post/DSkRZGcEfD9",
      "domain": "threads.net",
      "social_platform": "threads",
      "title": "cúi tuần tui đi đám cứi bên hưng yên á mí bà, mí bà bên hưng yên rcm cho tui bà nào makeup ôki xí đư...",
      "content": "cúi tuần tui đi đám cứi bên hưng yên á mí bà, mí bà bên hưng yên rcm cho tui bà nào makeup ôki xí được homm ah, zá rổ gì không quan trọnggggg!!! Translate 12",
      "word_count": 36,
      "published_date": 1766408665.0,
      "published_datetime": "2025-12-22 13:04:25+00:00",
      "likes_count": 0,
      "shares_count": 0,
      "comments_count": 0,
      "views_count": 0,
      "reactions": null,
      "account_id": "punnie._05",
      "account_name": "punnie._05",
      "account_url": "https://www.threads.net/@punnie._05",
      "post_id": "7859",
      "post_type": "thread",
      "raw_metadata": {
        "username": "punnie._05",
        "likes": 0,
        "replies": 0,
        "reposts": 0,
        "shares": 0,
        "time": "12/22/25",
        "datetime": "2025-12-22T13:04:25.000Z"
      },
      "is_cleaned": true,
      "data_type": "threads",
      "reposts_count": 0
    },
    {
      "url": "https://www.threads.net/@_toothlesssss_/post/DSuHEViD97E",
      "source_type": "threads",
      "source": "https://www.threads.net/@_toothlesssss_/post/DSuHEViD97E",
      "domain": "threads.net",
      "social_platform": "threads",
      "title": "Có ai thi sat t3 mà không có slot ở hnoi để đki giống mình k ạ?!?! Giờ nên đợi nhả thêm hay đăng kí ...",
      "content": "Có ai thi sat t3 mà không có slot ở hnoi để đki giống mình k ạ?!?! Giờ nên đợi nhả thêm hay đăng kí luôn ở đà nẵng ạ, tại mấy tỉnh gần hơn như hưng yên hải phòng cũng full seats mất r:((( Translate 12",
      "word_count": 47,
      "published_date": 1766738797.0,
      "published_datetime": "2025-12-26 08:46:37+00:00",
      "likes_count": 0,
      "shares_count": 0,
      "comments_count": 0,
      "views_count": 0,
      "reactions": null,
      "account_id": "_toothlesssss_",
      "account_name": "_toothlesssss_",
      "account_url": "https://www.threads.net/@_toothlesssss_",
      "post_id": "7858",
      "post_type": "thread",
      "raw_metadata": {
        "username": "_toothlesssss_",
        "likes": 0,
        "replies": 0,
        "reposts": 0,
        "shares": 0,
        "time": "12/26/25",
        "datetime": "2025-12-26T08:46:37.000Z"
      },
      "is_cleaned": true,
      "data_type": "threads",
      "reposts_count": 0
    },
    {
      "url": "https://www.threads.net/@nira19588/post/DS42eoDge5n",
      "source_type": "threads",
      "source": "https://www.threads.net/@nira19588/post/DS42eoDge5n",
      "domain": "threads.net",
      "social_platform": "threads",
      "title": "Còn ai ở Hải Phòng chưa có ng iu khum ạ !",
      "content": "Còn ai ở Hải Phòng chưa có ng iu khum ạ !",
      "word_count": 12,
      "published_date": 1767099198.0,
      "published_datetime": "2025-12-30 12:53:18+00:00",
      "likes_count": 0,
      "shares_count": 0,
      "comments_count": 0,
      "views_count": 0,
      "reactions": null,
      "account_id": "nira19588",
      "account_name": "nira19588",
      "account_url": "https://www.threads.net/@nira19588",
      "post_id": "7857",
      "post_type": "thread",
      "raw_metadata": {
        "username": "nira19588",
        "likes": 0,
        "replies": 0,
        "reposts": 0,
        "shares": 0,
        "time": "4d",
        "datetime": "2025-12-30T12:53:18.000Z"
      },
      "is_cleaned": true,
      "data_type": "threads",
      "reposts_count": 0
    },
    {
      "url": "https://www.threads.net/@thuuu_18121996/post/DS71yOzkza8",
      "source_type": "threads",
      "source": "https://www.threads.net/@thuuu_18121996/post/DS71yOzkza8",
      "domain": "threads.net",
      "social_platform": "threads",
      "title": "Có ai Phú Yên ở đây hông dẫy?",
      "content": "Có ai Phú Yên ở đây hông dẫy?",
      "word_count": 8,
      "published_date": 1767199498.0,
      "published_datetime": "2025-12-31 16:44:58+00:00",
      "likes_count": 0,
      "shares_count": 0,
      "comments_count": 0,
      "views_count": 0,
      "reactions": null,
      "account_id": "thuuu_18121996",
      "account_name": "thuuu_18121996",
      "account_url": "https://www.threads.net/@thuuu_18121996",
      "post_id": "7856",
      "post_type": "thread",
      "raw_metadata": {
        "username": "thuuu_18121996",
        "likes": 0,
        "replies": 0,
        "reposts": 0,
        "shares": 0,
        "time": "3d",
        "datetime": "2025-12-31T16:44:58.000Z"
      },
      "is_cleaned": true,
      "data_type": "threads",
      "reposts_count": 0
    },
    {
      "url": "https://www.threads.net/@ann.hn_d/post/DMctRJrv-rg",
      "source_type": "threads",
      "source": "https://www.threads.net/@ann.hn_d/post/DMctRJrv-rg",
      "domain": "threads.net",
      "social_platform": "threads",
      "title": "gái Hưng Yên gốc Thái Bình",
      "content": "gái Hưng Yên gốc Thái Bình",
      "word_count": 6,
      "published_date": 1753269980.0,
      "published_datetime": "2025-07-23 11:26:20+00:00",
      "likes_count": 0,
      "shares_count": 0,
      "comments_count": 0,
      "views_count": 0,
      "reactions": null,
      "account_id": "ann.hn_d",
      "account_name": "ann.hn_d",
      "account_url": "https://www.threads.net/@ann.hn_d",
      "post_id": "7855",
      "post_type": "thread",
      "raw_metadata": {
        "username": "ann.hn_d",
        "likes": 0,
        "replies": 0,
        "reposts": 0,
        "shares": 0,
        "time": "07/23/25",
        "datetime": "2025-07-23T11:26:20.000Z"
      },
      "is_cleaned": true,
      "data_type": "threads",
      "reposts_count": 0
    },
    {
      "url": "https://www.threads.net/@quynhvn_lily/post/DSHly_UERXN",
      "source_type": "threads",
      "source": "https://www.threads.net/@quynhvn_lily/post/DSHly_UERXN",
      "domain": "threads.net",
      "social_platform": "threads",
      "title": "Công ty châu Âu ở phố nối A Hưng Yên cần tuyển Project Manager, tiếng anh tốt, có kinh nghiệm làm pr...",
      "content": "Công ty châu Âu ở phố nối A Hưng Yên cần tuyển Project Manager, tiếng anh tốt, có kinh nghiệm làm project trong sản xuất, lương và chế độ châu Âu. Bạn nào muốn phỏng vấn trước tết qua tết đi làm thì Pm mình nhé!!!",
      "word_count": 46,
      "published_date": 1765446285.0,
      "published_datetime": "2025-12-11 09:44:45+00:00",
      "likes_count": 0,
      "shares_count": 0,
      "comments_count": 0,
      "views_count": 0,
      "reactions": null,
      "account_id": "quynhvn_lily",
      "account_name": "quynhvn_lily",
      "account_url": "https://www.threads.net/@quynhvn_lily",
      "post_id": "7854",
      "post_type": "thread",
      "raw_metadata": {
        "username": "quynhvn_lily",
        "likes": 0,
        "replies": 0,
        "reposts": 0,
        "shares": 0,
        "time": "12/11/25",
        "datetime": "2025-12-11T09:44:45.000Z"
      },
      "is_cleaned": true,
      "data_type": "threads",
      "reposts_count": 0
    },
    {
      "url": "https://www.threads.net/@huongbear_27/post/DTDWVVUE0U7",
      "source_type": "threads",
      "source": "https://www.threads.net/@huongbear_27/post/DTDWVVUE0U7",
      "domain": "threads.net",
      "social_platform": "threads",
      "title": "Em cần mượn Dji Pocket 3 ở Hưng Yên Mn ai có hoặc biết chỗ thuê không ạ",
      "content": "Em cần mượn Dji Pocket 3 ở Hưng Yên Mn ai có hoặc biết chỗ thuê không ạ",
      "word_count": 18,
      "published_date": 1767451443.0,
      "published_datetime": "2026-01-03 14:44:03+00:00",
      "likes_count": 0,
      "shares_count": 0,
      "comments_count": 0,
      "views_count": 0,
      "reactions": null,
      "account_id": "huongbear_27",
      "account_name": "huongbear_27",
      "account_url": "https://www.threads.net/@huongbear_27",
      "post_id": "7853",
      "post_type": "thread",
      "raw_metadata": {
        "username": "huongbear_27",
        "likes": 0,
        "replies": 0,
        "reposts": 0,
        "shares": 0,
        "time": "19h",
        "datetime": "2026-01-03T14:44:03.000Z"
      },
      "is_cleaned": true,
      "data_type": "threads",
      "reposts_count": 0
    },
    {
      "url": "https://www.threads.net/@ngvlx/post/DOfR4UVkqCu",
      "source_type": "threads",
      "source": "https://www.threads.net/@ngvlx/post/DOfR4UVkqCu",
      "domain": "threads.net",
      "social_platform": "threads",
      "title": "Các mom đã đi ATVNCG ở OCEAN PARK cho em hỏi xin thông tin xe các mom đi từ nội thành (cụ thể là cầu...",
      "content": "Các mom đã đi ATVNCG ở OCEAN PARK cho em hỏi xin thông tin xe các mom đi từ nội thành (cụ thể là cầu giấy) đến OCEAN PARK với ạ, khổ cái thân già lại phải lê ra tận Hưng Yên xem Rồng xuất thế",
      "word_count": 46,
      "published_date": 1757651214.0,
      "published_datetime": "2025-09-12 04:26:54+00:00",
      "likes_count": 0,
      "shares_count": 0,
      "comments_count": 0,
      "views_count": 0,
      "reactions": null,
      "account_id": "ngvlx",
      "account_name": "ngvlx",
      "account_url": "https://www.threads.net/@ngvlx",
      "post_id": "7852",
      "post_type": "thread",
      "raw_metadata": {
        "username": "ngvlx",
        "likes": 0,
        "replies": 0,
        "reposts": 0,
        "shares": 0,
        "time": "09/12/25",
        "datetime": "2025-09-12T04:26:54.000Z"
      },
      "is_cleaned": true,
      "data_type": "threads",
      "reposts_count": 0
    },
    {
      "url": "https://www.threads.net/@lunapham.08/post/DS5_d7cEpw1",
      "source_type": "threads",
      "source": "https://www.threads.net/@lunapham.08/post/DS5_d7cEpw1",
      "domain": "threads.net",
      "social_platform": "threads",
      "title": "ở Huế có chỗ nào như này kh mọi ngườiii",
      "content": "ở Huế có chỗ nào như này kh mọi ngườiii",
      "word_count": 10,
      "published_date": 1767137465.0,
      "published_datetime": "2025-12-30 23:31:05+00:00",
      "likes_count": 0,
      "shares_count": 0,
      "comments_count": 0,
      "views_count": 0,
      "reactions": null,
      "account_id": "lunapham.08",
      "account_name": "lunapham.08",
      "account_url": "https://www.threads.net/@lunapham.08",
      "post_id": "7851",
      "post_type": "thread",
      "raw_metadata": {
        "username": "lunapham.08",
        "likes": 0,
        "replies": 0,
        "reposts": 0,
        "shares": 0,
        "time": "4d",
        "datetime": "2025-12-30T23:31:05.000Z"
      },
      "is_cleaned": true,
      "data_type": "threads",
      "reposts_count": 0
    },
    {
      "url": "https://www.threads.net/@chichin1202/post/DS4jJHhEVuV",
      "source_type": "threads",
      "source": "https://www.threads.net/@chichin1202/post/DS4jJHhEVuV",
      "domain": "threads.net",
      "social_platform": "threads",
      "title": "Em cần tìm việc quanh kim động hưng yên ạk",
      "content": "Em cần tìm việc quanh kim động hưng yên ạk",
      "word_count": 10,
      "published_date": 1767089060.0,
      "published_datetime": "2025-12-30 10:04:20+00:00",
      "likes_count": 0,
      "shares_count": 0,
      "comments_count": 0,
      "views_count": 0,
      "reactions": null,
      "account_id": "chichin1202",
      "account_name": "chichin1202",
      "account_url": "https://www.threads.net/@chichin1202",
      "post_id": "7850",
      "post_type": "thread",
      "raw_metadata": {
        "username": "chichin1202",
        "likes": 0,
        "replies": 0,
        "reposts": 0,
        "shares": 0,
        "time": "5d",
        "datetime": "2025-12-30T10:04:20.000Z"
      },
      "is_cleaned": true,
      "data_type": "threads",
      "reposts_count": 0
    },
    {
      "url": "https://www.threads.net/@zippsw/post/DS5A6rvkhJN",
      "source_type": "threads",
      "source": "https://www.threads.net/@zippsw/post/DS5A6rvkhJN",
      "domain": "threads.net",
      "social_platform": "threads",
      "title": ": swan nguyễn, loại : loại rồi mà anh ))))))))))))))))))))))))))))))))))))",
      "content": ": swan nguyễn, loại : loại rồi mà anh ))))))))))))))))))))))))))))))))))))",
      "word_count": 10,
      "published_date": 1767104671.0,
      "published_datetime": "2025-12-30 14:24:31+00:00",
      "likes_count": 0,
      "shares_count": 0,
      "comments_count": 0,
      "views_count": 0,
      "reactions": null,
      "account_id": "zippsw",
      "account_name": "zippsw",
      "account_url": "https://www.threads.net/@zippsw",
      "post_id": "7849",
      "post_type": "thread",
      "raw_metadata": {
        "username": "zippsw",
        "likes": 0,
        "replies": 0,
        "reposts": 0,
        "shares": 0,
        "time": "4d",
        "datetime": "2025-12-30T14:24:31.000Z"
      },
      "is_cleaned": true,
      "data_type": "threads",
      "reposts_count": 0
    },
    {
      "url": "https://www.threads.net/@dieuanndeyy08/post/DPal4Ijj3P5",
      "source_type": "threads",
      "source": "https://www.threads.net/@dieuanndeyy08/post/DPal4Ijj3P5",
      "domain": "threads.net",
      "social_platform": "threads",
      "title": "Mọi người biết trung tâmlớp học nào ở Hưng Yên(cũ) ôn thi THPTQG môn Tiếng Anh không ạ, giới thiệu ...",
      "content": "Mọi người biết trung tâmlớp học nào ở Hưng Yên(cũ) ôn thi THPTQG môn Tiếng Anh không ạ, giới thiệu em với ạ Khu vực từ Quảng trường đổ lại thôi ạ",
      "word_count": 32,
      "published_date": 1759641410.0,
      "published_datetime": "2025-10-05 05:16:50+00:00",
      "likes_count": 0,
      "shares_count": 0,
      "comments_count": 0,
      "views_count": 0,
      "reactions": null,
      "account_id": "dieuanndeyy08",
      "account_name": "dieuanndeyy08",
      "account_url": "https://www.threads.net/@dieuanndeyy08",
      "post_id": "7848",
      "post_type": "thread",
      "raw_metadata": {
        "username": "dieuanndeyy08",
        "likes": 0,
        "replies": 0,
        "reposts": 0,
        "shares": 0,
        "time": "10/05/25",
        "datetime": "2025-10-05T05:16:50.000Z"
      },
      "is_cleaned": true,
      "data_type": "threads",
      "reposts_count": 0
    },
    {
      "url": "https://www.threads.net/@thainguyenvc/post/DSuQcZ4kjnJ",
      "source_type": "threads",
      "source": "https://www.threads.net/@thainguyenvc/post/DSuQcZ4kjnJ",
      "domain": "threads.net",
      "social_platform": "threads",
      "title": "Ai ở ân thi hưng yên gl ak",
      "content": "Ai ở ân thi hưng yên gl ak",
      "word_count": 8,
      "published_date": 1766743712.0,
      "published_datetime": "2025-12-26 10:08:32+00:00",
      "likes_count": 0,
      "shares_count": 0,
      "comments_count": 0,
      "views_count": 0,
      "reactions": null,
      "account_id": "thainguyenvc",
      "account_name": "thainguyenvc",
      "account_url": "https://www.threads.net/@thainguyenvc",
      "post_id": "7847",
      "post_type": "thread",
      "raw_metadata": {
        "username": "thainguyenvc",
        "likes": 0,
        "replies": 0,
        "reposts": 0,
        "shares": 0,
        "time": "12/26/25",
        "datetime": "2025-12-26T10:08:32.000Z"
      },
      "is_cleaned": true,
      "data_type": "threads",
      "reposts_count": 0
    },
    {
      "url": "https://www.threads.net/@thaituphoban/post/DS6SFvmAU40",
      "source_type": "threads",
      "source": "https://www.threads.net/@thaituphoban/post/DS6SFvmAU40",
      "domain": "threads.net",
      "social_platform": "threads",
      "title": "Thật sự chứ Nguyễn Hùng thắng bất cứ cái đề cử nào của Làn Sóng Xanh là hỏng ai dám cãi luôn á",
      "content": "Thật sự chứ Nguyễn Hùng thắng bất cứ cái đề cử nào của Làn Sóng Xanh là hỏng ai dám cãi luôn á",
      "word_count": 23,
      "published_date": 1767147229.0,
      "published_datetime": "2025-12-31 02:13:49+00:00",
      "likes_count": 0,
      "shares_count": 0,
      "comments_count": 0,
      "views_count": 0,
      "reactions": null,
      "account_id": "thaituphoban",
      "account_name": "thaituphoban",
      "account_url": "https://www.threads.net/@thaituphoban",
      "post_id": "7846",
      "post_type": "thread",
      "raw_metadata": {
        "username": "thaituphoban",
        "likes": 0,
        "replies": 0,
        "reposts": 0,
        "shares": 0,
        "time": "4d",
        "datetime": "2025-12-31T02:13:49.000Z"
      },
      "is_cleaned": true,
      "data_type": "threads",
      "reposts_count": 0
    },
    {
      "url": "https://www.threads.net/@lc_n299/post/DRrqICKj3wu",
      "source_type": "threads",
      "source": "https://www.threads.net/@lc_n299/post/DRrqICKj3wu",
      "domain": "threads.net",
      "social_platform": "threads",
      "title": "8 năm ở bên Nhật chưa gặp người Hưng Yên lần nào",
      "content": "8 năm ở bên Nhật chưa gặp người Hưng Yên lần nào",
      "word_count": 12,
      "published_date": 1764509030.0,
      "published_datetime": "2025-11-30 13:23:50+00:00",
      "likes_count": 0,
      "shares_count": 0,
      "comments_count": 0,
      "views_count": 0,
      "reactions": null,
      "account_id": "lc_n299",
      "account_name": "lc_n299",
      "account_url": "https://www.threads.net/@lc_n299",
      "post_id": "7845",
      "post_type": "thread",
      "raw_metadata": {
        "username": "lc_n299",
        "likes": 0,
        "replies": 0,
        "reposts": 0,
        "shares": 0,
        "time": "11/30/25",
        "datetime": "2025-11-30T13:23:50.000Z"
      },
      "is_cleaned": true,
      "data_type": "threads",
      "reposts_count": 0
    },
    {
      "url": "https://www.threads.net/@nt.vananh14/post/DQnhholEkTo",
      "source_type": "threads",
      "source": "https://www.threads.net/@nt.vananh14/post/DQnhholEkTo",
      "domain": "threads.net",
      "social_platform": "threads",
      "title": "Gái Hưng Yên quê Thái Bình  Translate 12",
      "content": "Gái Hưng Yên quê Thái Bình  Translate 12",
      "word_count": 8,
      "published_date": 1762222820.0,
      "published_datetime": "2025-11-04 02:20:20+00:00",
      "likes_count": 0,
      "shares_count": 0,
      "comments_count": 0,
      "views_count": 0,
      "reactions": null,
      "account_id": "nt.vananh14",
      "account_name": "nt.vananh14",
      "account_url": "https://www.threads.net/@nt.vananh14",
      "post_id": "7844",
      "post_type": "thread",
      "raw_metadata": {
        "username": "nt.vananh14",
        "likes": 0,
        "replies": 0,
        "reposts": 0,
        "shares": 0,
        "time": "11/03/25",
        "datetime": "2025-11-04T02:20:20.000Z"
      },
      "is_cleaned": true,
      "data_type": "threads",
      "reposts_count": 0
    },
    {
      "url": "https://www.threads.net/@im_lild.mtf/post/DMKA6aexwC0",
      "source_type": "threads",
      "source": "https://www.threads.net/@im_lild.mtf/post/DMKA6aexwC0",
      "domain": "threads.net",
      "social_platform": "threads",
      "title": "Gánh mấy ông bạn Hưng Yên 1 xòng lưng",
      "content": "Gánh mấy ông bạn Hưng Yên 1 xòng lưng",
      "word_count": 9,
      "published_date": 1752642708.0,
      "published_datetime": "2025-07-16 05:11:48+00:00",
      "likes_count": 0,
      "shares_count": 0,
      "comments_count": 0,
      "views_count": 0,
      "reactions": null,
      "account_id": "im_lild.mtf",
      "account_name": "im_lild.mtf",
      "account_url": "https://www.threads.net/@im_lild.mtf",
      "post_id": "7843",
      "post_type": "thread",
      "raw_metadata": {
        "username": "im_lild.mtf",
        "likes": 0,
        "replies": 0,
        "reposts": 0,
        "shares": 0,
        "time": "07/16/25",
        "datetime": "2025-07-16T05:11:48.000Z"
      },
      "is_cleaned": true,
      "data_type": "threads",
      "reposts_count": 0
    },
    {
      "url": "https://www.threads.net/@vu.naaa/post/C_0rNZ-S_dB",
      "source_type": "threads",
      "source": "https://www.threads.net/@vu.naaa/post/C_0rNZ-S_dB",
      "domain": "threads.net",
      "social_platform": "threads",
      "title": "Profile của mình  Trend: - Tên: Ngọc Anh - Năm sinh: 1994 - ST8 - Cao Nặng: 1m67 - 56kg - Quê nhà:...",
      "content": "Profile của mình  Trend: - Tên: Ngọc Anh - Năm sinh: 1994 - ST8 - Cao Nặng: 1m67 - 56kg - Quê nhà: Hưng Yên - Địa chỉ hiện tại: Lâm Gia Trang - Công việc: Công nhân nhà máy Kịch - Tính cách: Hay cười, hướng ngoại parttime - Ngoại hình: hoàn hảo - Sở thích: Đọc sách, uống trà, xem phim và ko làm gì cả",
      "word_count": 68,
      "published_date": 1726156899.0,
      "published_datetime": "2024-09-12 16:01:39+00:00",
      "likes_count": 0,
      "shares_count": 0,
      "comments_count": 0,
      "views_count": 0,
      "reactions": null,
      "account_id": "vu.naaa",
      "account_name": "vu.naaa",
      "account_url": "https://www.threads.net/@vu.naaa",
      "post_id": "7842",
      "post_type": "thread",
      "raw_metadata": {
        "username": "vu.naaa",
        "likes": 0,
        "replies": 0,
        "reposts": 0,
        "shares": 0,
        "time": "09/12/24",
        "datetime": "2024-09-12T16:01:39.000Z"
      },
      "is_cleaned": true,
      "data_type": "threads",
      "reposts_count": 0
    },
    {
      "url": "https://www.threads.net/@khnh.lnh18_/post/DSzfuTKk92b",
      "source_type": "threads",
      "source": "https://www.threads.net/@khnh.lnh18_/post/DSzfuTKk92b",
      "domain": "threads.net",
      "social_platform": "threads",
      "title": "tìm thợ chụp kỉ yếu nhóm 6 người cả ngày hôm 1112026 tại Hưng Yên ạ",
      "content": "tìm thợ chụp kỉ yếu nhóm 6 người cả ngày hôm 1112026 tại Hưng Yên ạ",
      "word_count": 16,
      "published_date": 1766919496.0,
      "published_datetime": "2025-12-28 10:58:16+00:00",
      "likes_count": 0,
      "shares_count": 0,
      "comments_count": 0,
      "views_count": 0,
      "reactions": null,
      "account_id": "khnh.lnh18_",
      "account_name": "khnh.lnh18_",
      "account_url": "https://www.threads.net/@khnh.lnh18_",
      "post_id": "7841",
      "post_type": "thread",
      "raw_metadata": {
        "username": "khnh.lnh18_",
        "likes": 0,
        "replies": 0,
        "reposts": 0,
        "shares": 0,
        "time": "6d",
        "datetime": "2025-12-28T10:58:16.000Z"
      },
      "is_cleaned": true,
      "data_type": "threads",
      "reposts_count": 0
    },
    {
      "url": "https://www.threads.net/@phaimuadcve/post/DSfW8zMkxmr",
      "source_type": "threads",
      "source": "https://www.threads.net/@phaimuadcve/post/DSfW8zMkxmr",
      "domain": "threads.net",
      "social_platform": "threads",
      "title": "Anh Thiên: \"Nam giờ phải sang Hưng Yên để diễn show bên í, với cả còn khoe múi\" Nhất các khách iu ở...",
      "content": "Anh Thiên: \"Nam giờ phải sang Hưng Yên để diễn show bên í, với cả còn khoe múi\" Nhất các khách iu ở Y ))))))))))))",
      "word_count": 25,
      "published_date": 1766243807.0,
      "published_datetime": "2025-12-20 15:16:47+00:00",
      "likes_count": 0,
      "shares_count": 0,
      "comments_count": 0,
      "views_count": 0,
      "reactions": null,
      "account_id": "phaimuadcve",
      "account_name": "phaimuadcve",
      "account_url": "https://www.threads.net/@phaimuadcve",
      "post_id": "7840",
      "post_type": "thread",
      "raw_metadata": {
        "username": "phaimuadcve",
        "likes": 0,
        "replies": 0,
        "reposts": 0,
        "shares": 0,
        "time": "12/20/25",
        "datetime": "2025-12-20T15:16:47.000Z"
      },
      "is_cleaned": true,
      "data_type": "threads",
      "reposts_count": 0
    },
    {
      "url": "https://www.threads.net/@mmmmmmmm_20022023/post/DSUTw-gkp3M",
      "source_type": "threads",
      "source": "https://www.threads.net/@mmmmmmmm_20022023/post/DSUTw-gkp3M",
      "domain": "threads.net",
      "social_platform": "threads",
      "title": "Em muốn thay đổi công việc vào năm 2026. Hiện em ở Hưng Yên muốn tìm công việc giờ hành chính. Anh C...",
      "content": "Em muốn thay đổi công việc vào năm 2026. Hiện em ở Hưng Yên muốn tìm công việc giờ hành chính. Anh Chị HR nào có jd ib em với ạ",
      "word_count": 31,
      "published_date": 1765873039.0,
      "published_datetime": "2025-12-16 08:17:19+00:00",
      "likes_count": 0,
      "shares_count": 0,
      "comments_count": 0,
      "views_count": 0,
      "reactions": null,
      "account_id": "mmmmmmmm_20022023",
      "account_name": "mmmmmmmm_20022023",
      "account_url": "https://www.threads.net/@mmmmmmmm_20022023",
      "post_id": "7839",
      "post_type": "thread",
      "raw_metadata": {
        "username": "mmmmmmmm_20022023",
        "likes": 0,
        "replies": 0,
        "reposts": 0,
        "shares": 0,
        "time": "12/16/25",
        "datetime": "2025-12-16T08:17:19.000Z"
      },
      "is_cleaned": true,
      "data_type": "threads",
      "reposts_count": 0
    },
    {
      "url": "https://www.threads.net/@lan_han2000/post/DSoFPv_keuk",
      "source_type": "threads",
      "source": "https://www.threads.net/@lan_han2000/post/DSoFPv_keuk",
      "domain": "threads.net",
      "social_platform": "threads",
      "title": "Mọi người ơi! Có ai có số xe Hưng yên về Hà Giang không cho em xin với ạ",
      "content": "Mọi người ơi! Có ai có số xe Hưng yên về Hà Giang không cho em xin với ạ",
      "word_count": 19,
      "published_date": 1766536515.0,
      "published_datetime": "2025-12-24 00:35:15+00:00",
      "likes_count": 0,
      "shares_count": 0,
      "comments_count": 0,
      "views_count": 0,
      "reactions": null,
      "account_id": "lan_han2000",
      "account_name": "lan_han2000",
      "account_url": "https://www.threads.net/@lan_han2000",
      "post_id": "7838",
      "post_type": "thread",
      "raw_metadata": {
        "username": "lan_han2000",
        "likes": 0,
        "replies": 0,
        "reposts": 0,
        "shares": 0,
        "time": "12/23/25",
        "datetime": "2025-12-24T00:35:15.000Z"
      },
      "is_cleaned": true,
      "data_type": "threads",
      "reposts_count": 0
    },
    {
      "url": "https://www.threads.net/@hai.nguyen.hai/post/DSliFWyknFj",
      "source_type": "threads",
      "source": "https://www.threads.net/@hai.nguyen.hai/post/DSliFWyknFj",
      "domain": "threads.net",
      "social_platform": "threads",
      "title": "Mình tha thiết tìm kế toán bán hàng. Cuối năm rồi mà tìm khó quá. Ace ai cần tìm việc thì nhắn mình ...",
      "content": "Mình tha thiết tìm kế toán bán hàng. Cuối năm rồi mà tìm khó quá. Ace ai cần tìm việc thì nhắn mình nha, không thì giới thiệu giúp mình. Có thể đi làm ngay hoặc ra Tết đi làm cũng OK ạ! Cảm ơn",
      "word_count": 45,
      "published_date": 1766450971.0,
      "published_datetime": "2025-12-23 00:49:31+00:00",
      "likes_count": 0,
      "shares_count": 0,
      "comments_count": 0,
      "views_count": 0,
      "reactions": null,
      "account_id": "hai.nguyen.hai",
      "account_name": "hai.nguyen.hai",
      "account_url": "https://www.threads.net/@hai.nguyen.hai",
      "post_id": "7837",
      "post_type": "thread",
      "raw_metadata": {
        "username": "hai.nguyen.hai",
        "likes": 0,
        "replies": 0,
        "reposts": 0,
        "shares": 0,
        "time": "12/22/25",
        "datetime": "2025-12-23T00:49:31.000Z"
      },
      "is_cleaned": true,
      "data_type": "threads",
      "reposts_count": 0
    },
    {
      "url": "https://www.threads.net/@thaovynguyen1101/post/DSSwBmKAXUz",
      "source_type": "threads",
      "source": "https://www.threads.net/@thaovynguyen1101/post/DSSwBmKAXUz",
      "domain": "threads.net",
      "social_platform": "threads",
      "title": "cần tìm bạn ở quanh ecopark hưng yên",
      "content": "cần tìm bạn ở quanh ecopark hưng yên",
      "word_count": 8,
      "published_date": 1765820746.0,
      "published_datetime": "2025-12-15 17:45:46+00:00",
      "likes_count": 0,
      "shares_count": 0,
      "comments_count": 0,
      "views_count": 0,
      "reactions": null,
      "account_id": "thaovynguyen1101",
      "account_name": "thaovynguyen1101",
      "account_url": "https://www.threads.net/@thaovynguyen1101",
      "post_id": "7836",
      "post_type": "thread",
      "raw_metadata": {
        "username": "thaovynguyen1101",
        "likes": 0,
        "replies": 0,
        "reposts": 0,
        "shares": 0,
        "time": "12/15/25",
        "datetime": "2025-12-15T17:45:46.000Z"
      },
      "is_cleaned": true,
      "data_type": "threads",
      "reposts_count": 0
    },
    {
      "url": "https://www.threads.net/@_nyezz.ie/post/DPiFv9SgclX",
      "source_type": "threads",
      "source": "https://www.threads.net/@_nyezz.ie/post/DPiFv9SgclX",
      "domain": "threads.net",
      "social_platform": "threads",
      "title": "xem thông tin bão lũ từ đêm qua tới giờ nhìn sót ruột thương bà con thật sự, cảm thấy mình vô cùng m...",
      "content": "xem thông tin bão lũ từ đêm qua tới giờ nhìn sót ruột thương bà con thật sự, cảm thấy mình vô cùng may mắn vì ở Hưng Yên :(((",
      "word_count": 30,
      "published_date": 1759893001.0,
      "published_datetime": "2025-10-08 03:10:01+00:00",
      "likes_count": 0,
      "shares_count": 0,
      "comments_count": 0,
      "views_count": 0,
      "reactions": null,
      "account_id": "_nyezz.ie",
      "account_name": "_nyezz.ie",
      "account_url": "https://www.threads.net/@_nyezz.ie",
      "post_id": "7835",
      "post_type": "thread",
      "raw_metadata": {
        "username": "_nyezz.ie",
        "likes": 0,
        "replies": 0,
        "reposts": 0,
        "shares": 0,
        "time": "10/07/25",
        "datetime": "2025-10-08T03:10:01.000Z"
      },
      "is_cleaned": true,
      "data_type": "threads",
      "reposts_count": 0
    },
    {
      "url": "https://www.threads.net/@khnh.lnh18_/post/DPnbtmFkxCf",
      "source_type": "threads",
      "source": "https://www.threads.net/@khnh.lnh18_/post/DPnbtmFkxCf",
      "domain": "threads.net",
      "social_platform": "threads",
      "title": "Em cần book make kỉ yếu 111 ở TP Hưng Yên, budget 300k-500k Người quen đi qua giả mù nha mng )))",
      "content": "Em cần book make kỉ yếu 111 ở TP Hưng Yên, budget 300k-500k Người quen đi qua giả mù nha mng )))",
      "word_count": 22,
      "published_date": 1760072289.0,
      "published_datetime": "2025-10-10 04:58:09+00:00",
      "likes_count": 0,
      "shares_count": 0,
      "comments_count": 0,
      "views_count": 0,
      "reactions": null,
      "account_id": "khnh.lnh18_",
      "account_name": "khnh.lnh18_",
      "account_url": "https://www.threads.net/@khnh.lnh18_",
      "post_id": "7834",
      "post_type": "thread",
      "raw_metadata": {
        "username": "khnh.lnh18_",
        "likes": 0,
        "replies": 0,
        "reposts": 0,
        "shares": 0,
        "time": "10/10/25",
        "datetime": "2025-10-10T04:58:09.000Z"
      },
      "is_cleaned": true,
      "data_type": "threads",
      "reposts_count": 0
    },
    {
      "url": "https://www.threads.net/@amie_xinh/post/DS48ZmZE5_U",
      "source_type": "threads",
      "source": "https://www.threads.net/@amie_xinh/post/DS48ZmZE5_U",
      "domain": "threads.net",
      "social_platform": "threads",
      "title": "Khi bạn lấy đúng ngườiii  Translate 12",
      "content": "Khi bạn lấy đúng ngườiii  Translate 12",
      "word_count": 7,
      "published_date": 1767102319.0,
      "published_datetime": "2025-12-30 13:45:19+00:00",
      "likes_count": 0,
      "shares_count": 0,
      "comments_count": 0,
      "views_count": 0,
      "reactions": null,
      "account_id": "amie_xinh",
      "account_name": "amie_xinh",
      "account_url": "https://www.threads.net/@amie_xinh",
      "post_id": "7833",
      "post_type": "thread",
      "raw_metadata": {
        "username": "amie_xinh",
        "likes": 0,
        "replies": 0,
        "reposts": 0,
        "shares": 0,
        "time": "4d",
        "datetime": "2025-12-30T13:45:19.000Z"
      },
      "is_cleaned": true,
      "data_type": "threads",
      "reposts_count": 0
    },
    {
      "url": "https://www.threads.net/@tinyyyoxxo/post/DTDWFOfE084",
      "source_type": "threads",
      "source": "https://www.threads.net/@tinyyyoxxo/post/DTDWFOfE084",
      "domain": "threads.net",
      "social_platform": "threads",
      "title": "Cả lò rcm em stu chụp ảnh sinh nhật quanh Hưng Yên hoặc Hnoi giá hssv ạ, e với cả b em chụp budget k...",
      "content": "Cả lò rcm em stu chụp ảnh sinh nhật quanh Hưng Yên hoặc Hnoi giá hssv ạ, e với cả b em chụp budget khoảng 1-1tr2bạn ạ",
      "word_count": 27,
      "published_date": 1767451312.0,
      "published_datetime": "2026-01-03 14:41:52+00:00",
      "likes_count": 0,
      "shares_count": 0,
      "comments_count": 0,
      "views_count": 0,
      "reactions": null,
      "account_id": "tinyyyoxxo",
      "account_name": "tinyyyoxxo",
      "account_url": "https://www.threads.net/@tinyyyoxxo",
      "post_id": "7832",
      "post_type": "thread",
      "raw_metadata": {
        "username": "tinyyyoxxo",
        "likes": 0,
        "replies": 0,
        "reposts": 0,
        "shares": 0,
        "time": "19h",
        "datetime": "2026-01-03T14:41:52.000Z"
      },
      "is_cleaned": true,
      "data_type": "threads",
      "reposts_count": 0
    },
    {
      "url": "https://www.threads.net/@nickypham268/post/DSoHAILEw4n",
      "source_type": "threads",
      "source": "https://www.threads.net/@nickypham268/post/DSoHAILEw4n",
      "domain": "threads.net",
      "social_platform": "threads",
      "title": "Hà Nội, Hưng Yên và Y-concert đã giúp tui uncrush như thế nào :))))) Hay quá cảm ơn nha Translate 1...",
      "content": "Hà Nội, Hưng Yên và Y-concert đã giúp tui uncrush như thế nào :))))) Hay quá cảm ơn nha Translate 12",
      "word_count": 21,
      "published_date": 1766537436.0,
      "published_datetime": "2025-12-24 00:50:36+00:00",
      "likes_count": 0,
      "shares_count": 0,
      "comments_count": 0,
      "views_count": 0,
      "reactions": null,
      "account_id": "nickypham268",
      "account_name": "nickypham268",
      "account_url": "https://www.threads.net/@nickypham268",
      "post_id": "7831",
      "post_type": "thread",
      "raw_metadata": {
        "username": "nickypham268",
        "likes": 0,
        "replies": 0,
        "reposts": 0,
        "shares": 0,
        "time": "12/23/25",
        "datetime": "2025-12-24T00:50:36.000Z"
      },
      "is_cleaned": true,
      "data_type": "threads",
      "reposts_count": 0
    },
    {
      "url": "https://www.threads.net/@vsksan_/post/DDUoUSRzo11",
      "source_type": "threads",
      "source": "https://www.threads.net/@vsksan_/post/DDUoUSRzo11",
      "domain": "threads.net",
      "social_platform": "threads",
      "title": "Nay đi xe Xanh SM: Xanh: Thế hôm qua em đi chtr ở Mỹ Đình không? Tôi: Không, em fan ctr khác ạ, tổ c...",
      "content": "Nay đi xe Xanh SM: Xanh: Thế hôm qua em đi chtr ở Mỹ Đình không? Tôi: Không, em fan ctr khác ạ, tổ chức ở Hưng Yên. Xanh: Em nhà nào? Tôi: Dạ???? Xanh: Em mua đc vé không? Tôi: Em không. Xanh: Anh có vé Sao Sáng Tôi: Dạ. Xanh: Anh có tận hai vé đấy, một vé đứng một vé ngồi! Tôi háo hức: Anh pass không ạ!? (lúc đó mình tưởng anh tính phe vé nên hỏi xem anh lấy giá bao nhiêu) Xanh: Anh không!",
      "word_count": 90,
      "published_date": 1733671559.0,
      "published_datetime": "2024-12-08 15:25:59+00:00",
      "likes_count": 0,
      "shares_count": 0,
      "comments_count": 0,
      "views_count": 0,
      "reactions": null,
      "account_id": "vsksan_",
      "account_name": "vsksan_",
      "account_url": "https://www.threads.net/@vsksan_",
      "post_id": "7830",
      "post_type": "thread",
      "raw_metadata": {
        "username": "vsksan_",
        "likes": 0,
        "replies": 0,
        "reposts": 0,
        "shares": 0,
        "time": "12/08/24",
        "datetime": "2024-12-08T15:25:59.000Z"
      },
      "is_cleaned": true,
      "data_type": "threads",
      "reposts_count": 0
    },
    {
      "url": "https://www.threads.net/@nti.3n_z/post/DPiXrE7AR1b",
      "source_type": "threads",
      "source": "https://www.threads.net/@nti.3n_z/post/DPiXrE7AR1b",
      "domain": "threads.net",
      "social_platform": "threads",
      "title": "các ac 2k7 có thể nào rcm vài studio chụp kỉ yếu lớp khum ạ , đừng seeding nha ạ tụi e ở Hưng Yên ạ",
      "content": "các ac 2k7 có thể nào rcm vài studio chụp kỉ yếu lớp khum ạ , đừng seeding nha ạ tụi e ở Hưng Yên ạ",
      "word_count": 26,
      "published_date": 1759902399.0,
      "published_datetime": "2025-10-08 05:46:39+00:00",
      "likes_count": 0,
      "shares_count": 0,
      "comments_count": 0,
      "views_count": 0,
      "reactions": null,
      "account_id": "nti.3n_z",
      "account_name": "nti.3n_z",
      "account_url": "https://www.threads.net/@nti.3n_z",
      "post_id": "7829",
      "post_type": "thread",
      "raw_metadata": {
        "username": "nti.3n_z",
        "likes": 0,
        "replies": 0,
        "reposts": 0,
        "shares": 0,
        "time": "10/08/25",
        "datetime": "2025-10-08T05:46:39.000Z"
      },
      "is_cleaned": true,
      "data_type": "threads",
      "reposts_count": 0
    },
    {
      "url": "https://www.threads.net/@morphine.1211/post/DPK4W7jj6O3",
      "source_type": "threads",
      "source": "https://www.threads.net/@morphine.1211/post/DPK4W7jj6O3",
      "domain": "threads.net",
      "social_platform": "threads",
      "title": "Quê Hưng Yên gốc Thái Bình",
      "content": "Quê Hưng Yên gốc Thái Bình",
      "word_count": 6,
      "published_date": 1759114229.0,
      "published_datetime": "2025-09-29 02:50:29+00:00",
      "likes_count": 0,
      "shares_count": 0,
      "comments_count": 0,
      "views_count": 0,
      "reactions": null,
      "account_id": "morphine.1211",
      "account_name": "morphine.1211",
      "account_url": "https://www.threads.net/@morphine.1211",
      "post_id": "7828",
      "post_type": "thread",
      "raw_metadata": {
        "username": "morphine.1211",
        "likes": 0,
        "replies": 0,
        "reposts": 0,
        "shares": 0,
        "time": "09/28/25",
        "datetime": "2025-09-29T02:50:29.000Z"
      },
      "is_cleaned": true,
      "data_type": "threads",
      "reposts_count": 0
    },
    {
      "url": "https://www.threads.net/@huyenthu2349/post/DS722abjwOA",
      "source_type": "threads",
      "source": "https://www.threads.net/@huyenthu2349/post/DS722abjwOA",
      "domain": "threads.net",
      "social_platform": "threads",
      "title": "Kiếm bn ở Huế tết năm nay đi xem pháo hoa cùng ,ai cũng đc chưa bồ là đc ;)nam hay nữ khg qtrong",
      "content": "Kiếm bn ở Huế tết năm nay đi xem pháo hoa cùng ,ai cũng đc chưa bồ là đc ;)nam hay nữ khg qtrong",
      "word_count": 24,
      "published_date": 1767200056.0,
      "published_datetime": "2025-12-31 16:54:16+00:00",
      "likes_count": 0,
      "shares_count": 0,
      "comments_count": 0,
      "views_count": 0,
      "reactions": null,
      "account_id": "huyenthu2349",
      "account_name": "huyenthu2349",
      "account_url": "https://www.threads.net/@huyenthu2349",
      "post_id": "7827",
      "post_type": "thread",
      "raw_metadata": {
        "username": "huyenthu2349",
        "likes": 0,
        "replies": 0,
        "reposts": 0,
        "shares": 0,
        "time": "3d",
        "datetime": "2025-12-31T16:54:16.000Z"
      },
      "is_cleaned": true,
      "data_type": "threads",
      "reposts_count": 0
    },
    {
      "url": "https://www.threads.net/@trabuta02/post/DQEjJWAj1w0",
      "source_type": "threads",
      "source": "https://www.threads.net/@trabuta02/post/DQEjJWAj1w0",
      "domain": "threads.net",
      "social_platform": "threads",
      "title": "Tốt nghiệp trường mơ ước Được làm môi trường ước mơ  Translate 12",
      "content": "Tốt nghiệp trường mơ ước Được làm môi trường ước mơ  Translate 12",
      "word_count": 13,
      "published_date": 1761049264.0,
      "published_datetime": "2025-10-21 12:21:04+00:00",
      "likes_count": 0,
      "shares_count": 0,
      "comments_count": 0,
      "views_count": 0,
      "reactions": null,
      "account_id": "trabuta02",
      "account_name": "trabuta02",
      "account_url": "https://www.threads.net/@trabuta02",
      "post_id": "7826",
      "post_type": "thread",
      "raw_metadata": {
        "username": "trabuta02",
        "likes": 0,
        "replies": 0,
        "reposts": 0,
        "shares": 0,
        "time": "10/21/25",
        "datetime": "2025-10-21T12:21:04.000Z"
      },
      "is_cleaned": true,
      "data_type": "threads",
      "reposts_count": 0
    },
    {
      "url": "https://www.threads.net/@_.kw.huyn/post/DSxU3_Sku2O",
      "source_type": "threads",
      "source": "https://www.threads.net/@_.kw.huyn/post/DSxU3_Sku2O",
      "domain": "threads.net",
      "social_platform": "threads",
      "title": "Em tìm thợ chụp kỉ yếu cá nhân ngày 82 ở Hưng Yên ạ.  budget 1tr5 đổ xuống  hỗ trợ pose dáng",
      "content": "Em tìm thợ chụp kỉ yếu cá nhân ngày 82 ở Hưng Yên ạ.  budget 1tr5 đổ xuống  hỗ trợ pose dáng",
      "word_count": 22,
      "published_date": 1766846699.0,
      "published_datetime": "2025-12-27 14:44:59+00:00",
      "likes_count": 0,
      "shares_count": 0,
      "comments_count": 0,
      "views_count": 0,
      "reactions": null,
      "account_id": "_.kw.huyn",
      "account_name": "_.kw.huyn",
      "account_url": "https://www.threads.net/@_.kw.huyn",
      "post_id": "7825",
      "post_type": "thread",
      "raw_metadata": {
        "username": "_.kw.huyn",
        "likes": 0,
        "replies": 0,
        "reposts": 0,
        "shares": 0,
        "time": "12/27/25",
        "datetime": "2025-12-27T14:44:59.000Z"
      },
      "is_cleaned": true,
      "data_type": "threads",
      "reposts_count": 0
    },
    {
      "url": "https://www.threads.net/@nththuy12/post/DPJLb0xkfgT",
      "source_type": "threads",
      "source": "https://www.threads.net/@nththuy12/post/DPJLb0xkfgT",
      "domain": "threads.net",
      "social_platform": "threads",
      "title": "Anh có về Hưng Yên cùng em không?",
      "content": "Anh có về Hưng Yên cùng em không?",
      "word_count": 8,
      "published_date": 1759057121.0,
      "published_datetime": "2025-09-28 10:58:41+00:00",
      "likes_count": 0,
      "shares_count": 0,
      "comments_count": 0,
      "views_count": 0,
      "reactions": null,
      "account_id": "nththuy12",
      "account_name": "nththuy12",
      "account_url": "https://www.threads.net/@nththuy12",
      "post_id": "7824",
      "post_type": "thread",
      "raw_metadata": {
        "username": "nththuy12",
        "likes": 0,
        "replies": 0,
        "reposts": 0,
        "shares": 0,
        "time": "09/28/25",
        "datetime": "2025-09-28T10:58:41.000Z"
      },
      "is_cleaned": true,
      "data_type": "threads",
      "reposts_count": 0
    },
    {
      "url": "https://www.threads.net/@haihoang11.01/post/DCQZDDHvFcg",
      "source_type": "threads",
      "source": "https://www.threads.net/@haihoang11.01/post/DCQZDDHvFcg",
      "domain": "threads.net",
      "social_platform": "threads",
      "title": "\"Concert tổ chức ở Hưng Yên nhưng vị trí xếp hàng của bạn đang ở Phú Quốc\" Trích cmt của 1 gai con ...",
      "content": "\"Concert tổ chức ở Hưng Yên nhưng vị trí xếp hàng của bạn đang ở Phú Quốc\" Trích cmt của 1 gai con Translate 12",
      "word_count": 25,
      "published_date": 1731381852.0,
      "published_datetime": "2024-11-12 03:24:12+00:00",
      "likes_count": 0,
      "shares_count": 0,
      "comments_count": 0,
      "views_count": 0,
      "reactions": null,
      "account_id": "haihoang11.01",
      "account_name": "haihoang11.01",
      "account_url": "https://www.threads.net/@haihoang11.01",
      "post_id": "7823",
      "post_type": "thread",
      "raw_metadata": {
        "username": "haihoang11.01",
        "likes": 0,
        "replies": 0,
        "reposts": 0,
        "shares": 0,
        "time": "11/11/24",
        "datetime": "2024-11-12T03:24:12.000Z"
      },
      "is_cleaned": true,
      "data_type": "threads",
      "reposts_count": 0
    },
    {
      "url": "https://www.threads.net/@minhtuan57808/post/DEjtksFvK-1",
      "source_type": "threads",
      "source": "https://www.threads.net/@minhtuan57808/post/DEjtksFvK-1",
      "domain": "threads.net",
      "social_platform": "threads",
      "title": "Mình tìm bạn ở yên viên, gia lâm, long biên kb nch đỡ sad. Có ai ở gần đây khong t 06 Translate 1...",
      "content": "Mình tìm bạn ở yên viên, gia lâm, long biên kb nch đỡ sad. Có ai ở gần đây khong t 06 Translate 12",
      "word_count": 24,
      "published_date": 1736325115.0,
      "published_datetime": "2025-01-08 08:31:55+00:00",
      "likes_count": 0,
      "shares_count": 0,
      "comments_count": 0,
      "views_count": 0,
      "reactions": null,
      "account_id": "minhtuan57808",
      "account_name": "minhtuan57808",
      "account_url": "https://www.threads.net/@minhtuan57808",
      "post_id": "7822",
      "post_type": "thread",
      "raw_metadata": {
        "username": "minhtuan57808",
        "likes": 0,
        "replies": 0,
        "reposts": 0,
        "shares": 0,
        "time": "01/08/25",
        "datetime": "2025-01-08T08:31:55.000Z"
      },
      "is_cleaned": true,
      "data_type": "threads",
      "reposts_count": 0
    },
    {
      "url": "https://www.threads.net/@nhat_anh.sg/post/DPbZheJkfq3",
      "source_type": "threads",
      "source": "https://www.threads.net/@nhat_anh.sg/post/DPbZheJkfq3",
      "domain": "threads.net",
      "social_platform": "threads",
      "title": "Sống đủ lâu để thấy Hưng Yên hết ngọng \"L\" với \"N\" . Trước mới lên HN học toàn bị các bạn trêu, tr...",
      "content": "Sống đủ lâu để thấy Hưng Yên hết ngọng \"L\" với \"N\" . Trước mới lên HN học toàn bị các bạn trêu, trong khi chính mình cũng k phân biệt được là đang phát âm sai...",
      "word_count": 37,
      "published_date": 1759668487.0,
      "published_datetime": "2025-10-05 12:48:07+00:00",
      "likes_count": 0,
      "shares_count": 0,
      "comments_count": 0,
      "views_count": 0,
      "reactions": null,
      "account_id": "nhat_anh.sg",
      "account_name": "nhat_anh.sg",
      "account_url": "https://www.threads.net/@nhat_anh.sg",
      "post_id": "7821",
      "post_type": "thread",
      "raw_metadata": {
        "username": "nhat_anh.sg",
        "likes": 0,
        "replies": 0,
        "reposts": 0,
        "shares": 0,
        "time": "10/05/25",
        "datetime": "2025-10-05T12:48:07.000Z"
      },
      "is_cleaned": true,
      "data_type": "threads",
      "reposts_count": 0
    },
    {
      "url": "https://www.threads.net/@_dwpi.i_/post/DS7OivND8t_",
      "source_type": "threads",
      "source": "https://www.threads.net/@_dwpi.i_/post/DS7OivND8t_",
      "domain": "threads.net",
      "social_platform": "threads",
      "title": "còn ai trống lịch chụp kỉ yếu 31 ở THPT Yên Hoà Cầu Giấy không ạ",
      "content": "còn ai trống lịch chụp kỉ yếu 31 ở THPT Yên Hoà Cầu Giấy không ạ",
      "word_count": 16,
      "published_date": 1767178923.0,
      "published_datetime": "2025-12-31 11:02:03+00:00",
      "likes_count": 0,
      "shares_count": 0,
      "comments_count": 0,
      "views_count": 0,
      "reactions": null,
      "account_id": "_dwpi.i_",
      "account_name": "_dwpi.i_",
      "account_url": "https://www.threads.net/@_dwpi.i_",
      "post_id": "7820",
      "post_type": "thread",
      "raw_metadata": {
        "username": "_dwpi.i_",
        "likes": 0,
        "replies": 0,
        "reposts": 0,
        "shares": 0,
        "time": "3d",
        "datetime": "2025-12-31T11:02:03.000Z"
      },
      "is_cleaned": true,
      "data_type": "threads",
      "reposts_count": 0
    },
    {
      "url": "https://www.threads.net/@ebbils/post/DPo2tEYD_Q3",
      "source_type": "threads",
      "source": "https://www.threads.net/@ebbils/post/DPo2tEYD_Q3",
      "domain": "threads.net",
      "social_platform": "threads",
      "title": "các bác đã có kinh nghiệm đi concert ở OCP3 - Hưng Yên cho toi hỏi đi xe máy đến xem concert được kh...",
      "content": "các bác đã có kinh nghiệm đi concert ở OCP3 - Hưng Yên cho toi hỏi đi xe máy đến xem concert được không? lúc về có ối dồi ôi không ạ help me",
      "word_count": 34,
      "published_date": 1760119994.0,
      "published_datetime": "2025-10-10 18:13:14+00:00",
      "likes_count": 0,
      "shares_count": 0,
      "comments_count": 0,
      "views_count": 0,
      "reactions": null,
      "account_id": "ebbils",
      "account_name": "ebbils",
      "account_url": "https://www.threads.net/@ebbils",
      "post_id": "7819",
      "post_type": "thread",
      "raw_metadata": {
        "username": "ebbils",
        "likes": 0,
        "replies": 0,
        "reposts": 0,
        "shares": 0,
        "time": "10/10/25",
        "datetime": "2025-10-10T18:13:14.000Z"
      },
      "is_cleaned": true,
      "data_type": "threads",
      "reposts_count": 0
    },
    {
      "url": "https://www.threads.net/@halenhaque/post/DLiF19TP06M",
      "source_type": "threads",
      "source": "https://www.threads.net/@halenhaque/post/DLiF19TP06M",
      "domain": "threads.net",
      "social_platform": "threads",
      "title": "Auce chào mọi người Mình là Hà Lê nhà quê, người Hưng Yên, gốc Thái Bình",
      "content": "Auce chào mọi người Mình là Hà Lê nhà quê, người Hưng Yên, gốc Thái Bình",
      "word_count": 16,
      "published_date": 1751303116.0,
      "published_datetime": "2025-06-30 17:05:16+00:00",
      "likes_count": 0,
      "shares_count": 0,
      "comments_count": 0,
      "views_count": 0,
      "reactions": null,
      "account_id": "halenhaque",
      "account_name": "halenhaque",
      "account_url": "https://www.threads.net/@halenhaque",
      "post_id": "7818",
      "post_type": "thread",
      "raw_metadata": {
        "username": "halenhaque",
        "likes": 0,
        "replies": 0,
        "reposts": 0,
        "shares": 0,
        "time": "06/30/25",
        "datetime": "2025-06-30T17:05:16.000Z"
      },
      "is_cleaned": true,
      "data_type": "threads",
      "reposts_count": 0
    },
    {
      "url": "https://www.threads.net/@xxuan_phong/post/DRIIDQ1ket3",
      "source_type": "threads",
      "source": "https://www.threads.net/@xxuan_phong/post/DRIIDQ1ket3",
      "domain": "threads.net",
      "social_platform": "threads",
      "title": "Crooked - nguyên liệu ưa thích của anh đầu bếp người Hưng Yên suốt một thập kỷ Translate 12",
      "content": "Crooked - nguyên liệu ưa thích của anh đầu bếp người Hưng Yên suốt một thập kỷ Translate 12",
      "word_count": 19,
      "published_date": 1763317112.0,
      "published_datetime": "2025-11-16 18:18:32+00:00",
      "likes_count": 0,
      "shares_count": 0,
      "comments_count": 0,
      "views_count": 0,
      "reactions": null,
      "account_id": "xxuan_phong",
      "account_name": "xxuan_phong",
      "account_url": "https://www.threads.net/@xxuan_phong",
      "post_id": "7817",
      "post_type": "thread",
      "raw_metadata": {
        "username": "xxuan_phong",
        "likes": 0,
        "replies": 0,
        "reposts": 0,
        "shares": 0,
        "time": "11/16/25",
        "datetime": "2025-11-16T18:18:32.000Z"
      },
      "is_cleaned": true,
      "data_type": "threads",
      "reposts_count": 0
    },
    {
      "url": "https://www.threads.net/@chessi_09/post/DR1bDe2Cecz",
      "source_type": "threads",
      "source": "https://www.threads.net/@chessi_09/post/DR1bDe2Cecz",
      "domain": "threads.net",
      "social_platform": "threads",
      "title": "Ai ở Hưng Yên đi chơi ko tớ đón..",
      "content": "Ai ở Hưng Yên đi chơi ko tớ đón..",
      "word_count": 9,
      "published_date": 1764836673.0,
      "published_datetime": "2025-12-04 08:24:33+00:00",
      "likes_count": 0,
      "shares_count": 0,
      "comments_count": 0,
      "views_count": 0,
      "reactions": null,
      "account_id": "chessi_09",
      "account_name": "chessi_09",
      "account_url": "https://www.threads.net/@chessi_09",
      "post_id": "7816",
      "post_type": "thread",
      "raw_metadata": {
        "username": "chessi_09",
        "likes": 0,
        "replies": 0,
        "reposts": 0,
        "shares": 0,
        "time": "12/04/25",
        "datetime": "2025-12-04T08:24:33.000Z"
      },
      "is_cleaned": true,
      "data_type": "threads",
      "reposts_count": 0
    },
    {
      "url": "https://www.threads.net/@lameiideyy/post/DSRK_tOk1-b",
      "source_type": "threads",
      "source": "https://www.threads.net/@lameiideyy/post/DSRK_tOk1-b",
      "domain": "threads.net",
      "social_platform": "threads",
      "title": "Vinhomes Ocean Park 2,3 - Vin Hưng Yên",
      "content": "Vinhomes Ocean Park 2,3 - Vin Hưng Yên",
      "word_count": 8,
      "published_date": 1765767777.0,
      "published_datetime": "2025-12-15 03:02:57+00:00",
      "likes_count": 0,
      "shares_count": 0,
      "comments_count": 0,
      "views_count": 0,
      "reactions": null,
      "account_id": "lameiideyy",
      "account_name": "lameiideyy",
      "account_url": "https://www.threads.net/@lameiideyy",
      "post_id": "7815",
      "post_type": "thread",
      "raw_metadata": {
        "username": "lameiideyy",
        "likes": 0,
        "replies": 0,
        "reposts": 0,
        "shares": 0,
        "time": "12/14/25",
        "datetime": "2025-12-15T03:02:57.000Z"
      },
      "is_cleaned": true,
      "data_type": "threads",
      "reposts_count": 0
    },
    {
      "url": "https://www.threads.net/@limecandyxoxo/post/DS7uwgxGF-M",
      "source_type": "threads",
      "source": "https://www.threads.net/@limecandyxoxo/post/DS7uwgxGF-M",
      "domain": "threads.net",
      "social_platform": "threads",
      "title": "Tớ yêu phụ nữ, tớ muốn có bạn gái. Mong là cậu cũng thích vẽ, thời trang hoặc mấy cái liên quan đến ...",
      "content": "Tớ yêu phụ nữ, tớ muốn có bạn gái. Mong là cậu cũng thích vẽ, thời trang hoặc mấy cái liên quan đến nghệ thuật giống tớ hữu duyên hữu duyên Translate 12",
      "word_count": 33,
      "published_date": 1767195813.0,
      "published_datetime": "2025-12-31 15:43:33+00:00",
      "likes_count": 0,
      "shares_count": 0,
      "comments_count": 0,
      "views_count": 0,
      "reactions": null,
      "account_id": "limecandyxoxo",
      "account_name": "limecandyxoxo",
      "account_url": "https://www.threads.net/@limecandyxoxo",
      "post_id": "7814",
      "post_type": "thread",
      "raw_metadata": {
        "username": "limecandyxoxo",
        "likes": 0,
        "replies": 0,
        "reposts": 0,
        "shares": 0,
        "time": "3d",
        "datetime": "2025-12-31T15:43:33.000Z"
      },
      "is_cleaned": true,
      "data_type": "threads",
      "reposts_count": 0
    },
    {
      "url": "https://www.threads.net/@nhubi_tq22/post/DIyueqDTIj3",
      "source_type": "threads",
      "source": "https://www.threads.net/@nhubi_tq22/post/DIyueqDTIj3",
      "domain": "threads.net",
      "social_platform": "threads",
      "title": "Có ai từng đi xe máy từ nội thành sang hưng yên chưa á. Mình xin review với, sau đợt đi xe bus day2 ...",
      "content": "Có ai từng đi xe máy từ nội thành sang hưng yên chưa á. Mình xin review với, sau đợt đi xe bus day2 quá kinh khủng nên quyết định d5,d6 t định đi xe máy sang. Xin revew chỗ để xe, giá ạ",
      "word_count": 44,
      "published_date": 1745418841.0,
      "published_datetime": "2025-04-23 14:34:01+00:00",
      "likes_count": 0,
      "shares_count": 0,
      "comments_count": 0,
      "views_count": 0,
      "reactions": null,
      "account_id": "nhubi_tq22",
      "account_name": "nhubi_tq22",
      "account_url": "https://www.threads.net/@nhubi_tq22",
      "post_id": "7813",
      "post_type": "thread",
      "raw_metadata": {
        "username": "nhubi_tq22",
        "likes": 0,
        "replies": 0,
        "reposts": 0,
        "shares": 0,
        "time": "04/23/25",
        "datetime": "2025-04-23T14:34:01.000Z"
      },
      "is_cleaned": true,
      "data_type": "threads",
      "reposts_count": 0
    },
    {
      "url": "https://www.threads.net/@chunn_2408/post/DSoQV8JkrrG",
      "source_type": "threads",
      "source": "https://www.threads.net/@chunn_2408/post/DSoQV8JkrrG",
      "domain": "threads.net",
      "social_platform": "threads",
      "title": "e cần tìm thợ chụp cho 2 người vào ngày 223 giá khoảng 700-900 quanh khu vực Hưng Yên ( văn lâm...",
      "content": "e cần tìm thợ chụp cho 2 người vào ngày 223 giá khoảng 700-900 quanh khu vực Hưng Yên ( văn lâm cũ ) màu ảnh same same như hình Mọi người giúp e với ạ , e cảm ơn",
      "word_count": 40,
      "published_date": 1766542333.0,
      "published_datetime": "2025-12-24 02:12:13+00:00",
      "likes_count": 0,
      "shares_count": 0,
      "comments_count": 0,
      "views_count": 0,
      "reactions": null,
      "account_id": "chunn_2408",
      "account_name": "chunn_2408",
      "account_url": "https://www.threads.net/@chunn_2408",
      "post_id": "7812",
      "post_type": "thread",
      "raw_metadata": {
        "username": "chunn_2408",
        "likes": 0,
        "replies": 0,
        "reposts": 0,
        "shares": 0,
        "time": "12/23/25",
        "datetime": "2025-12-24T02:12:13.000Z"
      },
      "is_cleaned": true,
      "data_type": "threads",
      "reposts_count": 0
    },
    {
      "url": "https://www.threads.net/@dlinhpu/post/DJAyAgOzxf_",
      "source_type": "threads",
      "source": "https://www.threads.net/@dlinhpu/post/DJAyAgOzxf_",
      "domain": "threads.net",
      "social_platform": "threads",
      "title": "T đi học đhoc ở hn, mỗi cuối tuần t bảo bố t sẽ về nhà, bố lại hỏi có cần bố đón k  chỉ cần t đồng ...",
      "content": "T đi học đhoc ở hn, mỗi cuối tuần t bảo bố t sẽ về nhà, bố lại hỏi có cần bố đón k  chỉ cần t đồng ý, bố t sẽ đi từ Hưng Yên lên đón về liền ước gì bố cứ mãi khoẻ mạnh để hỏi t câu này cả đời nhỉ",
      "word_count": 55,
      "published_date": 1745890453.0,
      "published_datetime": "2025-04-29 01:34:13+00:00",
      "likes_count": 0,
      "shares_count": 0,
      "comments_count": 0,
      "views_count": 0,
      "reactions": null,
      "account_id": "dlinhpu",
      "account_name": "dlinhpu",
      "account_url": "https://www.threads.net/@dlinhpu",
      "post_id": "7811",
      "post_type": "thread",
      "raw_metadata": {
        "username": "dlinhpu",
        "likes": 0,
        "replies": 0,
        "reposts": 0,
        "shares": 0,
        "time": "04/28/25",
        "datetime": "2025-04-29T01:34:13.000Z"
      },
      "is_cleaned": true,
      "data_type": "threads",
      "reposts_count": 0
    },
    {
      "url": "https://www.threads.net/@dovannam358/post/DN5xrrDgcOB",
      "source_type": "threads",
      "source": "https://www.threads.net/@dovannam358/post/DN5xrrDgcOB",
      "domain": "threads.net",
      "social_platform": "threads",
      "title": "Tìm bạn nào ở Hưng yên mà khó quá",
      "content": "Tìm bạn nào ở Hưng yên mà khó quá",
      "word_count": 9,
      "published_date": 1756392820.0,
      "published_datetime": "2025-08-28 14:53:40+00:00",
      "likes_count": 0,
      "shares_count": 0,
      "comments_count": 0,
      "views_count": 0,
      "reactions": null,
      "account_id": "dovannam358",
      "account_name": "dovannam358",
      "account_url": "https://www.threads.net/@dovannam358",
      "post_id": "7810",
      "post_type": "thread",
      "raw_metadata": {
        "username": "dovannam358",
        "likes": 0,
        "replies": 0,
        "reposts": 0,
        "shares": 0,
        "time": "08/28/25",
        "datetime": "2025-08-28T14:53:40.000Z"
      },
      "is_cleaned": true,
      "data_type": "threads",
      "reposts_count": 0
    },
    {
      "url": "https://www.threads.net/@hoangdainghia.05022006/post/DSp9tkiE96H",
      "source_type": "threads",
      "source": "https://www.threads.net/@hoangdainghia.05022006/post/DSp9tkiE96H",
      "domain": "threads.net",
      "social_platform": "threads",
      "title": "Ai quê nam định-hưng yên k",
      "content": "Ai quê nam định-hưng yên k",
      "word_count": 6,
      "published_date": 1766599674.0,
      "published_datetime": "2025-12-24 18:07:54+00:00",
      "likes_count": 0,
      "shares_count": 0,
      "comments_count": 0,
      "views_count": 0,
      "reactions": null,
      "account_id": "hoangdainghia.05022006",
      "account_name": "hoangdainghia.05022006",
      "account_url": "https://www.threads.net/@hoangdainghia.05022006",
      "post_id": "7809",
      "post_type": "thread",
      "raw_metadata": {
        "username": "hoangdainghia.05022006",
        "likes": 0,
        "replies": 0,
        "reposts": 0,
        "shares": 0,
        "time": "12/24/25",
        "datetime": "2025-12-24T18:07:54.000Z"
      },
      "is_cleaned": true,
      "data_type": "threads",
      "reposts_count": 0
    },
    {
      "url": "https://www.threads.net/@makalongweir/post/DOI7jEnj-ZR",
      "source_type": "threads",
      "source": "https://www.threads.net/@makalongweir/post/DOI7jEnj-ZR",
      "domain": "threads.net",
      "social_platform": "threads",
      "title": "Cả nhà ơi cuối tuần này đi xe máy từ Hà Nội về Hưng Yên không cho em đi ké với ạ. Em cần mang xe máy...",
      "content": "Cả nhà ơi cuối tuần này đi xe máy từ Hà Nội về Hưng Yên không cho em đi ké với ạ. Em cần mang xe máy về Hưng Yên mà có 1 mình thui hơi sợ á  Translate 12",
      "word_count": 40,
      "published_date": 1756901308.0,
      "published_datetime": "2025-09-03 12:08:28+00:00",
      "likes_count": 0,
      "shares_count": 0,
      "comments_count": 0,
      "views_count": 0,
      "reactions": null,
      "account_id": "makalongweir",
      "account_name": "makalongweir",
      "account_url": "https://www.threads.net/@makalongweir",
      "post_id": "7808",
      "post_type": "thread",
      "raw_metadata": {
        "username": "makalongweir",
        "likes": 0,
        "replies": 0,
        "reposts": 0,
        "shares": 0,
        "time": "09/03/25",
        "datetime": "2025-09-03T12:08:28.000Z"
      },
      "is_cleaned": true,
      "data_type": "threads",
      "reposts_count": 0
    },
    {
      "url": "https://www.threads.net/@diemmy2412_/post/DQgo4KrEvkV",
      "source_type": "threads",
      "source": "https://www.threads.net/@diemmy2412_/post/DQgo4KrEvkV",
      "domain": "threads.net",
      "social_platform": "threads",
      "title": "Em chào mng em 2k8 điểm toán đề khảo sát Hưng Yên em vừa thi xong thì được 6:(( em buồn kinh khủng h...",
      "content": "Em chào mng em 2k8 điểm toán đề khảo sát Hưng Yên em vừa thi xong thì được 6:(( em buồn kinh khủng huhu tại em ôn rất nhiều gần như làm đề và chữa take note lại rất kĩ vô vở nhưng đi thi đầu em cảm giác rất là Rỗng em không biết mình phải cần phải thay đổi phương pháp học ntn aim em 8 Thptqg mà giờ em sợ quá ai cho em xin lời khuyên với",
      "word_count": 81,
      "published_date": 1761991793.0,
      "published_datetime": "2025-11-01 10:09:53+00:00",
      "likes_count": 0,
      "shares_count": 0,
      "comments_count": 0,
      "views_count": 0,
      "reactions": null,
      "account_id": "diemmy2412_",
      "account_name": "diemmy2412_",
      "account_url": "https://www.threads.net/@diemmy2412_",
      "post_id": "7807",
      "post_type": "thread",
      "raw_metadata": {
        "username": "diemmy2412_",
        "likes": 0,
        "replies": 0,
        "reposts": 0,
        "shares": 0,
        "time": "11/01/25",
        "datetime": "2025-11-01T10:09:53.000Z"
      },
      "is_cleaned": true,
      "data_type": "threads",
      "reposts_count": 0
    },
    {
      "url": "https://www.threads.net/@_taoyeumaylam/post/DQgwd5KEsCW",
      "source_type": "threads",
      "source": "https://www.threads.net/@_taoyeumaylam/post/DQgwd5KEsCW",
      "domain": "threads.net",
      "social_platform": "threads",
      "title": "Thi xong giữa kì rồi, làm đề Hưng Yên xong thì 14đ văn t mới đỗ được ussh Hà Nội",
      "content": "Thi xong giữa kì rồi, làm đề Hưng Yên xong thì 14đ văn t mới đỗ được ussh Hà Nội",
      "word_count": 20,
      "published_date": 1761995773.0,
      "published_datetime": "2025-11-01 11:16:13+00:00",
      "likes_count": 0,
      "shares_count": 0,
      "comments_count": 0,
      "views_count": 0,
      "reactions": null,
      "account_id": "_taoyeumaylam",
      "account_name": "_taoyeumaylam",
      "account_url": "https://www.threads.net/@_taoyeumaylam",
      "post_id": "7806",
      "post_type": "thread",
      "raw_metadata": {
        "username": "_taoyeumaylam",
        "likes": 0,
        "replies": 0,
        "reposts": 0,
        "shares": 0,
        "time": "11/01/25",
        "datetime": "2025-11-01T11:16:13.000Z"
      },
      "is_cleaned": true,
      "data_type": "threads",
      "reposts_count": 0
    },
    {
      "url": "https://www.threads.net/@anhnn11128/post/DQgC5nAgQod",
      "source_type": "threads",
      "source": "https://www.threads.net/@anhnn11128/post/DQgC5nAgQod",
      "domain": "threads.net",
      "social_platform": "threads",
      "title": "Cm ơi nay ai thi đề văn của sở Hưng yên mà sốc như t ko đầu tiên là cái đề văn má ơi t đọc xong t ng...",
      "content": "Cm ơi nay ai thi đề văn của sở Hưng yên mà sốc như t ko đầu tiên là cái đề văn má ơi t đọc xong t nghĩ đến trùng sinh luôn ạ t trường t ko ôn cái from đề này văn còn sốc vừa anh cơ t chx gặp cái đề nào mà nó chỉ có đọc điền và đọc hiểu t nhận để t cứng người t ôn đề bn nó lệch bấy nhiêu  t biết rằng đề sở thái bình vẫn khó ai dè hợp tỉnh nó còn khó hơn",
      "word_count": 95,
      "published_date": 1761971882.0,
      "published_datetime": "2025-11-01 04:38:02+00:00",
      "likes_count": 0,
      "shares_count": 0,
      "comments_count": 0,
      "views_count": 0,
      "reactions": null,
      "account_id": "anhnn11128",
      "account_name": "anhnn11128",
      "account_url": "https://www.threads.net/@anhnn11128",
      "post_id": "7805",
      "post_type": "thread",
      "raw_metadata": {
        "username": "anhnn11128",
        "likes": 0,
        "replies": 0,
        "reposts": 0,
        "shares": 0,
        "time": "11/01/25",
        "datetime": "2025-11-01T04:38:02.000Z"
      },
      "is_cleaned": true,
      "data_type": "threads",
      "reposts_count": 0
    },
    {
      "url": "https://www.threads.net/@plz__stawpp/post/DSZvvoLEjtc",
      "source_type": "threads",
      "source": "https://www.threads.net/@plz__stawpp/post/DSZvvoLEjtc",
      "domain": "threads.net",
      "social_platform": "threads",
      "title": "đất hưng yên có gì vậy ạ...",
      "content": "đất hưng yên có gì vậy ạ...",
      "word_count": 7,
      "published_date": 1766055480.0,
      "published_datetime": "2025-12-18 10:58:00+00:00",
      "likes_count": 0,
      "shares_count": 0,
      "comments_count": 0,
      "views_count": 0,
      "reactions": null,
      "account_id": "plz__stawpp",
      "account_name": "plz__stawpp",
      "account_url": "https://www.threads.net/@plz__stawpp",
      "post_id": "7804",
      "post_type": "thread",
      "raw_metadata": {
        "username": "plz__stawpp",
        "likes": 0,
        "replies": 0,
        "reposts": 0,
        "shares": 0,
        "time": "12/18/25",
        "datetime": "2025-12-18T10:58:00.000Z"
      },
      "is_cleaned": true,
      "data_type": "threads",
      "reposts_count": 0
    },
    {
      "url": "https://www.threads.net/@nhanmat11/post/DS1i_hyka2R",
      "source_type": "threads",
      "source": "https://www.threads.net/@nhanmat11/post/DS1i_hyka2R",
      "domain": "threads.net",
      "social_platform": "threads",
      "title": "Hôm qua mình tới tháng ngày thứ 1, yên ổn cả ngày chả sao, tới tối đang đi đi chơi với anh người yêu...",
      "content": "Hôm qua mình tới tháng ngày thứ 1, yên ổn cả ngày chả sao, tới tối đang đi đi chơi với anh người yêu cái bụng đau quặn lên, tụt đường huyết, hoa mắt chóng mặt, trời lạnh mà mồ hôi túa hết cả ra. Hai đứa lết được tới GS25 Phùng Hưng thì mình gồng không nổi nữa, đau quá ngồi vạ vật ở ngoài cửa. Người yêu mình mua đồ ra cái gục người vào ảnh luôn, không nhấc người lên được nữa,cảm giác không có tí sức nào. Translate 12",
      "word_count": 93,
      "published_date": 1766988318.0,
      "published_datetime": "2025-12-29 06:05:18+00:00",
      "likes_count": 0,
      "shares_count": 0,
      "comments_count": 0,
      "views_count": 0,
      "reactions": null,
      "account_id": "nhanmat11",
      "account_name": "nhanmat11",
      "account_url": "https://www.threads.net/@nhanmat11",
      "post_id": "7803",
      "post_type": "thread",
      "raw_metadata": {
        "username": "nhanmat11",
        "likes": 0,
        "replies": 0,
        "reposts": 0,
        "shares": 0,
        "time": "6d",
        "datetime": "2025-12-29T06:05:18.000Z"
      },
      "is_cleaned": true,
      "data_type": "threads",
      "reposts_count": 0
    },
    {
      "url": "https://www.threads.net/@lynhan_w/post/DSwwnB0j385",
      "source_type": "threads",
      "source": "https://www.threads.net/@lynhan_w/post/DSwwnB0j385",
      "domain": "threads.net",
      "social_platform": "threads",
      "title": "mn ơi cho e hỏi chùa Phúc Lâm Tiên Quán ở Kim Động, Hưng Yên có đóng cửa hôm nào kh ạ, em dg tính 31...",
      "content": "mn ơi cho e hỏi chùa Phúc Lâm Tiên Quán ở Kim Động, Hưng Yên có đóng cửa hôm nào kh ạ, em dg tính 311 chụp ảnh Tết ở đó, e cảm ơn ạ!  Translate 12",
      "word_count": 37,
      "published_date": 1766827686.0,
      "published_datetime": "2025-12-27 09:28:06+00:00",
      "likes_count": 0,
      "shares_count": 0,
      "comments_count": 0,
      "views_count": 0,
      "reactions": null,
      "account_id": "lynhan_w",
      "account_name": "lynhan_w",
      "account_url": "https://www.threads.net/@lynhan_w",
      "post_id": "7802",
      "post_type": "thread",
      "raw_metadata": {
        "username": "lynhan_w",
        "likes": 0,
        "replies": 0,
        "reposts": 0,
        "shares": 0,
        "time": "12/27/25",
        "datetime": "2025-12-27T09:28:06.000Z"
      },
      "is_cleaned": true,
      "data_type": "threads",
      "reposts_count": 0
    },
    {
      "url": "https://www.threads.net/@vuhi_en1991/post/DOYZAuTk8gC",
      "source_type": "threads",
      "source": "https://www.threads.net/@vuhi_en1991/post/DOYZAuTk8gC",
      "domain": "threads.net",
      "social_platform": "threads",
      "title": "Có b nào ở hưng yên k",
      "content": "Có b nào ở hưng yên k",
      "word_count": 7,
      "published_date": 1757420072.0,
      "published_datetime": "2025-09-09 12:14:32+00:00",
      "likes_count": 0,
      "shares_count": 0,
      "comments_count": 0,
      "views_count": 0,
      "reactions": null,
      "account_id": "vuhi_en1991",
      "account_name": "vuhi_en1991",
      "account_url": "https://www.threads.net/@vuhi_en1991",
      "post_id": "7801",
      "post_type": "thread",
      "raw_metadata": {
        "username": "vuhi_en1991",
        "likes": 0,
        "replies": 0,
        "reposts": 0,
        "shares": 0,
        "time": "09/09/25",
        "datetime": "2025-09-09T12:14:32.000Z"
      },
      "is_cleaned": true,
      "data_type": "threads",
      "reposts_count": 0
    },
    {
      "url": "https://www.threads.net/@diephoang_13100109/post/DS4-q2BjxxE",
      "source_type": "threads",
      "source": "https://www.threads.net/@diephoang_13100109/post/DS4-q2BjxxE",
      "domain": "threads.net",
      "social_platform": "threads",
      "title": "Em tìm nhà xe limousine chạy từ HN về Hưng Yên và ngược lại vào hôm mùng 1 tết dương ạ",
      "content": "Em tìm nhà xe limousine chạy từ HN về Hưng Yên và ngược lại vào hôm mùng 1 tết dương ạ",
      "word_count": 21,
      "published_date": 1767103492.0,
      "published_datetime": "2025-12-30 14:04:52+00:00",
      "likes_count": 0,
      "shares_count": 0,
      "comments_count": 0,
      "views_count": 0,
      "reactions": null,
      "account_id": "diephoang_13100109",
      "account_name": "diephoang_13100109",
      "account_url": "https://www.threads.net/@diephoang_13100109",
      "post_id": "7800",
      "post_type": "thread",
      "raw_metadata": {
        "username": "diephoang_13100109",
        "likes": 0,
        "replies": 0,
        "reposts": 0,
        "shares": 0,
        "time": "4d",
        "datetime": "2025-12-30T14:04:52.000Z"
      },
      "is_cleaned": true,
      "data_type": "threads",
      "reposts_count": 0
    },
    {
      "url": "https://www.threads.net/@imquentinlee/post/DKy85M_hrjG",
      "source_type": "threads",
      "source": "https://www.threads.net/@imquentinlee/post/DKy85M_hrjG",
      "domain": "threads.net",
      "social_platform": "threads",
      "title": "Yes, tôi tôn trọng việc sát nhập tỉnh nhưng tôi SẼ MÃI là người Thái Bình, ai hỏi thì vẫn bảo Thái B...",
      "content": "Yes, tôi tôn trọng việc sát nhập tỉnh nhưng tôi SẼ MÃI là người Thái Bình, ai hỏi thì vẫn bảo Thái Bình. Không có Hưng Yên nào ở đây hết! (tôi không hề ghét hay ý kiến với Hưng Yên chỉ là sẽ mãi giữ tên quê tôi)  Translate 12",
      "word_count": 51,
      "published_date": 1749721366.0,
      "published_datetime": "2025-06-12 09:42:46+00:00",
      "likes_count": 0,
      "shares_count": 0,
      "comments_count": 0,
      "views_count": 0,
      "reactions": null,
      "account_id": "imquentinlee",
      "account_name": "imquentinlee",
      "account_url": "https://www.threads.net/@imquentinlee",
      "post_id": "7799",
      "post_type": "thread",
      "raw_metadata": {
        "username": "imquentinlee",
        "likes": 0,
        "replies": 0,
        "reposts": 0,
        "shares": 0,
        "time": "06/12/25",
        "datetime": "2025-06-12T09:42:46.000Z"
      },
      "is_cleaned": true,
      "data_type": "threads",
      "reposts_count": 0
    },
    {
      "url": "https://www.threads.net/@nobitano.95/post/DSeb3wGCemJ",
      "source_type": "threads",
      "source": "https://www.threads.net/@nobitano.95/post/DSeb3wGCemJ",
      "domain": "threads.net",
      "social_platform": "threads",
      "title": "Bài kiểm tra 1 tiết lớp Gen Tinh Hoa : Câu 1 : Máu bùn là gì? Phân biệt tầng lớp tinh hoa và máu bù...",
      "content": "Bài kiểm tra 1 tiết lớp Gen Tinh Hoa : Câu 1 : Máu bùn là gì? Phân biệt tầng lớp tinh hoa và máu bùn? Câu 2 : So sánh giống và khác nhau giữa máu bùn, tinh hoa và 3que Câu 3 : Cho 3 lọ mất nhãn bao gồm tinh hoa, gốc nội và máu bùn. Bằng phương pháp hoá học, nhận biết các loại trên. Câu 4 : Dấu hiệu nhận biết tầng lớp Tinh Hoa Câu 5 : Một nữ Gốc Hà Nội 4 đời nhiễm sắc thể XY kết hợp với nam Hưng Yên cho ra đàn con Tinh Hoa chiếm tỉ lệ bao nhiêu phần trăm. Biết Nam là LGBT đã qua 2 đời ck.",
      "word_count": 122,
      "published_date": 1766212833.0,
      "published_datetime": "2025-12-20 06:40:33+00:00",
      "likes_count": 0,
      "shares_count": 0,
      "comments_count": 0,
      "views_count": 0,
      "reactions": null,
      "account_id": "nobitano.95",
      "account_name": "nobitano.95",
      "account_url": "https://www.threads.net/@nobitano.95",
      "post_id": "7798",
      "post_type": "thread",
      "raw_metadata": {
        "username": "nobitano.95",
        "likes": 0,
        "replies": 0,
        "reposts": 0,
        "shares": 0,
        "time": "12/20/25",
        "datetime": "2025-12-20T06:40:33.000Z"
      },
      "is_cleaned": true,
      "data_type": "threads",
      "reposts_count": 0
    },
    {
      "url": "https://www.threads.net/@tuimi._/post/DSwcLTPk2sw",
      "source_type": "threads",
      "source": "https://www.threads.net/@tuimi._/post/DSwcLTPk2sw",
      "domain": "threads.net",
      "social_platform": "threads",
      "title": "Một người mà tui đã thực sự mong đc gặp ở Hưng Yên là DMH",
      "content": "Một người mà tui đã thực sự mong đc gặp ở Hưng Yên là DMH",
      "word_count": 15,
      "published_date": 1766816973.0,
      "published_datetime": "2025-12-27 06:29:33+00:00",
      "likes_count": 0,
      "shares_count": 0,
      "comments_count": 0,
      "views_count": 0,
      "reactions": null,
      "account_id": "tuimi._",
      "account_name": "tuimi._",
      "account_url": "https://www.threads.net/@tuimi._",
      "post_id": "7797",
      "post_type": "thread",
      "raw_metadata": {
        "username": "tuimi._",
        "likes": 0,
        "replies": 0,
        "reposts": 0,
        "shares": 0,
        "time": "12/27/25",
        "datetime": "2025-12-27T06:29:33.000Z"
      },
      "is_cleaned": true,
      "data_type": "threads",
      "reposts_count": 0
    },
    {
      "url": "https://www.threads.net/@honphuc2000/post/DOfyECNgfFU",
      "source_type": "threads",
      "source": "https://www.threads.net/@honphuc2000/post/DOfyECNgfFU",
      "domain": "threads.net",
      "social_platform": "threads",
      "title": "Có ai muốn đi xem phim cuối tuần không ạ",
      "content": "Có ai muốn đi xem phim cuối tuần không ạ",
      "word_count": 10,
      "published_date": 1757668088.0,
      "published_datetime": "2025-09-12 09:08:08+00:00",
      "likes_count": 0,
      "shares_count": 0,
      "comments_count": 0,
      "views_count": 0,
      "reactions": null,
      "account_id": "honphuc2000",
      "account_name": "honphuc2000",
      "account_url": "https://www.threads.net/@honphuc2000",
      "post_id": "7796",
      "post_type": "thread",
      "raw_metadata": {
        "username": "honphuc2000",
        "likes": 0,
        "replies": 0,
        "reposts": 0,
        "shares": 0,
        "time": "09/12/25",
        "datetime": "2025-09-12T09:08:08.000Z"
      },
      "is_cleaned": true,
      "data_type": "threads",
      "reposts_count": 0
    },
    {
      "url": "https://www.threads.net/@nlilyng/post/DS1rrJykt0B",
      "source_type": "threads",
      "source": "https://www.threads.net/@nlilyng/post/DS1rrJykt0B",
      "domain": "threads.net",
      "social_platform": "threads",
      "title": "Câu hỏi này mang lê đây chắc it người quan tâm. Nhưng năm nay tại sao đất ở Hưng Yên đấu giá nhiều v...",
      "content": "Câu hỏi này mang lê đây chắc it người quan tâm. Nhưng năm nay tại sao đất ở Hưng Yên đấu giá nhiều vậy ạ??? Hì hì",
      "word_count": 27,
      "published_date": 1766992870.0,
      "published_datetime": "2025-12-29 07:21:10+00:00",
      "likes_count": 0,
      "shares_count": 0,
      "comments_count": 0,
      "views_count": 0,
      "reactions": null,
      "account_id": "nlilyng",
      "account_name": "nlilyng",
      "account_url": "https://www.threads.net/@nlilyng",
      "post_id": "7795",
      "post_type": "thread",
      "raw_metadata": {
        "username": "nlilyng",
        "likes": 0,
        "replies": 0,
        "reposts": 0,
        "shares": 0,
        "time": "6d",
        "datetime": "2025-12-29T07:21:10.000Z"
      },
      "is_cleaned": true,
      "data_type": "threads",
      "reposts_count": 0
    },
    {
      "url": "https://www.threads.net/@daodai417/post/DOcW5FmE-DI",
      "source_type": "threads",
      "source": "https://www.threads.net/@daodai417/post/DOcW5FmE-DI",
      "domain": "threads.net",
      "social_platform": "threads",
      "title": "Có ai quê Hưng Yên không ạ",
      "content": "Có ai quê Hưng Yên không ạ",
      "word_count": 7,
      "published_date": 1757553179.0,
      "published_datetime": "2025-09-11 01:12:59+00:00",
      "likes_count": 0,
      "shares_count": 0,
      "comments_count": 0,
      "views_count": 0,
      "reactions": null,
      "account_id": "daodai417",
      "account_name": "daodai417",
      "account_url": "https://www.threads.net/@daodai417",
      "post_id": "7794",
      "post_type": "thread",
      "raw_metadata": {
        "username": "daodai417",
        "likes": 0,
        "replies": 0,
        "reposts": 0,
        "shares": 0,
        "time": "09/10/25",
        "datetime": "2025-09-11T01:12:59.000Z"
      },
      "is_cleaned": true,
      "data_type": "threads",
      "reposts_count": 0
    },
    {
      "url": "https://www.threads.net/@makalongweir/post/DObVEdLjwZO",
      "source_type": "threads",
      "source": "https://www.threads.net/@makalongweir/post/DObVEdLjwZO",
      "domain": "threads.net",
      "social_platform": "threads",
      "title": "Cả nhà ơi em tìm người đi xe máy cùng từ Hưng Yên về Hà Nội ạ  em đi từ kim động, đi ngày nào giờ n...",
      "content": "Cả nhà ơi em tìm người đi xe máy cùng từ Hưng Yên về Hà Nội ạ  em đi từ kim động, đi ngày nào giờ nào trong tuần này cũng được ạ. Em có xe mà không dám đi 1 mình",
      "word_count": 42,
      "published_date": 1757518669.0,
      "published_datetime": "2025-09-10 15:37:49+00:00",
      "likes_count": 0,
      "shares_count": 0,
      "comments_count": 0,
      "views_count": 0,
      "reactions": null,
      "account_id": "makalongweir",
      "account_name": "makalongweir",
      "account_url": "https://www.threads.net/@makalongweir",
      "post_id": "7793",
      "post_type": "thread",
      "raw_metadata": {
        "username": "makalongweir",
        "likes": 0,
        "replies": 0,
        "reposts": 0,
        "shares": 0,
        "time": "09/10/25",
        "datetime": "2025-09-10T15:37:49.000Z"
      },
      "is_cleaned": true,
      "data_type": "threads",
      "reposts_count": 0
    },
    {
      "url": "https://www.threads.net/@unth.uyph/post/DS64A3rE516",
      "source_type": "threads",
      "source": "https://www.threads.net/@unth.uyph/post/DS64A3rE516",
      "domain": "threads.net",
      "social_platform": "threads",
      "title": "Tuyệt vời ghê. Ở Huế vào ngày cuối năm 2025 và không quen ai, không biết đi đâu làm gì cả ))",
      "content": "Tuyệt vời ghê. Ở Huế vào ngày cuối năm 2025 và không quen ai, không biết đi đâu làm gì cả ))",
      "word_count": 22,
      "published_date": 1767167112.0,
      "published_datetime": "2025-12-31 07:45:12+00:00",
      "likes_count": 0,
      "shares_count": 0,
      "comments_count": 0,
      "views_count": 0,
      "reactions": null,
      "account_id": "unth.uyph",
      "account_name": "unth.uyph",
      "account_url": "https://www.threads.net/@unth.uyph",
      "post_id": "7792",
      "post_type": "thread",
      "raw_metadata": {
        "username": "unth.uyph",
        "likes": 0,
        "replies": 0,
        "reposts": 0,
        "shares": 0,
        "time": "4d",
        "datetime": "2025-12-31T07:45:12.000Z"
      },
      "is_cleaned": true,
      "data_type": "threads",
      "reposts_count": 0
    },
    {
      "url": "https://www.threads.net/@_dngocling_/post/DMX926xzbQZ",
      "source_type": "threads",
      "source": "https://www.threads.net/@_dngocling_/post/DMX926xzbQZ",
      "domain": "threads.net",
      "social_platform": "threads",
      "title": "Tui ở Hưng Yên (. Hưng Yên ) vẫn ổn còn chỗ mn bão bùng đến đâu r ? Cập nhật tui nghe vs",
      "content": "Tui ở Hưng Yên (. Hưng Yên ) vẫn ổn còn chỗ mn bão bùng đến đâu r ? Cập nhật tui nghe vs",
      "word_count": 24,
      "published_date": 1753110869.0,
      "published_datetime": "2025-07-21 15:14:29+00:00",
      "likes_count": 0,
      "shares_count": 0,
      "comments_count": 0,
      "views_count": 0,
      "reactions": null,
      "account_id": "_dngocling_",
      "account_name": "_dngocling_",
      "account_url": "https://www.threads.net/@_dngocling_",
      "post_id": "7791",
      "post_type": "thread",
      "raw_metadata": {
        "username": "_dngocling_",
        "likes": 0,
        "replies": 0,
        "reposts": 0,
        "shares": 0,
        "time": "07/21/25",
        "datetime": "2025-07-21T15:14:29.000Z"
      },
      "is_cleaned": true,
      "data_type": "threads",
      "reposts_count": 0
    },
    {
      "url": "https://www.threads.net/@omgomgomg_cjz/post/DSdrPsfktP5",
      "source_type": "threads",
      "source": "https://www.threads.net/@omgomgomg_cjz/post/DSdrPsfktP5",
      "domain": "threads.net",
      "social_platform": "threads",
      "title": "hưng yên mảnh đất hữu tình năm đôi phát một nổ tung các nhà",
      "content": "hưng yên mảnh đất hữu tình năm đôi phát một nổ tung các nhà",
      "word_count": 14,
      "published_date": 1766187339.0,
      "published_datetime": "2025-12-19 23:35:39+00:00",
      "likes_count": 0,
      "shares_count": 0,
      "comments_count": 0,
      "views_count": 0,
      "reactions": null,
      "account_id": "omgomgomg_cjz",
      "account_name": "omgomgomg_cjz",
      "account_url": "https://www.threads.net/@omgomgomg_cjz",
      "post_id": "7790",
      "post_type": "thread",
      "raw_metadata": {
        "username": "omgomgomg_cjz",
        "likes": 0,
        "replies": 0,
        "reposts": 0,
        "shares": 0,
        "time": "12/19/25",
        "datetime": "2025-12-19T23:35:39.000Z"
      },
      "is_cleaned": true,
      "data_type": "threads",
      "reposts_count": 0
    },
    {
      "url": "https://www.threads.net/@wakeup_1409/post/DJlJ5vURn15",
      "source_type": "threads",
      "source": "https://www.threads.net/@wakeup_1409/post/DJlJ5vURn15",
      "domain": "threads.net",
      "social_platform": "threads",
      "title": "Anh Long : Chào em, em có thể nhường đường cho anh đến sân Mỹ Đình không. GL : Em là Ocean Park 3 Hư...",
      "content": "Anh Long : Chào em, em có thể nhường đường cho anh đến sân Mỹ Đình không. GL : Em là Ocean Park 3 Hưng Yên, Hà Nội có sức chứa 150k người đó a. Anh Long : Biết rồi Ocean Park 3 Hưng Yên, Hà Nội có sức chứa 150k người , tránh ra đi em , anh còn phải đến Mỹ Đình diễn chứ .",
      "word_count": 67,
      "published_date": 1747110940.0,
      "published_datetime": "2025-05-13 04:35:40+00:00",
      "likes_count": 0,
      "shares_count": 0,
      "comments_count": 0,
      "views_count": 0,
      "reactions": null,
      "account_id": "wakeup_1409",
      "account_name": "wakeup_1409",
      "account_url": "https://www.threads.net/@wakeup_1409",
      "post_id": "7789",
      "post_type": "thread",
      "raw_metadata": {
        "username": "wakeup_1409",
        "likes": 0,
        "replies": 0,
        "reposts": 0,
        "shares": 0,
        "time": "05/13/25",
        "datetime": "2025-05-13T04:35:40.000Z"
      },
      "is_cleaned": true,
      "data_type": "threads",
      "reposts_count": 0
    },
    {
      "url": "https://www.threads.net/@_yannie_tran/post/DQgHX81kkAu",
      "source_type": "threads",
      "source": "https://www.threads.net/@_yannie_tran/post/DQgHX81kkAu",
      "domain": "threads.net",
      "social_platform": "threads",
      "title": "Trung bình học sinh 2k8 Hưng Yên sáng nay",
      "content": "Trung bình học sinh 2k8 Hưng Yên sáng nay",
      "word_count": 9,
      "published_date": 1761974228.0,
      "published_datetime": "2025-11-01 05:17:08+00:00",
      "likes_count": 0,
      "shares_count": 0,
      "comments_count": 0,
      "views_count": 0,
      "reactions": null,
      "account_id": "_yannie_tran",
      "account_name": "_yannie_tran",
      "account_url": "https://www.threads.net/@_yannie_tran",
      "post_id": "7788",
      "post_type": "thread",
      "raw_metadata": {
        "username": "_yannie_tran",
        "likes": 0,
        "replies": 0,
        "reposts": 0,
        "shares": 0,
        "time": "11/01/25",
        "datetime": "2025-11-01T05:17:08.000Z"
      },
      "is_cleaned": true,
      "data_type": "threads",
      "reposts_count": 0
    },
    {
      "url": "https://www.threads.net/@fecmi_mush/post/DL6wgWiBQif",
      "source_type": "threads",
      "source": "https://www.threads.net/@fecmi_mush/post/DL6wgWiBQif",
      "domain": "threads.net",
      "social_platform": "threads",
      "title": "cuối tuần có ai phượt về Hưng Yên không ạ? mình có xe nhưng chưa đj bao h nên cần xe nx đi cùng",
      "content": "cuối tuần có ai phượt về Hưng Yên không ạ? mình có xe nhưng chưa đj bao h nên cần xe nx đi cùng",
      "word_count": 24,
      "published_date": 1752130790.0,
      "published_datetime": "2025-07-10 06:59:50+00:00",
      "likes_count": 0,
      "shares_count": 0,
      "comments_count": 0,
      "views_count": 0,
      "reactions": null,
      "account_id": "fecmi_mush",
      "account_name": "fecmi_mush",
      "account_url": "https://www.threads.net/@fecmi_mush",
      "post_id": "7787",
      "post_type": "thread",
      "raw_metadata": {
        "username": "fecmi_mush",
        "likes": 0,
        "replies": 0,
        "reposts": 0,
        "shares": 0,
        "time": "07/10/25",
        "datetime": "2025-07-10T06:59:50.000Z"
      },
      "is_cleaned": true,
      "data_type": "threads",
      "reposts_count": 0
    },
    {
      "url": "https://www.threads.net/@taikhoannaychidetheodoiidol/post/DKhh2GrStZ4",
      "source_type": "threads",
      "source": "https://www.threads.net/@taikhoannaychidetheodoiidol/post/DKhh2GrStZ4",
      "domain": "threads.net",
      "social_platform": "threads",
      "title": "Các bác đu ATVNCG ở Hưng Yên cho e hỏi tí là: em mà đi xe máy từ HN qua đó có tiện ko? Có bị tắc đườ...",
      "content": "Các bác đu ATVNCG ở Hưng Yên cho e hỏi tí là: em mà đi xe máy từ HN qua đó có tiện ko? Có bị tắc đường lắm ko ạ? Hay nên đi taxi? Hay Vinbus ạ? ATVNCGConcert",
      "word_count": 39,
      "published_date": 1749136759.0,
      "published_datetime": "2025-06-05 15:19:19+00:00",
      "likes_count": 0,
      "shares_count": 0,
      "comments_count": 0,
      "views_count": 0,
      "reactions": null,
      "account_id": "taikhoannaychidetheodoiidol",
      "account_name": "taikhoannaychidetheodoiidol",
      "account_url": "https://www.threads.net/@taikhoannaychidetheodoiidol",
      "post_id": "7786",
      "post_type": "thread",
      "raw_metadata": {
        "username": "taikhoannaychidetheodoiidol",
        "likes": 0,
        "replies": 0,
        "reposts": 0,
        "shares": 0,
        "time": "06/05/25",
        "datetime": "2025-06-05T15:19:19.000Z"
      },
      "is_cleaned": true,
      "data_type": "threads",
      "reposts_count": 0
    },
    {
      "url": "https://www.threads.net/@nguyen_tu0409/post/DSt-wwkkWXX",
      "source_type": "threads",
      "source": "https://www.threads.net/@nguyen_tu0409/post/DSt-wwkkWXX",
      "domain": "threads.net",
      "social_platform": "threads",
      "title": "Ai hưng yên hemm dẫn tuii đi chơi đi về quê chán quá",
      "content": "Ai hưng yên hemm dẫn tuii đi chơi đi về quê chán quá",
      "word_count": 13,
      "published_date": 1766734442.0,
      "published_datetime": "2025-12-26 07:34:02+00:00",
      "likes_count": 0,
      "shares_count": 0,
      "comments_count": 0,
      "views_count": 0,
      "reactions": null,
      "account_id": "nguyen_tu0409",
      "account_name": "nguyen_tu0409",
      "account_url": "https://www.threads.net/@nguyen_tu0409",
      "post_id": "7785",
      "post_type": "thread",
      "raw_metadata": {
        "username": "nguyen_tu0409",
        "likes": 0,
        "replies": 0,
        "reposts": 0,
        "shares": 0,
        "time": "12/26/25",
        "datetime": "2025-12-26T07:34:02.000Z"
      },
      "is_cleaned": true,
      "data_type": "threads",
      "reposts_count": 0
    },
    {
      "url": "https://www.threads.net/@mintchoco_711/post/DSu7wQ9kmgR",
      "source_type": "threads",
      "source": "https://www.threads.net/@mintchoco_711/post/DSu7wQ9kmgR",
      "domain": "threads.net",
      "social_platform": "threads",
      "title": "HLE ơi, anh nghĩ sao về hà nội và hưng yên",
      "content": "HLE ơi, anh nghĩ sao về hà nội và hưng yên",
      "word_count": 11,
      "published_date": 1766766420.0,
      "published_datetime": "2025-12-26 16:27:00+00:00",
      "likes_count": 0,
      "shares_count": 0,
      "comments_count": 0,
      "views_count": 0,
      "reactions": null,
      "account_id": "mintchoco_711",
      "account_name": "mintchoco_711",
      "account_url": "https://www.threads.net/@mintchoco_711",
      "post_id": "7784",
      "post_type": "thread",
      "raw_metadata": {
        "username": "mintchoco_711",
        "likes": 0,
        "replies": 0,
        "reposts": 0,
        "shares": 0,
        "time": "12/26/25",
        "datetime": "2025-12-26T16:27:00.000Z"
      },
      "is_cleaned": true,
      "data_type": "threads",
      "reposts_count": 0
    },
    {
      "url": "https://www.threads.net/@ponie_phgg/post/DSz3v1WEz0M",
      "source_type": "threads",
      "source": "https://www.threads.net/@ponie_phgg/post/DSz3v1WEz0M",
      "domain": "threads.net",
      "social_platform": "threads",
      "title": "Mọi người ơi có ai ở Hưng Yên muốn chụp ảnh tết, ảnh cafe, không ạ, ở quanh khu vực Khoái Châu hoặc...",
      "content": "Mọi người ơi có ai ở Hưng Yên muốn chụp ảnh tết, ảnh cafe, không ạ, ở quanh khu vực Khoái Châu hoặc TP Hưng Yên thui vì mình k đi quá xa được. Mình rảnh 1 vài buổi chiều, có máy ảnh muốn đi chụp nhiều để luyện tay. Ai cần nhắn mình nha phí xíu xiu cả chụp cả makeup công đi lại và hỗ trợ mình mĩ phẩm 1xx thui ạ.",
      "word_count": 74,
      "published_date": 1766932091.0,
      "published_datetime": "2025-12-28 14:28:11+00:00",
      "likes_count": 0,
      "shares_count": 0,
      "comments_count": 0,
      "views_count": 0,
      "reactions": null,
      "account_id": "ponie_phgg",
      "account_name": "ponie_phgg",
      "account_url": "https://www.threads.net/@ponie_phgg",
      "post_id": "7783",
      "post_type": "thread",
      "raw_metadata": {
        "username": "ponie_phgg",
        "likes": 0,
        "replies": 0,
        "reposts": 0,
        "shares": 0,
        "time": "6d",
        "datetime": "2025-12-28T14:28:11.000Z"
      },
      "is_cleaned": true,
      "data_type": "threads",
      "reposts_count": 0
    },
    {
      "url": "https://www.threads.net/@ha_28th8/post/DTE7Qc1kocB",
      "source_type": "threads",
      "source": "https://www.threads.net/@ha_28th8/post/DTE7Qc1kocB",
      "domain": "threads.net",
      "social_platform": "threads",
      "title": "T đang ở chùa nôm hưng yên muốn nhảy trend  nói rằng mình là người Thanh Hoá bà nào ra nhả cùg cho...",
      "content": "T đang ở chùa nôm hưng yên muốn nhảy trend  nói rằng mình là người Thanh Hoá bà nào ra nhả cùg cho đỡ ngại với:))",
      "word_count": 26,
      "published_date": 1767504356.0,
      "published_datetime": "2026-01-04 05:25:56+00:00",
      "likes_count": 0,
      "shares_count": 0,
      "comments_count": 0,
      "views_count": 0,
      "reactions": null,
      "account_id": "ha_28th8",
      "account_name": "ha_28th8",
      "account_url": "https://www.threads.net/@ha_28th8",
      "post_id": "7782",
      "post_type": "thread",
      "raw_metadata": {
        "username": "ha_28th8",
        "likes": 0,
        "replies": 0,
        "reposts": 0,
        "shares": 0,
        "time": "4h",
        "datetime": "2026-01-04T05:25:56.000Z"
      },
      "is_cleaned": true,
      "data_type": "threads",
      "reposts_count": 0
    },
    {
      "url": "https://www.threads.net/@_ngbinhdayzoiii/post/DK7tKQkBpme",
      "source_type": "threads",
      "source": "https://www.threads.net/@_ngbinhdayzoiii/post/DK7tKQkBpme",
      "domain": "threads.net",
      "social_platform": "threads",
      "title": "thôi được rồi. Mưa Mỹ Đình xấu, còn mưa Hưng Yên thì đẹp và điện ảnh  của các bạn hết á",
      "content": "thôi được rồi. Mưa Mỹ Đình xấu, còn mưa Hưng Yên thì đẹp và điện ảnh  của các bạn hết á",
      "word_count": 21,
      "published_date": 1750015107.0,
      "published_datetime": "2025-06-15 19:18:27+00:00",
      "likes_count": 0,
      "shares_count": 0,
      "comments_count": 0,
      "views_count": 0,
      "reactions": null,
      "account_id": "_ngbinhdayzoiii",
      "account_name": "_ngbinhdayzoiii",
      "account_url": "https://www.threads.net/@_ngbinhdayzoiii",
      "post_id": "7781",
      "post_type": "thread",
      "raw_metadata": {
        "username": "_ngbinhdayzoiii",
        "likes": 0,
        "replies": 0,
        "reposts": 0,
        "shares": 0,
        "time": "06/15/25",
        "datetime": "2025-06-15T19:18:27.000Z"
      },
      "is_cleaned": true,
      "data_type": "threads",
      "reposts_count": 0
    },
    {
      "url": "https://www.threads.net/@duytien35/post/DNbRg9IMaOr",
      "source_type": "threads",
      "source": "https://www.threads.net/@duytien35/post/DNbRg9IMaOr",
      "domain": "threads.net",
      "social_platform": "threads",
      "title": "Hôm nay gặp bác khách hỏi  Mày quê đâu? Cháu quê Hưng Yên Khách: Thế mà lên tận Hà Nội làm, quê ô...",
      "content": "Hôm nay gặp bác khách hỏi  Mày quê đâu? Cháu quê Hưng Yên Khách: Thế mà lên tận Hà Nội làm, quê ông Lâm à ? Gần nhà ông ấy ko? Tôi: Cũng gần bác ạ, ông Lâm còn lên tận Hà Nội làm nữa là cháu .:)) Khách cười : ừ , tao cũng ở Hưng Yên . :))",
      "word_count": 60,
      "published_date": 1755369322.0,
      "published_datetime": "2025-08-16 18:35:22+00:00",
      "likes_count": 0,
      "shares_count": 0,
      "comments_count": 0,
      "views_count": 0,
      "reactions": null,
      "account_id": "duytien35",
      "account_name": "duytien35",
      "account_url": "https://www.threads.net/@duytien35",
      "post_id": "7780",
      "post_type": "thread",
      "raw_metadata": {
        "username": "duytien35",
        "likes": 0,
        "replies": 0,
        "reposts": 0,
        "shares": 0,
        "time": "08/16/25",
        "datetime": "2025-08-16T18:35:22.000Z"
      },
      "is_cleaned": true,
      "data_type": "threads",
      "reposts_count": 0
    },
    {
      "url": "https://www.threads.net/@duc_mel11/post/DSzI8YfCRqC",
      "source_type": "threads",
      "source": "https://www.threads.net/@duc_mel11/post/DSzI8YfCRqC",
      "domain": "threads.net",
      "social_platform": "threads",
      "title": "con vợ nào ở hưng yên cũ , tết đi chơi kh chán qua",
      "content": "con vợ nào ở hưng yên cũ , tết đi chơi kh chán qua",
      "word_count": 14,
      "published_date": 1766907552.0,
      "published_datetime": "2025-12-28 07:39:12+00:00",
      "likes_count": 0,
      "shares_count": 0,
      "comments_count": 0,
      "views_count": 0,
      "reactions": null,
      "account_id": "duc_mel11",
      "account_name": "duc_mel11",
      "account_url": "https://www.threads.net/@duc_mel11",
      "post_id": "7779",
      "post_type": "thread",
      "raw_metadata": {
        "username": "duc_mel11",
        "likes": 0,
        "replies": 0,
        "reposts": 0,
        "shares": 0,
        "time": "12/28/25",
        "datetime": "2025-12-28T07:39:12.000Z"
      },
      "is_cleaned": true,
      "data_type": "threads",
      "reposts_count": 0
    },
    {
      "url": "https://www.threads.net/@chidung4852/post/DRQ9crBj1FJ",
      "source_type": "threads",
      "source": "https://www.threads.net/@chidung4852/post/DRQ9crBj1FJ",
      "domain": "threads.net",
      "social_platform": "threads",
      "title": "Ở đây có ai ở yên mỹ hưng yên ko?? Tôi mới mua xe máy điện chưa đk biển số rồi bị công ăn bắt á(ms m...",
      "content": "Ở đây có ai ở yên mỹ hưng yên ko?? Tôi mới mua xe máy điện chưa đk biển số rồi bị công ăn bắt á(ms mua htrc hn bị bắt). Rồi họ nói toi chưa đủ tuổi (toi 2k10) vs ko biển số là bị phạt cảnh cáo còn bố mẹ có con chưa đủ tuổi mà điều khiển thì bị phạt tiền. Tổng là 9tr(mà nhà tui nghèo) mn cho tui xin ý kiến vs. Toi thấy phạt nặng qu kiểu \"ăn chặn\" á (ý kiến cá nhân). Mà toi có đọc trên Thư Viện Pháp Luật nói là nhiều nhất cx có 2tr th. Huhu",
      "word_count": 108,
      "published_date": 1763613191.0,
      "published_datetime": "2025-11-20 04:33:11+00:00",
      "likes_count": 0,
      "shares_count": 0,
      "comments_count": 0,
      "views_count": 0,
      "reactions": null,
      "account_id": "chidung4852",
      "account_name": "chidung4852",
      "account_url": "https://www.threads.net/@chidung4852",
      "post_id": "7778",
      "post_type": "thread",
      "raw_metadata": {
        "username": "chidung4852",
        "likes": 0,
        "replies": 0,
        "reposts": 0,
        "shares": 0,
        "time": "11/19/25",
        "datetime": "2025-11-20T04:33:11.000Z"
      },
      "is_cleaned": true,
      "data_type": "threads",
      "reposts_count": 0
    },
    {
      "url": "https://www.threads.net/@vaantooti/post/DL9cskxy9PN",
      "source_type": "threads",
      "source": "https://www.threads.net/@vaantooti/post/DL9cskxy9PN",
      "domain": "threads.net",
      "social_platform": "threads",
      "title": "Đây là một trong những lí do khiến khẩu chiến trên Social về Thái Bình, Hưng Yên ngày càng căng thẳn...",
      "content": "Đây là một trong những lí do khiến khẩu chiến trên Social về Thái Bình, Hưng Yên ngày càng căng thẳng. Admin fanpage cộng đồng mà comment kích động ntn t cx quỳ",
      "word_count": 33,
      "published_date": 1752221067.0,
      "published_datetime": "2025-07-11 08:04:27+00:00",
      "likes_count": 0,
      "shares_count": 0,
      "comments_count": 0,
      "views_count": 0,
      "reactions": null,
      "account_id": "vaantooti",
      "account_name": "vaantooti",
      "account_url": "https://www.threads.net/@vaantooti",
      "post_id": "7777",
      "post_type": "thread",
      "raw_metadata": {
        "username": "vaantooti",
        "likes": 0,
        "replies": 0,
        "reposts": 0,
        "shares": 0,
        "time": "07/11/25",
        "datetime": "2025-07-11T08:04:27.000Z"
      },
      "is_cleaned": true,
      "data_type": "threads",
      "reposts_count": 0
    },
    {
      "url": "https://www.threads.net/@nnghaannn_/post/DSxNqDPkyXf",
      "source_type": "threads",
      "source": "https://www.threads.net/@nnghaannn_/post/DSxNqDPkyXf",
      "domain": "threads.net",
      "social_platform": "threads",
      "title": "\"Tháng 4 Hai có lịch ở Hưng Yên ko?\" \"Mới tháng 1 mà tính lịch tháng 4\"",
      "content": "\"Tháng 4 Hai có lịch ở Hưng Yên ko?\" \"Mới tháng 1 mà tính lịch tháng 4\"",
      "word_count": 17,
      "published_date": 1766842915.0,
      "published_datetime": "2025-12-27 13:41:55+00:00",
      "likes_count": 0,
      "shares_count": 0,
      "comments_count": 0,
      "views_count": 0,
      "reactions": null,
      "account_id": "nnghaannn_",
      "account_name": "nnghaannn_",
      "account_url": "https://www.threads.net/@nnghaannn_",
      "post_id": "7776",
      "post_type": "thread",
      "raw_metadata": {
        "username": "nnghaannn_",
        "likes": 0,
        "replies": 0,
        "reposts": 0,
        "shares": 0,
        "time": "12/27/25",
        "datetime": "2025-12-27T13:41:55.000Z"
      },
      "is_cleaned": true,
      "data_type": "threads",
      "reposts_count": 0
    },
    {
      "url": "https://www.threads.net/@tsunindigokid/post/DCWm3H_BAUH",
      "source_type": "threads",
      "source": "https://www.threads.net/@tsunindigokid/post/DCWm3H_BAUH",
      "domain": "threads.net",
      "social_platform": "threads",
      "title": "Giờ con homestay nào ở Hưng Yên gần Ocean Park 3 mà giá ổn không mọi người ưi )))) Với lại ai có số...",
      "content": "Giờ con homestay nào ở Hưng Yên gần Ocean Park 3 mà giá ổn không mọi người ưi )))) Với lại ai có số thuê xê Nội Bài - Hưng Yên uy tín không ạ T_T chắc tui đi Nội Bài về Hưng Yên rồi sáng 15 từ Hưng Yên về Nội Bài bay về ĐN luôn qúa T_T",
      "word_count": 59,
      "published_date": 1731590421.0,
      "published_datetime": "2024-11-14 13:20:21+00:00",
      "likes_count": 0,
      "shares_count": 0,
      "comments_count": 0,
      "views_count": 0,
      "reactions": null,
      "account_id": "tsunindigokid",
      "account_name": "tsunindigokid",
      "account_url": "https://www.threads.net/@tsunindigokid",
      "post_id": "7775",
      "post_type": "thread",
      "raw_metadata": {
        "username": "tsunindigokid",
        "likes": 0,
        "replies": 0,
        "reposts": 0,
        "shares": 0,
        "time": "11/14/24",
        "datetime": "2024-11-14T13:20:21.000Z"
      },
      "is_cleaned": true,
      "data_type": "threads",
      "reposts_count": 0
    },
    {
      "url": "https://www.threads.net/@iamducanh/post/DJb5dZ5JlxP",
      "source_type": "threads",
      "source": "https://www.threads.net/@iamducanh/post/DJb5dZ5JlxP",
      "domain": "threads.net",
      "social_platform": "threads",
      "title": "Các mom cho mình hỏi có ai day 2 Hưng Yên đi từ HN sang OCP3 không? Đường vào có tắc không với xếp h...",
      "content": "Các mom cho mình hỏi có ai day 2 Hưng Yên đi từ HN sang OCP3 không? Đường vào có tắc không với xếp hàng check in có xa không ạ?",
      "word_count": 31,
      "published_date": 1746800329.0,
      "published_datetime": "2025-05-09 14:18:49+00:00",
      "likes_count": 0,
      "shares_count": 0,
      "comments_count": 0,
      "views_count": 0,
      "reactions": null,
      "account_id": "iamducanh",
      "account_name": "iamducanh",
      "account_url": "https://www.threads.net/@iamducanh",
      "post_id": "7774",
      "post_type": "thread",
      "raw_metadata": {
        "username": "iamducanh",
        "likes": 0,
        "replies": 0,
        "reposts": 0,
        "shares": 0,
        "time": "05/09/25",
        "datetime": "2025-05-09T14:18:49.000Z"
      },
      "is_cleaned": true,
      "data_type": "threads",
      "reposts_count": 0
    },
    {
      "url": "https://www.threads.net/@badger.536811/post/DSxUpmGEuPO",
      "source_type": "threads",
      "source": "https://www.threads.net/@badger.536811/post/DSxUpmGEuPO",
      "domain": "threads.net",
      "social_platform": "threads",
      "title": "Hôm nay đứa bạn đưa mình đi 1 vòng quanh Văn Giang Hưng Yên. Phải nói là người dân Văn Giang nhiều t...",
      "content": "Hôm nay đứa bạn đưa mình đi 1 vòng quanh Văn Giang Hưng Yên. Phải nói là người dân Văn Giang nhiều tiền thiệt đóỞ VN chỉ có nhờ vào bds mới có thể giàu nhanh lên được thôi",
      "word_count": 39,
      "published_date": 1766846581.0,
      "published_datetime": "2025-12-27 14:43:01+00:00",
      "likes_count": 0,
      "shares_count": 0,
      "comments_count": 0,
      "views_count": 0,
      "reactions": null,
      "account_id": "badger.536811",
      "account_name": "badger.536811",
      "account_url": "https://www.threads.net/@badger.536811",
      "post_id": "7773",
      "post_type": "thread",
      "raw_metadata": {
        "username": "badger.536811",
        "likes": 0,
        "replies": 0,
        "reposts": 0,
        "shares": 0,
        "time": "12/27/25",
        "datetime": "2025-12-27T14:43:01.000Z"
      },
      "is_cleaned": true,
      "data_type": "threads",
      "reposts_count": 0
    },
    {
      "url": "https://www.threads.net/@__mangosteen/post/DQSrX6okxct",
      "source_type": "threads",
      "source": "https://www.threads.net/@__mangosteen/post/DQSrX6okxct",
      "domain": "threads.net",
      "social_platform": "threads",
      "title": "Gợi ý Tour đón thu TP Hưng Yên ))))))))) Translate 12",
      "content": "Gợi ý Tour đón thu TP Hưng Yên ))))))))) Translate 12",
      "word_count": 11,
      "published_date": 1761523340.0,
      "published_datetime": "2025-10-27 00:02:20+00:00",
      "likes_count": 0,
      "shares_count": 0,
      "comments_count": 0,
      "views_count": 0,
      "reactions": null,
      "account_id": "__mangosteen",
      "account_name": "__mangosteen",
      "account_url": "https://www.threads.net/@__mangosteen",
      "post_id": "7772",
      "post_type": "thread",
      "raw_metadata": {
        "username": "__mangosteen",
        "likes": 0,
        "replies": 0,
        "reposts": 0,
        "shares": 0,
        "time": "10/26/25",
        "datetime": "2025-10-27T00:02:20.000Z"
      },
      "is_cleaned": true,
      "data_type": "threads",
      "reposts_count": 0
    },
    {
      "url": "https://www.threads.net/@nhavanhoa_giasu/post/DKrDZvUBeNl",
      "source_type": "threads",
      "source": "https://www.threads.net/@nhavanhoa_giasu/post/DKrDZvUBeNl",
      "domain": "threads.net",
      "social_platform": "threads",
      "title": "Nhớ hồi trước đi dạy gia sư cho một bé chuyên toán, nhà ở Ciputra. Buổi dạy cuối trước khi về nghỉ T...",
      "content": "Nhớ hồi trước đi dạy gia sư cho một bé chuyên toán, nhà ở Ciputra. Buổi dạy cuối trước khi về nghỉ Tết, chị phụ huynh hỏi học phí tháng đó là bao nhiêu, để chị gửi học phí cho con luôn vì chị vừa nhận lương. Cái mình báo học phí xong thì chị đưa mấy tờ 500ka (dư ra vài trăm so với tiền học phí) chị bảo Phần dư là chị lì xì cô, cô yên tâm. Cô cứ dạy tốt cho con đi, cô chưa có ny thì lễ tết nào chị cũng cho tiền, chị cho đến bao giờ cô có ny thì thôi. Sau này ny cô phải cho cô như chị đấy nhá. Translate 12",
      "word_count": 122,
      "published_date": 1749456342.0,
      "published_datetime": "2025-06-09 08:05:42+00:00",
      "likes_count": 0,
      "shares_count": 0,
      "comments_count": 0,
      "views_count": 0,
      "reactions": null,
      "account_id": "nhavanhoa_giasu",
      "account_name": "nhavanhoa_giasu",
      "account_url": "https://www.threads.net/@nhavanhoa_giasu",
      "post_id": "7771",
      "post_type": "thread",
      "raw_metadata": {
        "username": "nhavanhoa_giasu",
        "likes": 0,
        "replies": 0,
        "reposts": 0,
        "shares": 0,
        "time": "06/09/25",
        "datetime": "2025-06-09T08:05:42.000Z"
      },
      "is_cleaned": true,
      "data_type": "threads",
      "reposts_count": 0
    },
    {
      "url": "https://www.threads.net/@_hpig07/post/DB817ubpbXk",
      "source_type": "threads",
      "source": "https://www.threads.net/@_hpig07/post/DB817ubpbXk",
      "domain": "threads.net",
      "social_platform": "threads",
      "title": "Hưng Yên bắt đầu lạnh gòii",
      "content": "Hưng Yên bắt đầu lạnh gòii",
      "word_count": 6,
      "published_date": 1730725934.0,
      "published_datetime": "2024-11-04 13:12:14+00:00",
      "likes_count": 0,
      "shares_count": 0,
      "comments_count": 0,
      "views_count": 0,
      "reactions": null,
      "account_id": "_hpig07",
      "account_name": "_hpig07",
      "account_url": "https://www.threads.net/@_hpig07",
      "post_id": "7770",
      "post_type": "thread",
      "raw_metadata": {
        "username": "_hpig07",
        "likes": 0,
        "replies": 0,
        "reposts": 0,
        "shares": 0,
        "time": "11/04/24",
        "datetime": "2024-11-04T13:12:14.000Z"
      },
      "is_cleaned": true,
      "data_type": "threads",
      "reposts_count": 0
    },
    {
      "url": "https://www.threads.net/@supcuaocheoo/post/DS5Diwqk4eE",
      "source_type": "threads",
      "source": "https://www.threads.net/@supcuaocheoo/post/DS5Diwqk4eE",
      "domain": "threads.net",
      "social_platform": "threads",
      "title": "MÌNH LÀ PHÁI NỮ , KHÔNG CÓ NGHĨA MÌNH YẾU THẾ VÀ PHẢI IM LẶNG KHI BỊ ĐE DOẠ TUNG CLIP Mình cũng chẳn...",
      "content": "MÌNH LÀ PHÁI NỮ , KHÔNG CÓ NGHĨA MÌNH YẾU THẾ VÀ PHẢI IM LẶNG KHI BỊ ĐE DOẠ TUNG CLIP Mình cũng chẳng làm gì sai với ai hết , và cũng không mong cầu tất cả mọi người đều phải yêu quý mình Nên việc bạn Hưng với (fb SAN SAN KỲ LÊ ) đòi tung clip hay cắt ghép hình ảnh ghép vào những thứ không phù hợp , nó cũng chẳng phải việc mình sợ . Người sai là bạn chứ không phải mình , nên bạn đừng đe doạ và uy hiếp mình với những cụm từ vô nghĩa đó . Translate 14",
      "word_count": 108,
      "published_date": 1767106048.0,
      "published_datetime": "2025-12-30 14:47:28+00:00",
      "likes_count": 0,
      "shares_count": 0,
      "comments_count": 0,
      "views_count": 0,
      "reactions": null,
      "account_id": "supcuaocheoo",
      "account_name": "supcuaocheoo",
      "account_url": "https://www.threads.net/@supcuaocheoo",
      "post_id": "7769",
      "post_type": "thread",
      "raw_metadata": {
        "username": "supcuaocheoo",
        "likes": 0,
        "replies": 0,
        "reposts": 0,
        "shares": 0,
        "time": "4d",
        "datetime": "2025-12-30T14:47:28.000Z"
      },
      "is_cleaned": true,
      "data_type": "threads",
      "reposts_count": 0
    },
    {
      "url": "https://www.threads.net/@bbipooooooo/post/DSm0baGE3VG",
      "source_type": "threads",
      "source": "https://www.threads.net/@bbipooooooo/post/DSm0baGE3VG",
      "domain": "threads.net",
      "social_platform": "threads",
      "title": "Hỏi: chuyện gì đã xảy ra ở Hưng Yên?",
      "content": "Hỏi: chuyện gì đã xảy ra ở Hưng Yên?",
      "word_count": 9,
      "published_date": 1766494143.0,
      "published_datetime": "2025-12-23 12:49:03+00:00",
      "likes_count": 0,
      "shares_count": 0,
      "comments_count": 0,
      "views_count": 0,
      "reactions": null,
      "account_id": "bbipooooooo",
      "account_name": "bbipooooooo",
      "account_url": "https://www.threads.net/@bbipooooooo",
      "post_id": "7768",
      "post_type": "thread",
      "raw_metadata": {
        "username": "bbipooooooo",
        "likes": 0,
        "replies": 0,
        "reposts": 0,
        "shares": 0,
        "time": "12/23/25",
        "datetime": "2025-12-23T12:49:03.000Z"
      },
      "is_cleaned": true,
      "data_type": "threads",
      "reposts_count": 0
    },
    {
      "url": "https://www.threads.net/@cunn.1402/post/DQpGBwXkxXX",
      "source_type": "threads",
      "source": "https://www.threads.net/@cunn.1402/post/DQpGBwXkxXX",
      "domain": "threads.net",
      "social_platform": "threads",
      "title": "Nay về Thái Bình nhưng cột mốc đổi thành Hưng Yên mà thấy buồn vậy ạ",
      "content": "Nay về Thái Bình nhưng cột mốc đổi thành Hưng Yên mà thấy buồn vậy ạ",
      "word_count": 16,
      "published_date": 1762275512.0,
      "published_datetime": "2025-11-04 16:58:32+00:00",
      "likes_count": 0,
      "shares_count": 0,
      "comments_count": 0,
      "views_count": 0,
      "reactions": null,
      "account_id": "cunn.1402",
      "account_name": "cunn.1402",
      "account_url": "https://www.threads.net/@cunn.1402",
      "post_id": "7767",
      "post_type": "thread",
      "raw_metadata": {
        "username": "cunn.1402",
        "likes": 0,
        "replies": 0,
        "reposts": 0,
        "shares": 0,
        "time": "11/04/25",
        "datetime": "2025-11-04T16:58:32.000Z"
      },
      "is_cleaned": true,
      "data_type": "threads",
      "reposts_count": 0
    },
    {
      "url": "https://www.threads.net/@thuhuyen2681/post/DQgp3YUjyJu",
      "source_type": "threads",
      "source": "https://www.threads.net/@thuhuyen2681/post/DQgp3YUjyJu",
      "domain": "threads.net",
      "social_platform": "threads",
      "title": "Cả tỉnh Hưng Yên hôm nay tái sinh luôn",
      "content": "Cả tỉnh Hưng Yên hôm nay tái sinh luôn",
      "word_count": 9,
      "published_date": 1761992311.0,
      "published_datetime": "2025-11-01 10:18:31+00:00",
      "likes_count": 0,
      "shares_count": 0,
      "comments_count": 0,
      "views_count": 0,
      "reactions": null,
      "account_id": "thuhuyen2681",
      "account_name": "thuhuyen2681",
      "account_url": "https://www.threads.net/@thuhuyen2681",
      "post_id": "7766",
      "post_type": "thread",
      "raw_metadata": {
        "username": "thuhuyen2681",
        "likes": 0,
        "replies": 0,
        "reposts": 0,
        "shares": 0,
        "time": "11/01/25",
        "datetime": "2025-11-01T10:18:31.000Z"
      },
      "is_cleaned": true,
      "data_type": "threads",
      "reposts_count": 0
    },
    {
      "url": "https://www.threads.net/@tustus_12798/post/DQreZefjwBg",
      "source_type": "threads",
      "source": "https://www.threads.net/@tustus_12798/post/DQreZefjwBg",
      "domain": "threads.net",
      "social_platform": "threads",
      "title": "Các bạn Hưng Yên ơi ai có đáp án đề anh ko cho tớ xin với",
      "content": "Các bạn Hưng Yên ơi ai có đáp án đề anh ko cho tớ xin với",
      "word_count": 16,
      "published_date": 1762355398.0,
      "published_datetime": "2025-11-05 15:09:58+00:00",
      "likes_count": 0,
      "shares_count": 0,
      "comments_count": 0,
      "views_count": 0,
      "reactions": null,
      "account_id": "tustus_12798",
      "account_name": "tustus_12798",
      "account_url": "https://www.threads.net/@tustus_12798",
      "post_id": "7765",
      "post_type": "thread",
      "raw_metadata": {
        "username": "tustus_12798",
        "likes": 0,
        "replies": 0,
        "reposts": 0,
        "shares": 0,
        "time": "11/05/25",
        "datetime": "2025-11-05T15:09:58.000Z"
      },
      "is_cleaned": true,
      "data_type": "threads",
      "reposts_count": 0
    },
    {
      "url": "https://www.threads.net/@imminhhh_412/post/DL__dxrPej3",
      "source_type": "threads",
      "source": "https://www.threads.net/@imminhhh_412/post/DL__dxrPej3",
      "domain": "threads.net",
      "social_platform": "threads",
      "title": "Hoà chung không khí sáp nhập tỉnh, bác bảo vệ chung cư đã chào tôi là Hưng Yên ơiiii",
      "content": "Hoà chung không khí sáp nhập tỉnh, bác bảo vệ chung cư đã chào tôi là Hưng Yên ơiiii",
      "word_count": 19,
      "published_date": 1752306405.0,
      "published_datetime": "2025-07-12 07:46:45+00:00",
      "likes_count": 0,
      "shares_count": 0,
      "comments_count": 0,
      "views_count": 0,
      "reactions": null,
      "account_id": "imminhhh_412",
      "account_name": "imminhhh_412",
      "account_url": "https://www.threads.net/@imminhhh_412",
      "post_id": "7764",
      "post_type": "thread",
      "raw_metadata": {
        "username": "imminhhh_412",
        "likes": 0,
        "replies": 0,
        "reposts": 0,
        "shares": 0,
        "time": "07/12/25",
        "datetime": "2025-07-12T07:46:45.000Z"
      },
      "is_cleaned": true,
      "data_type": "threads",
      "reposts_count": 0
    },
    {
      "url": "https://www.threads.net/@hoan.lch/post/DOKTK9Mkths",
      "source_type": "threads",
      "source": "https://www.threads.net/@hoan.lch/post/DOKTK9Mkths",
      "domain": "threads.net",
      "social_platform": "threads",
      "title": "Có 2 sự thật: 1. Chiến sĩ nổi tiếng nhất Việt Nam - Lê Hoàng Hiệp quê Hưng Yên 2. Ca sĩ nổi tiếng nh...",
      "content": "Có 2 sự thật: 1. Chiến sĩ nổi tiếng nhất Việt Nam - Lê Hoàng Hiệp quê Hưng Yên 2. Ca sĩ nổi tiếng nhất Việt Nam - Sơn Tùng MTP quê Hưng Yên",
      "word_count": 34,
      "published_date": 1756947248.0,
      "published_datetime": "2025-09-04 00:54:08+00:00",
      "likes_count": 0,
      "shares_count": 0,
      "comments_count": 0,
      "views_count": 0,
      "reactions": null,
      "account_id": "hoan.lch",
      "account_name": "hoan.lch",
      "account_url": "https://www.threads.net/@hoan.lch",
      "post_id": "7763",
      "post_type": "thread",
      "raw_metadata": {
        "username": "hoan.lch",
        "likes": 0,
        "replies": 0,
        "reposts": 0,
        "shares": 0,
        "time": "09/03/25",
        "datetime": "2025-09-04T00:54:08.000Z"
      },
      "is_cleaned": true,
      "data_type": "threads",
      "reposts_count": 0
    },
    {
      "url": "https://www.threads.net/@tnpeach__/post/DRw-AgaEZ3K",
      "source_type": "threads",
      "source": "https://www.threads.net/@tnpeach__/post/DRw-AgaEZ3K",
      "domain": "threads.net",
      "social_platform": "threads",
      "title": "oh lol hưng yên 189 no wonder why ))))) bcuoi là ở đây bao nhiêu năm vẫn đéo có giải pháp xử lí rác...",
      "content": "oh lol hưng yên 189 no wonder why ))))) bcuoi là ở đây bao nhiêu năm vẫn đéo có giải pháp xử lí rác  mấy cái khu công nghiệp nó thải ra như nào, đường thì cũng bụi vãi cặc Và somehow hà nội vẫn ô nhiễm hơn )))",
      "word_count": 49,
      "published_date": 1764687226.0,
      "published_datetime": "2025-12-02 14:53:46+00:00",
      "likes_count": 0,
      "shares_count": 0,
      "comments_count": 0,
      "views_count": 0,
      "reactions": null,
      "account_id": "tnpeach__",
      "account_name": "tnpeach__",
      "account_url": "https://www.threads.net/@tnpeach__",
      "post_id": "7762",
      "post_type": "thread",
      "raw_metadata": {
        "username": "tnpeach__",
        "likes": 0,
        "replies": 0,
        "reposts": 0,
        "shares": 0,
        "time": "12/02/25",
        "datetime": "2025-12-02T14:53:46.000Z"
      },
      "is_cleaned": true,
      "data_type": "threads",
      "reposts_count": 0
    },
    {
      "url": "https://www.threads.net/@_anheny_2809/post/DS2FfUTkg5r",
      "source_type": "threads",
      "source": "https://www.threads.net/@_anheny_2809/post/DS2FfUTkg5r",
      "domain": "threads.net",
      "social_platform": "threads",
      "title": "Có ai ở Ecopark-Hưng Yên không ạ",
      "content": "Có ai ở Ecopark-Hưng Yên không ạ",
      "word_count": 7,
